"No.","Time","Source","Destination","Protocol","Length","Info"
"1","0.000000","172.20.0.4","172.20.0.2","DNS","59","DNS Stateful operations (DSO) 0x3434[Malformed Packet]"
"2","0.000566","172.20.0.2","172.20.0.4","DNS","70","DNS Stateful operations (DSO) 0x3434[Malformed Packet]"
"3","0.052520","172.20.0.4","172.20.0.3","TCP","74","38868  >  8080 [SYN] Seq=0 Win=64240 Len=0 MSS=1460 SACK_PERM TSval=3911453587 TSecr=0 WS=128"
"4","0.052789","172.20.0.3","172.20.0.4","TCP","74","8080  >  38868 [SYN, ACK] Seq=0 Ack=1 Win=65160 Len=0 MSS=1460 SACK_PERM TSval=3931964192 TSecr=3911453587 WS=128"
"5","0.103075","172.20.0.4","172.20.0.3","TCP","66","38868  >  8080 [ACK] Seq=1 Ack=1 Win=64256 Len=0 TSval=3911453638 TSecr=3931964192"
"6","0.103090","172.20.0.4","172.20.0.3","HTTP","221","GET /arquivo_100kb.bin HTTP/1.1 "
"7","0.103371","172.20.0.3","172.20.0.4","TCP","66","8080  >  38868 [ACK] Seq=1 Ack=156 Win=65024 Len=0 TSval=3931964242 TSecr=3911453638"
"8","0.113484","172.20.0.3","172.20.0.4","TCP","2962","8080  >  38868 [PSH, ACK] Seq=1 Ack=156 Win=65024 Len=2896 TSval=3931964252 TSecr=3911453638 [TCP PDU reassembled in 58]"
"9","0.113647","172.20.0.3","172.20.0.4","TCP","2962","8080  >  38868 [PSH, ACK] Seq=2897 Ack=156 Win=65024 Len=2896 TSval=3931964253 TSecr=3911453638 [TCP PDU reassembled in 58]"
"10","0.113673","172.20.0.3","172.20.0.4","TCP","2962","8080  >  38868 [PSH, ACK] Seq=5793 Ack=156 Win=65024 Len=2896 TSval=3931964253 TSecr=3911453638 [TCP PDU reassembled in 58]"
"11","0.113695","172.20.0.3","172.20.0.4","TCP","2962","8080  >  38868 [PSH, ACK] Seq=8689 Ack=156 Win=65024 Len=2896 TSval=3931964253 TSecr=3911453638 [TCP PDU reassembled in 58]"
"12","0.113715","172.20.0.3","172.20.0.4","TCP","2962","8080  >  38868 [PSH, ACK] Seq=11585 Ack=156 Win=65024 Len=2896 TSval=3931964253 TSecr=3911453638 [TCP PDU reassembled in 58]"
"13","0.163788","172.20.0.4","172.20.0.3","TCP","66","38868  >  8080 [ACK] Seq=156 Ack=2897 Win=70144 Len=0 TSval=3911453699 TSecr=3931964252"
"14","0.163800","172.20.0.4","172.20.0.3","TCP","66","38868  >  8080 [ACK] Seq=156 Ack=5793 Win=75904 Len=0 TSval=3911453699 TSecr=3931964253"
"15","0.163803","172.20.0.4","172.20.0.3","TCP","66","38868  >  8080 [ACK] Seq=156 Ack=8689 Win=81664 Len=0 TSval=3911453699 TSecr=3931964253"
"16","0.163806","172.20.0.4","172.20.0.3","TCP","66","38868  >  8080 [ACK] Seq=156 Ack=11585 Win=87424 Len=0 TSval=3911453699 TSecr=3931964253"
"17","0.163809","172.20.0.4","172.20.0.3","TCP","66","38868  >  8080 [ACK] Seq=156 Ack=14481 Win=88320 Len=0 TSval=3911453699 TSecr=3931964253"
"18","0.164066","172.20.0.3","172.20.0.4","TCP","2962","8080  >  38868 [PSH, ACK] Seq=14481 Ack=156 Win=65024 Len=2896 TSval=3931964303 TSecr=3911453699 [TCP PDU reassembled in 58]"
"19","0.164206","172.20.0.3","172.20.0.4","TCP","2962","8080  >  38868 [PSH, ACK] Seq=17377 Ack=156 Win=65024 Len=2896 TSval=3931964303 TSecr=3911453699 [TCP PDU reassembled in 58]"
"20","0.164302","172.20.0.3","172.20.0.4","TCP","2962","8080  >  38868 [PSH, ACK] Seq=20273 Ack=156 Win=65024 Len=2896 TSval=3931964303 TSecr=3911453699 [TCP PDU reassembled in 58]"
"21","0.164326","172.20.0.3","172.20.0.4","TCP","2962","8080  >  38868 [PSH, ACK] Seq=23169 Ack=156 Win=65024 Len=2896 TSval=3931964303 TSecr=3911453699 [TCP PDU reassembled in 58]"
"22","0.164400","172.20.0.3","172.20.0.4","TCP","2962","8080  >  38868 [PSH, ACK] Seq=26065 Ack=156 Win=65024 Len=2896 TSval=3931964303 TSecr=3911453699 [TCP PDU reassembled in 58]"
"23","0.164437","172.20.0.3","172.20.0.4","TCP","2962","8080  >  38868 [PSH, ACK] Seq=28961 Ack=156 Win=65024 Len=2896 TSval=3931964303 TSecr=3911453699 [TCP PDU reassembled in 58]"
"24","0.164510","172.20.0.3","172.20.0.4","TCP","2962","8080  >  38868 [PSH, ACK] Seq=31857 Ack=156 Win=65024 Len=2896 TSval=3931964304 TSecr=3911453699 [TCP PDU reassembled in 58]"
"25","0.164537","172.20.0.3","172.20.0.4","TCP","2962","8080  >  38868 [PSH, ACK] Seq=34753 Ack=156 Win=65024 Len=2896 TSval=3931964304 TSecr=3911453699 [TCP PDU reassembled in 58]"
"26","0.164614","172.20.0.3","172.20.0.4","TCP","2962","8080  >  38868 [PSH, ACK] Seq=37649 Ack=156 Win=65024 Len=2896 TSval=3931964304 TSecr=3911453699 [TCP PDU reassembled in 58]"
"27","0.164728","172.20.0.3","172.20.0.4","TCP","2962","8080  >  38868 [PSH, ACK] Seq=40545 Ack=156 Win=65024 Len=2896 TSval=3931964304 TSecr=3911453699 [TCP PDU reassembled in 58]"
"28","0.215132","172.20.0.4","172.20.0.3","TCP","66","38868  >  8080 [ACK] Seq=156 Ack=17377 Win=94080 Len=0 TSval=3911453749 TSecr=3931964303"
"29","0.215146","172.20.0.4","172.20.0.3","TCP","66","38868  >  8080 [ACK] Seq=156 Ack=20273 Win=94080 Len=0 TSval=3911453749 TSecr=3931964303"
"30","0.215149","172.20.0.4","172.20.0.3","TCP","66","38868  >  8080 [ACK] Seq=156 Ack=23169 Win=94080 Len=0 TSval=3911453749 TSecr=3931964303"
"31","0.215153","172.20.0.4","172.20.0.3","TCP","66","38868  >  8080 [ACK] Seq=156 Ack=26065 Win=94080 Len=0 TSval=3911453749 TSecr=3931964303"
"32","0.215156","172.20.0.4","172.20.0.3","TCP","66","38868  >  8080 [ACK] Seq=156 Ack=28961 Win=97024 Len=0 TSval=3911453749 TSecr=3931964303"
"33","0.215161","172.20.0.4","172.20.0.3","TCP","66","38868  >  8080 [ACK] Seq=156 Ack=31857 Win=94208 Len=0 TSval=3911453750 TSecr=3931964303"
"34","0.215164","172.20.0.4","172.20.0.3","TCP","66","38868  >  8080 [ACK] Seq=156 Ack=34753 Win=97024 Len=0 TSval=3911453750 TSecr=3931964304"
"35","0.215167","172.20.0.4","172.20.0.3","TCP","66","38868  >  8080 [ACK] Seq=156 Ack=37649 Win=94208 Len=0 TSval=3911453750 TSecr=3931964304"
"36","0.215170","172.20.0.4","172.20.0.3","TCP","66","38868  >  8080 [ACK] Seq=156 Ack=40545 Win=97024 Len=0 TSval=3911453750 TSecr=3931964304"
"37","0.215175","172.20.0.4","172.20.0.3","TCP","66","38868  >  8080 [ACK] Seq=156 Ack=43441 Win=94208 Len=0 TSval=3911453750 TSecr=3931964304"
"38","0.215738","172.20.0.3","172.20.0.4","TCP","2962","8080  >  38868 [PSH, ACK] Seq=43441 Ack=156 Win=65024 Len=2896 TSval=3931964355 TSecr=3911453749 [TCP PDU reassembled in 58]"
"39","0.215983","172.20.0.3","172.20.0.4","TCP","2962","8080  >  38868 [PSH, ACK] Seq=46337 Ack=156 Win=65024 Len=2896 TSval=3931964355 TSecr=3911453749 [TCP PDU reassembled in 58]"
"40","0.216120","172.20.0.3","172.20.0.4","TCP","2962","8080  >  38868 [PSH, ACK] Seq=49233 Ack=156 Win=65024 Len=2896 TSval=3931964355 TSecr=3911453750 [TCP PDU reassembled in 58]"
"41","0.216146","172.20.0.3","172.20.0.4","TCP","2962","8080  >  38868 [PSH, ACK] Seq=52129 Ack=156 Win=65024 Len=2896 TSval=3931964355 TSecr=3911453750 [TCP PDU reassembled in 58]"
"42","0.216214","172.20.0.3","172.20.0.4","TCP","2962","8080  >  38868 [PSH, ACK] Seq=55025 Ack=156 Win=65024 Len=2896 TSval=3931964355 TSecr=3911453750 [TCP PDU reassembled in 58]"
"43","0.216237","172.20.0.3","172.20.0.4","TCP","2962","8080  >  38868 [PSH, ACK] Seq=57921 Ack=156 Win=65024 Len=2896 TSval=3931964355 TSecr=3911453750 [TCP PDU reassembled in 58]"
"44","0.216310","172.20.0.3","172.20.0.4","TCP","2962","8080  >  38868 [PSH, ACK] Seq=60817 Ack=156 Win=65024 Len=2896 TSval=3931964355 TSecr=3911453750 [TCP PDU reassembled in 58]"
"45","0.216332","172.20.0.3","172.20.0.4","TCP","2962","8080  >  38868 [PSH, ACK] Seq=63713 Ack=156 Win=65024 Len=2896 TSval=3931964355 TSecr=3911453750 [TCP PDU reassembled in 58]"
"46","0.216407","172.20.0.3","172.20.0.4","TCP","2962","8080  >  38868 [PSH, ACK] Seq=66609 Ack=156 Win=65024 Len=2896 TSval=3931964355 TSecr=3911453750 [TCP PDU reassembled in 58]"
"47","0.216416","172.20.0.3","172.20.0.4","TCP","2962","8080  >  38868 [PSH, ACK] Seq=69505 Ack=156 Win=65024 Len=2896 TSval=3931964355 TSecr=3911453750 [TCP PDU reassembled in 58]"
"48","0.216516","172.20.0.3","172.20.0.4","TCP","2962","8080  >  38868 [PSH, ACK] Seq=72401 Ack=156 Win=65024 Len=2896 TSval=3931964356 TSecr=3911453750 [TCP PDU reassembled in 58]"
"49","0.216540","172.20.0.3","172.20.0.4","TCP","2962","8080  >  38868 [PSH, ACK] Seq=75297 Ack=156 Win=65024 Len=2896 TSval=3931964356 TSecr=3911453750 [TCP PDU reassembled in 58]"
"50","0.216630","172.20.0.3","172.20.0.4","TCP","2962","8080  >  38868 [PSH, ACK] Seq=78193 Ack=156 Win=65024 Len=2896 TSval=3931964356 TSecr=3911453750 [TCP PDU reassembled in 58]"
"51","0.216657","172.20.0.3","172.20.0.4","TCP","2962","8080  >  38868 [PSH, ACK] Seq=81089 Ack=156 Win=65024 Len=2896 TSval=3931964356 TSecr=3911453750 [TCP PDU reassembled in 58]"
"52","0.216765","172.20.0.3","172.20.0.4","TCP","2962","8080  >  38868 [PSH, ACK] Seq=83985 Ack=156 Win=65024 Len=2896 TSval=3931964356 TSecr=3911453750 [TCP PDU reassembled in 58]"
"53","0.216790","172.20.0.3","172.20.0.4","TCP","2962","8080  >  38868 [PSH, ACK] Seq=86881 Ack=156 Win=65024 Len=2896 TSval=3931964356 TSecr=3911453750 [TCP PDU reassembled in 58]"
"54","0.216937","172.20.0.3","172.20.0.4","TCP","2962","8080  >  38868 [PSH, ACK] Seq=89777 Ack=156 Win=65024 Len=2896 TSval=3931964356 TSecr=3911453750 [TCP PDU reassembled in 58]"
"55","0.216979","172.20.0.3","172.20.0.4","TCP","2962","8080  >  38868 [PSH, ACK] Seq=92673 Ack=156 Win=65024 Len=2896 TSval=3931964356 TSecr=3911453750 [TCP PDU reassembled in 58]"
"56","0.217070","172.20.0.3","172.20.0.4","TCP","2962","8080  >  38868 [PSH, ACK] Seq=95569 Ack=156 Win=65024 Len=2896 TSval=3931964356 TSecr=3911453750 [TCP PDU reassembled in 58]"
"57","0.217094","172.20.0.3","172.20.0.4","TCP","2962","8080  >  38868 [PSH, ACK] Seq=98465 Ack=156 Win=65024 Len=2896 TSval=3931964356 TSecr=3911453750 [TCP PDU reassembled in 58]"
"58","0.217138","172.20.0.3","172.20.0.4","HTTP","1289","HTTP/1.1 200 OK "
"59","0.266080","172.20.0.4","172.20.0.3","TCP","66","38868  >  8080 [ACK] Seq=156 Ack=46337 Win=97024 Len=0 TSval=3911453801 TSecr=3931964355"
"60","0.266091","172.20.0.4","172.20.0.3","TCP","66","38868  >  8080 [ACK] Seq=156 Ack=49233 Win=94208 Len=0 TSval=3911453801 TSecr=3931964355"
"61","0.266242","172.20.0.4","172.20.0.3","TCP","66","38868  >  8080 [ACK] Seq=156 Ack=52129 Win=91392 Len=0 TSval=3911453801 TSecr=3931964355"
"62","0.266246","172.20.0.4","172.20.0.3","TCP","66","38868  >  8080 [ACK] Seq=156 Ack=57921 Win=108544 Len=0 TSval=3911453801 TSecr=3931964355"
"63","0.266285","172.20.0.4","172.20.0.3","TCP","66","38868  >  8080 [ACK] Seq=156 Ack=60817 Win=114432 Len=0 TSval=3911453801 TSecr=3931964355"
"64","0.266368","172.20.0.4","172.20.0.3","TCP","66","38868  >  8080 [ACK] Seq=156 Ack=63713 Win=120192 Len=0 TSval=3911453801 TSecr=3931964355"
"65","0.266501","172.20.0.4","172.20.0.3","TCP","66","38868  >  8080 [ACK] Seq=156 Ack=72401 Win=137600 Len=0 TSval=3911453802 TSecr=3931964355"
"66","0.266572","172.20.0.4","172.20.0.3","TCP","66","38868  >  8080 [ACK] Seq=156 Ack=75297 Win=143360 Len=0 TSval=3911453802 TSecr=3931964356"
"67","0.266574","172.20.0.4","172.20.0.3","TCP","66","38868  >  8080 [ACK] Seq=156 Ack=78193 Win=149120 Len=0 TSval=3911453802 TSecr=3931964356"
"68","0.266714","172.20.0.4","172.20.0.3","TCP","66","38868  >  8080 [ACK] Seq=156 Ack=81089 Win=154880 Len=0 TSval=3911453802 TSecr=3931964356"
"69","0.266717","172.20.0.4","172.20.0.3","TCP","66","38868  >  8080 [ACK] Seq=156 Ack=83985 Win=160768 Len=0 TSval=3911453802 TSecr=3931964356"
"70","0.266824","172.20.0.4","172.20.0.3","TCP","66","38868  >  8080 [ACK] Seq=156 Ack=86881 Win=166528 Len=0 TSval=3911453802 TSecr=3931964356"
"71","0.266827","172.20.0.4","172.20.0.3","TCP","66","38868  >  8080 [ACK] Seq=156 Ack=89777 Win=166144 Len=0 TSval=3911453802 TSecr=3931964356"
"72","0.267032","172.20.0.4","172.20.0.3","TCP","66","38868  >  8080 [ACK] Seq=156 Ack=92673 Win=172288 Len=0 TSval=3911453802 TSecr=3931964356"
"73","0.267035","172.20.0.4","172.20.0.3","TCP","66","38868  >  8080 [ACK] Seq=156 Ack=95569 Win=171904 Len=0 TSval=3911453802 TSecr=3931964356"
"74","0.267113","172.20.0.4","172.20.0.3","TCP","66","38868  >  8080 [ACK] Seq=156 Ack=98465 Win=169088 Len=0 TSval=3911453802 TSecr=3931964356"
"75","0.267251","172.20.0.4","172.20.0.3","TCP","66","38868  >  8080 [ACK] Seq=156 Ack=102585 Win=170368 Len=0 TSval=3911453802 TSecr=3931964356"
"76","0.267766","172.20.0.4","172.20.0.3","TCP","66","38868  >  8080 [FIN, ACK] Seq=156 Ack=102585 Win=172288 Len=0 TSval=3911453803 TSecr=3931964356"
"77","0.267834","172.20.0.3","172.20.0.4","TCP","66","8080  >  38868 [ACK] Seq=102585 Ack=157 Win=65024 Len=0 TSval=3931964407 TSecr=3911453803"
"78","1.965267","172.20.0.4","172.20.0.2","DNS","59","DNS Stateful operations (DSO) 0x3531[Malformed Packet]"
"79","1.965824","172.20.0.2","172.20.0.4","DNS","70","DNS Stateful operations (DSO) 0x3531[Malformed Packet]"
"80","2.017366","172.20.0.4","172.20.0.3","TCP","74","48162  >  8080 [SYN] Seq=0 Win=64240 Len=0 MSS=1460 SACK_PERM TSval=3911455551 TSecr=0 WS=128"
"81","2.017554","172.20.0.3","172.20.0.4","TCP","74","8080  >  48162 [SYN, ACK] Seq=0 Ack=1 Win=65160 Len=0 MSS=1460 SACK_PERM TSval=3931966157 TSecr=3911455551 WS=128"
"82","2.068419","172.20.0.4","172.20.0.3","TCP","66","48162  >  8080 [ACK] Seq=1 Ack=1 Win=64256 Len=0 TSval=3911455603 TSecr=3931966157"
"83","2.068432","172.20.0.4","172.20.0.3","HTTP","221","GET /arquivo_100kb.bin HTTP/1.1 "
"84","2.068852","172.20.0.3","172.20.0.4","TCP","66","8080  >  48162 [ACK] Seq=1 Ack=156 Win=65024 Len=0 TSval=3931966208 TSecr=3911455603"
"85","2.083230","172.20.0.3","172.20.0.4","TCP","2962","8080  >  48162 [PSH, ACK] Seq=1 Ack=156 Win=65024 Len=2896 TSval=3931966222 TSecr=3911455603 [TCP PDU reassembled in 147]"
"86","2.083443","172.20.0.3","172.20.0.4","TCP","2962","8080  >  48162 [PSH, ACK] Seq=2897 Ack=156 Win=65024 Len=2896 TSval=3931966222 TSecr=3911455603 [TCP PDU reassembled in 147]"
"87","2.083503","172.20.0.3","172.20.0.4","TCP","2962","8080  >  48162 [PSH, ACK] Seq=5793 Ack=156 Win=65024 Len=2896 TSval=3931966222 TSecr=3911455603 [TCP PDU reassembled in 147]"
"88","2.083551","172.20.0.3","172.20.0.4","TCP","2962","8080  >  48162 [PSH, ACK] Seq=8689 Ack=156 Win=65024 Len=2896 TSval=3931966222 TSecr=3911455603 [TCP PDU reassembled in 147]"
"89","2.083589","172.20.0.3","172.20.0.4","TCP","2962","8080  >  48162 [PSH, ACK] Seq=11585 Ack=156 Win=65024 Len=2896 TSval=3931966222 TSecr=3911455603 [TCP PDU reassembled in 147]"
"90","2.133650","172.20.0.4","172.20.0.3","TCP","66","48162  >  8080 [ACK] Seq=156 Ack=5793 Win=75904 Len=0 TSval=3911455669 TSecr=3931966222"
"91","2.133662","172.20.0.4","172.20.0.3","TCP","66","48162  >  8080 [ACK] Seq=156 Ack=8689 Win=81664 Len=0 TSval=3911455669 TSecr=3931966222"
"92","2.133665","172.20.0.4","172.20.0.3","TCP","66","48162  >  8080 [ACK] Seq=156 Ack=11585 Win=87424 Len=0 TSval=3911455669 TSecr=3931966222"
"93","2.133887","172.20.0.3","172.20.0.4","TCP","2962","8080  >  48162 [PSH, ACK] Seq=14481 Ack=156 Win=65024 Len=2896 TSval=3931966273 TSecr=3911455669 [TCP PDU reassembled in 147]"
"94","2.134004","172.20.0.3","172.20.0.4","TCP","2962","8080  >  48162 [PSH, ACK] Seq=17377 Ack=156 Win=65024 Len=2896 TSval=3931966273 TSecr=3911455669 [TCP PDU reassembled in 147]"
"95","2.134086","172.20.0.3","172.20.0.4","TCP","2962","8080  >  48162 [PSH, ACK] Seq=20273 Ack=156 Win=65024 Len=2896 TSval=3931966273 TSecr=3911455669 [TCP PDU reassembled in 147]"
"96","2.134103","172.20.0.3","172.20.0.4","TCP","2962","8080  >  48162 [PSH, ACK] Seq=23169 Ack=156 Win=65024 Len=2896 TSval=3931966273 TSecr=3911455669 [TCP PDU reassembled in 147]"
"97","2.134152","172.20.0.3","172.20.0.4","TCP","2962","8080  >  48162 [PSH, ACK] Seq=26065 Ack=156 Win=65024 Len=2896 TSval=3931966273 TSecr=3911455669 [TCP PDU reassembled in 147]"
"98","2.134167","172.20.0.3","172.20.0.4","TCP","2962","8080  >  48162 [PSH, ACK] Seq=28961 Ack=156 Win=65024 Len=2896 TSval=3931966273 TSecr=3911455669 [TCP PDU reassembled in 147]"
"99","2.134221","172.20.0.3","172.20.0.4","TCP","2962","8080  >  48162 [PSH, ACK] Seq=31857 Ack=156 Win=65024 Len=2896 TSval=3931966273 TSecr=3911455669 [TCP PDU reassembled in 147]"
"100","2.134235","172.20.0.3","172.20.0.4","TCP","2962","8080  >  48162 [PSH, ACK] Seq=34753 Ack=156 Win=65024 Len=2896 TSval=3931966273 TSecr=3911455669 [TCP PDU reassembled in 147]"
"101","2.184789","172.20.0.4","172.20.0.3","TCP","66","48162  >  8080 [ACK] Seq=156 Ack=17377 Win=97024 Len=0 TSval=3911455719 TSecr=3931966273"
"102","2.184801","172.20.0.4","172.20.0.3","TCP","66","48162  >  8080 [ACK] Seq=156 Ack=20273 Win=94208 Len=0 TSval=3911455719 TSecr=3931966273"
"103","2.184804","172.20.0.4","172.20.0.3","TCP","66","48162  >  8080 [ACK] Seq=156 Ack=23169 Win=91392 Len=0 TSval=3911455719 TSecr=3931966273"
"104","2.184807","172.20.0.4","172.20.0.3","TCP","66","48162  >  8080 [ACK] Seq=156 Ack=26065 Win=88576 Len=0 TSval=3911455719 TSecr=3931966273"
"105","2.184809","172.20.0.4","172.20.0.3","TCP","66","48162  >  8080 [ACK] Seq=156 Ack=28961 Win=88320 Len=0 TSval=3911455719 TSecr=3931966273"
"106","2.184812","172.20.0.4","172.20.0.3","TCP","66","48162  >  8080 [ACK] Seq=156 Ack=31857 Win=85504 Len=0 TSval=3911455719 TSecr=3931966273"
"107","2.184815","172.20.0.4","172.20.0.3","TCP","66","48162  >  8080 [ACK] Seq=156 Ack=34753 Win=91264 Len=0 TSval=3911455719 TSecr=3931966273"
"108","2.184818","172.20.0.4","172.20.0.3","TCP","66","48162  >  8080 [ACK] Seq=156 Ack=37649 Win=88448 Len=0 TSval=3911455719 TSecr=3931966273"
"109","2.185136","172.20.0.3","172.20.0.4","TCP","2962","8080  >  48162 [PSH, ACK] Seq=37649 Ack=156 Win=65024 Len=2896 TSval=3931966324 TSecr=3911455719 [TCP PDU reassembled in 147]"
"110","2.185261","172.20.0.3","172.20.0.4","TCP","2962","8080  >  48162 [PSH, ACK] Seq=40545 Ack=156 Win=65024 Len=2896 TSval=3931966324 TSecr=3911455719 [TCP PDU reassembled in 147]"
"111","2.185337","172.20.0.3","172.20.0.4","TCP","2962","8080  >  48162 [PSH, ACK] Seq=43441 Ack=156 Win=65024 Len=2896 TSval=3931966324 TSecr=3911455719 [TCP PDU reassembled in 147]"
"112","2.185354","172.20.0.3","172.20.0.4","TCP","2962","8080  >  48162 [PSH, ACK] Seq=46337 Ack=156 Win=65024 Len=2896 TSval=3931966324 TSecr=3911455719 [TCP PDU reassembled in 147]"
"113","2.185401","172.20.0.3","172.20.0.4","TCP","2962","8080  >  48162 [PSH, ACK] Seq=49233 Ack=156 Win=65024 Len=2896 TSval=3931966324 TSecr=3911455719 [TCP PDU reassembled in 147]"
"114","2.185416","172.20.0.3","172.20.0.4","TCP","2962","8080  >  48162 [PSH, ACK] Seq=52129 Ack=156 Win=65024 Len=2896 TSval=3931966324 TSecr=3911455719 [TCP PDU reassembled in 147]"
"115","2.185470","172.20.0.3","172.20.0.4","TCP","2962","8080  >  48162 [PSH, ACK] Seq=55025 Ack=156 Win=65024 Len=2896 TSval=3931966325 TSecr=3911455719 [TCP PDU reassembled in 147]"
"116","2.185486","172.20.0.3","172.20.0.4","TCP","2962","8080  >  48162 [PSH, ACK] Seq=57921 Ack=156 Win=65024 Len=2896 TSval=3931966325 TSecr=3911455719 [TCP PDU reassembled in 147]"
"117","2.185539","172.20.0.3","172.20.0.4","TCP","2962","8080  >  48162 [PSH, ACK] Seq=60817 Ack=156 Win=65024 Len=2896 TSval=3931966325 TSecr=3911455719 [TCP PDU reassembled in 147]"
"118","2.185555","172.20.0.3","172.20.0.4","TCP","2962","8080  >  48162 [PSH, ACK] Seq=63713 Ack=156 Win=65024 Len=2896 TSval=3931966325 TSecr=3911455719 [TCP PDU reassembled in 147]"
"119","2.185634","172.20.0.3","172.20.0.4","TCP","2962","8080  >  48162 [PSH, ACK] Seq=66609 Ack=156 Win=65024 Len=2896 TSval=3931966325 TSecr=3911455719 [TCP PDU reassembled in 147]"
"120","2.185652","172.20.0.3","172.20.0.4","TCP","2962","8080  >  48162 [PSH, ACK] Seq=69505 Ack=156 Win=65024 Len=2896 TSval=3931966325 TSecr=3911455719 [TCP PDU reassembled in 147]"
"121","2.185699","172.20.0.3","172.20.0.4","TCP","2962","8080  >  48162 [PSH, ACK] Seq=72401 Ack=156 Win=65024 Len=2896 TSval=3931966325 TSecr=3911455719 [TCP PDU reassembled in 147]"
"122","2.185708","172.20.0.3","172.20.0.4","TCP","2962","8080  >  48162 [PSH, ACK] Seq=75297 Ack=156 Win=65024 Len=2896 TSval=3931966325 TSecr=3911455719 [TCP PDU reassembled in 147]"
"123","2.185755","172.20.0.3","172.20.0.4","TCP","2962","8080  >  48162 [PSH, ACK] Seq=78193 Ack=156 Win=65024 Len=2896 TSval=3931966325 TSecr=3911455719 [TCP PDU reassembled in 147]"
"124","2.185770","172.20.0.3","172.20.0.4","TCP","2962","8080  >  48162 [PSH, ACK] Seq=81089 Ack=156 Win=65024 Len=2896 TSval=3931966325 TSecr=3911455719 [TCP PDU reassembled in 147]"
"125","2.185823","172.20.0.3","172.20.0.4","TCP","2962","8080  >  48162 [PSH, ACK] Seq=83985 Ack=156 Win=65024 Len=2896 TSval=3931966325 TSecr=3911455719 [TCP PDU reassembled in 147]"
"126","2.185832","172.20.0.3","172.20.0.4","TCP","2962","8080  >  48162 [PSH, ACK] Seq=86881 Ack=156 Win=65024 Len=2896 TSval=3931966325 TSecr=3911455719 [TCP PDU reassembled in 147]"
"127","2.235948","172.20.0.4","172.20.0.3","TCP","66","48162  >  8080 [ACK] Seq=156 Ack=40545 Win=97024 Len=0 TSval=3911455770 TSecr=3931966324"
"128","2.235960","172.20.0.4","172.20.0.3","TCP","66","48162  >  8080 [ACK] Seq=156 Ack=43441 Win=94208 Len=0 TSval=3911455770 TSecr=3931966324"
"129","2.235963","172.20.0.4","172.20.0.3","TCP","66","48162  >  8080 [ACK] Seq=156 Ack=46337 Win=91392 Len=0 TSval=3911455770 TSecr=3931966324"
"130","2.235965","172.20.0.4","172.20.0.3","TCP","66","48162  >  8080 [ACK] Seq=156 Ack=49233 Win=102784 Len=0 TSval=3911455770 TSecr=3931966324"
"131","2.235968","172.20.0.4","172.20.0.3","TCP","66","48162  >  8080 [ACK] Seq=156 Ack=52129 Win=104320 Len=0 TSval=3911455770 TSecr=3931966324"
"132","2.235970","172.20.0.4","172.20.0.3","TCP","66","48162  >  8080 [ACK] Seq=156 Ack=55025 Win=101504 Len=0 TSval=3911455770 TSecr=3931966324"
"133","2.235973","172.20.0.4","172.20.0.3","TCP","66","48162  >  8080 [ACK] Seq=156 Ack=57921 Win=98688 Len=0 TSval=3911455771 TSecr=3931966325"
"134","2.235975","172.20.0.4","172.20.0.3","TCP","66","48162  >  8080 [ACK] Seq=156 Ack=60817 Win=95872 Len=0 TSval=3911455771 TSecr=3931966325"
"135","2.235978","172.20.0.4","172.20.0.3","TCP","66","48162  >  8080 [ACK] Seq=156 Ack=63713 Win=93056 Len=0 TSval=3911455771 TSecr=3931966325"
"136","2.235986","172.20.0.4","172.20.0.3","TCP","66","48162  >  8080 [ACK] Seq=156 Ack=66609 Win=90240 Len=0 TSval=3911455771 TSecr=3931966325"
"137","2.235989","172.20.0.4","172.20.0.3","TCP","66","48162  >  8080 [ACK] Seq=156 Ack=69505 Win=87424 Len=0 TSval=3911455771 TSecr=3931966325"
"138","2.235991","172.20.0.4","172.20.0.3","TCP","66","48162  >  8080 [ACK] Seq=156 Ack=78193 Win=81280 Len=0 TSval=3911455771 TSecr=3931966325"
"139","2.235994","172.20.0.4","172.20.0.3","TCP","66","48162  >  8080 [ACK] Seq=156 Ack=81089 Win=84096 Len=0 TSval=3911455771 TSecr=3931966325"
"140","2.235996","172.20.0.4","172.20.0.3","TCP","66","48162  >  8080 [ACK] Seq=156 Ack=83985 Win=84096 Len=0 TSval=3911455771 TSecr=3931966325"
"141","2.235999","172.20.0.4","172.20.0.3","TCP","66","48162  >  8080 [ACK] Seq=156 Ack=86881 Win=84096 Len=0 TSval=3911455771 TSecr=3931966325"
"142","2.236001","172.20.0.4","172.20.0.3","TCP","66","48162  >  8080 [ACK] Seq=156 Ack=89777 Win=87040 Len=0 TSval=3911455771 TSecr=3931966325"
"143","2.236460","172.20.0.3","172.20.0.4","TCP","2962","8080  >  48162 [PSH, ACK] Seq=89777 Ack=156 Win=65024 Len=2896 TSval=3931966375 TSecr=3911455770 [TCP PDU reassembled in 147]"
"144","2.236580","172.20.0.3","172.20.0.4","TCP","2962","8080  >  48162 [PSH, ACK] Seq=92673 Ack=156 Win=65024 Len=2896 TSval=3931966375 TSecr=3911455770 [TCP PDU reassembled in 147]"
"145","2.236653","172.20.0.3","172.20.0.4","TCP","2962","8080  >  48162 [PSH, ACK] Seq=95569 Ack=156 Win=65024 Len=2896 TSval=3931966376 TSecr=3911455771 [TCP PDU reassembled in 147]"
"146","2.236664","172.20.0.3","172.20.0.4","TCP","2962","8080  >  48162 [PSH, ACK] Seq=98465 Ack=156 Win=65024 Len=2896 TSval=3931966376 TSecr=3911455771 [TCP PDU reassembled in 147]"
"147","2.236693","172.20.0.3","172.20.0.4","HTTP","1289","HTTP/1.1 200 OK "
"148","2.286696","172.20.0.4","172.20.0.3","TCP","66","48162  >  8080 [ACK] Seq=156 Ack=92673 Win=110080 Len=0 TSval=3911455822 TSecr=3931966375"
"149","2.286737","172.20.0.4","172.20.0.3","TCP","66","48162  >  8080 [ACK] Seq=156 Ack=95569 Win=110080 Len=0 TSval=3911455822 TSecr=3931966375"
"150","2.286759","172.20.0.4","172.20.0.3","TCP","66","48162  >  8080 [ACK] Seq=156 Ack=98465 Win=110080 Len=0 TSval=3911455822 TSecr=3931966376"
"151","2.286764","172.20.0.4","172.20.0.3","TCP","66","48162  >  8080 [ACK] Seq=156 Ack=101361 Win=115968 Len=0 TSval=3911455822 TSecr=3931966376"
"152","2.287025","172.20.0.4","172.20.0.3","TCP","66","48162  >  8080 [FIN, ACK] Seq=156 Ack=102585 Win=118784 Len=0 TSval=3911455822 TSecr=3931966376"
"153","2.287122","172.20.0.3","172.20.0.4","TCP","66","8080  >  48162 [ACK] Seq=102585 Ack=157 Win=65024 Len=0 TSval=3931966426 TSecr=3911455822"
"154","3.990682","172.20.0.4","172.20.0.2","DNS","59","DNS Stateful operations (DSO) 0x3530[Malformed Packet]"
"155","3.991210","172.20.0.2","172.20.0.4","DNS","70","DNS Stateful operations (DSO) 0x3530[Malformed Packet]"
"156","4.041969","172.20.0.4","172.20.0.3","TCP","74","48176  >  8080 [SYN] Seq=0 Win=64240 Len=0 MSS=1460 SACK_PERM TSval=3911457577 TSecr=0 WS=128"
"157","4.042157","172.20.0.3","172.20.0.4","TCP","74","8080  >  48176 [SYN, ACK] Seq=0 Ack=1 Win=65160 Len=0 MSS=1460 SACK_PERM TSval=3931968181 TSecr=3911457577 WS=128"
"158","4.092399","172.20.0.4","172.20.0.3","TCP","66","48176  >  8080 [ACK] Seq=1 Ack=1 Win=64256 Len=0 TSval=3911457627 TSecr=3931968181"
"159","4.092412","172.20.0.4","172.20.0.3","HTTP","221","GET /arquivo_100kb.bin HTTP/1.1 "
"160","4.092630","172.20.0.3","172.20.0.4","TCP","66","8080  >  48176 [ACK] Seq=1 Ack=156 Win=65024 Len=0 TSval=3931968232 TSecr=3911457627"
"161","4.109529","172.20.0.3","172.20.0.4","TCP","2962","8080  >  48176 [PSH, ACK] Seq=1 Ack=156 Win=65024 Len=2896 TSval=3931968249 TSecr=3911457627 [TCP PDU reassembled in 210]"
"162","4.109707","172.20.0.3","172.20.0.4","TCP","2962","8080  >  48176 [PSH, ACK] Seq=2897 Ack=156 Win=65024 Len=2896 TSval=3931968249 TSecr=3911457627 [TCP PDU reassembled in 210]"
"163","4.109753","172.20.0.3","172.20.0.4","TCP","2962","8080  >  48176 [PSH, ACK] Seq=5793 Ack=156 Win=65024 Len=2896 TSval=3931968249 TSecr=3911457627 [TCP PDU reassembled in 210]"
"164","4.109788","172.20.0.3","172.20.0.4","TCP","2962","8080  >  48176 [PSH, ACK] Seq=8689 Ack=156 Win=65024 Len=2896 TSval=3931968249 TSecr=3911457627 [TCP PDU reassembled in 210]"
"165","4.109821","172.20.0.3","172.20.0.4","TCP","2962","8080  >  48176 [PSH, ACK] Seq=11585 Ack=156 Win=65024 Len=2896 TSval=3931968249 TSecr=3911457627 [TCP PDU reassembled in 210]"
"166","4.160441","172.20.0.4","172.20.0.3","TCP","66","48176  >  8080 [ACK] Seq=156 Ack=2897 Win=70144 Len=0 TSval=3911457695 TSecr=3931968249"
"167","4.160453","172.20.0.4","172.20.0.3","TCP","66","48176  >  8080 [ACK] Seq=156 Ack=8689 Win=81664 Len=0 TSval=3911457695 TSecr=3931968249"
"168","4.160456","172.20.0.4","172.20.0.3","TCP","66","48176  >  8080 [ACK] Seq=156 Ack=11585 Win=87424 Len=0 TSval=3911457695 TSecr=3931968249"
"169","4.160459","172.20.0.4","172.20.0.3","TCP","66","48176  >  8080 [ACK] Seq=156 Ack=14481 Win=88320 Len=0 TSval=3911457695 TSecr=3931968249"
"170","4.160696","172.20.0.3","172.20.0.4","TCP","2962","8080  >  48176 [PSH, ACK] Seq=14481 Ack=156 Win=65024 Len=2896 TSval=3931968300 TSecr=3911457695 [TCP PDU reassembled in 210]"
"171","4.160826","172.20.0.3","172.20.0.4","TCP","2962","8080  >  48176 [PSH, ACK] Seq=17377 Ack=156 Win=65024 Len=2896 TSval=3931968300 TSecr=3911457695 [TCP PDU reassembled in 210]"
"172","4.160909","172.20.0.3","172.20.0.4","TCP","2962","8080  >  48176 [PSH, ACK] Seq=20273 Ack=156 Win=65024 Len=2896 TSval=3931968300 TSecr=3911457695 [TCP PDU reassembled in 210]"
"173","4.160926","172.20.0.3","172.20.0.4","TCP","2962","8080  >  48176 [PSH, ACK] Seq=23169 Ack=156 Win=65024 Len=2896 TSval=3931968300 TSecr=3911457695 [TCP PDU reassembled in 210]"
"174","4.160974","172.20.0.3","172.20.0.4","TCP","2962","8080  >  48176 [PSH, ACK] Seq=26065 Ack=156 Win=65024 Len=2896 TSval=3931968300 TSecr=3911457695 [TCP PDU reassembled in 210]"
"175","4.160989","172.20.0.3","172.20.0.4","TCP","2962","8080  >  48176 [PSH, ACK] Seq=28961 Ack=156 Win=65024 Len=2896 TSval=3931968300 TSecr=3911457695 [TCP PDU reassembled in 210]"
"176","4.161044","172.20.0.3","172.20.0.4","TCP","2962","8080  >  48176 [PSH, ACK] Seq=31857 Ack=156 Win=65024 Len=2896 TSval=3931968300 TSecr=3911457695 [TCP PDU reassembled in 210]"
"177","4.161051","172.20.0.3","172.20.0.4","TCP","2962","8080  >  48176 [PSH, ACK] Seq=34753 Ack=156 Win=65024 Len=2896 TSval=3931968300 TSecr=3911457695 [TCP PDU reassembled in 210]"
"178","4.161096","172.20.0.3","172.20.0.4","TCP","2962","8080  >  48176 [PSH, ACK] Seq=37649 Ack=156 Win=65024 Len=2896 TSval=3931968300 TSecr=3911457695 [TCP PDU reassembled in 210]"
"179","4.161112","172.20.0.3","172.20.0.4","TCP","2962","8080  >  48176 [PSH, ACK] Seq=40545 Ack=156 Win=65024 Len=2896 TSval=3931968300 TSecr=3911457695 [TCP PDU reassembled in 210]"
"180","4.211630","172.20.0.4","172.20.0.3","TCP","66","48176  >  8080 [ACK] Seq=156 Ack=17377 Win=94080 Len=0 TSval=3911457746 TSecr=3931968300"
"181","4.211643","172.20.0.4","172.20.0.3","TCP","66","48176  >  8080 [ACK] Seq=156 Ack=20273 Win=94080 Len=0 TSval=3911457746 TSecr=3931968300"
"182","4.211645","172.20.0.4","172.20.0.3","TCP","66","48176  >  8080 [ACK] Seq=156 Ack=23169 Win=91264 Len=0 TSval=3911457746 TSecr=3931968300"
"183","4.211648","172.20.0.4","172.20.0.3","TCP","66","48176  >  8080 [ACK] Seq=156 Ack=26065 Win=88448 Len=0 TSval=3911457746 TSecr=3931968300"
"184","4.211651","172.20.0.4","172.20.0.3","TCP","66","48176  >  8080 [ACK] Seq=156 Ack=28961 Win=88320 Len=0 TSval=3911457746 TSecr=3931968300"
"185","4.211654","172.20.0.4","172.20.0.3","TCP","66","48176  >  8080 [ACK] Seq=156 Ack=31857 Win=85504 Len=0 TSval=3911457746 TSecr=3931968300"
"186","4.211657","172.20.0.4","172.20.0.3","TCP","66","48176  >  8080 [ACK] Seq=156 Ack=34753 Win=88320 Len=0 TSval=3911457746 TSecr=3931968300"
"187","4.211659","172.20.0.4","172.20.0.3","TCP","66","48176  >  8080 [ACK] Seq=156 Ack=37649 Win=85504 Len=0 TSval=3911457746 TSecr=3931968300"
"188","4.211662","172.20.0.4","172.20.0.3","TCP","66","48176  >  8080 [ACK] Seq=156 Ack=40545 Win=85504 Len=0 TSval=3911457746 TSecr=3931968300"
"189","4.211667","172.20.0.4","172.20.0.3","TCP","66","48176  >  8080 [ACK] Seq=156 Ack=43441 Win=82688 Len=0 TSval=3911457746 TSecr=3931968300"
"190","4.212014","172.20.0.3","172.20.0.4","TCP","2962","8080  >  48176 [PSH, ACK] Seq=43441 Ack=156 Win=65024 Len=2896 TSval=3931968351 TSecr=3911457746 [TCP PDU reassembled in 210]"
"191","4.212140","172.20.0.3","172.20.0.4","TCP","2962","8080  >  48176 [PSH, ACK] Seq=46337 Ack=156 Win=65024 Len=2896 TSval=3931968351 TSecr=3911457746 [TCP PDU reassembled in 210]"
"192","4.212215","172.20.0.3","172.20.0.4","TCP","2962","8080  >  48176 [PSH, ACK] Seq=49233 Ack=156 Win=65024 Len=2896 TSval=3931968351 TSecr=3911457746 [TCP PDU reassembled in 210]"
"193","4.212231","172.20.0.3","172.20.0.4","TCP","2962","8080  >  48176 [PSH, ACK] Seq=52129 Ack=156 Win=65024 Len=2896 TSval=3931968351 TSecr=3911457746 [TCP PDU reassembled in 210]"
"194","4.212279","172.20.0.3","172.20.0.4","TCP","2962","8080  >  48176 [PSH, ACK] Seq=55025 Ack=156 Win=65024 Len=2896 TSval=3931968351 TSecr=3911457746 [TCP PDU reassembled in 210]"
"195","4.212296","172.20.0.3","172.20.0.4","TCP","2962","8080  >  48176 [PSH, ACK] Seq=57921 Ack=156 Win=65024 Len=2896 TSval=3931968351 TSecr=3911457746 [TCP PDU reassembled in 210]"
"196","4.212349","172.20.0.3","172.20.0.4","TCP","2962","8080  >  48176 [PSH, ACK] Seq=60817 Ack=156 Win=65024 Len=2896 TSval=3931968351 TSecr=3911457746 [TCP PDU reassembled in 210]"
"197","4.212365","172.20.0.3","172.20.0.4","TCP","2962","8080  >  48176 [PSH, ACK] Seq=63713 Ack=156 Win=65024 Len=2896 TSval=3931968351 TSecr=3911457746 [TCP PDU reassembled in 210]"
"198","4.212419","172.20.0.3","172.20.0.4","TCP","2962","8080  >  48176 [PSH, ACK] Seq=66609 Ack=156 Win=65024 Len=2896 TSval=3931968351 TSecr=3911457746 [TCP PDU reassembled in 210]"
"199","4.212435","172.20.0.3","172.20.0.4","TCP","2962","8080  >  48176 [PSH, ACK] Seq=69505 Ack=156 Win=65024 Len=2896 TSval=3931968351 TSecr=3911457746 [TCP PDU reassembled in 210]"
"200","4.212513","172.20.0.3","172.20.0.4","TCP","2962","8080  >  48176 [PSH, ACK] Seq=72401 Ack=156 Win=65024 Len=2896 TSval=3931968352 TSecr=3911457746 [TCP PDU reassembled in 210]"
"201","4.212529","172.20.0.3","172.20.0.4","TCP","2962","8080  >  48176 [PSH, ACK] Seq=75297 Ack=156 Win=65024 Len=2896 TSval=3931968352 TSecr=3911457746 [TCP PDU reassembled in 210]"
"202","4.212575","172.20.0.3","172.20.0.4","TCP","2962","8080  >  48176 [PSH, ACK] Seq=78193 Ack=156 Win=65024 Len=2896 TSval=3931968352 TSecr=3911457746 [TCP PDU reassembled in 210]"
"203","4.212591","172.20.0.3","172.20.0.4","TCP","2962","8080  >  48176 [PSH, ACK] Seq=81089 Ack=156 Win=65024 Len=2896 TSval=3931968352 TSecr=3911457746 [TCP PDU reassembled in 210]"
"204","4.212645","172.20.0.3","172.20.0.4","TCP","2962","8080  >  48176 [PSH, ACK] Seq=83985 Ack=156 Win=65024 Len=2896 TSval=3931968352 TSecr=3911457746 [TCP PDU reassembled in 210]"
"205","4.212661","172.20.0.3","172.20.0.4","TCP","2962","8080  >  48176 [PSH, ACK] Seq=86881 Ack=156 Win=65024 Len=2896 TSval=3931968352 TSecr=3911457746 [TCP PDU reassembled in 210]"
"206","4.212706","172.20.0.3","172.20.0.4","TCP","2962","8080  >  48176 [PSH, ACK] Seq=89777 Ack=156 Win=65024 Len=2896 TSval=3931968352 TSecr=3911457746 [TCP PDU reassembled in 210]"
"207","4.212721","172.20.0.3","172.20.0.4","TCP","2962","8080  >  48176 [PSH, ACK] Seq=92673 Ack=156 Win=65024 Len=2896 TSval=3931968352 TSecr=3911457746 [TCP PDU reassembled in 210]"
"208","4.212774","172.20.0.3","172.20.0.4","TCP","2962","8080  >  48176 [PSH, ACK] Seq=95569 Ack=156 Win=65024 Len=2896 TSval=3931968352 TSecr=3911457746 [TCP PDU reassembled in 210]"
"209","4.212789","172.20.0.3","172.20.0.4","TCP","2962","8080  >  48176 [PSH, ACK] Seq=98465 Ack=156 Win=65024 Len=2896 TSval=3931968352 TSecr=3911457746 [TCP PDU reassembled in 210]"
"210","4.212821","172.20.0.3","172.20.0.4","HTTP","1289","HTTP/1.1 200 OK "
"211","4.262326","172.20.0.4","172.20.0.3","TCP","66","48176  >  8080 [ACK] Seq=156 Ack=46337 Win=97024 Len=0 TSval=3911457797 TSecr=3931968351"
"212","4.262339","172.20.0.4","172.20.0.3","TCP","66","48176  >  8080 [ACK] Seq=156 Ack=49233 Win=94208 Len=0 TSval=3911457797 TSecr=3931968351"
"213","4.262343","172.20.0.4","172.20.0.3","TCP","66","48176  >  8080 [ACK] Seq=156 Ack=52129 Win=91392 Len=0 TSval=3911457797 TSecr=3931968351"
"214","4.262355","172.20.0.4","172.20.0.3","TCP","66","48176  >  8080 [ACK] Seq=156 Ack=55025 Win=102784 Len=0 TSval=3911457797 TSecr=3931968351"
"215","4.262389","172.20.0.4","172.20.0.3","TCP","66","48176  >  8080 [ACK] Seq=156 Ack=57921 Win=108544 Len=0 TSval=3911457797 TSecr=3931968351"
"216","4.262393","172.20.0.4","172.20.0.3","TCP","66","48176  >  8080 [ACK] Seq=156 Ack=60817 Win=114432 Len=0 TSval=3911457797 TSecr=3931968351"
"217","4.262404","172.20.0.4","172.20.0.3","TCP","66","48176  >  8080 [ACK] Seq=156 Ack=63713 Win=120192 Len=0 TSval=3911457797 TSecr=3931968351"
"218","4.262408","172.20.0.4","172.20.0.3","TCP","66","48176  >  8080 [ACK] Seq=156 Ack=66609 Win=125952 Len=0 TSval=3911457797 TSecr=3931968351"
"219","4.262855","172.20.0.4","172.20.0.3","TCP","66","48176  >  8080 [ACK] Seq=156 Ack=69505 Win=131712 Len=0 TSval=3911457797 TSecr=3931968351"
"220","4.262859","172.20.0.4","172.20.0.3","TCP","66","48176  >  8080 [ACK] Seq=156 Ack=72401 Win=137600 Len=0 TSval=3911457798 TSecr=3931968351"
"221","4.262862","172.20.0.4","172.20.0.3","TCP","66","48176  >  8080 [ACK] Seq=156 Ack=75297 Win=143360 Len=0 TSval=3911457798 TSecr=3931968352"
"222","4.262865","172.20.0.4","172.20.0.3","TCP","66","48176  >  8080 [ACK] Seq=156 Ack=78193 Win=149120 Len=0 TSval=3911457798 TSecr=3931968352"
"223","4.262867","172.20.0.4","172.20.0.3","TCP","66","48176  >  8080 [ACK] Seq=156 Ack=81089 Win=154880 Len=0 TSval=3911457798 TSecr=3931968352"
"224","4.262870","172.20.0.4","172.20.0.3","TCP","66","48176  >  8080 [ACK] Seq=156 Ack=83985 Win=160768 Len=0 TSval=3911457798 TSecr=3931968352"
"225","4.262872","172.20.0.4","172.20.0.3","TCP","66","48176  >  8080 [ACK] Seq=156 Ack=86881 Win=166144 Len=0 TSval=3911457798 TSecr=3931968352"
"226","4.262875","172.20.0.4","172.20.0.3","TCP","66","48176  >  8080 [ACK] Seq=156 Ack=89777 Win=163328 Len=0 TSval=3911457798 TSecr=3931968352"
"227","4.262877","172.20.0.4","172.20.0.3","TCP","66","48176  >  8080 [ACK] Seq=156 Ack=92673 Win=171904 Len=0 TSval=3911457798 TSecr=3931968352"
"228","4.262887","172.20.0.4","172.20.0.3","TCP","66","48176  >  8080 [ACK] Seq=156 Ack=95569 Win=169088 Len=0 TSval=3911457798 TSecr=3931968352"
"229","4.262890","172.20.0.4","172.20.0.3","TCP","66","48176  >  8080 [ACK] Seq=156 Ack=98465 Win=166272 Len=0 TSval=3911457798 TSecr=3931968352"
"230","4.262892","172.20.0.4","172.20.0.3","TCP","66","48176  >  8080 [ACK] Seq=156 Ack=101361 Win=171904 Len=0 TSval=3911457798 TSecr=3931968352"
"231","4.263267","172.20.0.4","172.20.0.3","TCP","66","48176  >  8080 [FIN, ACK] Seq=156 Ack=102585 Win=171904 Len=0 TSval=3911457798 TSecr=3931968352"
"232","4.263377","172.20.0.3","172.20.0.4","TCP","66","8080  >  48176 [ACK] Seq=102585 Ack=157 Win=65024 Len=0 TSval=3931968402 TSecr=3911457798"
"233","5.781135","172.20.0.4","172.20.0.2","DNS","59","DNS Stateful operations (DSO) 0x3931[Malformed Packet]"
"234","5.781680","172.20.0.2","172.20.0.4","DNS","70","DNS Stateful operations (DSO) 0x3931[Malformed Packet]"
"235","5.832620","172.20.0.4","172.20.0.3","TCP","74","48178  >  8080 [SYN] Seq=0 Win=64240 Len=0 MSS=1460 SACK_PERM TSval=3911459367 TSecr=0 WS=128"
"236","5.832813","172.20.0.3","172.20.0.4","TCP","74","8080  >  48178 [SYN, ACK] Seq=0 Ack=1 Win=65160 Len=0 MSS=1460 SACK_PERM TSval=3931969972 TSecr=3911459367 WS=128"
"237","5.883099","172.20.0.4","172.20.0.3","TCP","66","48178  >  8080 [ACK] Seq=1 Ack=1 Win=64256 Len=0 TSval=3911459418 TSecr=3931969972"
"238","5.883112","172.20.0.4","172.20.0.3","HTTP","221","GET /arquivo_100kb.bin HTTP/1.1 "
"239","5.883407","172.20.0.3","172.20.0.4","TCP","66","8080  >  48178 [ACK] Seq=1 Ack=156 Win=65024 Len=0 TSval=3931970022 TSecr=3911459418"
"240","5.899603","172.20.0.3","172.20.0.4","TCP","2962","8080  >  48178 [PSH, ACK] Seq=1 Ack=156 Win=65024 Len=2896 TSval=3931970039 TSecr=3911459418 [TCP PDU reassembled in 287]"
"241","5.899804","172.20.0.3","172.20.0.4","TCP","2962","8080  >  48178 [PSH, ACK] Seq=2897 Ack=156 Win=65024 Len=2896 TSval=3931970039 TSecr=3911459418 [TCP PDU reassembled in 287]"
"242","5.899862","172.20.0.3","172.20.0.4","TCP","2962","8080  >  48178 [PSH, ACK] Seq=5793 Ack=156 Win=65024 Len=2896 TSval=3931970039 TSecr=3911459418 [TCP PDU reassembled in 287]"
"243","5.899910","172.20.0.3","172.20.0.4","TCP","2962","8080  >  48178 [PSH, ACK] Seq=8689 Ack=156 Win=65024 Len=2896 TSval=3931970039 TSecr=3911459418 [TCP PDU reassembled in 287]"
"244","5.899958","172.20.0.3","172.20.0.4","TCP","2962","8080  >  48178 [PSH, ACK] Seq=11585 Ack=156 Win=65024 Len=2896 TSval=3931970039 TSecr=3911459418 [TCP PDU reassembled in 287]"
"245","5.949916","172.20.0.4","172.20.0.3","TCP","66","48178  >  8080 [ACK] Seq=156 Ack=2897 Win=70144 Len=0 TSval=3911459485 TSecr=3931970039"
"246","5.949927","172.20.0.4","172.20.0.3","TCP","66","48178  >  8080 [ACK] Seq=156 Ack=5793 Win=75904 Len=0 TSval=3911459485 TSecr=3931970039"
"247","5.949937","172.20.0.4","172.20.0.3","TCP","66","48178  >  8080 [ACK] Seq=156 Ack=8689 Win=81664 Len=0 TSval=3911459485 TSecr=3931970039"
"248","5.949940","172.20.0.4","172.20.0.3","TCP","66","48178  >  8080 [ACK] Seq=156 Ack=11585 Win=87424 Len=0 TSval=3911459485 TSecr=3931970039"
"249","5.950182","172.20.0.3","172.20.0.4","TCP","2962","8080  >  48178 [PSH, ACK] Seq=14481 Ack=156 Win=65024 Len=2896 TSval=3931970089 TSecr=3911459485 [TCP PDU reassembled in 287]"
"250","5.950292","172.20.0.4","172.20.0.3","TCP","66","48178  >  8080 [ACK] Seq=156 Ack=14481 Win=93312 Len=0 TSval=3911459485 TSecr=3931970039"
