"No.","Time","Source","Destination","Protocol","Length","Info"
"1","0.000000","172.20.0.4","172.20.0.2","DNS","59","DNS Stateful operations (DSO) 0x3733[Malformed Packet]"
"2","0.000524","172.20.0.2","172.20.0.4","DNS","70","DNS Stateful operations (DSO) 0x3733[Malformed Packet]"
"3","0.051903","172.20.0.4","172.20.0.3","TCP","74","48364  >  8080 [SYN] Seq=0 Win=64240 Len=0 MSS=1460 SACK_PERM TSval=3912434461 TSecr=0 WS=128"
"4","0.052104","172.20.0.3","172.20.0.4","TCP","74","8080  >  48364 [SYN, ACK] Seq=0 Ack=1 Win=65160 Len=0 MSS=1460 SACK_PERM TSval=3932945065 TSecr=3912434461 WS=128"
"5","0.102984","172.20.0.4","172.20.0.3","TCP","66","48364  >  8080 [ACK] Seq=1 Ack=1 Win=64256 Len=0 TSval=3912434511 TSecr=3932945065"
"6","0.102997","172.20.0.4","172.20.0.3","HTTP","219","GET /arquivo_1mb.bin HTTP/1.1 "
"7","0.103316","172.20.0.3","172.20.0.4","TCP","66","8080  >  48364 [ACK] Seq=1 Ack=154 Win=65024 Len=0 TSval=3932945116 TSecr=3912434512"
"8","0.140244","172.20.0.3","172.20.0.4","TCP","2962","8080  >  48364 [PSH, ACK] Seq=1 Ack=154 Win=65024 Len=2896 TSval=3932945153 TSecr=3912434512 [TCP PDU reassembled in 269]"
"9","0.140524","172.20.0.3","172.20.0.4","TCP","2962","8080  >  48364 [PSH, ACK] Seq=2897 Ack=154 Win=65024 Len=2896 TSval=3932945154 TSecr=3912434512 [TCP PDU reassembled in 269]"
"10","0.140583","172.20.0.3","172.20.0.4","TCP","2962","8080  >  48364 [PSH, ACK] Seq=5793 Ack=154 Win=65024 Len=2896 TSval=3932945154 TSecr=3912434512 [TCP PDU reassembled in 269]"
"11","0.140632","172.20.0.3","172.20.0.4","TCP","2962","8080  >  48364 [PSH, ACK] Seq=8689 Ack=154 Win=65024 Len=2896 TSval=3932945154 TSecr=3912434512 [TCP PDU reassembled in 269]"
"12","0.140670","172.20.0.3","172.20.0.4","TCP","2962","8080  >  48364 [PSH, ACK] Seq=11585 Ack=154 Win=65024 Len=2896 TSval=3932945154 TSecr=3912434512 [TCP PDU reassembled in 269]"
"13","0.191231","172.20.0.4","172.20.0.3","TCP","66","48364  >  8080 [ACK] Seq=154 Ack=2897 Win=70144 Len=0 TSval=3912434599 TSecr=3932945153"
"14","0.191244","172.20.0.4","172.20.0.3","TCP","66","48364  >  8080 [ACK] Seq=154 Ack=5793 Win=75904 Len=0 TSval=3912434600 TSecr=3932945154"
"15","0.191248","172.20.0.4","172.20.0.3","TCP","66","48364  >  8080 [ACK] Seq=154 Ack=8689 Win=81664 Len=0 TSval=3912434600 TSecr=3932945154"
"16","0.191251","172.20.0.4","172.20.0.3","TCP","66","48364  >  8080 [ACK] Seq=154 Ack=11585 Win=87424 Len=0 TSval=3912434600 TSecr=3932945154"
"17","0.191256","172.20.0.4","172.20.0.3","TCP","66","48364  >  8080 [ACK] Seq=154 Ack=14481 Win=93312 Len=0 TSval=3912434600 TSecr=3932945154"
"18","0.191636","172.20.0.3","172.20.0.4","TCP","2962","8080  >  48364 [PSH, ACK] Seq=14481 Ack=154 Win=65024 Len=2896 TSval=3932945205 TSecr=3912434599 [TCP PDU reassembled in 269]"
"19","0.191800","172.20.0.3","172.20.0.4","TCP","2962","8080  >  48364 [PSH, ACK] Seq=17377 Ack=154 Win=65024 Len=2896 TSval=3932945205 TSecr=3912434599 [TCP PDU reassembled in 269]"
"20","0.191920","172.20.0.3","172.20.0.4","TCP","2962","8080  >  48364 [PSH, ACK] Seq=20273 Ack=154 Win=65024 Len=2896 TSval=3932945205 TSecr=3912434600 [TCP PDU reassembled in 269]"
"21","0.192066","172.20.0.3","172.20.0.4","TCP","2962","8080  >  48364 [PSH, ACK] Seq=23169 Ack=154 Win=65024 Len=2896 TSval=3932945205 TSecr=3912434600 [TCP PDU reassembled in 269]"
"22","0.192084","172.20.0.3","172.20.0.4","TCP","2962","8080  >  48364 [PSH, ACK] Seq=26065 Ack=154 Win=65024 Len=2896 TSval=3932945205 TSecr=3912434600 [TCP PDU reassembled in 269]"
"23","0.192137","172.20.0.3","172.20.0.4","TCP","2962","8080  >  48364 [PSH, ACK] Seq=28961 Ack=154 Win=65024 Len=2896 TSval=3932945205 TSecr=3912434600 [TCP PDU reassembled in 269]"
"24","0.192208","172.20.0.3","172.20.0.4","TCP","2962","8080  >  48364 [PSH, ACK] Seq=31857 Ack=154 Win=65024 Len=2896 TSval=3932945205 TSecr=3912434600 [TCP PDU reassembled in 269]"
"25","0.192263","172.20.0.3","172.20.0.4","TCP","2962","8080  >  48364 [PSH, ACK] Seq=34753 Ack=154 Win=65024 Len=2896 TSval=3932945205 TSecr=3912434600 [TCP PDU reassembled in 269]"
"26","0.192390","172.20.0.3","172.20.0.4","TCP","2962","8080  >  48364 [PSH, ACK] Seq=37649 Ack=154 Win=65024 Len=2896 TSval=3932945205 TSecr=3912434600 [TCP PDU reassembled in 269]"
"27","0.192443","172.20.0.3","172.20.0.4","TCP","2962","8080  >  48364 [PSH, ACK] Seq=40545 Ack=154 Win=65024 Len=2896 TSval=3932945205 TSecr=3912434600 [TCP PDU reassembled in 269]"
"28","0.242638","172.20.0.4","172.20.0.3","TCP","66","48364  >  8080 [ACK] Seq=154 Ack=17377 Win=97024 Len=0 TSval=3912434651 TSecr=3932945205"
"29","0.242651","172.20.0.4","172.20.0.3","TCP","66","48364  >  8080 [ACK] Seq=154 Ack=20273 Win=94208 Len=0 TSval=3912434651 TSecr=3932945205"
"30","0.242653","172.20.0.4","172.20.0.3","TCP","66","48364  >  8080 [ACK] Seq=154 Ack=23169 Win=97024 Len=0 TSval=3912434651 TSecr=3932945205"
"31","0.242656","172.20.0.4","172.20.0.3","TCP","66","48364  >  8080 [ACK] Seq=154 Ack=26065 Win=94208 Len=0 TSval=3912434651 TSecr=3932945205"
"32","0.242659","172.20.0.4","172.20.0.3","TCP","66","48364  >  8080 [ACK] Seq=154 Ack=28961 Win=91392 Len=0 TSval=3912434651 TSecr=3932945205"
"33","0.242661","172.20.0.4","172.20.0.3","TCP","66","48364  >  8080 [ACK] Seq=154 Ack=31857 Win=88576 Len=0 TSval=3912434651 TSecr=3932945205"
"34","0.242664","172.20.0.4","172.20.0.3","TCP","66","48364  >  8080 [ACK] Seq=154 Ack=34753 Win=85760 Len=0 TSval=3912434651 TSecr=3932945205"
"35","0.242667","172.20.0.4","172.20.0.3","TCP","66","48364  >  8080 [ACK] Seq=154 Ack=37649 Win=85504 Len=0 TSval=3912434652 TSecr=3932945205"
"36","0.242670","172.20.0.4","172.20.0.3","TCP","66","48364  >  8080 [ACK] Seq=154 Ack=40545 Win=85504 Len=0 TSval=3912434652 TSecr=3932945205"
"37","0.242674","172.20.0.4","172.20.0.3","TCP","66","48364  >  8080 [ACK] Seq=154 Ack=43441 Win=82688 Len=0 TSval=3912434652 TSecr=3932945205"
"38","0.243157","172.20.0.3","172.20.0.4","TCP","2962","8080  >  48364 [PSH, ACK] Seq=43441 Ack=154 Win=65024 Len=2896 TSval=3932945256 TSecr=3912434651 [TCP PDU reassembled in 269]"
"39","0.243262","172.20.0.3","172.20.0.4","TCP","2962","[TCP Previous segment not captured] 8080  >  48364 [PSH, ACK] Seq=49233 Ack=154 Win=65024 Len=2896 TSval=3932945256 TSecr=3912434652 [TCP PDU reassembled in 269]"
"40","0.243322","172.20.0.3","172.20.0.4","TCP","2962","[TCP Out-Of-Order] 8080  >  48364 [PSH, ACK] Seq=46337 Ack=154 Win=65024 Len=2896 TSval=3932945256 TSecr=3912434651 [TCP PDU reassembled in 269]"
"41","0.243379","172.20.0.3","172.20.0.4","TCP","2962","8080  >  48364 [PSH, ACK] Seq=52129 Ack=154 Win=65024 Len=2896 TSval=3932945256 TSecr=3912434652 [TCP PDU reassembled in 269]"
"42","0.243449","172.20.0.3","172.20.0.4","TCP","2962","8080  >  48364 [PSH, ACK] Seq=55025 Ack=154 Win=65024 Len=2896 TSval=3932945256 TSecr=3912434652 [TCP PDU reassembled in 269]"
"43","0.243484","172.20.0.3","172.20.0.4","TCP","2962","8080  >  48364 [PSH, ACK] Seq=57921 Ack=154 Win=65024 Len=2896 TSval=3932945256 TSecr=3912434652 [TCP PDU reassembled in 269]"
"44","0.243529","172.20.0.3","172.20.0.4","TCP","2962","8080  >  48364 [PSH, ACK] Seq=60817 Ack=154 Win=65024 Len=2896 TSval=3932945256 TSecr=3912434652 [TCP PDU reassembled in 269]"
"45","0.243576","172.20.0.3","172.20.0.4","TCP","2962","8080  >  48364 [PSH, ACK] Seq=63713 Ack=154 Win=65024 Len=2896 TSval=3932945256 TSecr=3912434652 [TCP PDU reassembled in 269]"
"46","0.243620","172.20.0.3","172.20.0.4","TCP","2962","8080  >  48364 [PSH, ACK] Seq=66609 Ack=154 Win=65024 Len=2896 TSval=3932945256 TSecr=3912434652 [TCP PDU reassembled in 269]"
"47","0.243676","172.20.0.3","172.20.0.4","TCP","2962","8080  >  48364 [PSH, ACK] Seq=69505 Ack=154 Win=65024 Len=2896 TSval=3932945256 TSecr=3912434652 [TCP PDU reassembled in 269]"
"48","0.243735","172.20.0.3","172.20.0.4","TCP","2962","8080  >  48364 [PSH, ACK] Seq=72401 Ack=154 Win=65024 Len=2896 TSval=3932945256 TSecr=3912434652 [TCP PDU reassembled in 269]"
"49","0.243778","172.20.0.3","172.20.0.4","TCP","2962","8080  >  48364 [PSH, ACK] Seq=75297 Ack=154 Win=65024 Len=2896 TSval=3932945256 TSecr=3912434652 [TCP PDU reassembled in 269]"
"50","0.243825","172.20.0.3","172.20.0.4","TCP","2962","8080  >  48364 [PSH, ACK] Seq=78193 Ack=154 Win=65024 Len=2896 TSval=3932945256 TSecr=3912434652 [TCP PDU reassembled in 269]"
"51","0.243872","172.20.0.3","172.20.0.4","TCP","2962","8080  >  48364 [PSH, ACK] Seq=81089 Ack=154 Win=65024 Len=2896 TSval=3932945256 TSecr=3912434652 [TCP PDU reassembled in 269]"
"52","0.243906","172.20.0.3","172.20.0.4","TCP","2962","8080  >  48364 [PSH, ACK] Seq=83985 Ack=154 Win=65024 Len=2896 TSval=3932945256 TSecr=3912434652 [TCP PDU reassembled in 269]"
"53","0.243956","172.20.0.3","172.20.0.4","TCP","2962","8080  >  48364 [PSH, ACK] Seq=86881 Ack=154 Win=65024 Len=2896 TSval=3932945256 TSecr=3912434652 [TCP PDU reassembled in 269]"
"54","0.244003","172.20.0.3","172.20.0.4","TCP","2962","8080  >  48364 [PSH, ACK] Seq=89777 Ack=154 Win=65024 Len=2896 TSval=3932945256 TSecr=3912434652 [TCP PDU reassembled in 269]"
"55","0.244049","172.20.0.3","172.20.0.4","TCP","2962","8080  >  48364 [PSH, ACK] Seq=92673 Ack=154 Win=65024 Len=2896 TSval=3932945256 TSecr=3912434652 [TCP PDU reassembled in 269]"
"56","0.244097","172.20.0.3","172.20.0.4","TCP","2962","8080  >  48364 [PSH, ACK] Seq=95569 Ack=154 Win=65024 Len=2896 TSval=3932945256 TSecr=3912434652 [TCP PDU reassembled in 269]"
"57","0.244145","172.20.0.3","172.20.0.4","TCP","2962","8080  >  48364 [PSH, ACK] Seq=98465 Ack=154 Win=65024 Len=2896 TSval=3932945256 TSecr=3912434652 [TCP PDU reassembled in 269]"
"58","0.294160","172.20.0.4","172.20.0.3","TCP","66","48364  >  8080 [ACK] Seq=154 Ack=46337 Win=97024 Len=0 TSval=3912434702 TSecr=3932945256"
"59","0.294172","172.20.0.4","172.20.0.3","TCP","78","[TCP Dup ACK 58#1] 48364  >  8080 [ACK] Seq=154 Ack=46337 Win=97024 Len=0 TSval=3912434703 TSecr=3932945256 SLE=49233 SRE=52129"
"60","0.294175","172.20.0.4","172.20.0.3","TCP","66","48364  >  8080 [ACK] Seq=154 Ack=52129 Win=91264 Len=0 TSval=3912434703 TSecr=3932945256"
"61","0.294178","172.20.0.4","172.20.0.3","TCP","66","48364  >  8080 [ACK] Seq=154 Ack=55025 Win=88448 Len=0 TSval=3912434703 TSecr=3932945256"
"62","0.294180","172.20.0.4","172.20.0.3","TCP","66","48364  >  8080 [ACK] Seq=154 Ack=57921 Win=102784 Len=0 TSval=3912434703 TSecr=3932945256"
"63","0.294183","172.20.0.4","172.20.0.3","TCP","66","48364  >  8080 [ACK] Seq=154 Ack=60817 Win=108544 Len=0 TSval=3912434703 TSecr=3932945256"
"64","0.294186","172.20.0.4","172.20.0.3","TCP","66","48364  >  8080 [ACK] Seq=154 Ack=63713 Win=114432 Len=0 TSval=3912434703 TSecr=3932945256"
"65","0.294189","172.20.0.4","172.20.0.3","TCP","66","48364  >  8080 [ACK] Seq=154 Ack=66609 Win=120192 Len=0 TSval=3912434703 TSecr=3932945256"
"66","0.294191","172.20.0.4","172.20.0.3","TCP","66","48364  >  8080 [ACK] Seq=154 Ack=69505 Win=125952 Len=0 TSval=3912434703 TSecr=3932945256"
"67","0.294202","172.20.0.4","172.20.0.3","TCP","66","48364  >  8080 [ACK] Seq=154 Ack=72401 Win=131712 Len=0 TSval=3912434703 TSecr=3932945256"
"68","0.294205","172.20.0.4","172.20.0.3","TCP","66","48364  >  8080 [ACK] Seq=154 Ack=75297 Win=137600 Len=0 TSval=3912434703 TSecr=3932945256"
"69","0.294208","172.20.0.4","172.20.0.3","TCP","66","48364  >  8080 [ACK] Seq=154 Ack=78193 Win=143360 Len=0 TSval=3912434703 TSecr=3932945256"
"70","0.294211","172.20.0.4","172.20.0.3","TCP","66","48364  >  8080 [ACK] Seq=154 Ack=81089 Win=149120 Len=0 TSval=3912434703 TSecr=3932945256"
"71","0.294213","172.20.0.4","172.20.0.3","TCP","66","48364  >  8080 [ACK] Seq=154 Ack=83985 Win=154880 Len=0 TSval=3912434703 TSecr=3932945256"
"72","0.294216","172.20.0.4","172.20.0.3","TCP","66","48364  >  8080 [ACK] Seq=154 Ack=86881 Win=157440 Len=0 TSval=3912434703 TSecr=3932945256"
"73","0.294219","172.20.0.4","172.20.0.3","TCP","66","48364  >  8080 [ACK] Seq=154 Ack=89777 Win=163328 Len=0 TSval=3912434703 TSecr=3932945256"
"74","0.294221","172.20.0.4","172.20.0.3","TCP","66","48364  >  8080 [ACK] Seq=154 Ack=92673 Win=160512 Len=0 TSval=3912434703 TSecr=3932945256"
"75","0.294224","172.20.0.4","172.20.0.3","TCP","66","48364  >  8080 [ACK] Seq=154 Ack=95569 Win=157696 Len=0 TSval=3912434703 TSecr=3932945256"
"76","0.294228","172.20.0.4","172.20.0.3","TCP","66","48364  >  8080 [ACK] Seq=154 Ack=98465 Win=160384 Len=0 TSval=3912434703 TSecr=3932945256"
"77","0.294891","172.20.0.3","172.20.0.4","TCP","2962","8080  >  48364 [PSH, ACK] Seq=101361 Ack=154 Win=65024 Len=2896 TSval=3932945308 TSecr=3912434702 [TCP PDU reassembled in 269]"
"78","0.294917","172.20.0.3","172.20.0.4","TCP","2962","[TCP Previous segment not captured] 8080  >  48364 [PSH, ACK] Seq=107153 Ack=154 Win=65024 Len=2896 TSval=3932945308 TSecr=3912434703 [TCP PDU reassembled in 269]"
"79","0.295015","172.20.0.3","172.20.0.4","TCP","2962","[TCP Out-Of-Order] 8080  >  48364 [PSH, ACK] Seq=104257 Ack=154 Win=65024 Len=2896 TSval=3932945308 TSecr=3912434702 [TCP PDU reassembled in 269]"
"80","0.295073","172.20.0.3","172.20.0.4","TCP","2962","8080  >  48364 [PSH, ACK] Seq=110049 Ack=154 Win=65024 Len=2896 TSval=3932945308 TSecr=3912434703 [TCP PDU reassembled in 269]"
"81","0.295137","172.20.0.3","172.20.0.4","TCP","2962","8080  >  48364 [PSH, ACK] Seq=112945 Ack=154 Win=65024 Len=2896 TSval=3932945308 TSecr=3912434703 [TCP PDU reassembled in 269]"
"82","0.295178","172.20.0.3","172.20.0.4","TCP","2962","8080  >  48364 [PSH, ACK] Seq=115841 Ack=154 Win=65024 Len=2896 TSval=3932945308 TSecr=3912434703 [TCP PDU reassembled in 269]"
"83","0.295226","172.20.0.3","172.20.0.4","TCP","2962","8080  >  48364 [PSH, ACK] Seq=118737 Ack=154 Win=65024 Len=2896 TSval=3932945308 TSecr=3912434703 [TCP PDU reassembled in 269]"
"84","0.295271","172.20.0.3","172.20.0.4","TCP","2962","8080  >  48364 [PSH, ACK] Seq=121633 Ack=154 Win=65024 Len=2896 TSval=3932945308 TSecr=3912434703 [TCP PDU reassembled in 269]"
"85","0.295314","172.20.0.3","172.20.0.4","TCP","2962","8080  >  48364 [PSH, ACK] Seq=124529 Ack=154 Win=65024 Len=2896 TSval=3932945308 TSecr=3912434703 [TCP PDU reassembled in 269]"
"86","0.295360","172.20.0.3","172.20.0.4","TCP","2962","8080  >  48364 [PSH, ACK] Seq=127425 Ack=154 Win=65024 Len=2896 TSval=3932945308 TSecr=3912434703 [TCP PDU reassembled in 269]"
"87","0.295417","172.20.0.3","172.20.0.4","TCP","2962","8080  >  48364 [PSH, ACK] Seq=130321 Ack=154 Win=65024 Len=2896 TSval=3932945308 TSecr=3912434703 [TCP PDU reassembled in 269]"
"88","0.295478","172.20.0.3","172.20.0.4","TCP","2962","8080  >  48364 [PSH, ACK] Seq=133217 Ack=154 Win=65024 Len=2896 TSval=3932945308 TSecr=3912434703 [TCP PDU reassembled in 269]"
"89","0.295522","172.20.0.3","172.20.0.4","TCP","2962","8080  >  48364 [PSH, ACK] Seq=136113 Ack=154 Win=65024 Len=2896 TSval=3932945308 TSecr=3912434703 [TCP PDU reassembled in 269]"
"90","0.295584","172.20.0.3","172.20.0.4","TCP","2962","8080  >  48364 [PSH, ACK] Seq=139009 Ack=154 Win=65024 Len=2896 TSval=3932945308 TSecr=3912434703 [TCP PDU reassembled in 269]"
"91","0.295632","172.20.0.3","172.20.0.4","TCP","2962","8080  >  48364 [PSH, ACK] Seq=141905 Ack=154 Win=65024 Len=2896 TSval=3932945308 TSecr=3912434703 [TCP PDU reassembled in 269]"
"92","0.295667","172.20.0.3","172.20.0.4","TCP","2962","8080  >  48364 [PSH, ACK] Seq=144801 Ack=154 Win=65024 Len=2896 TSval=3932945308 TSecr=3912434703 [TCP PDU reassembled in 269]"
"93","0.295713","172.20.0.3","172.20.0.4","TCP","2962","8080  >  48364 [PSH, ACK] Seq=147697 Ack=154 Win=65024 Len=2896 TSval=3932945308 TSecr=3912434703 [TCP PDU reassembled in 269]"
"94","0.295769","172.20.0.3","172.20.0.4","TCP","2962","8080  >  48364 [PSH, ACK] Seq=150593 Ack=154 Win=65024 Len=2896 TSval=3932945308 TSecr=3912434703 [TCP PDU reassembled in 269]"
"95","0.295825","172.20.0.3","172.20.0.4","TCP","2962","8080  >  48364 [PSH, ACK] Seq=153489 Ack=154 Win=65024 Len=2896 TSval=3932945308 TSecr=3912434703 [TCP PDU reassembled in 269]"
"96","0.295875","172.20.0.3","172.20.0.4","TCP","2962","8080  >  48364 [PSH, ACK] Seq=156385 Ack=154 Win=65024 Len=2896 TSval=3932945308 TSecr=3912434703 [TCP PDU reassembled in 269]"
"97","0.295911","172.20.0.3","172.20.0.4","TCP","2962","8080  >  48364 [PSH, ACK] Seq=159281 Ack=154 Win=65024 Len=2896 TSval=3932945308 TSecr=3912434703 [TCP PDU reassembled in 269]"
"98","0.295957","172.20.0.3","172.20.0.4","TCP","2962","8080  >  48364 [PSH, ACK] Seq=162177 Ack=154 Win=65024 Len=2896 TSval=3932945308 TSecr=3912434703 [TCP PDU reassembled in 269]"
"99","0.296003","172.20.0.3","172.20.0.4","TCP","2962","8080  >  48364 [PSH, ACK] Seq=165073 Ack=154 Win=65024 Len=2896 TSval=3932945308 TSecr=3912434703 [TCP PDU reassembled in 269]"
"100","0.296049","172.20.0.3","172.20.0.4","TCP","2962","8080  >  48364 [PSH, ACK] Seq=167969 Ack=154 Win=65024 Len=2896 TSval=3932945308 TSecr=3912434703 [TCP PDU reassembled in 269]"
"101","0.296092","172.20.0.3","172.20.0.4","TCP","2962","8080  >  48364 [PSH, ACK] Seq=170865 Ack=154 Win=65024 Len=2896 TSval=3932945308 TSecr=3912434703 [TCP PDU reassembled in 269]"
"102","0.296139","172.20.0.3","172.20.0.4","TCP","2962","8080  >  48364 [PSH, ACK] Seq=173761 Ack=154 Win=65024 Len=2896 TSval=3932945308 TSecr=3912434703 [TCP PDU reassembled in 269]"
"103","0.296207","172.20.0.3","172.20.0.4","TCP","2962","8080  >  48364 [PSH, ACK] Seq=176657 Ack=154 Win=65024 Len=2896 TSval=3932945308 TSecr=3912434703 [TCP PDU reassembled in 269]"
"104","0.296309","172.20.0.3","172.20.0.4","TCP","2962","8080  >  48364 [PSH, ACK] Seq=179553 Ack=154 Win=65024 Len=2896 TSval=3932945308 TSecr=3912434703 [TCP PDU reassembled in 269]"
"105","0.296400","172.20.0.3","172.20.0.4","TCP","2962","8080  >  48364 [PSH, ACK] Seq=182449 Ack=154 Win=65024 Len=2896 TSval=3932945308 TSecr=3912434703 [TCP PDU reassembled in 269]"
"106","0.296638","172.20.0.3","172.20.0.4","TCP","2962","8080  >  48364 [PSH, ACK] Seq=185345 Ack=154 Win=65024 Len=2896 TSval=3932945310 TSecr=3912434703 [TCP PDU reassembled in 269]"
"107","0.296701","172.20.0.3","172.20.0.4","TCP","2962","8080  >  48364 [PSH, ACK] Seq=188241 Ack=154 Win=65024 Len=2896 TSval=3932945310 TSecr=3912434703 [TCP PDU reassembled in 269]"
"108","0.296750","172.20.0.3","172.20.0.4","TCP","2962","8080  >  48364 [PSH, ACK] Seq=191137 Ack=154 Win=65024 Len=2896 TSval=3932945310 TSecr=3912434703 [TCP PDU reassembled in 269]"
"109","0.296796","172.20.0.3","172.20.0.4","TCP","2962","8080  >  48364 [PSH, ACK] Seq=194033 Ack=154 Win=65024 Len=2896 TSval=3932945310 TSecr=3912434703 [TCP PDU reassembled in 269]"
"110","0.296839","172.20.0.3","172.20.0.4","TCP","2962","8080  >  48364 [PSH, ACK] Seq=196929 Ack=154 Win=65024 Len=2896 TSval=3932945310 TSecr=3912434703 [TCP PDU reassembled in 269]"
"111","0.296884","172.20.0.3","172.20.0.4","TCP","2962","8080  >  48364 [PSH, ACK] Seq=199825 Ack=154 Win=65024 Len=2896 TSval=3932945310 TSecr=3912434703 [TCP PDU reassembled in 269]"
"112","0.296920","172.20.0.3","172.20.0.4","TCP","2962","8080  >  48364 [PSH, ACK] Seq=202721 Ack=154 Win=65024 Len=2896 TSval=3932945310 TSecr=3912434703 [TCP PDU reassembled in 269]"
"113","0.296957","172.20.0.3","172.20.0.4","TCP","2962","8080  >  48364 [PSH, ACK] Seq=205617 Ack=154 Win=65024 Len=2896 TSval=3932945310 TSecr=3912434703 [TCP PDU reassembled in 269]"
"114","0.345802","172.20.0.4","172.20.0.3","TCP","66","48364  >  8080 [ACK] Seq=154 Ack=104257 Win=169088 Len=0 TSval=3912434754 TSecr=3932945308"
"115","0.345814","172.20.0.4","172.20.0.3","TCP","78","[TCP Dup ACK 114#1] 48364  >  8080 [ACK] Seq=154 Ack=104257 Win=174848 Len=0 TSval=3912434754 TSecr=3932945308 SLE=107153 SRE=110049"
"116","0.345817","172.20.0.4","172.20.0.3","TCP","66","48364  >  8080 [ACK] Seq=154 Ack=110049 Win=180608 Len=0 TSval=3912434754 TSecr=3932945308"
"117","0.345820","172.20.0.4","172.20.0.3","TCP","66","48364  >  8080 [ACK] Seq=154 Ack=115841 Win=180608 Len=0 TSval=3912434754 TSecr=3932945308"
"118","0.345822","172.20.0.4","172.20.0.3","TCP","66","48364  >  8080 [ACK] Seq=154 Ack=118737 Win=186368 Len=0 TSval=3912434754 TSecr=3932945308"
"119","0.345825","172.20.0.4","172.20.0.3","TCP","66","48364  >  8080 [ACK] Seq=154 Ack=124529 Win=198016 Len=0 TSval=3912434755 TSecr=3932945308"
"120","0.345828","172.20.0.4","172.20.0.3","TCP","66","48364  >  8080 [ACK] Seq=154 Ack=127425 Win=203776 Len=0 TSval=3912434755 TSecr=3932945308"
"121","0.345831","172.20.0.4","172.20.0.3","TCP","66","48364  >  8080 [ACK] Seq=154 Ack=130321 Win=209536 Len=0 TSval=3912434755 TSecr=3932945308"
"122","0.345834","172.20.0.4","172.20.0.3","TCP","66","48364  >  8080 [ACK] Seq=154 Ack=133217 Win=215296 Len=0 TSval=3912434755 TSecr=3932945308"
"123","0.345865","172.20.0.4","172.20.0.3","TCP","66","48364  >  8080 [ACK] Seq=154 Ack=136113 Win=221184 Len=0 TSval=3912434755 TSecr=3932945308"
"124","0.345868","172.20.0.4","172.20.0.3","TCP","66","48364  >  8080 [ACK] Seq=154 Ack=139009 Win=226944 Len=0 TSval=3912434755 TSecr=3932945308"
"125","0.345871","172.20.0.4","172.20.0.3","TCP","66","48364  >  8080 [ACK] Seq=154 Ack=141905 Win=232704 Len=0 TSval=3912434755 TSecr=3932945308"
"126","0.345874","172.20.0.4","172.20.0.3","TCP","66","48364  >  8080 [ACK] Seq=154 Ack=144801 Win=238464 Len=0 TSval=3912434755 TSecr=3932945308"
"127","0.345876","172.20.0.4","172.20.0.3","TCP","66","48364  >  8080 [ACK] Seq=154 Ack=147697 Win=244352 Len=0 TSval=3912434755 TSecr=3932945308"
"128","0.345879","172.20.0.4","172.20.0.3","TCP","66","48364  >  8080 [ACK] Seq=154 Ack=150593 Win=250112 Len=0 TSval=3912434755 TSecr=3932945308"
"129","0.345882","172.20.0.4","172.20.0.3","TCP","66","48364  >  8080 [ACK] Seq=154 Ack=153489 Win=255872 Len=0 TSval=3912434755 TSecr=3932945308"
"130","0.345890","172.20.0.4","172.20.0.3","TCP","66","48364  >  8080 [ACK] Seq=154 Ack=156385 Win=261632 Len=0 TSval=3912434755 TSecr=3932945308"
"131","0.346510","172.20.0.3","172.20.0.4","TCP","2962","8080  >  48364 [PSH, ACK] Seq=208513 Ack=154 Win=65024 Len=2896 TSval=3932945359 TSecr=3912434754 [TCP PDU reassembled in 269]"
"132","0.346634","172.20.0.4","172.20.0.3","TCP","66","48364  >  8080 [ACK] Seq=154 Ack=159281 Win=267520 Len=0 TSval=3912434755 TSecr=3932945308"
"133","0.346641","172.20.0.4","172.20.0.3","TCP","66","48364  >  8080 [ACK] Seq=154 Ack=162177 Win=273280 Len=0 TSval=3912434755 TSecr=3932945308"
"134","0.346645","172.20.0.4","172.20.0.3","TCP","66","48364  >  8080 [ACK] Seq=154 Ack=165073 Win=279040 Len=0 TSval=3912434755 TSecr=3932945308"
"135","0.346648","172.20.0.4","172.20.0.3","TCP","66","48364  >  8080 [ACK] Seq=154 Ack=167969 Win=284800 Len=0 TSval=3912434755 TSecr=3932945308"
"136","0.346652","172.20.0.4","172.20.0.3","TCP","66","48364  >  8080 [ACK] Seq=154 Ack=170865 Win=290688 Len=0 TSval=3912434755 TSecr=3932945308"
"137","0.346655","172.20.0.4","172.20.0.3","TCP","66","48364  >  8080 [ACK] Seq=154 Ack=173761 Win=296448 Len=0 TSval=3912434755 TSecr=3932945308"
"138","0.346658","172.20.0.4","172.20.0.3","TCP","66","48364  >  8080 [ACK] Seq=154 Ack=176657 Win=302208 Len=0 TSval=3912434755 TSecr=3932945308"
"139","0.346661","172.20.0.4","172.20.0.3","TCP","66","48364  >  8080 [ACK] Seq=154 Ack=179553 Win=307968 Len=0 TSval=3912434755 TSecr=3932945308"
"140","0.346664","172.20.0.4","172.20.0.3","TCP","66","48364  >  8080 [ACK] Seq=154 Ack=182449 Win=313856 Len=0 TSval=3912434756 TSecr=3932945308"
"141","0.346677","172.20.0.4","172.20.0.3","TCP","66","48364  >  8080 [ACK] Seq=154 Ack=185345 Win=319616 Len=0 TSval=3912434756 TSecr=3932945308"
"142","0.346681","172.20.0.4","172.20.0.3","TCP","66","48364  >  8080 [ACK] Seq=154 Ack=188241 Win=325376 Len=0 TSval=3912434756 TSecr=3932945310"
"143","0.346689","172.20.0.3","172.20.0.4","TCP","2962","8080  >  48364 [PSH, ACK] Seq=211409 Ack=154 Win=65024 Len=2896 TSval=3932945359 TSecr=3912434754 [TCP PDU reassembled in 269]"
"144","0.346733","172.20.0.3","172.20.0.4","TCP","2962","8080  >  48364 [PSH, ACK] Seq=214305 Ack=154 Win=65024 Len=2896 TSval=3932945360 TSecr=3912434755 [TCP PDU reassembled in 269]"
"145","0.346780","172.20.0.4","172.20.0.3","TCP","66","48364  >  8080 [ACK] Seq=154 Ack=191137 Win=331136 Len=0 TSval=3912434756 TSecr=3932945310"
"146","0.346790","172.20.0.4","172.20.0.3","TCP","66","48364  >  8080 [ACK] Seq=154 Ack=194033 Win=337024 Len=0 TSval=3912434756 TSecr=3932945310"
"147","0.346862","172.20.0.3","172.20.0.4","TCP","1514","8080  >  48364 [PSH, ACK] Seq=217201 Ack=154 Win=65024 Len=1448 TSval=3932945360 TSecr=3912434755 [TCP PDU reassembled in 269]"
"148","0.346878","172.20.0.4","172.20.0.3","TCP","66","48364  >  8080 [ACK] Seq=154 Ack=196929 Win=342784 Len=0 TSval=3912434756 TSecr=3932945310"
"149","0.346881","172.20.0.4","172.20.0.3","TCP","66","48364  >  8080 [ACK] Seq=154 Ack=199825 Win=348544 Len=0 TSval=3912434756 TSecr=3932945310"
"150","0.346936","172.20.0.3","172.20.0.4","TCP","5858","8080  >  48364 [PSH, ACK] Seq=218649 Ack=154 Win=65024 Len=5792 TSval=3932945360 TSecr=3912434755 [TCP PDU reassembled in 269]"
"151","0.347033","172.20.0.3","172.20.0.4","TCP","5858","8080  >  48364 [PSH, ACK] Seq=224441 Ack=154 Win=65024 Len=5792 TSval=3932945360 TSecr=3912434755 [TCP PDU reassembled in 269]"
"152","0.347094","172.20.0.3","172.20.0.4","TCP","5858","8080  >  48364 [PSH, ACK] Seq=230233 Ack=154 Win=65024 Len=5792 TSval=3932945360 TSecr=3912434755 [TCP PDU reassembled in 269]"
"153","0.347198","172.20.0.3","172.20.0.4","TCP","5858","8080  >  48364 [PSH, ACK] Seq=236025 Ack=154 Win=65024 Len=5792 TSval=3932945360 TSecr=3912434755 [TCP PDU reassembled in 269]"
"154","0.347260","172.20.0.3","172.20.0.4","TCP","5858","8080  >  48364 [PSH, ACK] Seq=241817 Ack=154 Win=65024 Len=5792 TSval=3932945360 TSecr=3912434755 [TCP PDU reassembled in 269]"
"155","0.347296","172.20.0.3","172.20.0.4","TCP","5858","8080  >  48364 [PSH, ACK] Seq=247609 Ack=154 Win=65024 Len=5792 TSval=3932945360 TSecr=3912434755 [TCP PDU reassembled in 269]"
"156","0.347329","172.20.0.3","172.20.0.4","TCP","5858","8080  >  48364 [PSH, ACK] Seq=253401 Ack=154 Win=65024 Len=5792 TSval=3932945360 TSecr=3912434755 [TCP PDU reassembled in 269]"
"157","0.347364","172.20.0.3","172.20.0.4","TCP","5858","8080  >  48364 [PSH, ACK] Seq=259193 Ack=154 Win=65024 Len=5792 TSval=3932945360 TSecr=3912434755 [TCP PDU reassembled in 269]"
"158","0.347396","172.20.0.3","172.20.0.4","TCP","1514","8080  >  48364 [PSH, ACK] Seq=264985 Ack=154 Win=65024 Len=1448 TSval=3932945360 TSecr=3912434755 [TCP PDU reassembled in 269]"
"159","0.347430","172.20.0.3","172.20.0.4","TCP","5858","8080  >  48364 [PSH, ACK] Seq=266433 Ack=154 Win=65024 Len=5792 TSval=3932945360 TSecr=3912434755 [TCP PDU reassembled in 269]"
"160","0.347478","172.20.0.3","172.20.0.4","TCP","5858","8080  >  48364 [PSH, ACK] Seq=272225 Ack=154 Win=65024 Len=5792 TSval=3932945360 TSecr=3912434755 [TCP PDU reassembled in 269]"
"161","0.347522","172.20.0.3","172.20.0.4","TCP","5858","8080  >  48364 [PSH, ACK] Seq=278017 Ack=154 Win=65024 Len=5792 TSval=3932945360 TSecr=3912434755 [TCP PDU reassembled in 269]"
"162","0.347570","172.20.0.3","172.20.0.4","TCP","5858","8080  >  48364 [PSH, ACK] Seq=283809 Ack=154 Win=65024 Len=5792 TSval=3932945360 TSecr=3912434755 [TCP PDU reassembled in 269]"
"163","0.347611","172.20.0.3","172.20.0.4","TCP","5858","8080  >  48364 [PSH, ACK] Seq=289601 Ack=154 Win=65024 Len=5792 TSval=3932945360 TSecr=3912434755 [TCP PDU reassembled in 269]"
"164","0.347647","172.20.0.3","172.20.0.4","TCP","5858","8080  >  48364 [PSH, ACK] Seq=295393 Ack=154 Win=65024 Len=5792 TSval=3932945360 TSecr=3912434755 [TCP PDU reassembled in 269]"
"165","0.347680","172.20.0.3","172.20.0.4","TCP","5858","8080  >  48364 [PSH, ACK] Seq=301185 Ack=154 Win=65024 Len=5792 TSval=3932945360 TSecr=3912434755 [TCP PDU reassembled in 269]"
"166","0.347707","172.20.0.3","172.20.0.4","TCP","5858","8080  >  48364 [PSH, ACK] Seq=306977 Ack=154 Win=65024 Len=5792 TSval=3932945360 TSecr=3912434755 [TCP PDU reassembled in 269]"
"167","0.347730","172.20.0.3","172.20.0.4","TCP","1514","8080  >  48364 [ACK] Seq=312769 Ack=154 Win=65024 Len=1448 TSval=3932945360 TSecr=3912434755 [TCP PDU reassembled in 269]"
"168","0.347763","172.20.0.3","172.20.0.4","TCP","5858","8080  >  48364 [PSH, ACK] Seq=314217 Ack=154 Win=65024 Len=5792 TSval=3932945360 TSecr=3912434755 [TCP PDU reassembled in 269]"
"169","0.347898","172.20.0.3","172.20.0.4","TCP","4410","8080  >  48364 [PSH, ACK] Seq=320009 Ack=154 Win=65024 Len=4344 TSval=3932945361 TSecr=3912434755 [TCP PDU reassembled in 269]"
"170","0.347990","172.20.0.3","172.20.0.4","TCP","7306","8080  >  48364 [PSH, ACK] Seq=324353 Ack=154 Win=65024 Len=7240 TSval=3932945361 TSecr=3912434756 [TCP PDU reassembled in 269]"
"171","0.348038","172.20.0.3","172.20.0.4","TCP","7306","8080  >  48364 [PSH, ACK] Seq=331593 Ack=154 Win=65024 Len=7240 TSval=3932945361 TSecr=3912434756 [TCP PDU reassembled in 269]"
"172","0.348078","172.20.0.3","172.20.0.4","TCP","7306","8080  >  48364 [PSH, ACK] Seq=338833 Ack=154 Win=65024 Len=7240 TSval=3932945361 TSecr=3912434756 [TCP PDU reassembled in 269]"
"173","0.348107","172.20.0.3","172.20.0.4","TCP","7306","8080  >  48364 [PSH, ACK] Seq=346073 Ack=154 Win=65024 Len=7240 TSval=3932945361 TSecr=3912434756 [TCP PDU reassembled in 269]"
"174","0.348135","172.20.0.3","172.20.0.4","TCP","7306","8080  >  48364 [PSH, ACK] Seq=353313 Ack=154 Win=65024 Len=7240 TSval=3932945361 TSecr=3912434756 [TCP PDU reassembled in 269]"
"175","0.348172","172.20.0.3","172.20.0.4","TCP","7306","8080  >  48364 [PSH, ACK] Seq=360553 Ack=154 Win=65024 Len=7240 TSval=3932945361 TSecr=3912434756 [TCP PDU reassembled in 269]"
"176","0.348214","172.20.0.3","172.20.0.4","TCP","7306","8080  >  48364 [PSH, ACK] Seq=367793 Ack=154 Win=65024 Len=7240 TSval=3932945361 TSecr=3912434756 [TCP PDU reassembled in 269]"
"177","0.348252","172.20.0.3","172.20.0.4","TCP","4410","8080  >  48364 [PSH, ACK] Seq=375033 Ack=154 Win=65024 Len=4344 TSval=3932945361 TSecr=3912434756 [TCP PDU reassembled in 269]"
"178","0.348349","172.20.0.3","172.20.0.4","TCP","7306","8080  >  48364 [PSH, ACK] Seq=379377 Ack=154 Win=65024 Len=7240 TSval=3932945361 TSecr=3912434756 [TCP PDU reassembled in 269]"
"179","0.348391","172.20.0.3","172.20.0.4","TCP","7306","8080  >  48364 [PSH, ACK] Seq=386617 Ack=154 Win=65024 Len=7240 TSval=3932945361 TSecr=3912434756 [TCP PDU reassembled in 269]"
"180","0.348430","172.20.0.3","172.20.0.4","TCP","5858","8080  >  48364 [PSH, ACK] Seq=393857 Ack=154 Win=65024 Len=5792 TSval=3932945361 TSecr=3912434756 [TCP PDU reassembled in 269]"
"181","0.348509","172.20.0.3","172.20.0.4","TCP","7306","8080  >  48364 [PSH, ACK] Seq=399649 Ack=154 Win=65024 Len=7240 TSval=3932945362 TSecr=3912434756 [TCP PDU reassembled in 269]"
"182","0.397090","172.20.0.4","172.20.0.3","TCP","66","48364  >  8080 [ACK] Seq=154 Ack=211409 Win=354304 Len=0 TSval=3912434806 TSecr=3932945359"
"183","0.397131","172.20.0.4","172.20.0.3","TCP","66","48364  >  8080 [ACK] Seq=154 Ack=214305 Win=360192 Len=0 TSval=3912434806 TSecr=3932945359"
"184","0.397136","172.20.0.4","172.20.0.3","TCP","66","48364  >  8080 [ACK] Seq=154 Ack=217201 Win=365952 Len=0 TSval=3912434806 TSecr=3932945360"
"185","0.397140","172.20.0.4","172.20.0.3","TCP","66","48364  >  8080 [ACK] Seq=154 Ack=218649 Win=368896 Len=0 TSval=3912434806 TSecr=3932945360"
"186","0.397144","172.20.0.4","172.20.0.3","TCP","66","48364  >  8080 [ACK] Seq=154 Ack=224441 Win=380416 Len=0 TSval=3912434806 TSecr=3932945360"
"187","0.397148","172.20.0.4","172.20.0.3","TCP","66","48364  >  8080 [ACK] Seq=154 Ack=230233 Win=392064 Len=0 TSval=3912434806 TSecr=3932945360"
"188","0.397161","172.20.0.4","172.20.0.3","TCP","66","48364  >  8080 [ACK] Seq=154 Ack=236025 Win=403584 Len=0 TSval=3912434806 TSecr=3932945360"
"189","0.397482","172.20.0.3","172.20.0.4","TCP","7306","8080  >  48364 [PSH, ACK] Seq=406889 Ack=154 Win=65024 Len=7240 TSval=3932945411 TSecr=3912434806 [TCP PDU reassembled in 269]"
"190","0.397592","172.20.0.4","172.20.0.3","TCP","66","48364  >  8080 [ACK] Seq=154 Ack=241817 Win=415232 Len=0 TSval=3912434806 TSecr=3932945360"
"191","0.397596","172.20.0.4","172.20.0.3","TCP","66","48364  >  8080 [ACK] Seq=154 Ack=247609 Win=426752 Len=0 TSval=3912434807 TSecr=3932945360"
"192","0.397599","172.20.0.4","172.20.0.3","TCP","66","48364  >  8080 [ACK] Seq=154 Ack=253401 Win=438400 Len=0 TSval=3912434807 TSecr=3932945360"
"193","0.397601","172.20.0.4","172.20.0.3","TCP","66","48364  >  8080 [ACK] Seq=154 Ack=259193 Win=449920 Len=0 TSval=3912434807 TSecr=3932945360"
"194","0.397604","172.20.0.4","172.20.0.3","TCP","66","48364  >  8080 [ACK] Seq=154 Ack=264985 Win=461568 Len=0 TSval=3912434807 TSecr=3932945360"
"195","0.397606","172.20.0.4","172.20.0.3","TCP","66","48364  >  8080 [ACK] Seq=154 Ack=266433 Win=464384 Len=0 TSval=3912434807 TSecr=3932945360"
"196","0.397609","172.20.0.4","172.20.0.3","TCP","66","48364  >  8080 [ACK] Seq=154 Ack=272225 Win=476032 Len=0 TSval=3912434807 TSecr=3932945360"
"197","0.397611","172.20.0.4","172.20.0.3","TCP","66","48364  >  8080 [ACK] Seq=154 Ack=278017 Win=487552 Len=0 TSval=3912434807 TSecr=3932945360"
"198","0.397614","172.20.0.4","172.20.0.3","TCP","66","48364  >  8080 [ACK] Seq=154 Ack=283809 Win=499200 Len=0 TSval=3912434807 TSecr=3932945360"
"199","0.397637","172.20.0.4","172.20.0.3","TCP","66","48364  >  8080 [ACK] Seq=154 Ack=289601 Win=510720 Len=0 TSval=3912434807 TSecr=3932945360"
"200","0.397644","172.20.0.4","172.20.0.3","TCP","66","48364  >  8080 [ACK] Seq=154 Ack=295393 Win=522368 Len=0 TSval=3912434807 TSecr=3932945360"
"201","0.397652","172.20.0.3","172.20.0.4","TCP","7306","8080  >  48364 [PSH, ACK] Seq=414129 Ack=154 Win=65024 Len=7240 TSval=3932945411 TSecr=3912434806 [TCP PDU reassembled in 269]"
"202","0.397685","172.20.0.4","172.20.0.3","TCP","66","48364  >  8080 [ACK] Seq=154 Ack=301185 Win=533888 Len=0 TSval=3912434807 TSecr=3932945360"
"203","0.398032","172.20.0.3","172.20.0.4","TCP","7306","8080  >  48364 [PSH, ACK] Seq=421369 Ack=154 Win=65024 Len=7240 TSval=3932945411 TSecr=3912434806 [TCP PDU reassembled in 269]"
"204","0.398051","172.20.0.4","172.20.0.3","TCP","66","48364  >  8080 [ACK] Seq=154 Ack=306977 Win=545536 Len=0 TSval=3912434807 TSecr=3932945360"
"205","0.398054","172.20.0.4","172.20.0.3","TCP","66","48364  >  8080 [ACK] Seq=154 Ack=314217 Win=548352 Len=0 TSval=3912434807 TSecr=3932945360"
"206","0.398060","172.20.0.3","172.20.0.4","TCP","8754","8080  >  48364 [PSH, ACK] Seq=428609 Ack=154 Win=65024 Len=8688 TSval=3932945411 TSecr=3912434806 [TCP PDU reassembled in 269]"
"207","0.398172","172.20.0.3","172.20.0.4","TCP","7306","8080  >  48364 [PSH, ACK] Seq=437297 Ack=154 Win=65024 Len=7240 TSval=3932945411 TSecr=3912434807 [TCP PDU reassembled in 269]"
"208","0.398190","172.20.0.3","172.20.0.4","TCP","11650","8080  >  48364 [PSH, ACK] Seq=444537 Ack=154 Win=65024 Len=11584 TSval=3932945411 TSecr=3912434807 [TCP PDU reassembled in 269]"
"209","0.398203","172.20.0.3","172.20.0.4","TCP","11650","8080  >  48364 [PSH, ACK] Seq=456121 Ack=154 Win=65024 Len=11584 TSval=3932945411 TSecr=3912434807 [TCP PDU reassembled in 269]"
"210","0.398256","172.20.0.3","172.20.0.4","TCP","11650","8080  >  48364 [PSH, ACK] Seq=467705 Ack=154 Win=65024 Len=11584 TSval=3932945411 TSecr=3912434807 [TCP PDU reassembled in 269]"
"211","0.398345","172.20.0.3","172.20.0.4","TCP","11650","8080  >  48364 [PSH, ACK] Seq=479289 Ack=154 Win=65024 Len=11584 TSval=3932945411 TSecr=3912434807 [TCP PDU reassembled in 269]"
"212","0.398463","172.20.0.3","172.20.0.4","TCP","11650","8080  >  48364 [PSH, ACK] Seq=490873 Ack=154 Win=65024 Len=11584 TSval=3932945412 TSecr=3912434807 [TCP PDU reassembled in 269]"
"213","0.398478","172.20.0.3","172.20.0.4","TCP","7306","8080  >  48364 [PSH, ACK] Seq=502457 Ack=154 Win=65024 Len=7240 TSval=3932945412 TSecr=3912434807 [TCP PDU reassembled in 269]"
"214","0.398492","172.20.0.3","172.20.0.4","TCP","11650","8080  >  48364 [PSH, ACK] Seq=509697 Ack=154 Win=65024 Len=11584 TSval=3932945412 TSecr=3912434807 [TCP PDU reassembled in 269]"
"215","0.398760","172.20.0.3","172.20.0.4","TCP","11650","8080  >  48364 [PSH, ACK] Seq=521281 Ack=154 Win=65024 Len=11584 TSval=3932945412 TSecr=3912434807 [TCP PDU reassembled in 269]"
"216","0.398805","172.20.0.3","172.20.0.4","TCP","11650","8080  >  48364 [PSH, ACK] Seq=532865 Ack=154 Win=65024 Len=11584 TSval=3932945412 TSecr=3912434807 [TCP PDU reassembled in 269]"
"217","0.398909","172.20.0.3","172.20.0.4","TCP","11650","8080  >  48364 [PSH, ACK] Seq=544449 Ack=154 Win=65024 Len=11584 TSval=3932945412 TSecr=3912434807 [TCP PDU reassembled in 269]"
"218","0.398940","172.20.0.3","172.20.0.4","TCP","11650","8080  >  48364 [PSH, ACK] Seq=556033 Ack=154 Win=65024 Len=11584 TSval=3932945412 TSecr=3912434807 [TCP PDU reassembled in 269]"
"219","0.399090","172.20.0.3","172.20.0.4","TCP","7306","8080  >  48364 [PSH, ACK] Seq=567617 Ack=154 Win=65024 Len=7240 TSval=3932945412 TSecr=3912434807 [TCP PDU reassembled in 269]"
"220","0.399115","172.20.0.3","172.20.0.4","TCP","11650","8080  >  48364 [PSH, ACK] Seq=574857 Ack=154 Win=65024 Len=11584 TSval=3932945412 TSecr=3912434807 [TCP PDU reassembled in 269]"
"221","0.399132","172.20.0.3","172.20.0.4","TCP","11650","8080  >  48364 [PSH, ACK] Seq=586441 Ack=154 Win=65024 Len=11584 TSval=3932945412 TSecr=3912434807 [TCP PDU reassembled in 269]"
"222","0.399196","172.20.0.3","172.20.0.4","TCP","11650","8080  >  48364 [PSH, ACK] Seq=598025 Ack=154 Win=65024 Len=11584 TSval=3932945412 TSecr=3912434807 [TCP PDU reassembled in 269]"
"223","0.399237","172.20.0.3","172.20.0.4","TCP","11650","8080  >  48364 [PSH, ACK] Seq=609609 Ack=154 Win=65024 Len=11584 TSval=3932945412 TSecr=3912434807 [TCP PDU reassembled in 269]"
"224","0.399319","172.20.0.3","172.20.0.4","TCP","11650","8080  >  48364 [PSH, ACK] Seq=621193 Ack=154 Win=65024 Len=11584 TSval=3932945412 TSecr=3912434807 [TCP PDU reassembled in 269]"
"225","0.399353","172.20.0.3","172.20.0.4","TCP","7306","8080  >  48364 [PSH, ACK] Seq=632777 Ack=154 Win=65024 Len=7240 TSval=3932945412 TSecr=3912434807 [TCP PDU reassembled in 269]"
"226","0.447731","172.20.0.4","172.20.0.3","TCP","66","48364  >  8080 [ACK] Seq=154 Ack=414129 Win=562816 Len=0 TSval=3912434857 TSecr=3932945411"
"227","0.447740","172.20.0.4","172.20.0.3","TCP","66","48364  >  8080 [ACK] Seq=154 Ack=421369 Win=577408 Len=0 TSval=3912434857 TSecr=3932945411"
"228","0.447936","172.20.0.3","172.20.0.4","TCP","13098","8080  >  48364 [PSH, ACK] Seq=640017 Ack=154 Win=65024 Len=13032 TSval=3932945461 TSecr=3912434857 [TCP PDU reassembled in 269]"
"229","0.447963","172.20.0.3","172.20.0.4","TCP","13098","8080  >  48364 [PSH, ACK] Seq=653049 Ack=154 Win=65024 Len=13032 TSval=3932945461 TSecr=3912434857 [TCP PDU reassembled in 269]"
"230","0.448000","172.20.0.3","172.20.0.4","TCP","13098","8080  >  48364 [PSH, ACK] Seq=666081 Ack=154 Win=65024 Len=13032 TSval=3932945461 TSecr=3912434857 [TCP PDU reassembled in 269]"
"231","0.448014","172.20.0.3","172.20.0.4","TCP","14546","8080  >  48364 [PSH, ACK] Seq=679113 Ack=154 Win=65024 Len=14480 TSval=3932945461 TSecr=3912434857 [TCP PDU reassembled in 269]"
"232","0.448069","172.20.0.3","172.20.0.4","TCP","11650","8080  >  48364 [PSH, ACK] Seq=693593 Ack=154 Win=65024 Len=11584 TSval=3932945461 TSecr=3912434857 [TCP PDU reassembled in 269]"
"233","0.448082","172.20.0.4","172.20.0.3","TCP","66","48364  >  8080 [ACK] Seq=154 Ack=428609 Win=591872 Len=0 TSval=3912434857 TSecr=3932945411"
"234","0.448084","172.20.0.4","172.20.0.3","TCP","66","48364  >  8080 [ACK] Seq=154 Ack=437297 Win=609152 Len=0 TSval=3912434857 TSecr=3932945411"
"235","0.448090","172.20.0.3","172.20.0.4","TCP","14546","8080  >  48364 [PSH, ACK] Seq=705177 Ack=154 Win=65024 Len=14480 TSval=3932945461 TSecr=3912434857 [TCP PDU reassembled in 269]"
"236","0.448103","172.20.0.3","172.20.0.4","TCP","14546","8080  >  48364 [PSH, ACK] Seq=719657 Ack=154 Win=65024 Len=14480 TSval=3932945461 TSecr=3912434857 [TCP PDU reassembled in 269]"
