"No.","Time","Source","Destination","Protocol","Length","Info"
"1","0.000000","172.20.0.4","172.20.0.2","DNS","59","Unknown operation (7) 0x3238[Malformed Packet]"
"2","0.002083","172.20.0.2","172.20.0.4","DNS","70","Unknown operation (7) 0x3238[Malformed Packet]"
"3","0.013158","172.20.0.4","172.20.0.3","TCP","74","37682  >  8080 [SYN] Seq=0 Win=64240 Len=0 MSS=1460 SACK_PERM TSval=3912369683 TSecr=0 WS=128"
"4","0.013493","172.20.0.3","172.20.0.4","TCP","74","8080  >  37682 [SYN, ACK] Seq=0 Ack=1 Win=65160 Len=0 MSS=1460 SACK_PERM TSval=3932880247 TSecr=3912369683 WS=128"
"5","0.023726","172.20.0.4","172.20.0.3","TCP","66","37682  >  8080 [ACK] Seq=1 Ack=1 Win=64256 Len=0 TSval=3912369693 TSecr=3932880247"
"6","0.023739","172.20.0.4","172.20.0.3","HTTP","219","GET /arquivo_1mb.bin HTTP/1.1 "
"7","0.024101","172.20.0.3","172.20.0.4","TCP","66","8080  >  37682 [ACK] Seq=1 Ack=154 Win=65024 Len=0 TSval=3932880258 TSecr=3912369694"
"8","0.069016","172.20.0.3","172.20.0.4","TCP","2962","8080  >  37682 [PSH, ACK] Seq=1 Ack=154 Win=65024 Len=2896 TSval=3932880303 TSecr=3912369694 [TCP PDU reassembled in 108]"
"9","0.069232","172.20.0.3","172.20.0.4","TCP","2962","8080  >  37682 [PSH, ACK] Seq=2897 Ack=154 Win=65024 Len=2896 TSval=3932880303 TSecr=3912369694 [TCP PDU reassembled in 108]"
"10","0.069270","172.20.0.3","172.20.0.4","TCP","2962","8080  >  37682 [PSH, ACK] Seq=5793 Ack=154 Win=65024 Len=2896 TSval=3932880303 TSecr=3912369694 [TCP PDU reassembled in 108]"
"11","0.069301","172.20.0.3","172.20.0.4","TCP","2962","8080  >  37682 [PSH, ACK] Seq=8689 Ack=154 Win=65024 Len=2896 TSval=3932880303 TSecr=3912369694 [TCP PDU reassembled in 108]"
"12","0.069329","172.20.0.3","172.20.0.4","TCP","2962","8080  >  37682 [PSH, ACK] Seq=11585 Ack=154 Win=65024 Len=2896 TSval=3932880303 TSecr=3912369694 [TCP PDU reassembled in 108]"
"13","0.079307","172.20.0.4","172.20.0.3","TCP","66","37682  >  8080 [ACK] Seq=154 Ack=2897 Win=70144 Len=0 TSval=3912369749 TSecr=3932880303"
"14","0.079331","172.20.0.4","172.20.0.3","TCP","66","37682  >  8080 [ACK] Seq=154 Ack=5793 Win=75904 Len=0 TSval=3912369749 TSecr=3932880303"
"15","0.079334","172.20.0.4","172.20.0.3","TCP","66","37682  >  8080 [ACK] Seq=154 Ack=8689 Win=81664 Len=0 TSval=3912369749 TSecr=3932880303"
"16","0.079353","172.20.0.4","172.20.0.3","TCP","66","37682  >  8080 [ACK] Seq=154 Ack=11585 Win=87424 Len=0 TSval=3912369749 TSecr=3932880303"
"17","0.079357","172.20.0.4","172.20.0.3","TCP","66","37682  >  8080 [ACK] Seq=154 Ack=14481 Win=88320 Len=0 TSval=3912369749 TSecr=3932880303"
"18","0.079648","172.20.0.3","172.20.0.4","TCP","2962","8080  >  37682 [PSH, ACK] Seq=14481 Ack=154 Win=65024 Len=2896 TSval=3932880313 TSecr=3912369749 [TCP PDU reassembled in 108]"
"19","0.079753","172.20.0.3","172.20.0.4","TCP","2962","8080  >  37682 [PSH, ACK] Seq=17377 Ack=154 Win=65024 Len=2896 TSval=3932880313 TSecr=3912369749 [TCP PDU reassembled in 108]"
"20","0.079875","172.20.0.3","172.20.0.4","TCP","2962","8080  >  37682 [PSH, ACK] Seq=20273 Ack=154 Win=65024 Len=2896 TSval=3932880314 TSecr=3912369749 [TCP PDU reassembled in 108]"
"21","0.079892","172.20.0.3","172.20.0.4","TCP","4410","8080  >  37682 [PSH, ACK] Seq=23169 Ack=154 Win=65024 Len=4344 TSval=3932880314 TSecr=3912369749 [TCP PDU reassembled in 108]"
"22","0.079906","172.20.0.3","172.20.0.4","TCP","4410","8080  >  37682 [PSH, ACK] Seq=27513 Ack=154 Win=65024 Len=4344 TSval=3932880314 TSecr=3912369749 [TCP PDU reassembled in 108]"
"23","0.079961","172.20.0.3","172.20.0.4","TCP","4410","8080  >  37682 [PSH, ACK] Seq=31857 Ack=154 Win=65024 Len=4344 TSval=3932880314 TSecr=3912369749 [TCP PDU reassembled in 108]"
"24","0.079976","172.20.0.3","172.20.0.4","TCP","4410","8080  >  37682 [PSH, ACK] Seq=36201 Ack=154 Win=65024 Len=4344 TSval=3932880314 TSecr=3912369749 [TCP PDU reassembled in 108]"
"25","0.080011","172.20.0.3","172.20.0.4","TCP","2962","8080  >  37682 [PSH, ACK] Seq=40545 Ack=154 Win=65024 Len=2896 TSval=3932880314 TSecr=3912369749 [TCP PDU reassembled in 108]"
"26","0.089949","172.20.0.4","172.20.0.3","TCP","66","37682  >  8080 [ACK] Seq=154 Ack=17377 Win=94080 Len=0 TSval=3912369760 TSecr=3932880313"
"27","0.089960","172.20.0.4","172.20.0.3","TCP","66","37682  >  8080 [ACK] Seq=154 Ack=20273 Win=94080 Len=0 TSval=3912369760 TSecr=3932880313"
"28","0.089963","172.20.0.4","172.20.0.3","TCP","66","37682  >  8080 [ACK] Seq=154 Ack=23169 Win=94080 Len=0 TSval=3912369760 TSecr=3932880314"
"29","0.089966","172.20.0.4","172.20.0.3","TCP","66","37682  >  8080 [ACK] Seq=154 Ack=27513 Win=90112 Len=0 TSval=3912369760 TSecr=3932880314"
"30","0.089984","172.20.0.4","172.20.0.3","TCP","66","37682  >  8080 [ACK] Seq=154 Ack=31857 Win=89088 Len=0 TSval=3912369760 TSecr=3932880314"
"31","0.090003","172.20.0.4","172.20.0.3","TCP","66","37682  >  8080 [ACK] Seq=154 Ack=36201 Win=91904 Len=0 TSval=3912369760 TSecr=3932880314"
"32","0.090011","172.20.0.4","172.20.0.3","TCP","66","37682  >  8080 [ACK] Seq=154 Ack=40545 Win=91904 Len=0 TSval=3912369760 TSecr=3932880314"
"33","0.090354","172.20.0.3","172.20.0.4","TCP","2962","8080  >  37682 [PSH, ACK] Seq=43441 Ack=154 Win=65024 Len=2896 TSval=3932880324 TSecr=3912369760 [TCP PDU reassembled in 108]"
"34","0.090458","172.20.0.4","172.20.0.3","TCP","66","37682  >  8080 [ACK] Seq=154 Ack=43441 Win=97024 Len=0 TSval=3912369760 TSecr=3932880314"
"35","0.090467","172.20.0.3","172.20.0.4","TCP","5858","8080  >  37682 [PSH, ACK] Seq=46337 Ack=154 Win=65024 Len=5792 TSval=3932880324 TSecr=3912369760 [TCP PDU reassembled in 108]"
"36","0.090488","172.20.0.3","172.20.0.4","TCP","5858","8080  >  37682 [PSH, ACK] Seq=52129 Ack=154 Win=65024 Len=5792 TSval=3932880324 TSecr=3912369760 [TCP PDU reassembled in 108]"
"37","0.090569","172.20.0.3","172.20.0.4","TCP","7306","8080  >  37682 [PSH, ACK] Seq=57921 Ack=154 Win=65024 Len=7240 TSval=3932880324 TSecr=3912369760 [TCP PDU reassembled in 108]"
"38","0.090583","172.20.0.3","172.20.0.4","TCP","10202","8080  >  37682 [PSH, ACK] Seq=65161 Ack=154 Win=65024 Len=10136 TSval=3932880324 TSecr=3912369760 [TCP PDU reassembled in 108]"
"39","0.090660","172.20.0.3","172.20.0.4","TCP","2962","8080  >  37682 [PSH, ACK] Seq=75297 Ack=154 Win=65024 Len=2896 TSval=3932880325 TSecr=3912369760 [TCP PDU reassembled in 108]"
"40","0.090689","172.20.0.3","172.20.0.4","TCP","10202","8080  >  37682 [PSH, ACK] Seq=78193 Ack=154 Win=65024 Len=10136 TSval=3932880325 TSecr=3912369760 [TCP PDU reassembled in 108]"
"41","0.090716","172.20.0.3","172.20.0.4","TCP","10202","8080  >  37682 [PSH, ACK] Seq=88329 Ack=154 Win=65024 Len=10136 TSval=3932880325 TSecr=3912369760 [TCP PDU reassembled in 108]"
"42","0.090737","172.20.0.3","172.20.0.4","TCP","2962","8080  >  37682 [PSH, ACK] Seq=98465 Ack=154 Win=65024 Len=2896 TSval=3932880325 TSecr=3912369760 [TCP PDU reassembled in 108]"
"43","0.101240","172.20.0.4","172.20.0.3","TCP","66","37682  >  8080 [ACK] Seq=154 Ack=46337 Win=97024 Len=0 TSval=3912369770 TSecr=3932880324"
"44","0.101254","172.20.0.4","172.20.0.3","TCP","66","37682  >  8080 [ACK] Seq=154 Ack=52129 Win=91904 Len=0 TSval=3912369770 TSecr=3932880324"
"45","0.101257","172.20.0.4","172.20.0.3","TCP","66","37682  >  8080 [ACK] Seq=154 Ack=57921 Win=86784 Len=0 TSval=3912369770 TSecr=3932880324"
"46","0.101261","172.20.0.4","172.20.0.3","TCP","66","37682  >  8080 [ACK] Seq=154 Ack=65161 Win=111488 Len=0 TSval=3912369770 TSecr=3932880324"
"47","0.101264","172.20.0.4","172.20.0.3","TCP","66","37682  >  8080 [ACK] Seq=154 Ack=75297 Win=131712 Len=0 TSval=3912369770 TSecr=3932880324"
"48","0.101268","172.20.0.4","172.20.0.3","TCP","66","37682  >  8080 [ACK] Seq=154 Ack=78193 Win=137600 Len=0 TSval=3912369771 TSecr=3932880325"
"49","0.101272","172.20.0.4","172.20.0.3","TCP","66","37682  >  8080 [ACK] Seq=154 Ack=88329 Win=157824 Len=0 TSval=3912369771 TSecr=3932880325"
"50","0.101275","172.20.0.4","172.20.0.3","TCP","66","37682  >  8080 [ACK] Seq=154 Ack=98465 Win=155008 Len=0 TSval=3912369771 TSecr=3932880325"
"51","0.101279","172.20.0.4","172.20.0.3","TCP","66","37682  >  8080 [ACK] Seq=154 Ack=101361 Win=152192 Len=0 TSval=3912369771 TSecr=3932880325"
"52","0.102025","172.20.0.3","172.20.0.4","TCP","5858","8080  >  37682 [PSH, ACK] Seq=101361 Ack=154 Win=65024 Len=5792 TSval=3932880336 TSecr=3912369770 [TCP PDU reassembled in 108]"
"53","0.102148","172.20.0.3","172.20.0.4","TCP","11650","8080  >  37682 [PSH, ACK] Seq=107153 Ack=154 Win=65024 Len=11584 TSval=3932880336 TSecr=3912369770 [TCP PDU reassembled in 108]"
"54","0.102170","172.20.0.3","172.20.0.4","TCP","2962","8080  >  37682 [PSH, ACK] Seq=118737 Ack=154 Win=65024 Len=2896 TSval=3932880336 TSecr=3912369771 [TCP PDU reassembled in 108]"
"55","0.102189","172.20.0.3","172.20.0.4","TCP","18890","8080  >  37682 [PSH, ACK] Seq=121633 Ack=154 Win=65024 Len=18824 TSval=3932880336 TSecr=3912369771 [TCP PDU reassembled in 108]"
"56","0.102299","172.20.0.3","172.20.0.4","TCP","18890","8080  >  37682 [PSH, ACK] Seq=140457 Ack=154 Win=65024 Len=18824 TSval=3932880336 TSecr=3912369771 [TCP PDU reassembled in 108]"
"57","0.102317","172.20.0.3","172.20.0.4","TCP","5858","8080  >  37682 [PSH, ACK] Seq=159281 Ack=154 Win=65024 Len=5792 TSval=3932880336 TSecr=3912369771 [TCP PDU reassembled in 108]"
"58","0.102336","172.20.0.3","172.20.0.4","TCP","20338","8080  >  37682 [PSH, ACK] Seq=165073 Ack=154 Win=65024 Len=20272 TSval=3932880336 TSecr=3912369771 [TCP PDU reassembled in 108]"
"59","0.102376","172.20.0.3","172.20.0.4","TCP","20338","8080  >  37682 [PSH, ACK] Seq=185345 Ack=154 Win=65024 Len=20272 TSval=3932880336 TSecr=3912369771 [TCP PDU reassembled in 108]"
"60","0.102431","172.20.0.3","172.20.0.4","TCP","7306","8080  >  37682 [PSH, ACK] Seq=205617 Ack=154 Win=65024 Len=7240 TSval=3932880336 TSecr=3912369771 [TCP PDU reassembled in 108]"
"61","0.102447","172.20.0.3","172.20.0.4","TCP","4410","8080  >  37682 [PSH, ACK] Seq=212857 Ack=154 Win=65024 Len=4344 TSval=3932880336 TSecr=3912369771 [TCP PDU reassembled in 108]"
"62","0.112490","172.20.0.4","172.20.0.3","TCP","66","37682  >  8080 [ACK] Seq=154 Ack=107153 Win=169472 Len=0 TSval=3912369782 TSecr=3932880336"
"63","0.112504","172.20.0.4","172.20.0.3","TCP","66","37682  >  8080 [ACK] Seq=154 Ack=118737 Win=174720 Len=0 TSval=3912369782 TSecr=3932880336"
"64","0.112508","172.20.0.4","172.20.0.3","TCP","66","37682  >  8080 [ACK] Seq=154 Ack=121633 Win=171904 Len=0 TSval=3912369782 TSecr=3932880336"
"65","0.112512","172.20.0.4","172.20.0.3","TCP","66","37682  >  8080 [ACK] Seq=154 Ack=140457 Win=156800 Len=0 TSval=3912369782 TSecr=3932880336"
"66","0.112515","172.20.0.4","172.20.0.3","TCP","66","37682  >  8080 [ACK] Seq=154 Ack=159281 Win=212352 Len=0 TSval=3912369782 TSecr=3932880336"
"67","0.112519","172.20.0.4","172.20.0.3","TCP","66","37682  >  8080 [ACK] Seq=154 Ack=165073 Win=223872 Len=0 TSval=3912369782 TSecr=3932880336"
"68","0.112523","172.20.0.4","172.20.0.3","TCP","66","37682  >  8080 [ACK] Seq=154 Ack=185345 Win=264448 Len=0 TSval=3912369782 TSecr=3932880336"
"69","0.112526","172.20.0.4","172.20.0.3","TCP","66","37682  >  8080 [ACK] Seq=154 Ack=205617 Win=305024 Len=0 TSval=3912369782 TSecr=3932880336"
"70","0.112533","172.20.0.4","172.20.0.3","TCP","66","37682  >  8080 [ACK] Seq=154 Ack=212857 Win=319488 Len=0 TSval=3912369782 TSecr=3932880336"
"71","0.112537","172.20.0.4","172.20.0.3","TCP","66","37682  >  8080 [ACK] Seq=154 Ack=217201 Win=328192 Len=0 TSval=3912369782 TSecr=3932880336"
"72","0.112950","172.20.0.3","172.20.0.4","TCP","11650","8080  >  37682 [PSH, ACK] Seq=217201 Ack=154 Win=65024 Len=11584 TSval=3932880347 TSecr=3912369782 [TCP PDU reassembled in 108]"
"73","0.113134","172.20.0.3","172.20.0.4","TCP","23234","8080  >  37682 [PSH, ACK] Seq=228785 Ack=154 Win=65024 Len=23168 TSval=3932880347 TSecr=3912369782 [TCP PDU reassembled in 108]"
"74","0.113167","172.20.0.3","172.20.0.4","TCP","8754","8080  >  37682 [PSH, ACK] Seq=251953 Ack=154 Win=65024 Len=8688 TSval=3932880347 TSecr=3912369782 [TCP PDU reassembled in 108]"
"75","0.113192","172.20.0.3","172.20.0.4","TCP","39162","8080  >  37682 [PSH, ACK] Seq=260641 Ack=154 Win=65024 Len=39096 TSval=3932880347 TSecr=3912369782 [TCP PDU reassembled in 108]"
"76","0.113365","172.20.0.3","172.20.0.4","TCP","8754","8080  >  37682 [PSH, ACK] Seq=299737 Ack=154 Win=65024 Len=8688 TSval=3932880347 TSecr=3912369782 [TCP PDU reassembled in 108]"
"77","0.113511","172.20.0.3","172.20.0.4","TCP","42058","8080  >  37682 [PSH, ACK] Seq=308425 Ack=154 Win=65024 Len=41992 TSval=3932880347 TSecr=3912369782 [TCP PDU reassembled in 108]"
"78","0.113571","172.20.0.3","172.20.0.4","TCP","23234","8080  >  37682 [PSH, ACK] Seq=350417 Ack=154 Win=65024 Len=23168 TSval=3932880347 TSecr=3912369782 [TCP PDU reassembled in 108]"
"79","0.113632","172.20.0.3","172.20.0.4","TCP","42058","8080  >  37682 [PSH, ACK] Seq=373585 Ack=154 Win=65024 Len=41992 TSval=3932880347 TSecr=3912369782 [TCP PDU reassembled in 108]"
"80","0.113742","172.20.0.3","172.20.0.4","TCP","23234","8080  >  37682 [PSH, ACK] Seq=415577 Ack=154 Win=65024 Len=23168 TSval=3932880347 TSecr=3912369782 [TCP PDU reassembled in 108]"
"81","0.113796","172.20.0.3","172.20.0.4","TCP","10202","8080  >  37682 [PSH, ACK] Seq=438745 Ack=154 Win=65024 Len=10136 TSval=3932880347 TSecr=3912369782 [TCP PDU reassembled in 108]"
"82","0.123224","172.20.0.4","172.20.0.3","TCP","66","37682  >  8080 [ACK] Seq=154 Ack=228785 Win=351360 Len=0 TSval=3912369793 TSecr=3932880347"
"83","0.123245","172.20.0.4","172.20.0.3","TCP","66","37682  >  8080 [ACK] Seq=154 Ack=251953 Win=397696 Len=0 TSval=3912369793 TSecr=3932880347"
"84","0.123249","172.20.0.4","172.20.0.3","TCP","66","37682  >  8080 [ACK] Seq=154 Ack=260641 Win=414976 Len=0 TSval=3912369793 TSecr=3932880347"
"85","0.123266","172.20.0.4","172.20.0.3","TCP","66","37682  >  8080 [ACK] Seq=154 Ack=299737 Win=493184 Len=0 TSval=3912369793 TSecr=3932880347"
"86","0.123599","172.20.0.3","172.20.0.4","TCP","23234","8080  >  37682 [PSH, ACK] Seq=448881 Ack=154 Win=65024 Len=23168 TSval=3932880357 TSecr=3912369793 [TCP PDU reassembled in 108]"
"87","0.123644","172.20.0.4","172.20.0.3","TCP","66","37682  >  8080 [ACK] Seq=154 Ack=308425 Win=510592 Len=0 TSval=3912369793 TSecr=3932880347"
"88","0.123648","172.20.0.4","172.20.0.3","TCP","66","37682  >  8080 [ACK] Seq=154 Ack=350417 Win=594560 Len=0 TSval=3912369793 TSecr=3932880347"
"89","0.123652","172.20.0.4","172.20.0.3","TCP","66","37682  >  8080 [ACK] Seq=154 Ack=373585 Win=620032 Len=0 TSval=3912369793 TSecr=3932880347"
"90","0.123676","172.20.0.3","172.20.0.4","TCP","31922","8080  >  37682 [PSH, ACK] Seq=472049 Ack=154 Win=65024 Len=31856 TSval=3932880357 TSecr=3912369793 [TCP PDU reassembled in 108]"
"91","0.123730","172.20.0.3","172.20.0.4","TCP","56538","8080  >  37682 [PSH, ACK] Seq=503905 Ack=154 Win=65024 Len=56472 TSval=3932880357 TSecr=3912369793 [TCP PDU reassembled in 108]"
"92","0.123968","172.20.0.3","172.20.0.4","TCP","8754","8080  >  37682 [PSH, ACK] Seq=560377 Ack=154 Win=65024 Len=8688 TSval=3932880358 TSecr=3912369793 [TCP PDU reassembled in 108]"
"93","0.124001","172.20.0.3","172.20.0.4","TCP","57986","8080  >  37682 [PSH, ACK] Seq=569065 Ack=154 Win=65024 Len=57920 TSval=3932880358 TSecr=3912369793 [TCP PDU reassembled in 108]"
"94","0.124022","172.20.0.3","172.20.0.4","TCP","7306","8080  >  37682 [PSH, ACK] Seq=626985 Ack=154 Win=65024 Len=7240 TSval=3932880358 TSecr=3912369793 [TCP PDU reassembled in 108]"
"95","0.124053","172.20.0.3","172.20.0.4","TCP","65226","8080  >  37682 [PSH, ACK] Seq=634225 Ack=154 Win=65024 Len=65160 TSval=3932880358 TSecr=3912369793 [TCP PDU reassembled in 108]"
"96","0.124100","172.20.0.4","172.20.0.3","TCP","66","37682  >  8080 [ACK] Seq=154 Ack=415577 Win=587392 Len=0 TSval=3912369794 TSecr=3932880347"
"97","0.124104","172.20.0.4","172.20.0.3","TCP","66","37682  >  8080 [ACK] Seq=154 Ack=438745 Win=568960 Len=0 TSval=3912369794 TSecr=3932880347"
"98","0.124106","172.20.0.4","172.20.0.3","TCP","66","37682  >  8080 [ACK] Seq=154 Ack=448881 Win=570112 Len=0 TSval=3912369794 TSecr=3932880347"
"99","0.124248","172.20.0.3","172.20.0.4","TCP","65226","8080  >  37682 [PSH, ACK] Seq=699385 Ack=154 Win=65024 Len=65160 TSval=3932880358 TSecr=3912369794 [TCP PDU reassembled in 108]"
"100","0.124278","172.20.0.3","172.20.0.4","TCP","65226","8080  >  37682 [PSH, ACK] Seq=764545 Ack=154 Win=65024 Len=65160 TSval=3932880358 TSecr=3912369794 [TCP PDU reassembled in 108]"
"101","0.124381","172.20.0.3","172.20.0.4","TCP","65226","8080  >  37682 [PSH, ACK] Seq=829705 Ack=154 Win=65024 Len=65160 TSval=3932880358 TSecr=3912369794 [TCP PDU reassembled in 108]"
"102","0.124410","172.20.0.3","172.20.0.4","TCP","17442","8080  >  37682 [PSH, ACK] Seq=894865 Ack=154 Win=65024 Len=17376 TSval=3932880358 TSecr=3912369794 [TCP PDU reassembled in 108]"
"103","0.133779","172.20.0.4","172.20.0.3","TCP","66","37682  >  8080 [ACK] Seq=154 Ack=472049 Win=577408 Len=0 TSval=3912369803 TSecr=3932880357"
"104","0.134077","172.20.0.3","172.20.0.4","TCP","46402","8080  >  37682 [PSH, ACK] Seq=912241 Ack=154 Win=65024 Len=46336 TSval=3932880368 TSecr=3912369803 [TCP PDU reassembled in 108]"
"105","0.134745","172.20.0.4","172.20.0.3","TCP","66","37682  >  8080 [ACK] Seq=154 Ack=912241 Win=235136 Len=0 TSval=3912369804 TSecr=3932880357"
"106","0.134915","172.20.0.3","172.20.0.4","TCP","1514","8080  >  37682 [PSH, ACK] Seq=958577 Ack=154 Win=65024 Len=1448 TSval=3932880369 TSecr=3912369804 [TCP PDU reassembled in 108]"
"107","0.134951","172.20.0.3","172.20.0.4","TCP","65226","8080  >  37682 [PSH, ACK] Seq=960025 Ack=154 Win=65024 Len=65160 TSval=3932880369 TSecr=3912369804 [TCP PDU reassembled in 108]"
"108","0.134969","172.20.0.3","172.20.0.4","HTTP","23642","HTTP/1.1 200 OK "
"109","0.144239","172.20.0.4","172.20.0.3","TCP","66","37682  >  8080 [ACK] Seq=154 Ack=958577 Win=236928 Len=0 TSval=3912369814 TSecr=3932880368"
"110","0.145927","172.20.0.4","172.20.0.3","TCP","66","37682  >  8080 [ACK] Seq=154 Ack=1048762 Win=166272 Len=0 TSval=3912369816 TSecr=3932880369"
"111","0.320866","172.20.0.4","172.20.0.3","TCP","66","37682  >  8080 [FIN, ACK] Seq=154 Ack=1048762 Win=620032 Len=0 TSval=3912369991 TSecr=3932880369"
"112","0.321051","172.20.0.3","172.20.0.4","TCP","66","8080  >  37682 [ACK] Seq=1048762 Ack=155 Win=65024 Len=0 TSval=3932880555 TSecr=3912369991"
"113","1.841641","172.20.0.4","172.20.0.2","DNS","59","Unknown operation (7) 0x3834[Malformed Packet]"
"114","1.842020","172.20.0.2","172.20.0.4","DNS","70","Unknown operation (7) 0x3834[Malformed Packet]"
"115","1.852820","172.20.0.4","172.20.0.3","TCP","74","37684  >  8080 [SYN] Seq=0 Win=64240 Len=0 MSS=1460 SACK_PERM TSval=3912371522 TSecr=0 WS=128"
"116","1.853044","172.20.0.3","172.20.0.4","TCP","74","8080  >  37684 [SYN, ACK] Seq=0 Ack=1 Win=65160 Len=0 MSS=1460 SACK_PERM TSval=3932882087 TSecr=3912371522 WS=128"
"117","1.863319","172.20.0.4","172.20.0.3","TCP","66","37684  >  8080 [ACK] Seq=1 Ack=1 Win=64256 Len=0 TSval=3912371533 TSecr=3932882087"
"118","1.863338","172.20.0.4","172.20.0.3","HTTP","219","GET /arquivo_1mb.bin HTTP/1.1 "
"119","1.863662","172.20.0.3","172.20.0.4","TCP","66","8080  >  37684 [ACK] Seq=1 Ack=154 Win=65024 Len=0 TSval=3932882097 TSecr=3912371533"
"120","1.896839","172.20.0.3","172.20.0.4","TCP","2962","8080  >  37684 [PSH, ACK] Seq=1 Ack=154 Win=65024 Len=2896 TSval=3932882131 TSecr=3912371533 [TCP PDU reassembled in 219]"
"121","1.897017","172.20.0.3","172.20.0.4","TCP","2962","8080  >  37684 [PSH, ACK] Seq=2897 Ack=154 Win=65024 Len=2896 TSval=3932882131 TSecr=3912371533 [TCP PDU reassembled in 219]"
"122","1.897044","172.20.0.3","172.20.0.4","TCP","2962","8080  >  37684 [PSH, ACK] Seq=5793 Ack=154 Win=65024 Len=2896 TSval=3932882131 TSecr=3912371533 [TCP PDU reassembled in 219]"
"123","1.897061","172.20.0.3","172.20.0.4","TCP","2962","8080  >  37684 [PSH, ACK] Seq=8689 Ack=154 Win=65024 Len=2896 TSval=3932882131 TSecr=3912371533 [TCP PDU reassembled in 219]"
"124","1.897078","172.20.0.3","172.20.0.4","TCP","2962","8080  >  37684 [PSH, ACK] Seq=11585 Ack=154 Win=65024 Len=2896 TSval=3932882131 TSecr=3912371533 [TCP PDU reassembled in 219]"
"125","1.907037","172.20.0.4","172.20.0.3","TCP","66","37684  >  8080 [ACK] Seq=154 Ack=2897 Win=70144 Len=0 TSval=3912371577 TSecr=3932882131"
"126","1.907049","172.20.0.4","172.20.0.3","TCP","66","37684  >  8080 [ACK] Seq=154 Ack=5793 Win=75904 Len=0 TSval=3912371577 TSecr=3932882131"
"127","1.907224","172.20.0.3","172.20.0.4","TCP","2962","8080  >  37684 [PSH, ACK] Seq=14481 Ack=154 Win=65024 Len=2896 TSval=3932882141 TSecr=3912371577 [TCP PDU reassembled in 219]"
"128","1.907303","172.20.0.4","172.20.0.3","TCP","66","37684  >  8080 [ACK] Seq=154 Ack=8689 Win=81664 Len=0 TSval=3912371577 TSecr=3932882131"
"129","1.907306","172.20.0.4","172.20.0.3","TCP","66","37684  >  8080 [ACK] Seq=154 Ack=11585 Win=85504 Len=0 TSval=3912371577 TSecr=3932882131"
"130","1.907307","172.20.0.4","172.20.0.3","TCP","66","37684  >  8080 [ACK] Seq=154 Ack=14481 Win=88320 Len=0 TSval=3912371577 TSecr=3932882131"
"131","1.907312","172.20.0.3","172.20.0.4","TCP","2962","8080  >  37684 [PSH, ACK] Seq=17377 Ack=154 Win=65024 Len=2896 TSval=3932882141 TSecr=3912371577 [TCP PDU reassembled in 219]"
"132","1.907401","172.20.0.3","172.20.0.4","TCP","2962","8080  >  37684 [PSH, ACK] Seq=20273 Ack=154 Win=65024 Len=2896 TSval=3932882141 TSecr=3912371577 [TCP PDU reassembled in 219]"
"133","1.907411","172.20.0.3","172.20.0.4","TCP","2962","8080  >  37684 [PSH, ACK] Seq=23169 Ack=154 Win=65024 Len=2896 TSval=3932882141 TSecr=3912371577 [TCP PDU reassembled in 219]"
"134","1.907487","172.20.0.3","172.20.0.4","TCP","2962","8080  >  37684 [PSH, ACK] Seq=26065 Ack=154 Win=65024 Len=2896 TSval=3932882141 TSecr=3912371577 [TCP PDU reassembled in 219]"
"135","1.907512","172.20.0.3","172.20.0.4","TCP","4410","8080  >  37684 [PSH, ACK] Seq=28961 Ack=154 Win=65024 Len=4344 TSval=3932882141 TSecr=3912371577 [TCP PDU reassembled in 219]"
"136","1.907533","172.20.0.3","172.20.0.4","TCP","4410","8080  >  37684 [PSH, ACK] Seq=33305 Ack=154 Win=65024 Len=4344 TSval=3932882141 TSecr=3912371577 [TCP PDU reassembled in 219]"
"137","1.907560","172.20.0.3","172.20.0.4","TCP","4410","8080  >  37684 [PSH, ACK] Seq=37649 Ack=154 Win=65024 Len=4344 TSval=3932882141 TSecr=3912371577 [TCP PDU reassembled in 219]"
"138","1.907581","172.20.0.3","172.20.0.4","TCP","1514","8080  >  37684 [ACK] Seq=41993 Ack=154 Win=65024 Len=1448 TSval=3932882141 TSecr=3912371577 [TCP PDU reassembled in 219]"
"139","1.917366","172.20.0.4","172.20.0.3","TCP","66","37684  >  8080 [ACK] Seq=154 Ack=17377 Win=94080 Len=0 TSval=3912371587 TSecr=3932882141"
"140","1.917377","172.20.0.4","172.20.0.3","TCP","66","37684  >  8080 [ACK] Seq=154 Ack=20273 Win=94080 Len=0 TSval=3912371587 TSecr=3932882141"
"141","1.917555","172.20.0.3","172.20.0.4","TCP","2962","8080  >  37684 [PSH, ACK] Seq=43441 Ack=154 Win=65024 Len=2896 TSval=3932882151 TSecr=3912371587 [TCP PDU reassembled in 219]"
"142","1.917638","172.20.0.4","172.20.0.3","TCP","66","37684  >  8080 [ACK] Seq=154 Ack=23169 Win=94080 Len=0 TSval=3912371587 TSecr=3932882141"
"143","1.917641","172.20.0.4","172.20.0.3","TCP","66","37684  >  8080 [ACK] Seq=154 Ack=26065 Win=91264 Len=0 TSval=3912371587 TSecr=3932882141"
"144","1.917642","172.20.0.4","172.20.0.3","TCP","66","37684  >  8080 [ACK] Seq=154 Ack=28961 Win=97024 Len=0 TSval=3912371587 TSecr=3932882141"
"145","1.917644","172.20.0.4","172.20.0.3","TCP","66","37684  >  8080 [ACK] Seq=154 Ack=33305 Win=95872 Len=0 TSval=3912371587 TSecr=3932882141"
"146","1.917645","172.20.0.4","172.20.0.3","TCP","66","37684  >  8080 [ACK] Seq=154 Ack=37649 Win=95872 Len=0 TSval=3912371587 TSecr=3932882141"
"147","1.917646","172.20.0.4","172.20.0.3","TCP","66","37684  >  8080 [ACK] Seq=154 Ack=41993 Win=91904 Len=0 TSval=3912371587 TSecr=3932882141"
"148","1.917648","172.20.0.4","172.20.0.3","TCP","66","37684  >  8080 [ACK] Seq=154 Ack=43441 Win=94080 Len=0 TSval=3912371587 TSecr=3932882141"
"149","1.917653","172.20.0.3","172.20.0.4","TCP","5858","8080  >  37684 [PSH, ACK] Seq=46337 Ack=154 Win=65024 Len=5792 TSval=3932882151 TSecr=3912371587 [TCP PDU reassembled in 219]"
"150","1.917801","172.20.0.3","172.20.0.4","TCP","5858","8080  >  37684 [PSH, ACK] Seq=52129 Ack=154 Win=65024 Len=5792 TSval=3932882152 TSecr=3912371587 [TCP PDU reassembled in 219]"
"151","1.917814","172.20.0.3","172.20.0.4","TCP","7306","8080  >  37684 [PSH, ACK] Seq=57921 Ack=154 Win=65024 Len=7240 TSval=3932882152 TSecr=3912371587 [TCP PDU reassembled in 219]"
"152","1.917825","172.20.0.3","172.20.0.4","TCP","7306","8080  >  37684 [PSH, ACK] Seq=65161 Ack=154 Win=65024 Len=7240 TSval=3932882152 TSecr=3912371587 [TCP PDU reassembled in 219]"
"153","1.917884","172.20.0.3","172.20.0.4","TCP","5858","8080  >  37684 [PSH, ACK] Seq=72401 Ack=154 Win=65024 Len=5792 TSval=3932882152 TSecr=3912371587 [TCP PDU reassembled in 219]"
"154","1.917896","172.20.0.3","172.20.0.4","TCP","10202","8080  >  37684 [PSH, ACK] Seq=78193 Ack=154 Win=65024 Len=10136 TSval=3932882152 TSecr=3912371587 [TCP PDU reassembled in 219]"
"155","1.917908","172.20.0.3","172.20.0.4","TCP","10202","8080  >  37684 [PSH, ACK] Seq=88329 Ack=154 Win=65024 Len=10136 TSval=3932882152 TSecr=3912371587 [TCP PDU reassembled in 219]"
"156","1.917928","172.20.0.3","172.20.0.4","TCP","2962","8080  >  37684 [PSH, ACK] Seq=98465 Ack=154 Win=65024 Len=2896 TSval=3932882152 TSecr=3912371587 [TCP PDU reassembled in 219]"
"157","1.927717","172.20.0.4","172.20.0.3","TCP","66","37684  >  8080 [ACK] Seq=154 Ack=46337 Win=97024 Len=0 TSval=3912371597 TSecr=3932882151"
"158","1.927724","172.20.0.4","172.20.0.3","TCP","66","37684  >  8080 [ACK] Seq=154 Ack=52129 Win=91904 Len=0 TSval=3912371598 TSecr=3932882151"
"159","1.927859","172.20.0.3","172.20.0.4","TCP","5858","8080  >  37684 [PSH, ACK] Seq=101361 Ack=154 Win=65024 Len=5792 TSval=3932882162 TSecr=3912371597 [TCP PDU reassembled in 219]"
"160","1.927947","172.20.0.4","172.20.0.3","TCP","66","37684  >  8080 [ACK] Seq=154 Ack=57921 Win=108544 Len=0 TSval=3912371598 TSecr=3932882152"
"161","1.927949","172.20.0.4","172.20.0.3","TCP","66","37684  >  8080 [ACK] Seq=154 Ack=65161 Win=123136 Len=0 TSval=3912371598 TSecr=3932882152"
"162","1.927951","172.20.0.4","172.20.0.3","TCP","66","37684  >  8080 [ACK] Seq=154 Ack=72401 Win=137600 Len=0 TSval=3912371598 TSecr=3932882152"
"163","1.927952","172.20.0.4","172.20.0.3","TCP","66","37684  >  8080 [ACK] Seq=154 Ack=78193 Win=149120 Len=0 TSval=3912371598 TSecr=3932882152"
"164","1.927953","172.20.0.4","172.20.0.3","TCP","66","37684  >  8080 [ACK] Seq=154 Ack=88329 Win=163328 Len=0 TSval=3912371598 TSecr=3932882152"
"165","1.927955","172.20.0.4","172.20.0.3","TCP","66","37684  >  8080 [ACK] Seq=154 Ack=98465 Win=155008 Len=0 TSval=3912371598 TSecr=3932882152"
"166","1.927960","172.20.0.4","172.20.0.3","TCP","66","37684  >  8080 [ACK] Seq=154 Ack=101361 Win=152192 Len=0 TSval=3912371598 TSecr=3932882152"
"167","1.927966","172.20.0.3","172.20.0.4","TCP","11650","8080  >  37684 [PSH, ACK] Seq=107153 Ack=154 Win=65024 Len=11584 TSval=3932882162 TSecr=3912371598 [TCP PDU reassembled in 219]"
"168","1.928147","172.20.0.3","172.20.0.4","TCP","2962","8080  >  37684 [PSH, ACK] Seq=118737 Ack=154 Win=65024 Len=2896 TSval=3932882162 TSecr=3912371598 [TCP PDU reassembled in 219]"
"169","1.928161","172.20.0.3","172.20.0.4","TCP","14546","8080  >  37684 [PSH, ACK] Seq=121633 Ack=154 Win=65024 Len=14480 TSval=3932882162 TSecr=3912371598 [TCP PDU reassembled in 219]"
"170","1.928175","172.20.0.3","172.20.0.4","TCP","15994","8080  >  37684 [PSH, ACK] Seq=136113 Ack=154 Win=65024 Len=15928 TSval=3932882162 TSecr=3912371598 [TCP PDU reassembled in 219]"
"171","1.928261","172.20.0.3","172.20.0.4","TCP","13098","8080  >  37684 [PSH, ACK] Seq=152041 Ack=154 Win=65024 Len=13032 TSval=3932882162 TSecr=3912371598 [TCP PDU reassembled in 219]"
"172","1.928289","172.20.0.3","172.20.0.4","TCP","21786","8080  >  37684 [PSH, ACK] Seq=165073 Ack=154 Win=65024 Len=21720 TSval=3932882162 TSecr=3912371598 [TCP PDU reassembled in 219]"
"173","1.928316","172.20.0.3","172.20.0.4","TCP","21786","8080  >  37684 [PSH, ACK] Seq=186793 Ack=154 Win=65024 Len=21720 TSval=3932882162 TSecr=3912371598 [TCP PDU reassembled in 219]"
"174","1.928336","172.20.0.3","172.20.0.4","TCP","4410","8080  >  37684 [PSH, ACK] Seq=208513 Ack=154 Win=65024 Len=4344 TSval=3932882162 TSecr=3912371598 [TCP PDU reassembled in 219]"
"175","1.928357","172.20.0.3","172.20.0.4","TCP","4410","8080  >  37684 [PSH, ACK] Seq=212857 Ack=154 Win=65024 Len=4344 TSval=3932882162 TSecr=3912371598 [TCP PDU reassembled in 219]"
"176","1.938115","172.20.0.4","172.20.0.3","TCP","66","37684  >  8080 [ACK] Seq=154 Ack=107153 Win=174976 Len=0 TSval=3912371608 TSecr=3932882162"
"177","1.938127","172.20.0.4","172.20.0.3","TCP","66","37684  >  8080 [ACK] Seq=154 Ack=118737 Win=174720 Len=0 TSval=3912371608 TSecr=3932882162"
"178","1.938387","172.20.0.3","172.20.0.4","TCP","11650","8080  >  37684 [PSH, ACK] Seq=217201 Ack=154 Win=65024 Len=11584 TSval=3932882172 TSecr=3912371608 [TCP PDU reassembled in 219]"
"179","1.938527","172.20.0.4","172.20.0.3","TCP","66","37684  >  8080 [ACK] Seq=154 Ack=121633 Win=180736 Len=0 TSval=3912371608 TSecr=3932882162"
"180","1.938532","172.20.0.4","172.20.0.3","TCP","66","37684  >  8080 [ACK] Seq=154 Ack=136113 Win=209664 Len=0 TSval=3912371608 TSecr=3932882162"
"181","1.938535","172.20.0.4","172.20.0.3","TCP","66","37684  >  8080 [ACK] Seq=154 Ack=152041 Win=241536 Len=0 TSval=3912371608 TSecr=3932882162"
"182","1.938537","172.20.0.4","172.20.0.3","TCP","66","37684  >  8080 [ACK] Seq=154 Ack=165073 Win=267648 Len=0 TSval=3912371608 TSecr=3932882162"
"183","1.938541","172.20.0.4","172.20.0.3","TCP","66","37684  >  8080 [ACK] Seq=154 Ack=186793 Win=311040 Len=0 TSval=3912371608 TSecr=3932882162"
"184","1.938543","172.20.0.4","172.20.0.3","TCP","66","37684  >  8080 [ACK] Seq=154 Ack=208513 Win=354048 Len=0 TSval=3912371608 TSecr=3932882162"
"185","1.938546","172.20.0.4","172.20.0.3","TCP","66","37684  >  8080 [ACK] Seq=154 Ack=212857 Win=350080 Len=0 TSval=3912371608 TSecr=3932882162"
"186","1.938549","172.20.0.4","172.20.0.3","TCP","66","37684  >  8080 [ACK] Seq=154 Ack=217201 Win=345984 Len=0 TSval=3912371608 TSecr=3932882162"
"187","1.938912","172.20.0.3","172.20.0.4","TCP","24682","8080  >  37684 [PSH, ACK] Seq=228785 Ack=154 Win=65024 Len=24616 TSval=3932882173 TSecr=3912371608 [TCP PDU reassembled in 219]"
"188","1.938953","172.20.0.3","172.20.0.4","TCP","7306","8080  >  37684 [PSH, ACK] Seq=253401 Ack=154 Win=65024 Len=7240 TSval=3932882173 TSecr=3912371608 [TCP PDU reassembled in 219]"
"189","1.938979","172.20.0.3","172.20.0.4","TCP","30474","8080  >  37684 [PSH, ACK] Seq=260641 Ack=154 Win=65024 Len=30408 TSval=3932882173 TSecr=3912371608 [TCP PDU reassembled in 219]"
"190","1.939094","172.20.0.3","172.20.0.4","TCP","17442","8080  >  37684 [PSH, ACK] Seq=291049 Ack=154 Win=65024 Len=17376 TSval=3932882173 TSecr=3912371608 [TCP PDU reassembled in 219]"
"191","1.939127","172.20.0.3","172.20.0.4","TCP","42058","8080  >  37684 [PSH, ACK] Seq=308425 Ack=154 Win=65024 Len=41992 TSval=3932882173 TSecr=3912371608 [TCP PDU reassembled in 219]"
"192","1.939195","172.20.0.3","172.20.0.4","TCP","23234","8080  >  37684 [PSH, ACK] Seq=350417 Ack=154 Win=65024 Len=23168 TSval=3932882173 TSecr=3912371608 [TCP PDU reassembled in 219]"
"193","1.939220","172.20.0.3","172.20.0.4","TCP","42058","8080  >  37684 [PSH, ACK] Seq=373585 Ack=154 Win=65024 Len=41992 TSval=3932882173 TSecr=3912371608 [TCP PDU reassembled in 219]"
"194","1.939594","172.20.0.3","172.20.0.4","TCP","23234","8080  >  37684 [PSH, ACK] Seq=415577 Ack=154 Win=65024 Len=23168 TSval=3932882173 TSecr=3912371608 [TCP PDU reassembled in 219]"
"195","1.939757","172.20.0.3","172.20.0.4","TCP","10202","8080  >  37684 [PSH, ACK] Seq=438745 Ack=154 Win=65024 Len=10136 TSval=3932882173 TSecr=3912371608 [TCP PDU reassembled in 219]"
"196","1.948650","172.20.0.4","172.20.0.3","TCP","66","37684  >  8080 [ACK] Seq=154 Ack=228785 Win=377216 Len=0 TSval=3912371618 TSecr=3932882172"
"197","1.948828","172.20.0.3","172.20.0.4","TCP","23234","8080  >  37684 [PSH, ACK] Seq=448881 Ack=154 Win=65024 Len=23168 TSval=3932882183 TSecr=3912371618 [TCP PDU reassembled in 219]"
"198","1.949020","172.20.0.4","172.20.0.3","TCP","66","37684  >  8080 [ACK] Seq=154 Ack=253401 Win=426368 Len=0 TSval=3912371619 TSecr=3932882173"
"199","1.949024","172.20.0.4","172.20.0.3","TCP","66","37684  >  8080 [ACK] Seq=154 Ack=260641 Win=440960 Len=0 TSval=3912371619 TSecr=3932882173"
"200","1.949026","172.20.0.4","172.20.0.3","TCP","66","37684  >  8080 [ACK] Seq=154 Ack=291049 Win=501760 Len=0 TSval=3912371619 TSecr=3932882173"
"201","1.949277","172.20.0.3","172.20.0.4","TCP","31922","8080  >  37684 [PSH, ACK] Seq=472049 Ack=154 Win=65024 Len=31856 TSval=3932882183 TSecr=3912371619 [TCP PDU reassembled in 219]"
"202","1.949311","172.20.0.3","172.20.0.4","TCP","56538","8080  >  37684 [PSH, ACK] Seq=503905 Ack=154 Win=65024 Len=56472 TSval=3932882183 TSecr=3912371619 [TCP PDU reassembled in 219]"
"203","1.949323","172.20.0.4","172.20.0.3","TCP","66","37684  >  8080 [ACK] Seq=154 Ack=308425 Win=536448 Len=0 TSval=3912371619 TSecr=3932882173"
"204","1.949326","172.20.0.4","172.20.0.3","TCP","66","37684  >  8080 [ACK] Seq=154 Ack=350417 Win=620416 Len=0 TSval=3912371619 TSecr=3932882173"
"205","1.949377","172.20.0.3","172.20.0.4","TCP","8754","8080  >  37684 [PSH, ACK] Seq=560377 Ack=154 Win=65024 Len=8688 TSval=3932882183 TSecr=3912371619 [TCP PDU reassembled in 219]"
"206","1.949430","172.20.0.3","172.20.0.4","TCP","65226","8080  >  37684 [PSH, ACK] Seq=569065 Ack=154 Win=65024 Len=65160 TSval=3932882183 TSecr=3912371619 [TCP PDU reassembled in 219]"
"207","1.949469","172.20.0.3","172.20.0.4","TCP","65226","8080  >  37684 [PSH, ACK] Seq=634225 Ack=154 Win=65024 Len=65160 TSval=3932882183 TSecr=3912371619 [TCP PDU reassembled in 219]"
"208","1.949800","172.20.0.4","172.20.0.3","TCP","66","37684  >  8080 [ACK] Seq=154 Ack=438745 Win=568960 Len=0 TSval=3912371620 TSecr=3932882173"
"209","1.949924","172.20.0.3","172.20.0.4","TCP","65226","8080  >  37684 [PSH, ACK] Seq=699385 Ack=154 Win=65024 Len=65160 TSval=3932882184 TSecr=3912371620 [TCP PDU reassembled in 219]"
"210","1.949961","172.20.0.3","172.20.0.4","TCP","65226","8080  >  37684 [PSH, ACK] Seq=764545 Ack=154 Win=65024 Len=65160 TSval=3932882184 TSecr=3912371620 [TCP PDU reassembled in 219]"
"211","1.950430","172.20.0.4","172.20.0.3","TCP","66","37684  >  8080 [ACK] Seq=154 Ack=448881 Win=570112 Len=0 TSval=3912371620 TSecr=3932882173"
"212","1.950568","172.20.0.3","172.20.0.4","TCP","65226","8080  >  37684 [PSH, ACK] Seq=829705 Ack=154 Win=65024 Len=65160 TSval=3932882184 TSecr=3912371620 [TCP PDU reassembled in 219]"
"213","1.950592","172.20.0.3","172.20.0.4","TCP","17442","8080  >  37684 [PSH, ACK] Seq=894865 Ack=154 Win=65024 Len=17376 TSval=3932882184 TSecr=3912371620 [TCP PDU reassembled in 219]"
"214","1.958946","172.20.0.4","172.20.0.3","TCP","66","37684  >  8080 [ACK] Seq=154 Ack=472049 Win=601216 Len=0 TSval=3912371629 TSecr=3932882183"
"215","1.959112","172.20.0.3","172.20.0.4","TCP","46402","8080  >  37684 [PSH, ACK] Seq=912241 Ack=154 Win=65024 Len=46336 TSval=3932882193 TSecr=3912371629 [TCP PDU reassembled in 219]"
"216","1.959746","172.20.0.4","172.20.0.3","TCP","66","37684  >  8080 [ACK] Seq=154 Ack=699385 Win=424704 Len=0 TSval=3912371629 TSecr=3932882183"
"217","1.959903","172.20.0.3","172.20.0.4","TCP","1514","8080  >  37684 [PSH, ACK] Seq=958577 Ack=154 Win=65024 Len=1448 TSval=3932882194 TSecr=3912371629 [TCP PDU reassembled in 219]"
"218","1.959943","172.20.0.3","172.20.0.4","TCP","65226","8080  >  37684 [PSH, ACK] Seq=960025 Ack=154 Win=65024 Len=65160 TSval=3932882194 TSecr=3912371629 [TCP PDU reassembled in 219]"
"219","1.959958","172.20.0.3","172.20.0.4","HTTP","23642","HTTP/1.1 200 OK "
"220","1.960339","172.20.0.4","172.20.0.3","TCP","66","37684  >  8080 [ACK] Seq=154 Ack=829705 Win=337792 Len=0 TSval=3912371630 TSecr=3932882184"
"221","1.960894","172.20.0.4","172.20.0.3","TCP","66","37684  >  8080 [ACK] Seq=154 Ack=912241 Win=273664 Len=0 TSval=3912371631 TSecr=3932882184"
"222","1.969232","172.20.0.4","172.20.0.3","TCP","66","37684  >  8080 [ACK] Seq=154 Ack=958577 Win=288640 Len=0 TSval=3912371639 TSecr=3932882193"
"223","1.970204","172.20.0.4","172.20.0.3","TCP","66","37684  >  8080 [ACK] Seq=154 Ack=1048762 Win=217856 Len=0 TSval=3912371640 TSecr=3932882194"
"224","2.148811","172.20.0.4","172.20.0.3","TCP","66","37684  >  8080 [FIN, ACK] Seq=154 Ack=1048762 Win=620416 Len=0 TSval=3912371819 TSecr=3932882194"
"225","2.148950","172.20.0.3","172.20.0.4","TCP","66","8080  >  37684 [ACK] Seq=1048762 Ack=155 Win=65024 Len=0 TSval=3932882383 TSecr=3912371819"
"226","3.557306","172.20.0.4","172.20.0.2","DNS","59","DNS Stateful operations (DSO) 0x3637[Malformed Packet]"
"227","3.557681","172.20.0.2","172.20.0.4","DNS","70","DNS Stateful operations (DSO) 0x3637[Malformed Packet]"
"228","3.568276","172.20.0.4","172.20.0.3","TCP","74","37690  >  8080 [SYN] Seq=0 Win=64240 Len=0 MSS=1460 SACK_PERM TSval=3912373238 TSecr=0 WS=128"
"229","3.568386","172.20.0.3","172.20.0.4","TCP","74","8080  >  37690 [SYN, ACK] Seq=0 Ack=1 Win=65160 Len=0 MSS=1460 SACK_PERM TSval=3932883802 TSecr=3912373238 WS=128"
"230","3.579198","172.20.0.4","172.20.0.3","TCP","66","37690  >  8080 [ACK] Seq=1 Ack=1 Win=64256 Len=0 TSval=3912373248 TSecr=3932883802"
"231","3.579210","172.20.0.4","172.20.0.3","HTTP","219","GET /arquivo_1mb.bin HTTP/1.1 "
"232","3.579500","172.20.0.3","172.20.0.4","TCP","66","8080  >  37690 [ACK] Seq=1 Ack=154 Win=65024 Len=0 TSval=3932883813 TSecr=3912373248"
"233","3.605401","172.20.0.3","172.20.0.4","TCP","2962","8080  >  37690 [PSH, ACK] Seq=1 Ack=154 Win=65024 Len=2896 TSval=3932883839 TSecr=3912373248 [TCP PDU reassembled in 331]"
"234","3.605627","172.20.0.3","172.20.0.4","TCP","2962","8080  >  37690 [PSH, ACK] Seq=2897 Ack=154 Win=65024 Len=2896 TSval=3932883839 TSecr=3912373248 [TCP PDU reassembled in 331]"
"235","3.605677","172.20.0.3","172.20.0.4","TCP","2962","8080  >  37690 [PSH, ACK] Seq=5793 Ack=154 Win=65024 Len=2896 TSval=3932883839 TSecr=3912373248 [TCP PDU reassembled in 331]"
"236","3.605718","172.20.0.3","172.20.0.4","TCP","2962","8080  >  37690 [PSH, ACK] Seq=8689 Ack=154 Win=65024 Len=2896 TSval=3932883839 TSecr=3912373248 [TCP PDU reassembled in 331]"
"237","3.605758","172.20.0.3","172.20.0.4","TCP","2962","8080  >  37690 [PSH, ACK] Seq=11585 Ack=154 Win=65024 Len=2896 TSval=3932883839 TSecr=3912373248 [TCP PDU reassembled in 331]"
"238","3.615711","172.20.0.4","172.20.0.3","TCP","66","37690  >  8080 [ACK] Seq=154 Ack=2897 Win=70144 Len=0 TSval=3912373285 TSecr=3932883839"
"239","3.615722","172.20.0.4","172.20.0.3","TCP","66","37690  >  8080 [ACK] Seq=154 Ack=5793 Win=75904 Len=0 TSval=3912373286 TSecr=3932883839"
"240","3.615730","172.20.0.4","172.20.0.3","TCP","66","37690  >  8080 [ACK] Seq=154 Ack=8689 Win=81664 Len=0 TSval=3912373286 TSecr=3932883839"
"241","3.615747","172.20.0.4","172.20.0.3","TCP","66","37690  >  8080 [ACK] Seq=154 Ack=11585 Win=87424 Len=0 TSval=3912373286 TSecr=3932883839"
"242","3.616000","172.20.0.3","172.20.0.4","TCP","2962","8080  >  37690 [PSH, ACK] Seq=14481 Ack=154 Win=65024 Len=2896 TSval=3932883850 TSecr=3912373285 [TCP PDU reassembled in 331]"
"243","3.616117","172.20.0.4","172.20.0.3","TCP","66","37690  >  8080 [ACK] Seq=154 Ack=14481 Win=93312 Len=0 TSval=3912373286 TSecr=3932883839"
"244","3.616126","172.20.0.3","172.20.0.4","TCP","2962","8080  >  37690 [PSH, ACK] Seq=17377 Ack=154 Win=65024 Len=2896 TSval=3932883850 TSecr=3912373285 [TCP PDU reassembled in 331]"
"245","3.616245","172.20.0.3","172.20.0.4","TCP","2962","8080  >  37690 [PSH, ACK] Seq=20273 Ack=154 Win=65024 Len=2896 TSval=3932883850 TSecr=3912373286 [TCP PDU reassembled in 331]"
