"No.","Time","Source","Destination","Protocol","Length","Info"
"1","0.000000","172.20.0.4","172.20.0.2","DNS","59","DNS Stateful operations (DSO) 0x3236[Malformed Packet]"
"2","0.000634","172.20.0.2","172.20.0.4","DNS","70","DNS Stateful operations (DSO) 0x3236[Malformed Packet]"
"3","0.011705","172.20.0.4","172.20.0.3","TCP","74","52904  >  8080 [SYN] Seq=0 Win=64240 Len=0 MSS=1460 SACK_PERM TSval=3911393018 TSecr=0 WS=128"
"4","0.011923","172.20.0.3","172.20.0.4","TCP","74","8080  >  52904 [SYN, ACK] Seq=0 Ack=1 Win=65160 Len=0 MSS=1460 SACK_PERM TSval=3931903582 TSecr=3911393018 WS=128"
"5","0.022060","172.20.0.4","172.20.0.3","TCP","66","52904  >  8080 [ACK] Seq=1 Ack=1 Win=64256 Len=0 TSval=3911393029 TSecr=3931903582"
"6","0.022211","172.20.0.4","172.20.0.3","HTTP","221","GET /arquivo_100kb.bin HTTP/1.1 "
"7","0.022253","172.20.0.3","172.20.0.4","TCP","66","8080  >  52904 [ACK] Seq=1 Ack=156 Win=65024 Len=0 TSval=3931903593 TSecr=3911393029"
"8","0.034938","172.20.0.3","172.20.0.4","TCP","2962","8080  >  52904 [PSH, ACK] Seq=1 Ack=156 Win=65024 Len=2896 TSval=3931903605 TSecr=3911393029 [TCP PDU reassembled in 43]"
"9","0.035116","172.20.0.3","172.20.0.4","TCP","2962","8080  >  52904 [PSH, ACK] Seq=2897 Ack=156 Win=65024 Len=2896 TSval=3931903606 TSecr=3911393029 [TCP PDU reassembled in 43]"
"10","0.035140","172.20.0.3","172.20.0.4","TCP","2962","8080  >  52904 [PSH, ACK] Seq=5793 Ack=156 Win=65024 Len=2896 TSval=3931903606 TSecr=3911393029 [TCP PDU reassembled in 43]"
"11","0.035161","172.20.0.3","172.20.0.4","TCP","2962","8080  >  52904 [PSH, ACK] Seq=8689 Ack=156 Win=65024 Len=2896 TSval=3931903606 TSecr=3911393029 [TCP PDU reassembled in 43]"
"12","0.035182","172.20.0.3","172.20.0.4","TCP","2962","8080  >  52904 [PSH, ACK] Seq=11585 Ack=156 Win=65024 Len=2896 TSval=3931903606 TSecr=3911393029 [TCP PDU reassembled in 43]"
"13","0.045253","172.20.0.4","172.20.0.3","TCP","66","52904  >  8080 [ACK] Seq=156 Ack=2897 Win=70144 Len=0 TSval=3911393052 TSecr=3931903605"
"14","0.045265","172.20.0.4","172.20.0.3","TCP","66","52904  >  8080 [ACK] Seq=156 Ack=5793 Win=75904 Len=0 TSval=3911393052 TSecr=3931903606"
"15","0.045267","172.20.0.4","172.20.0.3","TCP","66","52904  >  8080 [ACK] Seq=156 Ack=8689 Win=81664 Len=0 TSval=3911393052 TSecr=3931903606"
"16","0.045269","172.20.0.4","172.20.0.3","TCP","66","52904  >  8080 [ACK] Seq=156 Ack=11585 Win=87424 Len=0 TSval=3911393052 TSecr=3931903606"
"17","0.045271","172.20.0.4","172.20.0.3","TCP","66","52904  >  8080 [ACK] Seq=156 Ack=14481 Win=88320 Len=0 TSval=3911393052 TSecr=3931903606"
"18","0.045474","172.20.0.3","172.20.0.4","TCP","2962","8080  >  52904 [PSH, ACK] Seq=14481 Ack=156 Win=65024 Len=2896 TSval=3931903616 TSecr=3911393052 [TCP PDU reassembled in 43]"
"19","0.045564","172.20.0.3","172.20.0.4","TCP","2962","8080  >  52904 [PSH, ACK] Seq=17377 Ack=156 Win=65024 Len=2896 TSval=3931903616 TSecr=3911393052 [TCP PDU reassembled in 43]"
"20","0.045621","172.20.0.3","172.20.0.4","TCP","2962","8080  >  52904 [PSH, ACK] Seq=20273 Ack=156 Win=65024 Len=2896 TSval=3931903616 TSecr=3911393052 [TCP PDU reassembled in 43]"
"21","0.045631","172.20.0.3","172.20.0.4","TCP","4410","8080  >  52904 [PSH, ACK] Seq=23169 Ack=156 Win=65024 Len=4344 TSval=3931903616 TSecr=3911393052 [TCP PDU reassembled in 43]"
"22","0.045636","172.20.0.3","172.20.0.4","TCP","4410","8080  >  52904 [PSH, ACK] Seq=27513 Ack=156 Win=65024 Len=4344 TSval=3931903616 TSecr=3911393052 [TCP PDU reassembled in 43]"
"23","0.045665","172.20.0.3","172.20.0.4","TCP","4410","8080  >  52904 [PSH, ACK] Seq=31857 Ack=156 Win=65024 Len=4344 TSval=3931903616 TSecr=3911393052 [TCP PDU reassembled in 43]"
"24","0.045675","172.20.0.3","172.20.0.4","TCP","4410","8080  >  52904 [PSH, ACK] Seq=36201 Ack=156 Win=65024 Len=4344 TSval=3931903616 TSecr=3911393052 [TCP PDU reassembled in 43]"
"25","0.045696","172.20.0.3","172.20.0.4","TCP","2962","8080  >  52904 [PSH, ACK] Seq=40545 Ack=156 Win=65024 Len=2896 TSval=3931903616 TSecr=3911393052 [TCP PDU reassembled in 43]"
"26","0.055709","172.20.0.4","172.20.0.3","TCP","66","52904  >  8080 [ACK] Seq=156 Ack=17377 Win=94080 Len=0 TSval=3911393062 TSecr=3931903616"
"27","0.055719","172.20.0.4","172.20.0.3","TCP","66","52904  >  8080 [ACK] Seq=156 Ack=20273 Win=94080 Len=0 TSval=3911393062 TSecr=3931903616"
"28","0.055722","172.20.0.4","172.20.0.3","TCP","66","52904  >  8080 [ACK] Seq=156 Ack=23169 Win=91264 Len=0 TSval=3911393062 TSecr=3931903616"
"29","0.055725","172.20.0.4","172.20.0.3","TCP","66","52904  >  8080 [ACK] Seq=156 Ack=27513 Win=87040 Len=0 TSval=3911393062 TSecr=3931903616"
"30","0.055728","172.20.0.4","172.20.0.3","TCP","66","52904  >  8080 [ACK] Seq=156 Ack=31857 Win=82816 Len=0 TSval=3911393062 TSecr=3931903616"
"31","0.055734","172.20.0.4","172.20.0.3","TCP","66","52904  >  8080 [ACK] Seq=156 Ack=36201 Win=82176 Len=0 TSval=3911393062 TSecr=3931903616"
"32","0.055737","172.20.0.4","172.20.0.3","TCP","66","52904  >  8080 [ACK] Seq=156 Ack=40545 Win=78208 Len=0 TSval=3911393062 TSecr=3931903616"
"33","0.055740","172.20.0.4","172.20.0.3","TCP","66","52904  >  8080 [ACK] Seq=156 Ack=43441 Win=75392 Len=0 TSval=3911393062 TSecr=3931903616"
"34","0.056112","172.20.0.3","172.20.0.4","TCP","2962","8080  >  52904 [PSH, ACK] Seq=43441 Ack=156 Win=65024 Len=2896 TSval=3931903627 TSecr=3911393062 [TCP PDU reassembled in 43]"
"35","0.056236","172.20.0.3","172.20.0.4","TCP","5858","8080  >  52904 [PSH, ACK] Seq=46337 Ack=156 Win=65024 Len=5792 TSval=3931903627 TSecr=3911393062 [TCP PDU reassembled in 43]"
"36","0.056262","172.20.0.3","172.20.0.4","TCP","5858","8080  >  52904 [PSH, ACK] Seq=52129 Ack=156 Win=65024 Len=5792 TSval=3931903627 TSecr=3911393062 [TCP PDU reassembled in 43]"
"37","0.056339","172.20.0.3","172.20.0.4","TCP","7306","8080  >  52904 [PSH, ACK] Seq=57921 Ack=156 Win=65024 Len=7240 TSval=3931903627 TSecr=3911393062 [TCP PDU reassembled in 43]"
"38","0.056360","172.20.0.3","172.20.0.4","TCP","10202","8080  >  52904 [PSH, ACK] Seq=65161 Ack=156 Win=65024 Len=10136 TSval=3931903627 TSecr=3911393062 [TCP PDU reassembled in 43]"
"39","0.056446","172.20.0.3","172.20.0.4","TCP","2962","8080  >  52904 [PSH, ACK] Seq=75297 Ack=156 Win=65024 Len=2896 TSval=3931903627 TSecr=3911393062 [TCP PDU reassembled in 43]"
"40","0.056466","172.20.0.3","172.20.0.4","TCP","10202","8080  >  52904 [PSH, ACK] Seq=78193 Ack=156 Win=65024 Len=10136 TSval=3931903627 TSecr=3911393062 [TCP PDU reassembled in 43]"
"41","0.056485","172.20.0.3","172.20.0.4","TCP","10202","8080  >  52904 [PSH, ACK] Seq=88329 Ack=156 Win=65024 Len=10136 TSval=3931903627 TSecr=3911393062 [TCP PDU reassembled in 43]"
"42","0.056545","172.20.0.3","172.20.0.4","TCP","2962","8080  >  52904 [PSH, ACK] Seq=98465 Ack=156 Win=65024 Len=2896 TSval=3931903627 TSecr=3911393062 [TCP PDU reassembled in 43]"
"43","0.056563","172.20.0.3","172.20.0.4","HTTP","1289","HTTP/1.1 200 OK "
"44","0.066406","172.20.0.4","172.20.0.3","TCP","66","52904  >  8080 [ACK] Seq=156 Ack=46337 Win=97024 Len=0 TSval=3911393073 TSecr=3931903627"
"45","0.066418","172.20.0.4","172.20.0.3","TCP","66","52904  >  8080 [ACK] Seq=156 Ack=52129 Win=91904 Len=0 TSval=3911393073 TSecr=3931903627"
"46","0.066421","172.20.0.4","172.20.0.3","TCP","66","52904  >  8080 [ACK] Seq=156 Ack=57921 Win=86784 Len=0 TSval=3911393073 TSecr=3931903627"
"47","0.066423","172.20.0.4","172.20.0.3","TCP","66","52904  >  8080 [ACK] Seq=156 Ack=65161 Win=111488 Len=0 TSval=3911393073 TSecr=3931903627"
"48","0.066429","172.20.0.4","172.20.0.3","TCP","66","52904  >  8080 [ACK] Seq=156 Ack=75297 Win=131712 Len=0 TSval=3911393073 TSecr=3931903627"
"49","0.066657","172.20.0.4","172.20.0.3","TCP","66","52904  >  8080 [ACK] Seq=156 Ack=78193 Win=137600 Len=0 TSval=3911393073 TSecr=3931903627"
"50","0.066660","172.20.0.4","172.20.0.3","TCP","66","52904  >  8080 [ACK] Seq=156 Ack=88329 Win=153216 Len=0 TSval=3911393073 TSecr=3931903627"
"51","0.066661","172.20.0.4","172.20.0.3","TCP","66","52904  >  8080 [ACK] Seq=156 Ack=98465 Win=144768 Len=0 TSval=3911393073 TSecr=3931903627"
"52","0.066664","172.20.0.4","172.20.0.3","TCP","66","52904  >  8080 [ACK] Seq=156 Ack=101361 Win=141952 Len=0 TSval=3911393073 TSecr=3931903627"
"53","0.067659","172.20.0.4","172.20.0.3","TCP","66","52904  >  8080 [FIN, ACK] Seq=156 Ack=102585 Win=153216 Len=0 TSval=3911393074 TSecr=3931903627"
"54","0.067860","172.20.0.3","172.20.0.4","TCP","66","8080  >  52904 [ACK] Seq=102585 Ack=157 Win=65024 Len=0 TSval=3931903638 TSecr=3911393074"
"55","1.629435","172.20.0.4","172.20.0.2","DNS","59","Unknown operation (7) 0x3533[Malformed Packet]"
"56","1.630161","172.20.0.2","172.20.0.4","DNS","70","Unknown operation (7) 0x3533[Malformed Packet]"
"57","1.641319","172.20.0.4","172.20.0.3","TCP","74","52910  >  8080 [SYN] Seq=0 Win=64240 Len=0 MSS=1460 SACK_PERM TSval=3911394647 TSecr=0 WS=128"
"58","1.641502","172.20.0.3","172.20.0.4","TCP","74","8080  >  52910 [SYN, ACK] Seq=0 Ack=1 Win=65160 Len=0 MSS=1460 SACK_PERM TSval=3931905212 TSecr=3911394647 WS=128"
"59","1.652003","172.20.0.4","172.20.0.3","TCP","66","52910  >  8080 [ACK] Seq=1 Ack=1 Win=64256 Len=0 TSval=3911394658 TSecr=3931905212"
"60","1.652016","172.20.0.4","172.20.0.3","HTTP","221","GET /arquivo_100kb.bin HTTP/1.1 "
"61","1.652355","172.20.0.3","172.20.0.4","TCP","66","8080  >  52910 [ACK] Seq=1 Ack=156 Win=65024 Len=0 TSval=3931905223 TSecr=3911394659"
"62","1.664949","172.20.0.3","172.20.0.4","TCP","2962","8080  >  52910 [PSH, ACK] Seq=1 Ack=156 Win=65024 Len=2896 TSval=3931905235 TSecr=3911394659 [TCP PDU reassembled in 97]"
"63","1.665083","172.20.0.3","172.20.0.4","TCP","2962","8080  >  52910 [PSH, ACK] Seq=2897 Ack=156 Win=65024 Len=2896 TSval=3931905236 TSecr=3911394659 [TCP PDU reassembled in 97]"
"64","1.665108","172.20.0.3","172.20.0.4","TCP","2962","8080  >  52910 [PSH, ACK] Seq=5793 Ack=156 Win=65024 Len=2896 TSval=3931905236 TSecr=3911394659 [TCP PDU reassembled in 97]"
"65","1.665130","172.20.0.3","172.20.0.4","TCP","2962","8080  >  52910 [PSH, ACK] Seq=8689 Ack=156 Win=65024 Len=2896 TSval=3931905236 TSecr=3911394659 [TCP PDU reassembled in 97]"
"66","1.665150","172.20.0.3","172.20.0.4","TCP","2962","8080  >  52910 [PSH, ACK] Seq=11585 Ack=156 Win=65024 Len=2896 TSval=3931905236 TSecr=3911394659 [TCP PDU reassembled in 97]"
"67","1.675081","172.20.0.4","172.20.0.3","TCP","66","52910  >  8080 [ACK] Seq=156 Ack=2897 Win=70144 Len=0 TSval=3911394682 TSecr=3931905235"
"68","1.675124","172.20.0.4","172.20.0.3","TCP","66","52910  >  8080 [ACK] Seq=156 Ack=5793 Win=75904 Len=0 TSval=3911394682 TSecr=3931905236"
"69","1.675129","172.20.0.4","172.20.0.3","TCP","66","52910  >  8080 [ACK] Seq=156 Ack=8689 Win=81664 Len=0 TSval=3911394682 TSecr=3931905236"
"70","1.675310","172.20.0.3","172.20.0.4","TCP","2962","8080  >  52910 [PSH, ACK] Seq=14481 Ack=156 Win=65024 Len=2896 TSval=3931905246 TSecr=3911394682 [TCP PDU reassembled in 97]"
"71","1.675397","172.20.0.4","172.20.0.3","TCP","66","52910  >  8080 [ACK] Seq=156 Ack=11585 Win=87424 Len=0 TSval=3911394682 TSecr=3931905236"
"72","1.675399","172.20.0.4","172.20.0.3","TCP","66","52910  >  8080 [ACK] Seq=156 Ack=14481 Win=88320 Len=0 TSval=3911394682 TSecr=3931905236"
"73","1.675404","172.20.0.3","172.20.0.4","TCP","2962","8080  >  52910 [PSH, ACK] Seq=17377 Ack=156 Win=65024 Len=2896 TSval=3931905246 TSecr=3911394682 [TCP PDU reassembled in 97]"
"74","1.675479","172.20.0.3","172.20.0.4","TCP","2962","8080  >  52910 [PSH, ACK] Seq=20273 Ack=156 Win=65024 Len=2896 TSval=3931905246 TSecr=3911394682 [TCP PDU reassembled in 97]"
"75","1.675489","172.20.0.3","172.20.0.4","TCP","4410","8080  >  52910 [PSH, ACK] Seq=23169 Ack=156 Win=65024 Len=4344 TSval=3931905246 TSecr=3911394682 [TCP PDU reassembled in 97]"
"76","1.675499","172.20.0.3","172.20.0.4","TCP","4410","8080  >  52910 [PSH, ACK] Seq=27513 Ack=156 Win=65024 Len=4344 TSval=3931905246 TSecr=3911394682 [TCP PDU reassembled in 97]"
"77","1.675535","172.20.0.3","172.20.0.4","TCP","4410","8080  >  52910 [PSH, ACK] Seq=31857 Ack=156 Win=65024 Len=4344 TSval=3931905246 TSecr=3911394682 [TCP PDU reassembled in 97]"
"78","1.675545","172.20.0.3","172.20.0.4","TCP","4410","8080  >  52910 [PSH, ACK] Seq=36201 Ack=156 Win=65024 Len=4344 TSval=3931905246 TSecr=3911394682 [TCP PDU reassembled in 97]"
"79","1.675565","172.20.0.3","172.20.0.4","TCP","2962","8080  >  52910 [PSH, ACK] Seq=40545 Ack=156 Win=65024 Len=2896 TSval=3931905246 TSecr=3911394682 [TCP PDU reassembled in 97]"
"80","1.685499","172.20.0.4","172.20.0.3","TCP","66","52910  >  8080 [ACK] Seq=156 Ack=17377 Win=94080 Len=0 TSval=3911394692 TSecr=3931905246"
"81","1.685508","172.20.0.4","172.20.0.3","TCP","66","52910  >  8080 [ACK] Seq=156 Ack=20273 Win=94080 Len=0 TSval=3911394692 TSecr=3931905246"
"82","1.685516","172.20.0.4","172.20.0.3","TCP","66","52910  >  8080 [ACK] Seq=156 Ack=23169 Win=94080 Len=0 TSval=3911394692 TSecr=3931905246"
"83","1.685518","172.20.0.4","172.20.0.3","TCP","66","52910  >  8080 [ACK] Seq=156 Ack=27513 Win=90112 Len=0 TSval=3911394692 TSecr=3931905246"
"84","1.685520","172.20.0.4","172.20.0.3","TCP","66","52910  >  8080 [ACK] Seq=156 Ack=31857 Win=86144 Len=0 TSval=3911394692 TSecr=3931905246"
"85","1.685743","172.20.0.3","172.20.0.4","TCP","2962","8080  >  52910 [PSH, ACK] Seq=43441 Ack=156 Win=65024 Len=2896 TSval=3931905256 TSecr=3911394692 [TCP PDU reassembled in 97]"
"86","1.685831","172.20.0.4","172.20.0.3","TCP","66","52910  >  8080 [ACK] Seq=156 Ack=36201 Win=82176 Len=0 TSval=3911394692 TSecr=3931905246"
"87","1.685833","172.20.0.4","172.20.0.3","TCP","66","52910  >  8080 [ACK] Seq=156 Ack=40545 Win=78208 Len=0 TSval=3911394692 TSecr=3931905246"
"88","1.685835","172.20.0.4","172.20.0.3","TCP","66","52910  >  8080 [ACK] Seq=156 Ack=43441 Win=81024 Len=0 TSval=3911394692 TSecr=3931905246"
"89","1.685840","172.20.0.3","172.20.0.4","TCP","5858","8080  >  52910 [PSH, ACK] Seq=46337 Ack=156 Win=65024 Len=5792 TSval=3931905256 TSecr=3911394692 [TCP PDU reassembled in 97]"
"90","1.685854","172.20.0.3","172.20.0.4","TCP","5858","8080  >  52910 [PSH, ACK] Seq=52129 Ack=156 Win=65024 Len=5792 TSval=3931905256 TSecr=3911394692 [TCP PDU reassembled in 97]"
"91","1.685931","172.20.0.3","172.20.0.4","TCP","7306","8080  >  52910 [PSH, ACK] Seq=57921 Ack=156 Win=65024 Len=7240 TSval=3931905256 TSecr=3911394692 [TCP PDU reassembled in 97]"
"92","1.685944","172.20.0.3","172.20.0.4","TCP","8754","8080  >  52910 [PSH, ACK] Seq=65161 Ack=156 Win=65024 Len=8688 TSval=3931905256 TSecr=3911394692 [TCP PDU reassembled in 97]"
"93","1.686011","172.20.0.3","172.20.0.4","TCP","4410","8080  >  52910 [PSH, ACK] Seq=73849 Ack=156 Win=65024 Len=4344 TSval=3931905257 TSecr=3911394692 [TCP PDU reassembled in 97]"
"94","1.686031","172.20.0.3","172.20.0.4","TCP","10202","8080  >  52910 [PSH, ACK] Seq=78193 Ack=156 Win=65024 Len=10136 TSval=3931905257 TSecr=3911394692 [TCP PDU reassembled in 97]"
"95","1.686043","172.20.0.3","172.20.0.4","TCP","10202","8080  >  52910 [PSH, ACK] Seq=88329 Ack=156 Win=65024 Len=10136 TSval=3931905257 TSecr=3911394692 [TCP PDU reassembled in 97]"
"96","1.686079","172.20.0.3","172.20.0.4","TCP","2962","8080  >  52910 [PSH, ACK] Seq=98465 Ack=156 Win=65024 Len=2896 TSval=3931905257 TSecr=3911394692 [TCP PDU reassembled in 97]"
"97","1.686086","172.20.0.3","172.20.0.4","HTTP","1289","HTTP/1.1 200 OK "
"98","1.695984","172.20.0.4","172.20.0.3","TCP","66","52910  >  8080 [ACK] Seq=156 Ack=46337 Win=97024 Len=0 TSval=3911394702 TSecr=3931905256"
"99","1.695996","172.20.0.4","172.20.0.3","TCP","66","52910  >  8080 [ACK] Seq=156 Ack=52129 Win=91904 Len=0 TSval=3911394702 TSecr=3931905256"
"100","1.695998","172.20.0.4","172.20.0.3","TCP","66","52910  >  8080 [ACK] Seq=156 Ack=57921 Win=86784 Len=0 TSval=3911394702 TSecr=3931905256"
"101","1.696000","172.20.0.4","172.20.0.3","TCP","66","52910  >  8080 [ACK] Seq=156 Ack=65161 Win=80640 Len=0 TSval=3911394703 TSecr=3931905256"
"102","1.696006","172.20.0.4","172.20.0.3","TCP","66","52910  >  8080 [ACK] Seq=156 Ack=73849 Win=73344 Len=0 TSval=3911394703 TSecr=3931905256"
"103","1.696220","172.20.0.4","172.20.0.3","TCP","66","52910  >  8080 [ACK] Seq=156 Ack=78193 Win=69376 Len=0 TSval=3911394703 TSecr=3931905257"
"104","1.696280","172.20.0.4","172.20.0.3","TCP","66","52910  >  8080 [ACK] Seq=156 Ack=88329 Win=60928 Len=0 TSval=3911394703 TSecr=3931905257"
"105","1.696281","172.20.0.4","172.20.0.3","TCP","66","52910  >  8080 [ACK] Seq=156 Ack=98465 Win=52480 Len=0 TSval=3911394703 TSecr=3931905257"
"106","1.696283","172.20.0.4","172.20.0.3","TCP","66","52910  >  8080 [ACK] Seq=156 Ack=102585 Win=97024 Len=0 TSval=3911394703 TSecr=3931905257"
"107","1.697516","172.20.0.4","172.20.0.3","TCP","66","52910  >  8080 [FIN, ACK] Seq=156 Ack=102585 Win=97024 Len=0 TSval=3911394704 TSecr=3931905257"
"108","1.697713","172.20.0.3","172.20.0.4","TCP","66","8080  >  52910 [ACK] Seq=102585 Ack=157 Win=65024 Len=0 TSval=3931905268 TSecr=3911394704"
"109","3.377067","172.20.0.4","172.20.0.2","DNS","59","DNS Stateful operations (DSO) 0x3838[Malformed Packet]"
"110","3.377534","172.20.0.2","172.20.0.4","DNS","70","DNS Stateful operations (DSO) 0x3838[Malformed Packet]"
"111","3.388224","172.20.0.4","172.20.0.3","TCP","74","46874  >  8080 [SYN] Seq=0 Win=64240 Len=0 MSS=1460 SACK_PERM TSval=3911396395 TSecr=0 WS=128"
"112","3.388421","172.20.0.3","172.20.0.4","TCP","74","8080  >  46874 [SYN, ACK] Seq=0 Ack=1 Win=65160 Len=0 MSS=1460 SACK_PERM TSval=3931906959 TSecr=3911396395 WS=128"
"113","3.398653","172.20.0.4","172.20.0.3","TCP","66","46874  >  8080 [ACK] Seq=1 Ack=1 Win=64256 Len=0 TSval=3911396405 TSecr=3931906959"
"114","3.398666","172.20.0.4","172.20.0.3","HTTP","221","GET /arquivo_100kb.bin HTTP/1.1 "
"115","3.398964","172.20.0.3","172.20.0.4","TCP","66","8080  >  46874 [ACK] Seq=1 Ack=156 Win=65024 Len=0 TSval=3931906969 TSecr=3911396405"
"116","3.409635","172.20.0.3","172.20.0.4","TCP","2962","8080  >  46874 [PSH, ACK] Seq=1 Ack=156 Win=65024 Len=2896 TSval=3931906980 TSecr=3911396405 [TCP PDU reassembled in 151]"
"117","3.409768","172.20.0.3","172.20.0.4","TCP","2962","8080  >  46874 [PSH, ACK] Seq=2897 Ack=156 Win=65024 Len=2896 TSval=3931906980 TSecr=3911396405 [TCP PDU reassembled in 151]"
"118","3.409793","172.20.0.3","172.20.0.4","TCP","2962","8080  >  46874 [PSH, ACK] Seq=5793 Ack=156 Win=65024 Len=2896 TSval=3931906980 TSecr=3911396405 [TCP PDU reassembled in 151]"
"119","3.409810","172.20.0.3","172.20.0.4","TCP","2962","8080  >  46874 [PSH, ACK] Seq=8689 Ack=156 Win=65024 Len=2896 TSval=3931906980 TSecr=3911396405 [TCP PDU reassembled in 151]"
"120","3.409825","172.20.0.3","172.20.0.4","TCP","2962","8080  >  46874 [PSH, ACK] Seq=11585 Ack=156 Win=65024 Len=2896 TSval=3931906980 TSecr=3911396405 [TCP PDU reassembled in 151]"
"121","3.419881","172.20.0.4","172.20.0.3","TCP","66","46874  >  8080 [ACK] Seq=156 Ack=2897 Win=70144 Len=0 TSval=3911396426 TSecr=3931906980"
"122","3.419892","172.20.0.4","172.20.0.3","TCP","66","46874  >  8080 [ACK] Seq=156 Ack=5793 Win=75904 Len=0 TSval=3911396426 TSecr=3931906980"
"123","3.419895","172.20.0.4","172.20.0.3","TCP","66","46874  >  8080 [ACK] Seq=156 Ack=8689 Win=81664 Len=0 TSval=3911396426 TSecr=3931906980"
"124","3.419898","172.20.0.4","172.20.0.3","TCP","66","46874  >  8080 [ACK] Seq=156 Ack=11585 Win=85504 Len=0 TSval=3911396426 TSecr=3931906980"
"125","3.419901","172.20.0.4","172.20.0.3","TCP","66","46874  >  8080 [ACK] Seq=156 Ack=14481 Win=88320 Len=0 TSval=3911396426 TSecr=3931906980"
"126","3.420158","172.20.0.3","172.20.0.4","TCP","2962","8080  >  46874 [PSH, ACK] Seq=14481 Ack=156 Win=65024 Len=2896 TSval=3931906991 TSecr=3911396426 [TCP PDU reassembled in 151]"
"127","3.420271","172.20.0.3","172.20.0.4","TCP","2962","8080  >  46874 [PSH, ACK] Seq=17377 Ack=156 Win=65024 Len=2896 TSval=3931906991 TSecr=3911396426 [TCP PDU reassembled in 151]"
"128","3.420370","172.20.0.3","172.20.0.4","TCP","2962","8080  >  46874 [PSH, ACK] Seq=20273 Ack=156 Win=65024 Len=2896 TSval=3931906991 TSecr=3911396426 [TCP PDU reassembled in 151]"
"129","3.420387","172.20.0.3","172.20.0.4","TCP","4410","8080  >  46874 [PSH, ACK] Seq=23169 Ack=156 Win=65024 Len=4344 TSval=3931906991 TSecr=3911396426 [TCP PDU reassembled in 151]"
"130","3.420401","172.20.0.3","172.20.0.4","TCP","4410","8080  >  46874 [PSH, ACK] Seq=27513 Ack=156 Win=65024 Len=4344 TSval=3931906991 TSecr=3911396426 [TCP PDU reassembled in 151]"
"131","3.420457","172.20.0.3","172.20.0.4","TCP","4410","8080  >  46874 [PSH, ACK] Seq=31857 Ack=156 Win=65024 Len=4344 TSval=3931906991 TSecr=3911396426 [TCP PDU reassembled in 151]"
"132","3.420473","172.20.0.3","172.20.0.4","TCP","4410","8080  >  46874 [PSH, ACK] Seq=36201 Ack=156 Win=65024 Len=4344 TSval=3931906991 TSecr=3911396426 [TCP PDU reassembled in 151]"
"133","3.420509","172.20.0.3","172.20.0.4","TCP","2962","8080  >  46874 [PSH, ACK] Seq=40545 Ack=156 Win=65024 Len=2896 TSval=3931906991 TSecr=3911396426 [TCP PDU reassembled in 151]"
"134","3.430436","172.20.0.4","172.20.0.3","TCP","66","46874  >  8080 [ACK] Seq=156 Ack=17377 Win=94080 Len=0 TSval=3911396437 TSecr=3931906991"
"135","3.430447","172.20.0.4","172.20.0.3","TCP","66","46874  >  8080 [ACK] Seq=156 Ack=20273 Win=94080 Len=0 TSval=3911396437 TSecr=3931906991"
"136","3.430449","172.20.0.4","172.20.0.3","TCP","66","46874  >  8080 [ACK] Seq=156 Ack=23169 Win=94080 Len=0 TSval=3911396437 TSecr=3931906991"
"137","3.430451","172.20.0.4","172.20.0.3","TCP","66","46874  >  8080 [ACK] Seq=156 Ack=27513 Win=90112 Len=0 TSval=3911396437 TSecr=3931906991"
"138","3.430453","172.20.0.4","172.20.0.3","TCP","66","46874  >  8080 [ACK] Seq=156 Ack=31857 Win=86144 Len=0 TSval=3911396437 TSecr=3931906991"
"139","3.430690","172.20.0.3","172.20.0.4","TCP","2962","8080  >  46874 [PSH, ACK] Seq=43441 Ack=156 Win=65024 Len=2896 TSval=3931907001 TSecr=3911396437 [TCP PDU reassembled in 151]"
"140","3.430777","172.20.0.4","172.20.0.3","TCP","66","46874  >  8080 [ACK] Seq=156 Ack=36201 Win=87936 Len=0 TSval=3911396437 TSecr=3931906991"
"141","3.430780","172.20.0.4","172.20.0.3","TCP","66","46874  >  8080 [ACK] Seq=156 Ack=40545 Win=83968 Len=0 TSval=3911396437 TSecr=3931906991"
"142","3.430782","172.20.0.4","172.20.0.3","TCP","66","46874  >  8080 [ACK] Seq=156 Ack=43441 Win=89088 Len=0 TSval=3911396437 TSecr=3931906991"
"143","3.430787","172.20.0.3","172.20.0.4","TCP","5858","8080  >  46874 [PSH, ACK] Seq=46337 Ack=156 Win=65024 Len=5792 TSval=3931907001 TSecr=3911396437 [TCP PDU reassembled in 151]"
"144","3.430801","172.20.0.3","172.20.0.4","TCP","5858","8080  >  46874 [PSH, ACK] Seq=52129 Ack=156 Win=65024 Len=5792 TSval=3931907001 TSecr=3911396437 [TCP PDU reassembled in 151]"
"145","3.430880","172.20.0.3","172.20.0.4","TCP","7306","8080  >  46874 [PSH, ACK] Seq=57921 Ack=156 Win=65024 Len=7240 TSval=3931907001 TSecr=3911396437 [TCP PDU reassembled in 151]"
"146","3.430887","172.20.0.3","172.20.0.4","TCP","8754","8080  >  46874 [PSH, ACK] Seq=65161 Ack=156 Win=65024 Len=8688 TSval=3931907001 TSecr=3911396437 [TCP PDU reassembled in 151]"
"147","3.430946","172.20.0.3","172.20.0.4","TCP","4410","8080  >  46874 [PSH, ACK] Seq=73849 Ack=156 Win=65024 Len=4344 TSval=3931907001 TSecr=3911396437 [TCP PDU reassembled in 151]"
"148","3.430953","172.20.0.3","172.20.0.4","TCP","10202","8080  >  46874 [PSH, ACK] Seq=78193 Ack=156 Win=65024 Len=10136 TSval=3931907001 TSecr=3911396437 [TCP PDU reassembled in 151]"
"149","3.430960","172.20.0.3","172.20.0.4","TCP","10202","8080  >  46874 [PSH, ACK] Seq=88329 Ack=156 Win=65024 Len=10136 TSval=3931907001 TSecr=3911396437 [TCP PDU reassembled in 151]"
"150","3.431016","172.20.0.3","172.20.0.4","TCP","2962","8080  >  46874 [PSH, ACK] Seq=98465 Ack=156 Win=65024 Len=2896 TSval=3931907002 TSecr=3911396437 [TCP PDU reassembled in 151]"
"151","3.431020","172.20.0.3","172.20.0.4","HTTP","1289","HTTP/1.1 200 OK "
"152","3.440888","172.20.0.4","172.20.0.3","TCP","66","46874  >  8080 [ACK] Seq=156 Ack=46337 Win=97024 Len=0 TSval=3911396447 TSecr=3931907001"
"153","3.440899","172.20.0.4","172.20.0.3","TCP","66","46874  >  8080 [ACK] Seq=156 Ack=52129 Win=91904 Len=0 TSval=3911396447 TSecr=3931907001"
"154","3.440901","172.20.0.4","172.20.0.3","TCP","66","46874  >  8080 [ACK] Seq=156 Ack=57921 Win=86784 Len=0 TSval=3911396447 TSecr=3931907001"
"155","3.441045","172.20.0.4","172.20.0.3","TCP","66","46874  >  8080 [ACK] Seq=156 Ack=65161 Win=111488 Len=0 TSval=3911396447 TSecr=3931907001"
"156","3.441077","172.20.0.4","172.20.0.3","TCP","66","46874  >  8080 [ACK] Seq=156 Ack=73849 Win=126720 Len=0 TSval=3911396447 TSecr=3931907001"
"157","3.441079","172.20.0.4","172.20.0.3","TCP","66","46874  >  8080 [ACK] Seq=156 Ack=78193 Win=122752 Len=0 TSval=3911396448 TSecr=3931907001"
"158","3.441084","172.20.0.4","172.20.0.3","TCP","66","46874  >  8080 [ACK] Seq=156 Ack=88329 Win=114432 Len=0 TSval=3911396448 TSecr=3931907001"
"159","3.441086","172.20.0.4","172.20.0.3","TCP","66","46874  >  8080 [ACK] Seq=156 Ack=98465 Win=105984 Len=0 TSval=3911396448 TSecr=3931907001"
"160","3.441146","172.20.0.4","172.20.0.3","TCP","66","46874  >  8080 [ACK] Seq=156 Ack=101361 Win=103168 Len=0 TSval=3911396448 TSecr=3931907002"
"161","3.442115","172.20.0.4","172.20.0.3","TCP","66","46874  >  8080 [FIN, ACK] Seq=156 Ack=102585 Win=128896 Len=0 TSval=3911396449 TSecr=3931907002"
"162","3.442224","172.20.0.3","172.20.0.4","TCP","66","8080  >  46874 [ACK] Seq=102585 Ack=157 Win=65024 Len=0 TSval=3931907013 TSecr=3911396449"
"163","4.794438","172.20.0.4","172.20.0.2","DNS","59","DNS Stateful operations (DSO) 0x3136[Malformed Packet]"
"164","4.795026","172.20.0.2","172.20.0.4","DNS","70","DNS Stateful operations (DSO) 0x3136[Malformed Packet]"
"165","4.805679","172.20.0.4","172.20.0.3","TCP","74","46876  >  8080 [SYN] Seq=0 Win=64240 Len=0 MSS=1460 SACK_PERM TSval=3911397812 TSecr=0 WS=128"
"166","4.805820","172.20.0.3","172.20.0.4","TCP","74","8080  >  46876 [SYN, ACK] Seq=0 Ack=1 Win=65160 Len=0 MSS=1460 SACK_PERM TSval=3931908376 TSecr=3911397812 WS=128"
"167","4.815986","172.20.0.4","172.20.0.3","TCP","66","46876  >  8080 [ACK] Seq=1 Ack=1 Win=64256 Len=0 TSval=3911397822 TSecr=3931908376"
"168","4.815992","172.20.0.4","172.20.0.3","HTTP","221","GET /arquivo_100kb.bin HTTP/1.1 "
"169","4.816216","172.20.0.3","172.20.0.4","TCP","66","8080  >  46876 [ACK] Seq=1 Ack=156 Win=65024 Len=0 TSval=3931908387 TSecr=3911397823"
"170","4.828328","172.20.0.3","172.20.0.4","TCP","2962","8080  >  46876 [PSH, ACK] Seq=1 Ack=156 Win=65024 Len=2896 TSval=3931908399 TSecr=3911397823 [TCP PDU reassembled in 205]"
"171","4.828465","172.20.0.3","172.20.0.4","TCP","2962","8080  >  46876 [PSH, ACK] Seq=2897 Ack=156 Win=65024 Len=2896 TSval=3931908399 TSecr=3911397823 [TCP PDU reassembled in 205]"
"172","4.828491","172.20.0.3","172.20.0.4","TCP","2962","8080  >  46876 [PSH, ACK] Seq=5793 Ack=156 Win=65024 Len=2896 TSval=3931908399 TSecr=3911397823 [TCP PDU reassembled in 205]"
"173","4.828513","172.20.0.3","172.20.0.4","TCP","2962","8080  >  46876 [PSH, ACK] Seq=8689 Ack=156 Win=65024 Len=2896 TSval=3931908399 TSecr=3911397823 [TCP PDU reassembled in 205]"
"174","4.828530","172.20.0.3","172.20.0.4","TCP","2962","8080  >  46876 [PSH, ACK] Seq=11585 Ack=156 Win=65024 Len=2896 TSval=3931908399 TSecr=3911397823 [TCP PDU reassembled in 205]"
"175","4.839235","172.20.0.4","172.20.0.3","TCP","66","46876  >  8080 [ACK] Seq=156 Ack=2897 Win=70144 Len=0 TSval=3911397845 TSecr=3931908399"
"176","4.839245","172.20.0.4","172.20.0.3","TCP","66","46876  >  8080 [ACK] Seq=156 Ack=5793 Win=75904 Len=0 TSval=3911397845 TSecr=3931908399"
"177","4.839248","172.20.0.4","172.20.0.3","TCP","66","46876  >  8080 [ACK] Seq=156 Ack=8689 Win=81664 Len=0 TSval=3911397845 TSecr=3931908399"
"178","4.839251","172.20.0.4","172.20.0.3","TCP","66","46876  >  8080 [ACK] Seq=156 Ack=11585 Win=87424 Len=0 TSval=3911397845 TSecr=3931908399"
"179","4.839254","172.20.0.4","172.20.0.3","TCP","66","46876  >  8080 [ACK] Seq=156 Ack=14481 Win=84608 Len=0 TSval=3911397845 TSecr=3931908399"
"180","4.839543","172.20.0.3","172.20.0.4","TCP","2962","8080  >  46876 [PSH, ACK] Seq=14481 Ack=156 Win=65024 Len=2896 TSval=3931908410 TSecr=3911397845 [TCP PDU reassembled in 205]"
"181","4.839664","172.20.0.3","172.20.0.4","TCP","2962","8080  >  46876 [PSH, ACK] Seq=17377 Ack=156 Win=65024 Len=2896 TSval=3931908410 TSecr=3911397845 [TCP PDU reassembled in 205]"
"182","4.839764","172.20.0.3","172.20.0.4","TCP","2962","8080  >  46876 [PSH, ACK] Seq=20273 Ack=156 Win=65024 Len=2896 TSval=3931908410 TSecr=3911397845 [TCP PDU reassembled in 205]"
"183","4.839772","172.20.0.3","172.20.0.4","TCP","4410","8080  >  46876 [PSH, ACK] Seq=23169 Ack=156 Win=65024 Len=4344 TSval=3931908410 TSecr=3911397845 [TCP PDU reassembled in 205]"
"184","4.839779","172.20.0.3","172.20.0.4","TCP","4410","8080  >  46876 [PSH, ACK] Seq=27513 Ack=156 Win=65024 Len=4344 TSval=3931908410 TSecr=3911397845 [TCP PDU reassembled in 205]"
"185","4.839828","172.20.0.3","172.20.0.4","TCP","4410","8080  >  46876 [PSH, ACK] Seq=31857 Ack=156 Win=65024 Len=4344 TSval=3931908410 TSecr=3911397845 [TCP PDU reassembled in 205]"
"186","4.839845","172.20.0.3","172.20.0.4","TCP","4410","8080  >  46876 [PSH, ACK] Seq=36201 Ack=156 Win=65024 Len=4344 TSval=3931908410 TSecr=3911397845 [TCP PDU reassembled in 205]"
"187","4.839880","172.20.0.3","172.20.0.4","TCP","2962","8080  >  46876 [PSH, ACK] Seq=40545 Ack=156 Win=65024 Len=2896 TSval=3931908410 TSecr=3911397845 [TCP PDU reassembled in 205]"
"188","4.850438","172.20.0.4","172.20.0.3","TCP","66","46876  >  8080 [ACK] Seq=156 Ack=17377 Win=93312 Len=0 TSval=3911397856 TSecr=3931908410"
"189","4.850450","172.20.0.4","172.20.0.3","TCP","66","46876  >  8080 [ACK] Seq=156 Ack=20273 Win=94080 Len=0 TSval=3911397856 TSecr=3931908410"
"190","4.850453","172.20.0.4","172.20.0.3","TCP","66","46876  >  8080 [ACK] Seq=156 Ack=23169 Win=91264 Len=0 TSval=3911397856 TSecr=3931908410"
"191","4.850455","172.20.0.4","172.20.0.3","TCP","66","46876  >  8080 [ACK] Seq=156 Ack=27513 Win=87040 Len=0 TSval=3911397856 TSecr=3931908410"
"192","4.850458","172.20.0.4","172.20.0.3","TCP","66","46876  >  8080 [ACK] Seq=156 Ack=31857 Win=82816 Len=0 TSval=3911397856 TSecr=3931908410"
"193","4.850461","172.20.0.4","172.20.0.3","TCP","66","46876  >  8080 [ACK] Seq=156 Ack=36201 Win=82176 Len=0 TSval=3911397856 TSecr=3931908410"
"194","4.850464","172.20.0.4","172.20.0.3","TCP","66","46876  >  8080 [ACK] Seq=156 Ack=40545 Win=78208 Len=0 TSval=3911397856 TSecr=3931908410"
"195","4.850467","172.20.0.4","172.20.0.3","TCP","66","46876  >  8080 [ACK] Seq=156 Ack=43441 Win=75392 Len=0 TSval=3911397856 TSecr=3931908410"
"196","4.850804","172.20.0.3","172.20.0.4","TCP","2962","8080  >  46876 [PSH, ACK] Seq=43441 Ack=156 Win=65024 Len=2896 TSval=3931908421 TSecr=3911397856 [TCP PDU reassembled in 205]"
"197","4.850930","172.20.0.3","172.20.0.4","TCP","5858","8080  >  46876 [PSH, ACK] Seq=46337 Ack=156 Win=65024 Len=5792 TSval=3931908421 TSecr=3911397856 [TCP PDU reassembled in 205]"
"198","4.850952","172.20.0.3","172.20.0.4","TCP","5858","8080  >  46876 [PSH, ACK] Seq=52129 Ack=156 Win=65024 Len=5792 TSval=3931908421 TSecr=3911397856 [TCP PDU reassembled in 205]"
"199","4.851051","172.20.0.3","172.20.0.4","TCP","7306","8080  >  46876 [PSH, ACK] Seq=57921 Ack=156 Win=65024 Len=7240 TSval=3931908422 TSecr=3911397856 [TCP PDU reassembled in 205]"
"200","4.851069","172.20.0.3","172.20.0.4","TCP","10202","8080  >  46876 [PSH, ACK] Seq=65161 Ack=156 Win=65024 Len=10136 TSval=3931908422 TSecr=3911397856 [TCP PDU reassembled in 205]"
"201","4.851142","172.20.0.3","172.20.0.4","TCP","2962","8080  >  46876 [PSH, ACK] Seq=75297 Ack=156 Win=65024 Len=2896 TSval=3931908422 TSecr=3911397856 [TCP PDU reassembled in 205]"
"202","4.851160","172.20.0.3","172.20.0.4","TCP","10202","8080  >  46876 [PSH, ACK] Seq=78193 Ack=156 Win=65024 Len=10136 TSval=3931908422 TSecr=3911397856 [TCP PDU reassembled in 205]"
"203","4.851177","172.20.0.3","172.20.0.4","TCP","10202","8080  >  46876 [PSH, ACK] Seq=88329 Ack=156 Win=65024 Len=10136 TSval=3931908422 TSecr=3911397856 [TCP PDU reassembled in 205]"
"204","4.851227","172.20.0.3","172.20.0.4","TCP","2962","8080  >  46876 [PSH, ACK] Seq=98465 Ack=156 Win=65024 Len=2896 TSval=3931908422 TSecr=3911397856 [TCP PDU reassembled in 205]"
"205","4.851242","172.20.0.3","172.20.0.4","HTTP","1289","HTTP/1.1 200 OK "
"206","4.861027","172.20.0.4","172.20.0.3","TCP","66","46876  >  8080 [ACK] Seq=156 Ack=46337 Win=97024 Len=0 TSval=3911397867 TSecr=3931908421"
"207","4.861038","172.20.0.4","172.20.0.3","TCP","66","46876  >  8080 [ACK] Seq=156 Ack=52129 Win=91904 Len=0 TSval=3911397868 TSecr=3931908421"
"208","4.861040","172.20.0.4","172.20.0.3","TCP","66","46876  >  8080 [ACK] Seq=156 Ack=57921 Win=86784 Len=0 TSval=3911397868 TSecr=3931908421"
"209","4.861212","172.20.0.4","172.20.0.3","TCP","66","46876  >  8080 [ACK] Seq=156 Ack=65161 Win=111488 Len=0 TSval=3911397868 TSecr=3931908422"
"210","4.861215","172.20.0.4","172.20.0.3","TCP","66","46876  >  8080 [ACK] Seq=156 Ack=75297 Win=131712 Len=0 TSval=3911397868 TSecr=3931908422"
"211","4.861216","172.20.0.4","172.20.0.3","TCP","66","46876  >  8080 [ACK] Seq=156 Ack=78193 Win=137600 Len=0 TSval=3911397868 TSecr=3931908422"
"212","4.861218","172.20.0.4","172.20.0.3","TCP","66","46876  >  8080 [ACK] Seq=156 Ack=88329 Win=153216 Len=0 TSval=3911397868 TSecr=3931908422"
"213","4.861219","172.20.0.4","172.20.0.3","TCP","66","46876  >  8080 [ACK] Seq=156 Ack=98465 Win=144768 Len=0 TSval=3911397868 TSecr=3931908422"
"214","4.861294","172.20.0.4","172.20.0.3","TCP","66","46876  >  8080 [ACK] Seq=156 Ack=101361 Win=141952 Len=0 TSval=3911397868 TSecr=3931908422"
"215","4.862318","172.20.0.4","172.20.0.3","TCP","66","46876  >  8080 [FIN, ACK] Seq=156 Ack=102585 Win=153216 Len=0 TSval=3911397869 TSecr=3931908422"
"216","4.862463","172.20.0.3","172.20.0.4","TCP","66","8080  >  46876 [ACK] Seq=102585 Ack=157 Win=65024 Len=0 TSval=3931908433 TSecr=3911397869"
"217","6.233810","172.20.0.4","172.20.0.2","DNS","59","Unknown operation (7) 0x3239[Malformed Packet]"
"218","6.234345","172.20.0.2","172.20.0.4","DNS","70","Unknown operation (7) 0x3239[Malformed Packet]"
"219","6.245062","172.20.0.4","172.20.0.3","TCP","74","46886  >  8080 [SYN] Seq=0 Win=64240 Len=0 MSS=1460 SACK_PERM TSval=3911399251 TSecr=0 WS=128"
"220","6.245249","172.20.0.3","172.20.0.4","TCP","74","8080  >  46886 [SYN, ACK] Seq=0 Ack=1 Win=65160 Len=0 MSS=1460 SACK_PERM TSval=3931909816 TSecr=3911399251 WS=128"
"221","6.255505","172.20.0.4","172.20.0.3","TCP","66","46886  >  8080 [ACK] Seq=1 Ack=1 Win=64256 Len=0 TSval=3911399262 TSecr=3931909816"
"222","6.255519","172.20.0.4","172.20.0.3","HTTP","221","GET /arquivo_100kb.bin HTTP/1.1 "
"223","6.255845","172.20.0.3","172.20.0.4","TCP","66","8080  >  46886 [ACK] Seq=1 Ack=156 Win=65024 Len=0 TSval=3931909826 TSecr=3911399262"
"224","6.265139","172.20.0.3","172.20.0.4","TCP","2962","8080  >  46886 [PSH, ACK] Seq=1 Ack=156 Win=65024 Len=2896 TSval=3931909836 TSecr=3911399262 [TCP PDU reassembled in 259]"
"225","6.265282","172.20.0.3","172.20.0.4","TCP","2962","8080  >  46886 [PSH, ACK] Seq=2897 Ack=156 Win=65024 Len=2896 TSval=3931909836 TSecr=3911399262 [TCP PDU reassembled in 259]"
"226","6.265307","172.20.0.3","172.20.0.4","TCP","2962","8080  >  46886 [PSH, ACK] Seq=5793 Ack=156 Win=65024 Len=2896 TSval=3931909836 TSecr=3911399262 [TCP PDU reassembled in 259]"
"227","6.265324","172.20.0.3","172.20.0.4","TCP","2962","8080  >  46886 [PSH, ACK] Seq=8689 Ack=156 Win=65024 Len=2896 TSval=3931909836 TSecr=3911399262 [TCP PDU reassembled in 259]"
"228","6.265339","172.20.0.3","172.20.0.4","TCP","2962","8080  >  46886 [PSH, ACK] Seq=11585 Ack=156 Win=65024 Len=2896 TSval=3931909836 TSecr=3911399262 [TCP PDU reassembled in 259]"
"229","6.275809","172.20.0.4","172.20.0.3","TCP","66","46886  >  8080 [ACK] Seq=156 Ack=2897 Win=70144 Len=0 TSval=3911399282 TSecr=3931909836"
"230","6.275821","172.20.0.4","172.20.0.3","TCP","66","46886  >  8080 [ACK] Seq=156 Ack=5793 Win=75904 Len=0 TSval=3911399282 TSecr=3931909836"
"231","6.275823","172.20.0.4","172.20.0.3","TCP","66","46886  >  8080 [ACK] Seq=156 Ack=8689 Win=81664 Len=0 TSval=3911399282 TSecr=3931909836"
"232","6.275826","172.20.0.4","172.20.0.3","TCP","66","46886  >  8080 [ACK] Seq=156 Ack=11585 Win=85504 Len=0 TSval=3911399282 TSecr=3931909836"
"233","6.275829","172.20.0.4","172.20.0.3","TCP","66","46886  >  8080 [ACK] Seq=156 Ack=14481 Win=88320 Len=0 TSval=3911399282 TSecr=3931909836"
"234","6.276112","172.20.0.3","172.20.0.4","TCP","2962","8080  >  46886 [PSH, ACK] Seq=14481 Ack=156 Win=65024 Len=2896 TSval=3931909847 TSecr=3911399282 [TCP PDU reassembled in 259]"
"235","6.276230","172.20.0.3","172.20.0.4","TCP","2962","8080  >  46886 [PSH, ACK] Seq=17377 Ack=156 Win=65024 Len=2896 TSval=3931909847 TSecr=3911399282 [TCP PDU reassembled in 259]"
"236","6.276320","172.20.0.3","172.20.0.4","TCP","2962","8080  >  46886 [PSH, ACK] Seq=20273 Ack=156 Win=65024 Len=2896 TSval=3931909847 TSecr=3911399282 [TCP PDU reassembled in 259]"
"237","6.276336","172.20.0.3","172.20.0.4","TCP","4410","8080  >  46886 [PSH, ACK] Seq=23169 Ack=156 Win=65024 Len=4344 TSval=3931909847 TSecr=3911399282 [TCP PDU reassembled in 259]"
"238","6.276351","172.20.0.3","172.20.0.4","TCP","4410","8080  >  46886 [PSH, ACK] Seq=27513 Ack=156 Win=65024 Len=4344 TSval=3931909847 TSecr=3911399282 [TCP PDU reassembled in 259]"
"239","6.276405","172.20.0.3","172.20.0.4","TCP","4410","8080  >  46886 [PSH, ACK] Seq=31857 Ack=156 Win=65024 Len=4344 TSval=3931909847 TSecr=3911399282 [TCP PDU reassembled in 259]"
"240","6.276420","172.20.0.3","172.20.0.4","TCP","4410","8080  >  46886 [PSH, ACK] Seq=36201 Ack=156 Win=65024 Len=4344 TSval=3931909847 TSecr=3911399282 [TCP PDU reassembled in 259]"
"241","6.276454","172.20.0.3","172.20.0.4","TCP","2962","8080  >  46886 [PSH, ACK] Seq=40545 Ack=156 Win=65024 Len=2896 TSval=3931909847 TSecr=3911399282 [TCP PDU reassembled in 259]"
"242","6.286354","172.20.0.4","172.20.0.3","TCP","66","46886  >  8080 [ACK] Seq=156 Ack=17377 Win=94080 Len=0 TSval=3911399293 TSecr=3931909847"
"243","6.286367","172.20.0.4","172.20.0.3","TCP","66","46886  >  8080 [ACK] Seq=156 Ack=20273 Win=94080 Len=0 TSval=3911399293 TSecr=3931909847"
"244","6.286377","172.20.0.4","172.20.0.3","TCP","66","46886  >  8080 [ACK] Seq=156 Ack=23169 Win=94080 Len=0 TSval=3911399293 TSecr=3931909847"
"245","6.286380","172.20.0.4","172.20.0.3","TCP","66","46886  >  8080 [ACK] Seq=156 Ack=27513 Win=90112 Len=0 TSval=3911399293 TSecr=3931909847"
"246","6.286382","172.20.0.4","172.20.0.3","TCP","66","46886  >  8080 [ACK] Seq=156 Ack=31857 Win=86144 Len=0 TSval=3911399293 TSecr=3931909847"
"247","6.286671","172.20.0.3","172.20.0.4","TCP","2962","8080  >  46886 [PSH, ACK] Seq=43441 Ack=156 Win=65024 Len=2896 TSval=3931909857 TSecr=3911399293 [TCP PDU reassembled in 259]"
"248","6.286786","172.20.0.4","172.20.0.3","TCP","66","46886  >  8080 [ACK] Seq=156 Ack=36201 Win=87936 Len=0 TSval=3911399293 TSecr=3931909847"
"249","6.286790","172.20.0.4","172.20.0.3","TCP","66","46886  >  8080 [ACK] Seq=156 Ack=40545 Win=83968 Len=0 TSval=3911399293 TSecr=3931909847"
"250","6.286792","172.20.0.4","172.20.0.3","TCP","66","46886  >  8080 [ACK] Seq=156 Ack=43441 Win=89088 Len=0 TSval=3911399293 TSecr=3931909847"
"251","6.286799","172.20.0.3","172.20.0.4","TCP","5858","8080  >  46886 [PSH, ACK] Seq=46337 Ack=156 Win=65024 Len=5792 TSval=3931909857 TSecr=3911399293 [TCP PDU reassembled in 259]"
"252","6.287043","172.20.0.3","172.20.0.4","TCP","5858","8080  >  46886 [PSH, ACK] Seq=52129 Ack=156 Win=65024 Len=5792 TSval=3931909857 TSecr=3911399293 [TCP PDU reassembled in 259]"
"253","6.287224","172.20.0.3","172.20.0.4","TCP","7306","8080  >  46886 [PSH, ACK] Seq=57921 Ack=156 Win=65024 Len=7240 TSval=3931909858 TSecr=3911399293 [TCP PDU reassembled in 259]"
"254","6.287250","172.20.0.3","172.20.0.4","TCP","8754","8080  >  46886 [PSH, ACK] Seq=65161 Ack=156 Win=65024 Len=8688 TSval=3931909858 TSecr=3911399293 [TCP PDU reassembled in 259]"
"255","6.287364","172.20.0.3","172.20.0.4","TCP","4410","8080  >  46886 [PSH, ACK] Seq=73849 Ack=156 Win=65024 Len=4344 TSval=3931909858 TSecr=3911399293 [TCP PDU reassembled in 259]"
"256","6.287382","172.20.0.3","172.20.0.4","TCP","10202","8080  >  46886 [PSH, ACK] Seq=78193 Ack=156 Win=65024 Len=10136 TSval=3931909858 TSecr=3911399293 [TCP PDU reassembled in 259]"
"257","6.287399","172.20.0.3","172.20.0.4","TCP","10202","8080  >  46886 [PSH, ACK] Seq=88329 Ack=156 Win=65024 Len=10136 TSval=3931909858 TSecr=3911399293 [TCP PDU reassembled in 259]"
"258","6.287468","172.20.0.3","172.20.0.4","TCP","2962","8080  >  46886 [PSH, ACK] Seq=98465 Ack=156 Win=65024 Len=2896 TSval=3931909858 TSecr=3911399293 [TCP PDU reassembled in 259]"
"259","6.287484","172.20.0.3","172.20.0.4","HTTP","1289","HTTP/1.1 200 OK "
"260","6.296921","172.20.0.4","172.20.0.3","TCP","66","46886  >  8080 [ACK] Seq=156 Ack=46337 Win=97024 Len=0 TSval=3911399303 TSecr=3931909857"
"261","6.297078","172.20.0.4","172.20.0.3","TCP","66","46886  >  8080 [ACK] Seq=156 Ack=52129 Win=108544 Len=0 TSval=3911399304 TSecr=3931909857"
"262","6.297081","172.20.0.4","172.20.0.3","TCP","66","46886  >  8080 [ACK] Seq=156 Ack=57921 Win=120192 Len=0 TSval=3911399304 TSecr=3931909857"
"263","6.297312","172.20.0.4","172.20.0.3","TCP","66","46886  >  8080 [ACK] Seq=156 Ack=65161 Win=134656 Len=0 TSval=3911399304 TSecr=3931909858"
"264","6.297315","172.20.0.4","172.20.0.3","TCP","66","46886  >  8080 [ACK] Seq=156 Ack=73849 Win=152064 Len=0 TSval=3911399304 TSecr=3931909858"
"265","6.297442","172.20.0.4","172.20.0.3","TCP","66","46886  >  8080 [ACK] Seq=156 Ack=78193 Win=160768 Len=0 TSval=3911399304 TSecr=3931909858"
"266","6.297446","172.20.0.4","172.20.0.3","TCP","66","46886  >  8080 [ACK] Seq=156 Ack=88329 Win=153216 Len=0 TSval=3911399304 TSecr=3931909858"
"267","6.297449","172.20.0.4","172.20.0.3","TCP","66","46886  >  8080 [ACK] Seq=156 Ack=98465 Win=144768 Len=0 TSval=3911399304 TSecr=3931909858"
"268","6.297542","172.20.0.4","172.20.0.3","TCP","66","46886  >  8080 [ACK] Seq=156 Ack=101361 Win=152064 Len=0 TSval=3911399304 TSecr=3931909858"
"269","6.298338","172.20.0.4","172.20.0.3","TCP","66","46886  >  8080 [FIN, ACK] Seq=156 Ack=102585 Win=160768 Len=0 TSval=3911399305 TSecr=3931909858"
"270","6.298464","172.20.0.3","172.20.0.4","TCP","66","8080  >  46886 [ACK] Seq=102585 Ack=157 Win=65024 Len=0 TSval=3931909869 TSecr=3911399305"
"271","7.836957","172.20.0.4","172.20.0.2","DNS","59","DNS Stateful operations (DSO) 0x3837[Malformed Packet]"
"272","7.837498","172.20.0.2","172.20.0.4","DNS","70","DNS Stateful operations (DSO) 0x3837[Malformed Packet]"
"273","7.848207","172.20.0.4","172.20.0.3","TCP","74","46894  >  8080 [SYN] Seq=0 Win=64240 Len=0 MSS=1460 SACK_PERM TSval=3911400855 TSecr=0 WS=128"
"274","7.848460","172.20.0.3","172.20.0.4","TCP","74","8080  >  46894 [SYN, ACK] Seq=0 Ack=1 Win=65160 Len=0 MSS=1460 SACK_PERM TSval=3931911419 TSecr=3911400855 WS=128"
"275","7.858825","172.20.0.4","172.20.0.3","TCP","66","46894  >  8080 [ACK] Seq=1 Ack=1 Win=64256 Len=0 TSval=3911400865 TSecr=3931911419"
"276","7.858838","172.20.0.4","172.20.0.3","HTTP","221","GET /arquivo_100kb.bin HTTP/1.1 "
"277","7.859084","172.20.0.3","172.20.0.4","TCP","66","8080  >  46894 [ACK] Seq=1 Ack=156 Win=65024 Len=0 TSval=3931911430 TSecr=3911400865"
"278","7.881060","172.20.0.3","172.20.0.4","TCP","2962","8080  >  46894 [PSH, ACK] Seq=1 Ack=156 Win=65024 Len=2896 TSval=3931911452 TSecr=3911400865 [TCP PDU reassembled in 313]"
"279","7.881228","172.20.0.3","172.20.0.4","TCP","2962","8080  >  46894 [PSH, ACK] Seq=2897 Ack=156 Win=65024 Len=2896 TSval=3931911452 TSecr=3911400865 [TCP PDU reassembled in 313]"
"280","7.881254","172.20.0.3","172.20.0.4","TCP","2962","8080  >  46894 [PSH, ACK] Seq=5793 Ack=156 Win=65024 Len=2896 TSval=3931911452 TSecr=3911400865 [TCP PDU reassembled in 313]"
"281","7.881274","172.20.0.3","172.20.0.4","TCP","2962","8080  >  46894 [PSH, ACK] Seq=8689 Ack=156 Win=65024 Len=2896 TSval=3931911452 TSecr=3911400865 [TCP PDU reassembled in 313]"
"282","7.881295","172.20.0.3","172.20.0.4","TCP","2962","8080  >  46894 [PSH, ACK] Seq=11585 Ack=156 Win=65024 Len=2896 TSval=3931911452 TSecr=3911400865 [TCP PDU reassembled in 313]"
"283","7.891272","172.20.0.4","172.20.0.3","TCP","66","46894  >  8080 [ACK] Seq=156 Ack=2897 Win=70144 Len=0 TSval=3911400898 TSecr=3931911452"
"284","7.891291","172.20.0.4","172.20.0.3","TCP","66","46894  >  8080 [ACK] Seq=156 Ack=5793 Win=75904 Len=0 TSval=3911400898 TSecr=3931911452"
"285","7.891294","172.20.0.4","172.20.0.3","TCP","66","46894  >  8080 [ACK] Seq=156 Ack=8689 Win=81664 Len=0 TSval=3911400898 TSecr=3931911452"
"286","7.891296","172.20.0.4","172.20.0.3","TCP","66","46894  >  8080 [ACK] Seq=156 Ack=11585 Win=87424 Len=0 TSval=3911400898 TSecr=3931911452"
"287","7.891570","172.20.0.3","172.20.0.4","TCP","2962","8080  >  46894 [PSH, ACK] Seq=14481 Ack=156 Win=65024 Len=2896 TSval=3931911462 TSecr=3911400898 [TCP PDU reassembled in 313]"
"288","7.891701","172.20.0.4","172.20.0.3","TCP","66","46894  >  8080 [ACK] Seq=156 Ack=14481 Win=88320 Len=0 TSval=3911400898 TSecr=3931911452"
"289","7.891708","172.20.0.3","172.20.0.4","TCP","2962","8080  >  46894 [PSH, ACK] Seq=17377 Ack=156 Win=65024 Len=2896 TSval=3931911462 TSecr=3911400898 [TCP PDU reassembled in 313]"
"290","7.891822","172.20.0.3","172.20.0.4","TCP","2962","8080  >  46894 [PSH, ACK] Seq=20273 Ack=156 Win=65024 Len=2896 TSval=3931911462 TSecr=3911400898 [TCP PDU reassembled in 313]"
"291","7.891841","172.20.0.3","172.20.0.4","TCP","4410","8080  >  46894 [PSH, ACK] Seq=23169 Ack=156 Win=65024 Len=4344 TSval=3931911462 TSecr=3911400898 [TCP PDU reassembled in 313]"
"292","7.891855","172.20.0.3","172.20.0.4","TCP","4410","8080  >  46894 [PSH, ACK] Seq=27513 Ack=156 Win=65024 Len=4344 TSval=3931911462 TSecr=3911400898 [TCP PDU reassembled in 313]"
"293","7.891918","172.20.0.3","172.20.0.4","TCP","4410","8080  >  46894 [PSH, ACK] Seq=31857 Ack=156 Win=65024 Len=4344 TSval=3931911462 TSecr=3911400898 [TCP PDU reassembled in 313]"
"294","7.891943","172.20.0.3","172.20.0.4","TCP","4410","8080  >  46894 [PSH, ACK] Seq=36201 Ack=156 Win=65024 Len=4344 TSval=3931911462 TSecr=3911400898 [TCP PDU reassembled in 313]"
"295","7.891983","172.20.0.3","172.20.0.4","TCP","2962","8080  >  46894 [PSH, ACK] Seq=40545 Ack=156 Win=65024 Len=2896 TSval=3931911463 TSecr=3911400898 [TCP PDU reassembled in 313]"
"296","7.901907","172.20.0.4","172.20.0.3","TCP","66","46894  >  8080 [ACK] Seq=156 Ack=17377 Win=94080 Len=0 TSval=3911400908 TSecr=3931911462"
"297","7.901922","172.20.0.4","172.20.0.3","TCP","66","46894  >  8080 [ACK] Seq=156 Ack=20273 Win=94080 Len=0 TSval=3911400908 TSecr=3931911462"
"298","7.901924","172.20.0.4","172.20.0.3","TCP","66","46894  >  8080 [ACK] Seq=156 Ack=23169 Win=94080 Len=0 TSval=3911400908 TSecr=3931911462"
"299","7.901927","172.20.0.4","172.20.0.3","TCP","66","46894  >  8080 [ACK] Seq=156 Ack=27513 Win=90112 Len=0 TSval=3911400908 TSecr=3931911462"
"300","7.901934","172.20.0.4","172.20.0.3","TCP","66","46894  >  8080 [ACK] Seq=156 Ack=31857 Win=86144 Len=0 TSval=3911400908 TSecr=3931911462"
"301","7.902232","172.20.0.3","172.20.0.4","TCP","2962","8080  >  46894 [PSH, ACK] Seq=43441 Ack=156 Win=65024 Len=2896 TSval=3931911473 TSecr=3911400908 [TCP PDU reassembled in 313]"
"302","7.902400","172.20.0.4","172.20.0.3","TCP","66","46894  >  8080 [ACK] Seq=156 Ack=36201 Win=87936 Len=0 TSval=3911400909 TSecr=3931911462"
"303","7.902404","172.20.0.4","172.20.0.3","TCP","66","46894  >  8080 [ACK] Seq=156 Ack=40545 Win=87936 Len=0 TSval=3911400909 TSecr=3931911462"
"304","7.902406","172.20.0.4","172.20.0.3","TCP","66","46894  >  8080 [ACK] Seq=156 Ack=43441 Win=93056 Len=0 TSval=3911400909 TSecr=3931911463"
"305","7.902416","172.20.0.3","172.20.0.4","TCP","5858","8080  >  46894 [PSH, ACK] Seq=46337 Ack=156 Win=65024 Len=5792 TSval=3931911473 TSecr=3911400908 [TCP PDU reassembled in 313]"
"306","7.902438","172.20.0.3","172.20.0.4","TCP","5858","8080  >  46894 [PSH, ACK] Seq=52129 Ack=156 Win=65024 Len=5792 TSval=3931911473 TSecr=3911400908 [TCP PDU reassembled in 313]"
"307","7.902558","172.20.0.3","172.20.0.4","TCP","7306","8080  >  46894 [PSH, ACK] Seq=57921 Ack=156 Win=65024 Len=7240 TSval=3931911473 TSecr=3911400909 [TCP PDU reassembled in 313]"
"308","7.902581","172.20.0.3","172.20.0.4","TCP","8754","8080  >  46894 [PSH, ACK] Seq=65161 Ack=156 Win=65024 Len=8688 TSval=3931911473 TSecr=3911400909 [TCP PDU reassembled in 313]"
"309","7.902652","172.20.0.3","172.20.0.4","TCP","4410","8080  >  46894 [PSH, ACK] Seq=73849 Ack=156 Win=65024 Len=4344 TSval=3931911473 TSecr=3911400909 [TCP PDU reassembled in 313]"
"310","7.902672","172.20.0.3","172.20.0.4","TCP","10202","8080  >  46894 [PSH, ACK] Seq=78193 Ack=156 Win=65024 Len=10136 TSval=3931911473 TSecr=3911400909 [TCP PDU reassembled in 313]"
"311","7.902691","172.20.0.3","172.20.0.4","TCP","10202","8080  >  46894 [PSH, ACK] Seq=88329 Ack=156 Win=65024 Len=10136 TSval=3931911473 TSecr=3911400909 [TCP PDU reassembled in 313]"
"312","7.902734","172.20.0.3","172.20.0.4","TCP","2962","8080  >  46894 [PSH, ACK] Seq=98465 Ack=156 Win=65024 Len=2896 TSval=3931911473 TSecr=3911400909 [TCP PDU reassembled in 313]"
"313","7.902749","172.20.0.3","172.20.0.4","HTTP","1289","HTTP/1.1 200 OK "
"314","7.912527","172.20.0.4","172.20.0.3","TCP","66","46894  >  8080 [ACK] Seq=156 Ack=46337 Win=97024 Len=0 TSval=3911400919 TSecr=3931911473"
"315","7.912544","172.20.0.4","172.20.0.3","TCP","66","46894  >  8080 [ACK] Seq=156 Ack=52129 Win=91904 Len=0 TSval=3911400919 TSecr=3931911473"
"316","7.912549","172.20.0.4","172.20.0.3","TCP","66","46894  >  8080 [ACK] Seq=156 Ack=57921 Win=86784 Len=0 TSval=3911400919 TSecr=3931911473"
"317","7.912764","172.20.0.4","172.20.0.3","TCP","66","46894  >  8080 [ACK] Seq=156 Ack=65161 Win=111488 Len=0 TSval=3911400919 TSecr=3931911473"
"318","7.912767","172.20.0.4","172.20.0.3","TCP","66","46894  >  8080 [ACK] Seq=156 Ack=73849 Win=128896 Len=0 TSval=3911400919 TSecr=3931911473"
"319","7.912769","172.20.0.4","172.20.0.3","TCP","66","46894  >  8080 [ACK] Seq=156 Ack=78193 Win=137600 Len=0 TSval=3911400919 TSecr=3931911473"
"320","7.912771","172.20.0.4","172.20.0.3","TCP","66","46894  >  8080 [ACK] Seq=156 Ack=88329 Win=153216 Len=0 TSval=3911400919 TSecr=3931911473"
"321","7.912773","172.20.0.4","172.20.0.3","TCP","66","46894  >  8080 [ACK] Seq=156 Ack=98465 Win=144768 Len=0 TSval=3911400919 TSecr=3931911473"
"322","7.912775","172.20.0.4","172.20.0.3","TCP","66","46894  >  8080 [ACK] Seq=156 Ack=101361 Win=141952 Len=0 TSval=3911400919 TSecr=3931911473"
"323","7.913809","172.20.0.4","172.20.0.3","TCP","66","46894  >  8080 [FIN, ACK] Seq=156 Ack=102585 Win=153216 Len=0 TSval=3911400920 TSecr=3931911473"
"324","7.913983","172.20.0.3","172.20.0.4","TCP","66","8080  >  46894 [ACK] Seq=102585 Ack=157 Win=65024 Len=0 TSval=3931911484 TSecr=3911400920"
"325","9.550628","172.20.0.4","172.20.0.2","DNS","59","Unknown operation (7) 0x3530[Malformed Packet]"
"326","9.551264","172.20.0.2","172.20.0.4","DNS","70","Unknown operation (7) 0x3530[Malformed Packet]"
"327","9.561976","172.20.0.4","172.20.0.3","TCP","74","46904  >  8080 [SYN] Seq=0 Win=64240 Len=0 MSS=1460 SACK_PERM TSval=3911402568 TSecr=0 WS=128"
"328","9.562222","172.20.0.3","172.20.0.4","TCP","74","8080  >  46904 [SYN, ACK] Seq=0 Ack=1 Win=65160 Len=0 MSS=1460 SACK_PERM TSval=3931913133 TSecr=3911402568 WS=128"
"329","9.572503","172.20.0.4","172.20.0.3","TCP","66","46904  >  8080 [ACK] Seq=1 Ack=1 Win=64256 Len=0 TSval=3911402579 TSecr=3931913133"
"330","9.572517","172.20.0.4","172.20.0.3","HTTP","221","GET /arquivo_100kb.bin HTTP/1.1 "
"331","9.572764","172.20.0.3","172.20.0.4","TCP","66","8080  >  46904 [ACK] Seq=1 Ack=156 Win=65024 Len=0 TSval=3931913143 TSecr=3911402579"
"332","9.585943","172.20.0.3","172.20.0.4","TCP","2962","8080  >  46904 [PSH, ACK] Seq=1 Ack=156 Win=65024 Len=2896 TSval=3931913156 TSecr=3911402579 [TCP PDU reassembled in 367]"
"333","9.586157","172.20.0.3","172.20.0.4","TCP","2962","8080  >  46904 [PSH, ACK] Seq=2897 Ack=156 Win=65024 Len=2896 TSval=3931913157 TSecr=3911402579 [TCP PDU reassembled in 367]"
"334","9.586191","172.20.0.3","172.20.0.4","TCP","2962","8080  >  46904 [PSH, ACK] Seq=5793 Ack=156 Win=65024 Len=2896 TSval=3931913157 TSecr=3911402579 [TCP PDU reassembled in 367]"
"335","9.586219","172.20.0.3","172.20.0.4","TCP","2962","8080  >  46904 [PSH, ACK] Seq=8689 Ack=156 Win=65024 Len=2896 TSval=3931913157 TSecr=3911402579 [TCP PDU reassembled in 367]"
"336","9.586241","172.20.0.3","172.20.0.4","TCP","2962","8080  >  46904 [PSH, ACK] Seq=11585 Ack=156 Win=65024 Len=2896 TSval=3931913157 TSecr=3911402579 [TCP PDU reassembled in 367]"
"337","9.596273","172.20.0.4","172.20.0.3","TCP","66","46904  >  8080 [ACK] Seq=156 Ack=2897 Win=70144 Len=0 TSval=3911402603 TSecr=3931913156"
"338","9.596288","172.20.0.4","172.20.0.3","TCP","66","46904  >  8080 [ACK] Seq=156 Ack=5793 Win=75904 Len=0 TSval=3911402603 TSecr=3931913157"
"339","9.596291","172.20.0.4","172.20.0.3","TCP","66","46904  >  8080 [ACK] Seq=156 Ack=8689 Win=81664 Len=0 TSval=3911402603 TSecr=3931913157"
"340","9.596298","172.20.0.4","172.20.0.3","TCP","66","46904  >  8080 [ACK] Seq=156 Ack=11585 Win=87424 Len=0 TSval=3911402603 TSecr=3931913157"
"341","9.596302","172.20.0.4","172.20.0.3","TCP","66","46904  >  8080 [ACK] Seq=156 Ack=14481 Win=91264 Len=0 TSval=3911402603 TSecr=3931913157"
"342","9.596748","172.20.0.3","172.20.0.4","TCP","2962","8080  >  46904 [PSH, ACK] Seq=14481 Ack=156 Win=65024 Len=2896 TSval=3931913167 TSecr=3911402603 [TCP PDU reassembled in 367]"
"343","9.596904","172.20.0.3","172.20.0.4","TCP","2962","8080  >  46904 [PSH, ACK] Seq=17377 Ack=156 Win=65024 Len=2896 TSval=3931913167 TSecr=3911402603 [TCP PDU reassembled in 367]"
"344","9.597029","172.20.0.3","172.20.0.4","TCP","2962","8080  >  46904 [PSH, ACK] Seq=20273 Ack=156 Win=65024 Len=2896 TSval=3931913168 TSecr=3911402603 [TCP PDU reassembled in 367]"
"345","9.597055","172.20.0.3","172.20.0.4","TCP","4410","8080  >  46904 [PSH, ACK] Seq=23169 Ack=156 Win=65024 Len=4344 TSval=3931913168 TSecr=3911402603 [TCP PDU reassembled in 367]"
"346","9.597075","172.20.0.3","172.20.0.4","TCP","4410","8080  >  46904 [PSH, ACK] Seq=27513 Ack=156 Win=65024 Len=4344 TSval=3931913168 TSecr=3911402603 [TCP PDU reassembled in 367]"
"347","9.597147","172.20.0.3","172.20.0.4","TCP","4410","8080  >  46904 [PSH, ACK] Seq=31857 Ack=156 Win=65024 Len=4344 TSval=3931913168 TSecr=3911402603 [TCP PDU reassembled in 367]"
"348","9.597157","172.20.0.3","172.20.0.4","TCP","4410","8080  >  46904 [PSH, ACK] Seq=36201 Ack=156 Win=65024 Len=4344 TSval=3931913168 TSecr=3911402603 [TCP PDU reassembled in 367]"
"349","9.597197","172.20.0.3","172.20.0.4","TCP","2962","8080  >  46904 [PSH, ACK] Seq=40545 Ack=156 Win=65024 Len=2896 TSval=3931913168 TSecr=3911402603 [TCP PDU reassembled in 367]"
"350","9.607042","172.20.0.4","172.20.0.3","TCP","66","46904  >  8080 [ACK] Seq=156 Ack=17377 Win=97024 Len=0 TSval=3911402613 TSecr=3931913167"
"351","9.607066","172.20.0.4","172.20.0.3","TCP","66","46904  >  8080 [ACK] Seq=156 Ack=20273 Win=94208 Len=0 TSval=3911402613 TSecr=3931913167"
"352","9.607082","172.20.0.4","172.20.0.3","TCP","66","46904  >  8080 [ACK] Seq=156 Ack=23169 Win=94080 Len=0 TSval=3911402614 TSecr=3931913168"
"353","9.607090","172.20.0.4","172.20.0.3","TCP","66","46904  >  8080 [ACK] Seq=156 Ack=27513 Win=90112 Len=0 TSval=3911402614 TSecr=3931913168"
"354","9.607346","172.20.0.3","172.20.0.4","TCP","2962","8080  >  46904 [PSH, ACK] Seq=43441 Ack=156 Win=65024 Len=2896 TSval=3931913178 TSecr=3911402613 [TCP PDU reassembled in 367]"
"355","9.607464","172.20.0.4","172.20.0.3","TCP","66","46904  >  8080 [ACK] Seq=156 Ack=31857 Win=85888 Len=0 TSval=3911402614 TSecr=3931913168"
"356","9.607467","172.20.0.4","172.20.0.3","TCP","66","46904  >  8080 [ACK] Seq=156 Ack=36201 Win=83968 Len=0 TSval=3911402614 TSecr=3931913168"
"357","9.607469","172.20.0.4","172.20.0.3","TCP","66","46904  >  8080 [ACK] Seq=156 Ack=40545 Win=79744 Len=0 TSval=3911402614 TSecr=3931913168"
"358","9.607470","172.20.0.4","172.20.0.3","TCP","66","46904  >  8080 [ACK] Seq=156 Ack=43441 Win=89088 Len=0 TSval=3911402614 TSecr=3931913168"
"359","9.607477","172.20.0.3","172.20.0.4","TCP","5858","8080  >  46904 [PSH, ACK] Seq=46337 Ack=156 Win=65024 Len=5792 TSval=3931913178 TSecr=3911402613 [TCP PDU reassembled in 367]"
"360","9.607494","172.20.0.3","172.20.0.4","TCP","5858","8080  >  46904 [PSH, ACK] Seq=52129 Ack=156 Win=65024 Len=5792 TSval=3931913178 TSecr=3911402614 [TCP PDU reassembled in 367]"
"361","9.607602","172.20.0.3","172.20.0.4","TCP","7306","8080  >  46904 [PSH, ACK] Seq=57921 Ack=156 Win=65024 Len=7240 TSval=3931913178 TSecr=3911402614 [TCP PDU reassembled in 367]"
"362","9.607614","172.20.0.3","172.20.0.4","TCP","7306","8080  >  46904 [PSH, ACK] Seq=65161 Ack=156 Win=65024 Len=7240 TSval=3931913178 TSecr=3911402614 [TCP PDU reassembled in 367]"
"363","9.607660","172.20.0.3","172.20.0.4","TCP","5858","8080  >  46904 [PSH, ACK] Seq=72401 Ack=156 Win=65024 Len=5792 TSval=3931913178 TSecr=3911402614 [TCP PDU reassembled in 367]"
"364","9.607673","172.20.0.3","172.20.0.4","TCP","10202","8080  >  46904 [PSH, ACK] Seq=78193 Ack=156 Win=65024 Len=10136 TSval=3931913178 TSecr=3911402614 [TCP PDU reassembled in 367]"
"365","9.607686","172.20.0.3","172.20.0.4","TCP","10202","8080  >  46904 [PSH, ACK] Seq=88329 Ack=156 Win=65024 Len=10136 TSval=3931913178 TSecr=3911402614 [TCP PDU reassembled in 367]"
"366","9.607717","172.20.0.3","172.20.0.4","TCP","2962","8080  >  46904 [PSH, ACK] Seq=98465 Ack=156 Win=65024 Len=2896 TSval=3931913178 TSecr=3911402614 [TCP PDU reassembled in 367]"
"367","9.607726","172.20.0.3","172.20.0.4","HTTP","1289","HTTP/1.1 200 OK "
"368","9.617651","172.20.0.4","172.20.0.3","TCP","66","46904  >  8080 [ACK] Seq=156 Ack=46337 Win=97024 Len=0 TSval=3911402624 TSecr=3931913178"
"369","9.617663","172.20.0.4","172.20.0.3","TCP","66","46904  >  8080 [ACK] Seq=156 Ack=52129 Win=91904 Len=0 TSval=3911402624 TSecr=3931913178"
"370","9.617664","172.20.0.4","172.20.0.3","TCP","66","46904  >  8080 [ACK] Seq=156 Ack=57921 Win=86784 Len=0 TSval=3911402624 TSecr=3931913178"
"371","9.617704","172.20.0.4","172.20.0.3","TCP","66","46904  >  8080 [ACK] Seq=156 Ack=65161 Win=111488 Len=0 TSval=3911402624 TSecr=3931913178"
"372","9.617707","172.20.0.4","172.20.0.3","TCP","66","46904  >  8080 [ACK] Seq=156 Ack=72401 Win=125952 Len=0 TSval=3911402624 TSecr=3931913178"
"373","9.617716","172.20.0.4","172.20.0.3","TCP","66","46904  >  8080 [ACK] Seq=156 Ack=78193 Win=137600 Len=0 TSval=3911402624 TSecr=3931913178"
"374","9.617718","172.20.0.4","172.20.0.3","TCP","66","46904  >  8080 [ACK] Seq=156 Ack=88329 Win=153216 Len=0 TSval=3911402624 TSecr=3931913178"
"375","9.617720","172.20.0.4","172.20.0.3","TCP","66","46904  >  8080 [ACK] Seq=156 Ack=98465 Win=144768 Len=0 TSval=3911402624 TSecr=3931913178"
"376","9.618031","172.20.0.4","172.20.0.3","TCP","66","46904  >  8080 [ACK] Seq=156 Ack=101361 Win=141952 Len=0 TSval=3911402624 TSecr=3931913178"
"377","9.618588","172.20.0.4","172.20.0.3","TCP","66","46904  >  8080 [FIN, ACK] Seq=156 Ack=102585 Win=153216 Len=0 TSval=3911402625 TSecr=3931913178"
"378","9.618816","172.20.0.3","172.20.0.4","TCP","66","8080  >  46904 [ACK] Seq=102585 Ack=157 Win=65024 Len=0 TSval=3931913189 TSecr=3911402625"
"379","11.129976","172.20.0.4","172.20.0.2","DNS","59","DNS Stateful operations (DSO) 0x3339[Malformed Packet]"
"380","11.130908","172.20.0.2","172.20.0.4","DNS","70","DNS Stateful operations (DSO) 0x3339[Malformed Packet]"
"381","11.142098","172.20.0.4","172.20.0.3","TCP","74","46906  >  8080 [SYN] Seq=0 Win=64240 Len=0 MSS=1460 SACK_PERM TSval=3911404148 TSecr=0 WS=128"
"382","11.142321","172.20.0.3","172.20.0.4","TCP","74","8080  >  46906 [SYN, ACK] Seq=0 Ack=1 Win=65160 Len=0 MSS=1460 SACK_PERM TSval=3931914713 TSecr=3911404148 WS=128"
"383","11.152625","172.20.0.4","172.20.0.3","TCP","66","46906  >  8080 [ACK] Seq=1 Ack=1 Win=64256 Len=0 TSval=3911404159 TSecr=3931914713"
"384","11.152647","172.20.0.4","172.20.0.3","HTTP","221","GET /arquivo_100kb.bin HTTP/1.1 "
"385","11.153280","172.20.0.3","172.20.0.4","TCP","66","8080  >  46906 [ACK] Seq=1 Ack=156 Win=65024 Len=0 TSval=3931914724 TSecr=3911404159"
"386","11.174985","172.20.0.3","172.20.0.4","TCP","2962","8080  >  46906 [PSH, ACK] Seq=1 Ack=156 Win=65024 Len=2896 TSval=3931914745 TSecr=3911404159 [TCP PDU reassembled in 421]"
"387","11.175233","172.20.0.3","172.20.0.4","TCP","2962","8080  >  46906 [PSH, ACK] Seq=2897 Ack=156 Win=65024 Len=2896 TSval=3931914746 TSecr=3911404159 [TCP PDU reassembled in 421]"
"388","11.175269","172.20.0.3","172.20.0.4","TCP","2962","8080  >  46906 [PSH, ACK] Seq=5793 Ack=156 Win=65024 Len=2896 TSval=3931914746 TSecr=3911404159 [TCP PDU reassembled in 421]"
"389","11.175301","172.20.0.3","172.20.0.4","TCP","2962","8080  >  46906 [PSH, ACK] Seq=8689 Ack=156 Win=65024 Len=2896 TSval=3931914746 TSecr=3911404159 [TCP PDU reassembled in 421]"
"390","11.175330","172.20.0.3","172.20.0.4","TCP","2962","8080  >  46906 [PSH, ACK] Seq=11585 Ack=156 Win=65024 Len=2896 TSval=3931914746 TSecr=3911404159 [TCP PDU reassembled in 421]"
"391","11.185343","172.20.0.4","172.20.0.3","TCP","66","46906  >  8080 [ACK] Seq=156 Ack=2897 Win=70144 Len=0 TSval=3911404192 TSecr=3931914745"
"392","11.185357","172.20.0.4","172.20.0.3","TCP","66","46906  >  8080 [ACK] Seq=156 Ack=5793 Win=75904 Len=0 TSval=3911404192 TSecr=3931914746"
"393","11.185358","172.20.0.4","172.20.0.3","TCP","66","46906  >  8080 [ACK] Seq=156 Ack=8689 Win=81664 Len=0 TSval=3911404192 TSecr=3931914746"
"394","11.185361","172.20.0.4","172.20.0.3","TCP","66","46906  >  8080 [ACK] Seq=156 Ack=11585 Win=87424 Len=0 TSval=3911404192 TSecr=3931914746"
"395","11.185363","172.20.0.4","172.20.0.3","TCP","66","46906  >  8080 [ACK] Seq=156 Ack=14481 Win=91264 Len=0 TSval=3911404192 TSecr=3931914746"
"396","11.185614","172.20.0.3","172.20.0.4","TCP","2962","8080  >  46906 [PSH, ACK] Seq=14481 Ack=156 Win=65024 Len=2896 TSval=3931914756 TSecr=3911404192 [TCP PDU reassembled in 421]"
"397","11.185749","172.20.0.3","172.20.0.4","TCP","2962","8080  >  46906 [PSH, ACK] Seq=17377 Ack=156 Win=65024 Len=2896 TSval=3931914756 TSecr=3911404192 [TCP PDU reassembled in 421]"
"398","11.185833","172.20.0.3","172.20.0.4","TCP","2962","8080  >  46906 [PSH, ACK] Seq=20273 Ack=156 Win=65024 Len=2896 TSval=3931914756 TSecr=3911404192 [TCP PDU reassembled in 421]"
"399","11.185879","172.20.0.3","172.20.0.4","TCP","4410","8080  >  46906 [PSH, ACK] Seq=23169 Ack=156 Win=65024 Len=4344 TSval=3931914756 TSecr=3911404192 [TCP PDU reassembled in 421]"
"400","11.185899","172.20.0.3","172.20.0.4","TCP","4410","8080  >  46906 [PSH, ACK] Seq=27513 Ack=156 Win=65024 Len=4344 TSval=3931914756 TSecr=3911404192 [TCP PDU reassembled in 421]"
"401","11.185954","172.20.0.3","172.20.0.4","TCP","4410","8080  >  46906 [PSH, ACK] Seq=31857 Ack=156 Win=65024 Len=4344 TSval=3931914756 TSecr=3911404192 [TCP PDU reassembled in 421]"
"402","11.185969","172.20.0.3","172.20.0.4","TCP","4410","8080  >  46906 [PSH, ACK] Seq=36201 Ack=156 Win=65024 Len=4344 TSval=3931914756 TSecr=3911404192 [TCP PDU reassembled in 421]"
"403","11.185994","172.20.0.3","172.20.0.4","TCP","2962","8080  >  46906 [PSH, ACK] Seq=40545 Ack=156 Win=65024 Len=2896 TSval=3931914757 TSecr=3911404192 [TCP PDU reassembled in 421]"
"404","11.195928","172.20.0.4","172.20.0.3","TCP","66","46906  >  8080 [ACK] Seq=156 Ack=17377 Win=97024 Len=0 TSval=3911404202 TSecr=3931914756"
"405","11.195943","172.20.0.4","172.20.0.3","TCP","66","46906  >  8080 [ACK] Seq=156 Ack=20273 Win=94208 Len=0 TSval=3911404202 TSecr=3931914756"
"406","11.195946","172.20.0.4","172.20.0.3","TCP","66","46906  >  8080 [ACK] Seq=156 Ack=23169 Win=94080 Len=0 TSval=3911404202 TSecr=3931914756"
"407","11.195955","172.20.0.4","172.20.0.3","TCP","66","46906  >  8080 [ACK] Seq=156 Ack=27513 Win=90112 Len=0 TSval=3911404202 TSecr=3931914756"
"408","11.195957","172.20.0.4","172.20.0.3","TCP","66","46906  >  8080 [ACK] Seq=156 Ack=31857 Win=86144 Len=0 TSval=3911404202 TSecr=3931914756"
"409","11.196279","172.20.0.3","172.20.0.4","TCP","2962","8080  >  46906 [PSH, ACK] Seq=43441 Ack=156 Win=65024 Len=2896 TSval=3931914767 TSecr=3911404202 [TCP PDU reassembled in 421]"
"410","11.196442","172.20.0.4","172.20.0.3","TCP","66","46906  >  8080 [ACK] Seq=156 Ack=36201 Win=84992 Len=0 TSval=3911404203 TSecr=3931914756"
"411","11.196447","172.20.0.4","172.20.0.3","TCP","66","46906  >  8080 [ACK] Seq=156 Ack=40545 Win=81024 Len=0 TSval=3911404203 TSecr=3931914756"
"412","11.196451","172.20.0.4","172.20.0.3","TCP","66","46906  >  8080 [ACK] Seq=156 Ack=43441 Win=78208 Len=0 TSval=3911404203 TSecr=3931914757"
"413","11.196461","172.20.0.3","172.20.0.4","TCP","5858","8080  >  46906 [PSH, ACK] Seq=46337 Ack=156 Win=65024 Len=5792 TSval=3931914767 TSecr=3911404202 [TCP PDU reassembled in 421]"
"414","11.196490","172.20.0.3","172.20.0.4","TCP","5858","8080  >  46906 [PSH, ACK] Seq=52129 Ack=156 Win=65024 Len=5792 TSval=3931914767 TSecr=3911404202 [TCP PDU reassembled in 421]"
"415","11.196634","172.20.0.3","172.20.0.4","TCP","7306","8080  >  46906 [PSH, ACK] Seq=57921 Ack=156 Win=65024 Len=7240 TSval=3931914767 TSecr=3911404203 [TCP PDU reassembled in 421]"
"416","11.196658","172.20.0.3","172.20.0.4","TCP","8754","8080  >  46906 [PSH, ACK] Seq=65161 Ack=156 Win=65024 Len=8688 TSval=3931914767 TSecr=3911404203 [TCP PDU reassembled in 421]"
"417","11.196733","172.20.0.3","172.20.0.4","TCP","4410","8080  >  46906 [PSH, ACK] Seq=73849 Ack=156 Win=65024 Len=4344 TSval=3931914767 TSecr=3911404203 [TCP PDU reassembled in 421]"
"418","11.196756","172.20.0.3","172.20.0.4","TCP","10202","8080  >  46906 [PSH, ACK] Seq=78193 Ack=156 Win=65024 Len=10136 TSval=3931914767 TSecr=3911404203 [TCP PDU reassembled in 421]"
"419","11.196776","172.20.0.3","172.20.0.4","TCP","10202","8080  >  46906 [PSH, ACK] Seq=88329 Ack=156 Win=65024 Len=10136 TSval=3931914767 TSecr=3911404203 [TCP PDU reassembled in 421]"
"420","11.196830","172.20.0.3","172.20.0.4","TCP","2962","8080  >  46906 [PSH, ACK] Seq=98465 Ack=156 Win=65024 Len=2896 TSval=3931914767 TSecr=3911404203 [TCP PDU reassembled in 421]"
"421","11.196845","172.20.0.3","172.20.0.4","HTTP","1289","HTTP/1.1 200 OK "
"422","11.206561","172.20.0.4","172.20.0.3","TCP","66","46906  >  8080 [ACK] Seq=156 Ack=46337 Win=97024 Len=0 TSval=3911404213 TSecr=3931914767"
"423","11.206573","172.20.0.4","172.20.0.3","TCP","66","46906  >  8080 [ACK] Seq=156 Ack=52129 Win=91904 Len=0 TSval=3911404213 TSecr=3931914767"
"424","11.206575","172.20.0.4","172.20.0.3","TCP","66","46906  >  8080 [ACK] Seq=156 Ack=57921 Win=86784 Len=0 TSval=3911404213 TSecr=3931914767"
"425","11.206736","172.20.0.4","172.20.0.3","TCP","66","46906  >  8080 [ACK] Seq=156 Ack=65161 Win=111488 Len=0 TSval=3911404213 TSecr=3931914767"
"426","11.206738","172.20.0.4","172.20.0.3","TCP","66","46906  >  8080 [ACK] Seq=156 Ack=73849 Win=128896 Len=0 TSval=3911404213 TSecr=3931914767"
"427","11.206778","172.20.0.4","172.20.0.3","TCP","66","46906  >  8080 [ACK] Seq=156 Ack=78193 Win=137600 Len=0 TSval=3911404213 TSecr=3931914767"
"428","11.206780","172.20.0.4","172.20.0.3","TCP","66","46906  >  8080 [ACK] Seq=156 Ack=88329 Win=153216 Len=0 TSval=3911404213 TSecr=3931914767"
"429","11.206813","172.20.0.4","172.20.0.3","TCP","66","46906  >  8080 [ACK] Seq=156 Ack=98465 Win=144768 Len=0 TSval=3911404213 TSecr=3931914767"
"430","11.206884","172.20.0.4","172.20.0.3","TCP","66","46906  >  8080 [ACK] Seq=156 Ack=101361 Win=141952 Len=0 TSval=3911404213 TSecr=3931914767"
"431","11.207801","172.20.0.4","172.20.0.3","TCP","66","46906  >  8080 [FIN, ACK] Seq=156 Ack=102585 Win=153216 Len=0 TSval=3911404214 TSecr=3931914767"
"432","11.207976","172.20.0.3","172.20.0.4","TCP","66","8080  >  46906 [ACK] Seq=102585 Ack=157 Win=65024 Len=0 TSval=3931914778 TSecr=3911404214"
"433","13.275550","172.20.0.4","172.20.0.2","DNS","59","Unknown operation (7) 0x3836[Malformed Packet]"
"434","13.276100","172.20.0.2","172.20.0.4","DNS","70","Unknown operation (7) 0x3836[Malformed Packet]"
"435","13.286966","172.20.0.4","172.20.0.3","TCP","74","40548  >  8080 [SYN] Seq=0 Win=64240 Len=0 MSS=1460 SACK_PERM TSval=3911406293 TSecr=0 WS=128"
"436","13.287186","172.20.0.3","172.20.0.4","TCP","74","8080  >  40548 [SYN, ACK] Seq=0 Ack=1 Win=65160 Len=0 MSS=1460 SACK_PERM TSval=3931916858 TSecr=3911406293 WS=128"
"437","13.297483","172.20.0.4","172.20.0.3","TCP","66","40548  >  8080 [ACK] Seq=1 Ack=1 Win=64256 Len=0 TSval=3911406304 TSecr=3931916858"
"438","13.297512","172.20.0.4","172.20.0.3","HTTP","221","GET /arquivo_100kb.bin HTTP/1.1 "
"439","13.297891","172.20.0.3","172.20.0.4","TCP","66","8080  >  40548 [ACK] Seq=1 Ack=156 Win=65024 Len=0 TSval=3931916868 TSecr=3911406304"
"440","13.311837","172.20.0.3","172.20.0.4","TCP","2962","8080  >  40548 [PSH, ACK] Seq=1 Ack=156 Win=65024 Len=2896 TSval=3931916882 TSecr=3911406304 [TCP PDU reassembled in 475]"
"441","13.311986","172.20.0.3","172.20.0.4","TCP","2962","8080  >  40548 [PSH, ACK] Seq=2897 Ack=156 Win=65024 Len=2896 TSval=3931916883 TSecr=3911406304 [TCP PDU reassembled in 475]"
"442","13.312011","172.20.0.3","172.20.0.4","TCP","2962","8080  >  40548 [PSH, ACK] Seq=5793 Ack=156 Win=65024 Len=2896 TSval=3931916883 TSecr=3911406304 [TCP PDU reassembled in 475]"
"443","13.312033","172.20.0.3","172.20.0.4","TCP","2962","8080  >  40548 [PSH, ACK] Seq=8689 Ack=156 Win=65024 Len=2896 TSval=3931916883 TSecr=3911406304 [TCP PDU reassembled in 475]"
"444","13.312054","172.20.0.3","172.20.0.4","TCP","2962","8080  >  40548 [PSH, ACK] Seq=11585 Ack=156 Win=65024 Len=2896 TSval=3931916883 TSecr=3911406304 [TCP PDU reassembled in 475]"
"445","13.322638","172.20.0.4","172.20.0.3","TCP","66","40548  >  8080 [ACK] Seq=156 Ack=2897 Win=70144 Len=0 TSval=3911406328 TSecr=3931916882"
"446","13.322650","172.20.0.4","172.20.0.3","TCP","66","40548  >  8080 [ACK] Seq=156 Ack=5793 Win=75904 Len=0 TSval=3911406329 TSecr=3931916883"
"447","13.322653","172.20.0.4","172.20.0.3","TCP","66","40548  >  8080 [ACK] Seq=156 Ack=8689 Win=81664 Len=0 TSval=3911406329 TSecr=3931916883"
"448","13.322656","172.20.0.4","172.20.0.3","TCP","66","40548  >  8080 [ACK] Seq=156 Ack=11585 Win=87424 Len=0 TSval=3911406329 TSecr=3931916883"
"449","13.322659","172.20.0.4","172.20.0.3","TCP","66","40548  >  8080 [ACK] Seq=156 Ack=14481 Win=85504 Len=0 TSval=3911406329 TSecr=3931916883"
"450","13.322920","172.20.0.3","172.20.0.4","TCP","2962","8080  >  40548 [PSH, ACK] Seq=14481 Ack=156 Win=65024 Len=2896 TSval=3931916893 TSecr=3911406328 [TCP PDU reassembled in 475]"
"451","13.323080","172.20.0.3","172.20.0.4","TCP","2962","8080  >  40548 [PSH, ACK] Seq=17377 Ack=156 Win=65024 Len=2896 TSval=3931916893 TSecr=3911406328 [TCP PDU reassembled in 475]"
"452","13.323199","172.20.0.3","172.20.0.4","TCP","2962","8080  >  40548 [PSH, ACK] Seq=20273 Ack=156 Win=65024 Len=2896 TSval=3931916894 TSecr=3911406329 [TCP PDU reassembled in 475]"
"453","13.323216","172.20.0.3","172.20.0.4","TCP","4410","8080  >  40548 [PSH, ACK] Seq=23169 Ack=156 Win=65024 Len=4344 TSval=3931916894 TSecr=3911406329 [TCP PDU reassembled in 475]"
"454","13.323231","172.20.0.3","172.20.0.4","TCP","4410","8080  >  40548 [PSH, ACK] Seq=27513 Ack=156 Win=65024 Len=4344 TSval=3931916894 TSecr=3911406329 [TCP PDU reassembled in 475]"
"455","13.323285","172.20.0.3","172.20.0.4","TCP","4410","8080  >  40548 [PSH, ACK] Seq=31857 Ack=156 Win=65024 Len=4344 TSval=3931916894 TSecr=3911406329 [TCP PDU reassembled in 475]"
"456","13.323300","172.20.0.3","172.20.0.4","TCP","4410","8080  >  40548 [PSH, ACK] Seq=36201 Ack=156 Win=65024 Len=4344 TSval=3931916894 TSecr=3911406329 [TCP PDU reassembled in 475]"
"457","13.323334","172.20.0.3","172.20.0.4","TCP","2962","8080  >  40548 [PSH, ACK] Seq=40545 Ack=156 Win=65024 Len=2896 TSval=3931916894 TSecr=3911406329 [TCP PDU reassembled in 475]"
"458","13.333205","172.20.0.4","172.20.0.3","TCP","66","40548  >  8080 [ACK] Seq=156 Ack=17377 Win=93312 Len=0 TSval=3911406340 TSecr=3931916893"
"459","13.333224","172.20.0.4","172.20.0.3","TCP","66","40548  >  8080 [ACK] Seq=156 Ack=20273 Win=94080 Len=0 TSval=3911406340 TSecr=3931916893"
"460","13.333237","172.20.0.4","172.20.0.3","TCP","66","40548  >  8080 [ACK] Seq=156 Ack=23169 Win=94080 Len=0 TSval=3911406340 TSecr=3931916894"
"461","13.333249","172.20.0.4","172.20.0.3","TCP","66","40548  >  8080 [ACK] Seq=156 Ack=27513 Win=90112 Len=0 TSval=3911406340 TSecr=3931916894"
"462","13.333255","172.20.0.4","172.20.0.3","TCP","66","40548  >  8080 [ACK] Seq=156 Ack=31857 Win=86144 Len=0 TSval=3911406340 TSecr=3931916894"
"463","13.333482","172.20.0.3","172.20.0.4","TCP","2962","8080  >  40548 [PSH, ACK] Seq=43441 Ack=156 Win=65024 Len=2896 TSval=3931916904 TSecr=3911406340 [TCP PDU reassembled in 475]"
"464","13.333583","172.20.0.4","172.20.0.3","TCP","66","40548  >  8080 [ACK] Seq=156 Ack=36201 Win=87936 Len=0 TSval=3911406340 TSecr=3931916894"
"465","13.333586","172.20.0.4","172.20.0.3","TCP","66","40548  >  8080 [ACK] Seq=156 Ack=40545 Win=83968 Len=0 TSval=3911406340 TSecr=3931916894"
"466","13.333591","172.20.0.4","172.20.0.3","TCP","66","40548  >  8080 [ACK] Seq=156 Ack=43441 Win=90112 Len=0 TSval=3911406340 TSecr=3931916894"
"467","13.333598","172.20.0.3","172.20.0.4","TCP","5858","8080  >  40548 [PSH, ACK] Seq=46337 Ack=156 Win=65024 Len=5792 TSval=3931916904 TSecr=3911406340 [TCP PDU reassembled in 475]"
"468","13.333618","172.20.0.3","172.20.0.4","TCP","5858","8080  >  40548 [PSH, ACK] Seq=52129 Ack=156 Win=65024 Len=5792 TSval=3931916904 TSecr=3911406340 [TCP PDU reassembled in 475]"
"469","13.333719","172.20.0.3","172.20.0.4","TCP","7306","8080  >  40548 [PSH, ACK] Seq=57921 Ack=156 Win=65024 Len=7240 TSval=3931916904 TSecr=3911406340 [TCP PDU reassembled in 475]"
"470","13.333735","172.20.0.3","172.20.0.4","TCP","8754","8080  >  40548 [PSH, ACK] Seq=65161 Ack=156 Win=65024 Len=8688 TSval=3931916904 TSecr=3911406340 [TCP PDU reassembled in 475]"
"471","13.333795","172.20.0.3","172.20.0.4","TCP","4410","8080  >  40548 [PSH, ACK] Seq=73849 Ack=156 Win=65024 Len=4344 TSval=3931916904 TSecr=3911406340 [TCP PDU reassembled in 475]"
"472","13.333812","172.20.0.3","172.20.0.4","TCP","10202","8080  >  40548 [PSH, ACK] Seq=78193 Ack=156 Win=65024 Len=10136 TSval=3931916904 TSecr=3911406340 [TCP PDU reassembled in 475]"
"473","13.333826","172.20.0.3","172.20.0.4","TCP","10202","8080  >  40548 [PSH, ACK] Seq=88329 Ack=156 Win=65024 Len=10136 TSval=3931916904 TSecr=3911406340 [TCP PDU reassembled in 475]"
"474","13.333869","172.20.0.3","172.20.0.4","TCP","2962","8080  >  40548 [PSH, ACK] Seq=98465 Ack=156 Win=65024 Len=2896 TSval=3931916904 TSecr=3911406340 [TCP PDU reassembled in 475]"
"475","13.333881","172.20.0.3","172.20.0.4","HTTP","1289","HTTP/1.1 200 OK "
"476","13.343729","172.20.0.4","172.20.0.3","TCP","66","40548  >  8080 [ACK] Seq=156 Ack=46337 Win=97024 Len=0 TSval=3911406350 TSecr=3931916904"
"477","13.343755","172.20.0.4","172.20.0.3","TCP","66","40548  >  8080 [ACK] Seq=156 Ack=52129 Win=91904 Len=0 TSval=3911406350 TSecr=3931916904"
"478","13.343759","172.20.0.4","172.20.0.3","TCP","66","40548  >  8080 [ACK] Seq=156 Ack=57921 Win=86784 Len=0 TSval=3911406350 TSecr=3931916904"
"479","13.343768","172.20.0.4","172.20.0.3","TCP","66","40548  >  8080 [ACK] Seq=156 Ack=65161 Win=111488 Len=0 TSval=3911406350 TSecr=3931916904"
"480","13.343772","172.20.0.4","172.20.0.3","TCP","66","40548  >  8080 [ACK] Seq=156 Ack=73849 Win=128896 Len=0 TSval=3911406350 TSecr=3931916904"
"481","13.343993","172.20.0.4","172.20.0.3","TCP","66","40548  >  8080 [ACK] Seq=156 Ack=78193 Win=137600 Len=0 TSval=3911406350 TSecr=3931916904"
"482","13.343996","172.20.0.4","172.20.0.3","TCP","66","40548  >  8080 [ACK] Seq=156 Ack=88329 Win=153216 Len=0 TSval=3911406350 TSecr=3931916904"
"483","13.343999","172.20.0.4","172.20.0.3","TCP","66","40548  >  8080 [ACK] Seq=156 Ack=98465 Win=144768 Len=0 TSval=3911406350 TSecr=3931916904"
"484","13.344002","172.20.0.4","172.20.0.3","TCP","66","40548  >  8080 [ACK] Seq=156 Ack=101361 Win=141952 Len=0 TSval=3911406350 TSecr=3931916904"
"485","13.344480","172.20.0.4","172.20.0.3","TCP","66","40548  >  8080 [FIN, ACK] Seq=156 Ack=102585 Win=153216 Len=0 TSval=3911406351 TSecr=3931916904"
"486","13.344603","172.20.0.3","172.20.0.4","TCP","66","8080  >  40548 [ACK] Seq=102585 Ack=157 Win=65024 Len=0 TSval=3931916915 TSecr=3911406351"
"487","14.795717","172.20.0.4","172.20.0.2","DNS","59","Unknown operation (7) 0x3335[Malformed Packet]"
"488","14.796297","172.20.0.2","172.20.0.4","DNS","70","Unknown operation (7) 0x3335[Malformed Packet]"
"489","14.807477","172.20.0.4","172.20.0.3","TCP","74","40562  >  8080 [SYN] Seq=0 Win=64240 Len=0 MSS=1460 SACK_PERM TSval=3911407814 TSecr=0 WS=128"
"490","14.807670","172.20.0.3","172.20.0.4","TCP","74","8080  >  40562 [SYN, ACK] Seq=0 Ack=1 Win=65160 Len=0 MSS=1460 SACK_PERM TSval=3931918378 TSecr=3911407814 WS=128"
"491","14.817924","172.20.0.4","172.20.0.3","TCP","66","40562  >  8080 [ACK] Seq=1 Ack=1 Win=64256 Len=0 TSval=3911407824 TSecr=3931918378"
"492","14.817935","172.20.0.4","172.20.0.3","HTTP","221","GET /arquivo_100kb.bin HTTP/1.1 "
"493","14.818145","172.20.0.3","172.20.0.4","TCP","66","8080  >  40562 [ACK] Seq=1 Ack=156 Win=65024 Len=0 TSval=3931918389 TSecr=3911407824"
"494","14.833955","172.20.0.3","172.20.0.4","TCP","2962","8080  >  40562 [PSH, ACK] Seq=1 Ack=156 Win=65024 Len=2896 TSval=3931918404 TSecr=3911407824 [TCP PDU reassembled in 529]"
"495","14.834130","172.20.0.3","172.20.0.4","TCP","2962","8080  >  40562 [PSH, ACK] Seq=2897 Ack=156 Win=65024 Len=2896 TSval=3931918405 TSecr=3911407824 [TCP PDU reassembled in 529]"
"496","14.834172","172.20.0.3","172.20.0.4","TCP","2962","8080  >  40562 [PSH, ACK] Seq=5793 Ack=156 Win=65024 Len=2896 TSval=3931918405 TSecr=3911407824 [TCP PDU reassembled in 529]"
"497","14.834206","172.20.0.3","172.20.0.4","TCP","2962","8080  >  40562 [PSH, ACK] Seq=8689 Ack=156 Win=65024 Len=2896 TSval=3931918405 TSecr=3911407824 [TCP PDU reassembled in 529]"
"498","14.834239","172.20.0.3","172.20.0.4","TCP","2962","8080  >  40562 [PSH, ACK] Seq=11585 Ack=156 Win=65024 Len=2896 TSval=3931918405 TSecr=3911407824 [TCP PDU reassembled in 529]"
"499","14.844211","172.20.0.4","172.20.0.3","TCP","66","40562  >  8080 [ACK] Seq=156 Ack=2897 Win=70144 Len=0 TSval=3911407851 TSecr=3931918404"
"500","14.844236","172.20.0.4","172.20.0.3","TCP","66","40562  >  8080 [ACK] Seq=156 Ack=5793 Win=75904 Len=0 TSval=3911407851 TSecr=3931918405"
"501","14.844239","172.20.0.4","172.20.0.3","TCP","66","40562  >  8080 [ACK] Seq=156 Ack=8689 Win=81664 Len=0 TSval=3911407851 TSecr=3931918405"
"502","14.844247","172.20.0.4","172.20.0.3","TCP","66","40562  >  8080 [ACK] Seq=156 Ack=11585 Win=87424 Len=0 TSval=3911407851 TSecr=3931918405"
"503","14.844262","172.20.0.4","172.20.0.3","TCP","66","40562  >  8080 [ACK] Seq=156 Ack=14481 Win=88320 Len=0 TSval=3911407851 TSecr=3931918405"
"504","14.844515","172.20.0.3","172.20.0.4","TCP","2962","8080  >  40562 [PSH, ACK] Seq=14481 Ack=156 Win=65024 Len=2896 TSval=3931918415 TSecr=3911407851 [TCP PDU reassembled in 529]"
"505","14.844633","172.20.0.3","172.20.0.4","TCP","2962","8080  >  40562 [PSH, ACK] Seq=17377 Ack=156 Win=65024 Len=2896 TSval=3931918415 TSecr=3911407851 [TCP PDU reassembled in 529]"
"506","14.844731","172.20.0.3","172.20.0.4","TCP","2962","8080  >  40562 [PSH, ACK] Seq=20273 Ack=156 Win=65024 Len=2896 TSval=3931918415 TSecr=3911407851 [TCP PDU reassembled in 529]"
"507","14.844738","172.20.0.3","172.20.0.4","TCP","4410","8080  >  40562 [PSH, ACK] Seq=23169 Ack=156 Win=65024 Len=4344 TSval=3931918415 TSecr=3911407851 [TCP PDU reassembled in 529]"
"508","14.844745","172.20.0.3","172.20.0.4","TCP","4410","8080  >  40562 [PSH, ACK] Seq=27513 Ack=156 Win=65024 Len=4344 TSval=3931918415 TSecr=3911407851 [TCP PDU reassembled in 529]"
"509","14.844793","172.20.0.3","172.20.0.4","TCP","4410","8080  >  40562 [PSH, ACK] Seq=31857 Ack=156 Win=65024 Len=4344 TSval=3931918415 TSecr=3911407851 [TCP PDU reassembled in 529]"
"510","14.844810","172.20.0.3","172.20.0.4","TCP","4410","8080  >  40562 [PSH, ACK] Seq=36201 Ack=156 Win=65024 Len=4344 TSval=3931918415 TSecr=3911407851 [TCP PDU reassembled in 529]"
"511","14.844844","172.20.0.3","172.20.0.4","TCP","2962","8080  >  40562 [PSH, ACK] Seq=40545 Ack=156 Win=65024 Len=2896 TSval=3931918415 TSecr=3911407851 [TCP PDU reassembled in 529]"
"512","14.855081","172.20.0.4","172.20.0.3","TCP","66","40562  >  8080 [ACK] Seq=156 Ack=17377 Win=94080 Len=0 TSval=3911407861 TSecr=3931918415"
"513","14.855093","172.20.0.4","172.20.0.3","TCP","66","40562  >  8080 [ACK] Seq=156 Ack=20273 Win=94080 Len=0 TSval=3911407861 TSecr=3931918415"
"514","14.855096","172.20.0.4","172.20.0.3","TCP","66","40562  >  8080 [ACK] Seq=156 Ack=23169 Win=91264 Len=0 TSval=3911407861 TSecr=3931918415"
"515","14.855099","172.20.0.4","172.20.0.3","TCP","66","40562  >  8080 [ACK] Seq=156 Ack=27513 Win=87040 Len=0 TSval=3911407861 TSecr=3931918415"
"516","14.855101","172.20.0.4","172.20.0.3","TCP","66","40562  >  8080 [ACK] Seq=156 Ack=31857 Win=82816 Len=0 TSval=3911407861 TSecr=3931918415"
"517","14.855104","172.20.0.4","172.20.0.3","TCP","66","40562  >  8080 [ACK] Seq=156 Ack=36201 Win=82176 Len=0 TSval=3911407861 TSecr=3931918415"
"518","14.855107","172.20.0.4","172.20.0.3","TCP","66","40562  >  8080 [ACK] Seq=156 Ack=40545 Win=78208 Len=0 TSval=3911407861 TSecr=3931918415"
"519","14.855110","172.20.0.4","172.20.0.3","TCP","66","40562  >  8080 [ACK] Seq=156 Ack=43441 Win=75392 Len=0 TSval=3911407861 TSecr=3931918415"
"520","14.855455","172.20.0.3","172.20.0.4","TCP","2962","8080  >  40562 [PSH, ACK] Seq=43441 Ack=156 Win=65024 Len=2896 TSval=3931918426 TSecr=3911407861 [TCP PDU reassembled in 529]"
"521","14.855583","172.20.0.3","172.20.0.4","TCP","5858","8080  >  40562 [PSH, ACK] Seq=46337 Ack=156 Win=65024 Len=5792 TSval=3931918426 TSecr=3911407861 [TCP PDU reassembled in 529]"
"522","14.855605","172.20.0.3","172.20.0.4","TCP","5858","8080  >  40562 [PSH, ACK] Seq=52129 Ack=156 Win=65024 Len=5792 TSval=3931918426 TSecr=3911407861 [TCP PDU reassembled in 529]"
"523","14.855671","172.20.0.3","172.20.0.4","TCP","7306","8080  >  40562 [PSH, ACK] Seq=57921 Ack=156 Win=65024 Len=7240 TSval=3931918426 TSecr=3911407861 [TCP PDU reassembled in 529]"
"524","14.855689","172.20.0.3","172.20.0.4","TCP","10202","8080  >  40562 [PSH, ACK] Seq=65161 Ack=156 Win=65024 Len=10136 TSval=3931918426 TSecr=3911407861 [TCP PDU reassembled in 529]"
"525","14.855762","172.20.0.3","172.20.0.4","TCP","2962","8080  >  40562 [PSH, ACK] Seq=75297 Ack=156 Win=65024 Len=2896 TSval=3931918426 TSecr=3911407861 [TCP PDU reassembled in 529]"
"526","14.855779","172.20.0.3","172.20.0.4","TCP","10202","8080  >  40562 [PSH, ACK] Seq=78193 Ack=156 Win=65024 Len=10136 TSval=3931918426 TSecr=3911407861 [TCP PDU reassembled in 529]"
"527","14.855795","172.20.0.3","172.20.0.4","TCP","10202","8080  >  40562 [PSH, ACK] Seq=88329 Ack=156 Win=65024 Len=10136 TSval=3931918426 TSecr=3911407861 [TCP PDU reassembled in 529]"
"528","14.855846","172.20.0.3","172.20.0.4","TCP","2962","8080  >  40562 [PSH, ACK] Seq=98465 Ack=156 Win=65024 Len=2896 TSval=3931918426 TSecr=3911407861 [TCP PDU reassembled in 529]"
"529","14.855860","172.20.0.3","172.20.0.4","HTTP","1289","HTTP/1.1 200 OK "
"530","14.865729","172.20.0.4","172.20.0.3","TCP","66","40562  >  8080 [ACK] Seq=156 Ack=46337 Win=97024 Len=0 TSval=3911407872 TSecr=3931918426"
"531","14.865740","172.20.0.4","172.20.0.3","TCP","66","40562  >  8080 [ACK] Seq=156 Ack=52129 Win=91904 Len=0 TSval=3911407872 TSecr=3931918426"
"532","14.865743","172.20.0.4","172.20.0.3","TCP","66","40562  >  8080 [ACK] Seq=156 Ack=57921 Win=86784 Len=0 TSval=3911407872 TSecr=3931918426"
"533","14.865746","172.20.0.4","172.20.0.3","TCP","66","40562  >  8080 [ACK] Seq=156 Ack=65161 Win=111488 Len=0 TSval=3911407872 TSecr=3931918426"
"534","14.865749","172.20.0.4","172.20.0.3","TCP","66","40562  >  8080 [ACK] Seq=156 Ack=75297 Win=131712 Len=0 TSval=3911407872 TSecr=3931918426"
"535","14.865969","172.20.0.4","172.20.0.3","TCP","66","40562  >  8080 [ACK] Seq=156 Ack=78193 Win=137600 Len=0 TSval=3911407872 TSecr=3931918426"
"536","14.865972","172.20.0.4","172.20.0.3","TCP","66","40562  >  8080 [ACK] Seq=156 Ack=88329 Win=153216 Len=0 TSval=3911407872 TSecr=3931918426"
"537","14.865975","172.20.0.4","172.20.0.3","TCP","66","40562  >  8080 [ACK] Seq=156 Ack=98465 Win=144768 Len=0 TSval=3911407872 TSecr=3931918426"
"538","14.865977","172.20.0.4","172.20.0.3","TCP","66","40562  >  8080 [ACK] Seq=156 Ack=101361 Win=141952 Len=0 TSval=3911407872 TSecr=3931918426"
"539","14.867347","172.20.0.4","172.20.0.3","TCP","66","40562  >  8080 [FIN, ACK] Seq=156 Ack=102585 Win=153216 Len=0 TSval=3911407874 TSecr=3931918426"
"540","14.867508","172.20.0.3","172.20.0.4","TCP","66","8080  >  40562 [ACK] Seq=102585 Ack=157 Win=65024 Len=0 TSval=3931918438 TSecr=3911407874"
