"No.","Time","Source","Destination","Protocol","Length","Info"
"1","0.000000","172.20.0.4","172.20.0.2","DNS","59","DNS Stateful operations (DSO) 0x3830[Malformed Packet]"
"2","0.001210","172.20.0.2","172.20.0.4","DNS","70","DNS Stateful operations (DSO) 0x3830[Malformed Packet]"
"3","0.052481","172.20.0.4","172.20.0.3","TCP","74","37944  >  8080 [SYN] Seq=0 Win=64240 Len=0 MSS=1460 SACK_PERM TSval=3911967124 TSecr=0 WS=128"
"4","0.052788","172.20.0.3","172.20.0.4","TCP","74","8080  >  37944 [SYN, ACK] Seq=0 Ack=1 Win=65160 Len=0 MSS=1460 SACK_PERM TSval=3932477729 TSecr=3911967124 WS=128"
"5","0.103731","172.20.0.4","172.20.0.3","TCP","66","37944  >  8080 [ACK] Seq=1 Ack=1 Win=64256 Len=0 TSval=3911967175 TSecr=3932477729"
"6","0.103744","172.20.0.4","172.20.0.3","HTTP","221","GET /arquivo_500kb.bin HTTP/1.1 "
"7","0.104116","172.20.0.3","172.20.0.4","TCP","66","8080  >  37944 [ACK] Seq=1 Ack=156 Win=65024 Len=0 TSval=3932477780 TSecr=3911967175"
"8","0.120648","172.20.0.3","172.20.0.4","TCP","2962","8080  >  37944 [PSH, ACK] Seq=1 Ack=156 Win=65024 Len=2896 TSval=3932477797 TSecr=3911967175 [TCP PDU reassembled in 207]"
"9","0.120802","172.20.0.3","172.20.0.4","TCP","2962","8080  >  37944 [PSH, ACK] Seq=2897 Ack=156 Win=65024 Len=2896 TSval=3932477797 TSecr=3911967175 [TCP PDU reassembled in 207]"
"10","0.120831","172.20.0.3","172.20.0.4","TCP","2962","8080  >  37944 [PSH, ACK] Seq=5793 Ack=156 Win=65024 Len=2896 TSval=3932477797 TSecr=3911967175 [TCP PDU reassembled in 207]"
"11","0.120849","172.20.0.3","172.20.0.4","TCP","2962","8080  >  37944 [PSH, ACK] Seq=8689 Ack=156 Win=65024 Len=2896 TSval=3932477797 TSecr=3911967175 [TCP PDU reassembled in 207]"
"12","0.120865","172.20.0.3","172.20.0.4","TCP","2962","8080  >  37944 [PSH, ACK] Seq=11585 Ack=156 Win=65024 Len=2896 TSval=3932477797 TSecr=3911967175 [TCP PDU reassembled in 207]"
"13","0.170937","172.20.0.4","172.20.0.3","TCP","66","37944  >  8080 [ACK] Seq=156 Ack=5793 Win=75904 Len=0 TSval=3911967243 TSecr=3932477797"
"14","0.170948","172.20.0.4","172.20.0.3","TCP","66","37944  >  8080 [ACK] Seq=156 Ack=8689 Win=81664 Len=0 TSval=3911967243 TSecr=3932477797"
"15","0.170952","172.20.0.4","172.20.0.3","TCP","66","37944  >  8080 [ACK] Seq=156 Ack=11585 Win=85504 Len=0 TSval=3911967243 TSecr=3932477797"
"16","0.170956","172.20.0.4","172.20.0.3","TCP","66","37944  >  8080 [ACK] Seq=156 Ack=14481 Win=88320 Len=0 TSval=3911967243 TSecr=3932477797"
"17","0.171259","172.20.0.3","172.20.0.4","TCP","2962","8080  >  37944 [PSH, ACK] Seq=14481 Ack=156 Win=65024 Len=2896 TSval=3932477847 TSecr=3911967243 [TCP PDU reassembled in 207]"
"18","0.171372","172.20.0.3","172.20.0.4","TCP","2962","8080  >  37944 [PSH, ACK] Seq=17377 Ack=156 Win=65024 Len=2896 TSval=3932477847 TSecr=3911967243 [TCP PDU reassembled in 207]"
"19","0.171446","172.20.0.3","172.20.0.4","TCP","2962","8080  >  37944 [PSH, ACK] Seq=20273 Ack=156 Win=65024 Len=2896 TSval=3932477848 TSecr=3911967243 [TCP PDU reassembled in 207]"
"20","0.171462","172.20.0.3","172.20.0.4","TCP","2962","8080  >  37944 [PSH, ACK] Seq=23169 Ack=156 Win=65024 Len=2896 TSval=3932477848 TSecr=3911967243 [TCP PDU reassembled in 207]"
"21","0.171508","172.20.0.3","172.20.0.4","TCP","2962","8080  >  37944 [PSH, ACK] Seq=26065 Ack=156 Win=65024 Len=2896 TSval=3932477848 TSecr=3911967243 [TCP PDU reassembled in 207]"
"22","0.171522","172.20.0.3","172.20.0.4","TCP","2962","8080  >  37944 [PSH, ACK] Seq=28961 Ack=156 Win=65024 Len=2896 TSval=3932477848 TSecr=3911967243 [TCP PDU reassembled in 207]"
"23","0.171566","172.20.0.3","172.20.0.4","TCP","2962","8080  >  37944 [PSH, ACK] Seq=31857 Ack=156 Win=65024 Len=2896 TSval=3932477848 TSecr=3911967243 [TCP PDU reassembled in 207]"
"24","0.171587","172.20.0.3","172.20.0.4","TCP","2962","8080  >  37944 [PSH, ACK] Seq=34753 Ack=156 Win=65024 Len=2896 TSval=3932477848 TSecr=3911967243 [TCP PDU reassembled in 207]"
"25","0.171667","172.20.0.3","172.20.0.4","TCP","2962","8080  >  37944 [PSH, ACK] Seq=37649 Ack=156 Win=65024 Len=2896 TSval=3932477848 TSecr=3911967243 [TCP PDU reassembled in 207]"
"26","0.171701","172.20.0.3","172.20.0.4","TCP","2962","8080  >  37944 [PSH, ACK] Seq=40545 Ack=156 Win=65024 Len=2896 TSval=3932477848 TSecr=3911967243 [TCP PDU reassembled in 207]"
"27","0.221617","172.20.0.4","172.20.0.3","TCP","66","37944  >  8080 [ACK] Seq=156 Ack=17377 Win=94080 Len=0 TSval=3911967293 TSecr=3932477847"
"28","0.221630","172.20.0.4","172.20.0.3","TCP","66","37944  >  8080 [ACK] Seq=156 Ack=20273 Win=94080 Len=0 TSval=3911967294 TSecr=3932477847"
"29","0.221632","172.20.0.4","172.20.0.3","TCP","66","37944  >  8080 [ACK] Seq=156 Ack=23169 Win=94080 Len=0 TSval=3911967294 TSecr=3932477848"
"30","0.221634","172.20.0.4","172.20.0.3","TCP","66","37944  >  8080 [ACK] Seq=156 Ack=26065 Win=91264 Len=0 TSval=3911967294 TSecr=3932477848"
"31","0.221637","172.20.0.4","172.20.0.3","TCP","66","37944  >  8080 [ACK] Seq=156 Ack=28961 Win=97024 Len=0 TSval=3911967294 TSecr=3932477848"
"32","0.221639","172.20.0.4","172.20.0.3","TCP","66","37944  >  8080 [ACK] Seq=156 Ack=31857 Win=94208 Len=0 TSval=3911967294 TSecr=3932477848"
"33","0.221649","172.20.0.4","172.20.0.3","TCP","66","37944  >  8080 [ACK] Seq=156 Ack=34753 Win=97024 Len=0 TSval=3911967294 TSecr=3932477848"
"34","0.221651","172.20.0.4","172.20.0.3","TCP","66","37944  >  8080 [ACK] Seq=156 Ack=37649 Win=94208 Len=0 TSval=3911967294 TSecr=3932477848"
"35","0.222072","172.20.0.3","172.20.0.4","TCP","2962","8080  >  37944 [PSH, ACK] Seq=43441 Ack=156 Win=65024 Len=2896 TSval=3932477898 TSecr=3911967293 [TCP PDU reassembled in 207]"
"36","0.222123","172.20.0.4","172.20.0.3","TCP","66","37944  >  8080 [ACK] Seq=156 Ack=40545 Win=97024 Len=0 TSval=3911967294 TSecr=3932477848"
"37","0.222126","172.20.0.4","172.20.0.3","TCP","66","37944  >  8080 [ACK] Seq=156 Ack=43441 Win=97024 Len=0 TSval=3911967294 TSecr=3932477848"
"38","0.222132","172.20.0.3","172.20.0.4","TCP","2962","8080  >  37944 [PSH, ACK] Seq=46337 Ack=156 Win=65024 Len=2896 TSval=3932477898 TSecr=3911967293 [TCP PDU reassembled in 207]"
"39","0.222164","172.20.0.3","172.20.0.4","TCP","2962","8080  >  37944 [PSH, ACK] Seq=49233 Ack=156 Win=65024 Len=2896 TSval=3932477898 TSecr=3911967294 [TCP PDU reassembled in 207]"
"40","0.222199","172.20.0.3","172.20.0.4","TCP","2962","8080  >  37944 [PSH, ACK] Seq=52129 Ack=156 Win=65024 Len=2896 TSval=3932477898 TSecr=3911967294 [TCP PDU reassembled in 207]"
"41","0.222223","172.20.0.3","172.20.0.4","TCP","2962","8080  >  37944 [PSH, ACK] Seq=55025 Ack=156 Win=65024 Len=2896 TSval=3932477898 TSecr=3911967294 [TCP PDU reassembled in 207]"
"42","0.222251","172.20.0.3","172.20.0.4","TCP","2962","8080  >  37944 [PSH, ACK] Seq=57921 Ack=156 Win=65024 Len=2896 TSval=3932477898 TSecr=3911967294 [TCP PDU reassembled in 207]"
"43","0.222400","172.20.0.3","172.20.0.4","TCP","2962","8080  >  37944 [PSH, ACK] Seq=60817 Ack=156 Win=65024 Len=2896 TSval=3932477898 TSecr=3911967294 [TCP PDU reassembled in 207]"
"44","0.222451","172.20.0.3","172.20.0.4","TCP","2962","8080  >  37944 [PSH, ACK] Seq=63713 Ack=156 Win=65024 Len=2896 TSval=3932477898 TSecr=3911967294 [TCP PDU reassembled in 207]"
"45","0.222483","172.20.0.3","172.20.0.4","TCP","2962","8080  >  37944 [PSH, ACK] Seq=66609 Ack=156 Win=65024 Len=2896 TSval=3932477898 TSecr=3911967294 [TCP PDU reassembled in 207]"
"46","0.222511","172.20.0.3","172.20.0.4","TCP","2962","8080  >  37944 [PSH, ACK] Seq=69505 Ack=156 Win=65024 Len=2896 TSval=3932477898 TSecr=3911967294 [TCP PDU reassembled in 207]"
"47","0.222539","172.20.0.3","172.20.0.4","TCP","2962","8080  >  37944 [PSH, ACK] Seq=72401 Ack=156 Win=65024 Len=2896 TSval=3932477898 TSecr=3911967294 [TCP PDU reassembled in 207]"
"48","0.222566","172.20.0.3","172.20.0.4","TCP","2962","8080  >  37944 [PSH, ACK] Seq=75297 Ack=156 Win=65024 Len=2896 TSval=3932477898 TSecr=3911967294 [TCP PDU reassembled in 207]"
"49","0.222589","172.20.0.3","172.20.0.4","TCP","2962","8080  >  37944 [PSH, ACK] Seq=78193 Ack=156 Win=65024 Len=2896 TSval=3932477898 TSecr=3911967294 [TCP PDU reassembled in 207]"
"50","0.222619","172.20.0.3","172.20.0.4","TCP","2962","8080  >  37944 [PSH, ACK] Seq=81089 Ack=156 Win=65024 Len=2896 TSval=3932477898 TSecr=3911967294 [TCP PDU reassembled in 207]"
"51","0.222648","172.20.0.3","172.20.0.4","TCP","2962","8080  >  37944 [PSH, ACK] Seq=83985 Ack=156 Win=65024 Len=2896 TSval=3932477898 TSecr=3911967294 [TCP PDU reassembled in 207]"
"52","0.222680","172.20.0.3","172.20.0.4","TCP","2962","8080  >  37944 [PSH, ACK] Seq=86881 Ack=156 Win=65024 Len=2896 TSval=3932477898 TSecr=3911967294 [TCP PDU reassembled in 207]"
"53","0.222782","172.20.0.3","172.20.0.4","TCP","2962","8080  >  37944 [PSH, ACK] Seq=89777 Ack=156 Win=65024 Len=2896 TSval=3932477899 TSecr=3911967294 [TCP PDU reassembled in 207]"
"54","0.222815","172.20.0.3","172.20.0.4","TCP","2962","8080  >  37944 [PSH, ACK] Seq=92673 Ack=156 Win=65024 Len=2896 TSval=3932477899 TSecr=3911967294 [TCP PDU reassembled in 207]"
"55","0.222843","172.20.0.3","172.20.0.4","TCP","2962","8080  >  37944 [PSH, ACK] Seq=95569 Ack=156 Win=65024 Len=2896 TSval=3932477899 TSecr=3911967294 [TCP PDU reassembled in 207]"
"56","0.222874","172.20.0.3","172.20.0.4","TCP","2962","8080  >  37944 [PSH, ACK] Seq=98465 Ack=156 Win=65024 Len=2896 TSval=3932477899 TSecr=3911967294 [TCP PDU reassembled in 207]"
"57","0.272339","172.20.0.4","172.20.0.3","TCP","66","37944  >  8080 [ACK] Seq=156 Ack=46337 Win=97024 Len=0 TSval=3911967344 TSecr=3932477898"
"58","0.272352","172.20.0.4","172.20.0.3","TCP","66","37944  >  8080 [ACK] Seq=156 Ack=49233 Win=94208 Len=0 TSval=3911967344 TSecr=3932477898"
"59","0.272355","172.20.0.4","172.20.0.3","TCP","66","37944  >  8080 [ACK] Seq=156 Ack=52129 Win=91392 Len=0 TSval=3911967344 TSecr=3932477898"
"60","0.272358","172.20.0.4","172.20.0.3","TCP","66","37944  >  8080 [ACK] Seq=156 Ack=55025 Win=102784 Len=0 TSval=3911967344 TSecr=3932477898"
"61","0.272361","172.20.0.4","172.20.0.3","TCP","66","37944  >  8080 [ACK] Seq=156 Ack=57921 Win=108544 Len=0 TSval=3911967344 TSecr=3932477898"
"62","0.272364","172.20.0.4","172.20.0.3","TCP","66","37944  >  8080 [ACK] Seq=156 Ack=60817 Win=114432 Len=0 TSval=3911967344 TSecr=3932477898"
"63","0.272709","172.20.0.3","172.20.0.4","TCP","2962","8080  >  37944 [PSH, ACK] Seq=101361 Ack=156 Win=65024 Len=2896 TSval=3932477949 TSecr=3911967344 [TCP PDU reassembled in 207]"
"64","0.272770","172.20.0.4","172.20.0.3","TCP","66","37944  >  8080 [ACK] Seq=156 Ack=63713 Win=120192 Len=0 TSval=3911967345 TSecr=3932477898"
"65","0.272773","172.20.0.4","172.20.0.3","TCP","66","37944  >  8080 [ACK] Seq=156 Ack=66609 Win=125952 Len=0 TSval=3911967345 TSecr=3932477898"
"66","0.272776","172.20.0.4","172.20.0.3","TCP","66","37944  >  8080 [ACK] Seq=156 Ack=69505 Win=131712 Len=0 TSval=3911967345 TSecr=3932477898"
"67","0.272779","172.20.0.4","172.20.0.3","TCP","66","37944  >  8080 [ACK] Seq=156 Ack=72401 Win=137600 Len=0 TSval=3911967345 TSecr=3932477898"
"68","0.272782","172.20.0.4","172.20.0.3","TCP","66","37944  >  8080 [ACK] Seq=156 Ack=78193 Win=149120 Len=0 TSval=3911967345 TSecr=3932477898"
"69","0.272785","172.20.0.4","172.20.0.3","TCP","66","37944  >  8080 [ACK] Seq=156 Ack=81089 Win=154880 Len=0 TSval=3911967345 TSecr=3932477898"
"70","0.272788","172.20.0.4","172.20.0.3","TCP","66","37944  >  8080 [ACK] Seq=156 Ack=83985 Win=160768 Len=0 TSval=3911967345 TSecr=3932477898"
"71","0.272790","172.20.0.4","172.20.0.3","TCP","66","37944  >  8080 [ACK] Seq=156 Ack=86881 Win=166528 Len=0 TSval=3911967345 TSecr=3932477898"
"72","0.272793","172.20.0.4","172.20.0.3","TCP","66","37944  >  8080 [ACK] Seq=156 Ack=89777 Win=172288 Len=0 TSval=3911967345 TSecr=3932477898"
"73","0.272804","172.20.0.4","172.20.0.3","TCP","66","37944  >  8080 [ACK] Seq=156 Ack=92673 Win=178048 Len=0 TSval=3911967345 TSecr=3932477899"
"74","0.272810","172.20.0.3","172.20.0.4","TCP","2962","8080  >  37944 [PSH, ACK] Seq=104257 Ack=156 Win=65024 Len=2896 TSval=3932477949 TSecr=3911967344 [TCP PDU reassembled in 207]"
"75","0.272844","172.20.0.4","172.20.0.3","TCP","66","37944  >  8080 [ACK] Seq=156 Ack=95569 Win=183552 Len=0 TSval=3911967345 TSecr=3932477899"
"76","0.273227","172.20.0.3","172.20.0.4","TCP","2962","8080  >  37944 [PSH, ACK] Seq=107153 Ack=156 Win=65024 Len=2896 TSval=3932477949 TSecr=3911967345 [TCP PDU reassembled in 207]"
"77","0.273239","172.20.0.3","172.20.0.4","TCP","2962","8080  >  37944 [PSH, ACK] Seq=110049 Ack=156 Win=65024 Len=2896 TSval=3932477949 TSecr=3911967345 [TCP PDU reassembled in 207]"
"78","0.273274","172.20.0.4","172.20.0.3","TCP","66","37944  >  8080 [ACK] Seq=156 Ack=98465 Win=180736 Len=0 TSval=3911967345 TSecr=3932477899"
"79","0.273276","172.20.0.4","172.20.0.3","TCP","66","37944  >  8080 [ACK] Seq=156 Ack=101361 Win=186368 Len=0 TSval=3911967345 TSecr=3932477899"
"80","0.273314","172.20.0.3","172.20.0.4","TCP","2962","8080  >  37944 [PSH, ACK] Seq=112945 Ack=156 Win=65024 Len=2896 TSval=3932477949 TSecr=3911967345 [TCP PDU reassembled in 207]"
"81","0.273366","172.20.0.3","172.20.0.4","TCP","2962","8080  >  37944 [PSH, ACK] Seq=115841 Ack=156 Win=65024 Len=2896 TSval=3932477949 TSecr=3911967345 [TCP PDU reassembled in 207]"
"82","0.273398","172.20.0.3","172.20.0.4","TCP","2962","8080  >  37944 [PSH, ACK] Seq=118737 Ack=156 Win=65024 Len=2896 TSval=3932477949 TSecr=3911967345 [TCP PDU reassembled in 207]"
"83","0.273423","172.20.0.3","172.20.0.4","TCP","2962","8080  >  37944 [PSH, ACK] Seq=121633 Ack=156 Win=65024 Len=2896 TSval=3932477949 TSecr=3911967345 [TCP PDU reassembled in 207]"
"84","0.273468","172.20.0.3","172.20.0.4","TCP","2962","8080  >  37944 [PSH, ACK] Seq=124529 Ack=156 Win=65024 Len=2896 TSval=3932477949 TSecr=3911967345 [TCP PDU reassembled in 207]"
"85","0.273494","172.20.0.3","172.20.0.4","TCP","2962","8080  >  37944 [PSH, ACK] Seq=127425 Ack=156 Win=65024 Len=2896 TSval=3932477949 TSecr=3911967345 [TCP PDU reassembled in 207]"
"86","0.273516","172.20.0.3","172.20.0.4","TCP","2962","8080  >  37944 [PSH, ACK] Seq=130321 Ack=156 Win=65024 Len=2896 TSval=3932477949 TSecr=3911967345 [TCP PDU reassembled in 207]"
"87","0.273538","172.20.0.3","172.20.0.4","TCP","2962","8080  >  37944 [PSH, ACK] Seq=133217 Ack=156 Win=65024 Len=2896 TSval=3932477949 TSecr=3911967345 [TCP PDU reassembled in 207]"
"88","0.273560","172.20.0.3","172.20.0.4","TCP","2962","8080  >  37944 [PSH, ACK] Seq=136113 Ack=156 Win=65024 Len=2896 TSval=3932477949 TSecr=3911967345 [TCP PDU reassembled in 207]"
"89","0.273581","172.20.0.3","172.20.0.4","TCP","2962","8080  >  37944 [PSH, ACK] Seq=139009 Ack=156 Win=65024 Len=2896 TSval=3932477949 TSecr=3911967345 [TCP PDU reassembled in 207]"
"90","0.273603","172.20.0.3","172.20.0.4","TCP","2962","8080  >  37944 [PSH, ACK] Seq=141905 Ack=156 Win=65024 Len=2896 TSval=3932477949 TSecr=3911967345 [TCP PDU reassembled in 207]"
"91","0.273625","172.20.0.3","172.20.0.4","TCP","2962","8080  >  37944 [PSH, ACK] Seq=144801 Ack=156 Win=65024 Len=2896 TSval=3932477949 TSecr=3911967345 [TCP PDU reassembled in 207]"
"92","0.273647","172.20.0.3","172.20.0.4","TCP","2962","8080  >  37944 [PSH, ACK] Seq=147697 Ack=156 Win=65024 Len=2896 TSval=3932477949 TSecr=3911967345 [TCP PDU reassembled in 207]"
"93","0.273668","172.20.0.3","172.20.0.4","TCP","2962","8080  >  37944 [PSH, ACK] Seq=150593 Ack=156 Win=65024 Len=2896 TSval=3932477949 TSecr=3911967345 [TCP PDU reassembled in 207]"
"94","0.273689","172.20.0.3","172.20.0.4","TCP","2962","8080  >  37944 [PSH, ACK] Seq=153489 Ack=156 Win=65024 Len=2896 TSval=3932477949 TSecr=3911967345 [TCP PDU reassembled in 207]"
"95","0.273710","172.20.0.3","172.20.0.4","TCP","2962","8080  >  37944 [PSH, ACK] Seq=156385 Ack=156 Win=65024 Len=2896 TSval=3932477949 TSecr=3911967345 [TCP PDU reassembled in 207]"
"96","0.273732","172.20.0.3","172.20.0.4","TCP","2962","8080  >  37944 [PSH, ACK] Seq=159281 Ack=156 Win=65024 Len=2896 TSval=3932477949 TSecr=3911967345 [TCP PDU reassembled in 207]"
"97","0.273752","172.20.0.3","172.20.0.4","TCP","2962","8080  >  37944 [PSH, ACK] Seq=162177 Ack=156 Win=65024 Len=2896 TSval=3932477949 TSecr=3911967345 [TCP PDU reassembled in 207]"
"98","0.273773","172.20.0.3","172.20.0.4","TCP","2962","8080  >  37944 [PSH, ACK] Seq=165073 Ack=156 Win=65024 Len=2896 TSval=3932477949 TSecr=3911967345 [TCP PDU reassembled in 207]"
"99","0.273794","172.20.0.3","172.20.0.4","TCP","2962","8080  >  37944 [PSH, ACK] Seq=167969 Ack=156 Win=65024 Len=2896 TSval=3932477949 TSecr=3911967345 [TCP PDU reassembled in 207]"
"100","0.273817","172.20.0.3","172.20.0.4","TCP","2962","8080  >  37944 [PSH, ACK] Seq=170865 Ack=156 Win=65024 Len=2896 TSval=3932477949 TSecr=3911967345 [TCP PDU reassembled in 207]"
"101","0.273840","172.20.0.3","172.20.0.4","TCP","2962","8080  >  37944 [PSH, ACK] Seq=173761 Ack=156 Win=65024 Len=2896 TSval=3932477949 TSecr=3911967345 [TCP PDU reassembled in 207]"
"102","0.273862","172.20.0.3","172.20.0.4","TCP","2962","8080  >  37944 [PSH, ACK] Seq=176657 Ack=156 Win=65024 Len=2896 TSval=3932477949 TSecr=3911967345 [TCP PDU reassembled in 207]"
"103","0.273886","172.20.0.3","172.20.0.4","TCP","2962","8080  >  37944 [PSH, ACK] Seq=179553 Ack=156 Win=65024 Len=2896 TSval=3932477949 TSecr=3911967345 [TCP PDU reassembled in 207]"
"104","0.273908","172.20.0.3","172.20.0.4","TCP","2962","8080  >  37944 [PSH, ACK] Seq=182449 Ack=156 Win=65024 Len=2896 TSval=3932477949 TSecr=3911967345 [TCP PDU reassembled in 207]"
"105","0.273931","172.20.0.3","172.20.0.4","TCP","2962","8080  >  37944 [PSH, ACK] Seq=185345 Ack=156 Win=65024 Len=2896 TSval=3932477949 TSecr=3911967345 [TCP PDU reassembled in 207]"
"106","0.273954","172.20.0.3","172.20.0.4","TCP","2962","8080  >  37944 [PSH, ACK] Seq=188241 Ack=156 Win=65024 Len=2896 TSval=3932477949 TSecr=3911967345 [TCP PDU reassembled in 207]"
"107","0.273974","172.20.0.3","172.20.0.4","TCP","2962","8080  >  37944 [PSH, ACK] Seq=191137 Ack=156 Win=65024 Len=2896 TSval=3932477949 TSecr=3911967345 [TCP PDU reassembled in 207]"
"108","0.274008","172.20.0.3","172.20.0.4","TCP","4410","8080  >  37944 [PSH, ACK] Seq=194033 Ack=156 Win=65024 Len=4344 TSval=3932477950 TSecr=3911967345 [TCP PDU reassembled in 207]"
"109","0.274030","172.20.0.3","172.20.0.4","TCP","4410","8080  >  37944 [PSH, ACK] Seq=198377 Ack=156 Win=65024 Len=4344 TSval=3932477950 TSecr=3911967345 [TCP PDU reassembled in 207]"
"110","0.274047","172.20.0.3","172.20.0.4","TCP","4410","8080  >  37944 [PSH, ACK] Seq=202721 Ack=156 Win=65024 Len=4344 TSval=3932477950 TSecr=3911967345 [TCP PDU reassembled in 207]"
"111","0.274065","172.20.0.3","172.20.0.4","TCP","4410","8080  >  37944 [PSH, ACK] Seq=207065 Ack=156 Win=65024 Len=4344 TSval=3932477950 TSecr=3911967345 [TCP PDU reassembled in 207]"
"112","0.274081","172.20.0.3","172.20.0.4","TCP","1514","8080  >  37944 [PSH, ACK] Seq=211409 Ack=156 Win=65024 Len=1448 TSval=3932477950 TSecr=3911967345 [TCP PDU reassembled in 207]"
"113","0.274099","172.20.0.3","172.20.0.4","TCP","4410","8080  >  37944 [PSH, ACK] Seq=212857 Ack=156 Win=65024 Len=4344 TSval=3932477950 TSecr=3911967345 [TCP PDU reassembled in 207]"
"114","0.323574","172.20.0.4","172.20.0.3","TCP","66","37944  >  8080 [ACK] Seq=156 Ack=104257 Win=186368 Len=0 TSval=3911967395 TSecr=3932477949"
"115","0.323586","172.20.0.4","172.20.0.3","TCP","66","37944  >  8080 [ACK] Seq=156 Ack=107153 Win=183552 Len=0 TSval=3911967395 TSecr=3932477949"
"116","0.323589","172.20.0.4","172.20.0.3","TCP","66","37944  >  8080 [ACK] Seq=156 Ack=112945 Win=186368 Len=0 TSval=3911967396 TSecr=3932477949"
"117","0.323592","172.20.0.4","172.20.0.3","TCP","66","37944  >  8080 [ACK] Seq=156 Ack=115841 Win=192128 Len=0 TSval=3911967396 TSecr=3932477949"
"118","0.323595","172.20.0.4","172.20.0.3","TCP","66","37944  >  8080 [ACK] Seq=156 Ack=118737 Win=198016 Len=0 TSval=3911967396 TSecr=3932477949"
"119","0.323597","172.20.0.4","172.20.0.3","TCP","66","37944  >  8080 [ACK] Seq=156 Ack=121633 Win=203776 Len=0 TSval=3911967396 TSecr=3932477949"
"120","0.323600","172.20.0.4","172.20.0.3","TCP","66","37944  >  8080 [ACK] Seq=156 Ack=124529 Win=209536 Len=0 TSval=3911967396 TSecr=3932477949"
"121","0.323603","172.20.0.4","172.20.0.3","TCP","66","37944  >  8080 [ACK] Seq=156 Ack=127425 Win=215296 Len=0 TSval=3911967396 TSecr=3932477949"
"122","0.323606","172.20.0.4","172.20.0.3","TCP","66","37944  >  8080 [ACK] Seq=156 Ack=130321 Win=221184 Len=0 TSval=3911967396 TSecr=3932477949"
"123","0.323635","172.20.0.4","172.20.0.3","TCP","66","37944  >  8080 [ACK] Seq=156 Ack=133217 Win=226944 Len=0 TSval=3911967396 TSecr=3932477949"
"124","0.323638","172.20.0.4","172.20.0.3","TCP","66","37944  >  8080 [ACK] Seq=156 Ack=136113 Win=232704 Len=0 TSval=3911967396 TSecr=3932477949"
"125","0.323641","172.20.0.4","172.20.0.3","TCP","66","37944  >  8080 [ACK] Seq=156 Ack=139009 Win=238464 Len=0 TSval=3911967396 TSecr=3932477949"
"126","0.323644","172.20.0.4","172.20.0.3","TCP","66","37944  >  8080 [ACK] Seq=156 Ack=141905 Win=244352 Len=0 TSval=3911967396 TSecr=3932477949"
"127","0.323653","172.20.0.4","172.20.0.3","TCP","66","37944  >  8080 [ACK] Seq=156 Ack=144801 Win=250112 Len=0 TSval=3911967396 TSecr=3932477949"
"128","0.323665","172.20.0.4","172.20.0.3","TCP","66","37944  >  8080 [ACK] Seq=156 Ack=147697 Win=255872 Len=0 TSval=3911967396 TSecr=3932477949"
"129","0.323673","172.20.0.4","172.20.0.3","TCP","66","37944  >  8080 [ACK] Seq=156 Ack=150593 Win=261632 Len=0 TSval=3911967396 TSecr=3932477949"
"130","0.323689","172.20.0.4","172.20.0.3","TCP","66","37944  >  8080 [ACK] Seq=156 Ack=153489 Win=267520 Len=0 TSval=3911967396 TSecr=3932477949"
"131","0.324241","172.20.0.3","172.20.0.4","TCP","4410","8080  >  37944 [PSH, ACK] Seq=217201 Ack=156 Win=65024 Len=4344 TSval=3932478000 TSecr=3911967395 [TCP PDU reassembled in 207]"
"132","0.324325","172.20.0.4","172.20.0.3","TCP","66","37944  >  8080 [ACK] Seq=156 Ack=156385 Win=273280 Len=0 TSval=3911967396 TSecr=3932477949"
"133","0.324334","172.20.0.4","172.20.0.3","TCP","66","37944  >  8080 [ACK] Seq=156 Ack=159281 Win=279040 Len=0 TSval=3911967396 TSecr=3932477949"
"134","0.324340","172.20.0.4","172.20.0.3","TCP","66","37944  >  8080 [ACK] Seq=156 Ack=162177 Win=284800 Len=0 TSval=3911967396 TSecr=3932477949"
"135","0.324344","172.20.0.4","172.20.0.3","TCP","66","37944  >  8080 [ACK] Seq=156 Ack=165073 Win=290688 Len=0 TSval=3911967396 TSecr=3932477949"
"136","0.324347","172.20.0.4","172.20.0.3","TCP","66","37944  >  8080 [ACK] Seq=156 Ack=167969 Win=296448 Len=0 TSval=3911967396 TSecr=3932477949"
"137","0.324352","172.20.0.4","172.20.0.3","TCP","66","37944  >  8080 [ACK] Seq=156 Ack=170865 Win=302208 Len=0 TSval=3911967396 TSecr=3932477949"
"138","0.324358","172.20.0.4","172.20.0.3","TCP","66","37944  >  8080 [ACK] Seq=156 Ack=173761 Win=307968 Len=0 TSval=3911967396 TSecr=3932477949"
"139","0.324364","172.20.0.4","172.20.0.3","TCP","66","37944  >  8080 [ACK] Seq=156 Ack=176657 Win=313856 Len=0 TSval=3911967396 TSecr=3932477949"
"140","0.324369","172.20.0.4","172.20.0.3","TCP","66","37944  >  8080 [ACK] Seq=156 Ack=179553 Win=319616 Len=0 TSval=3911967396 TSecr=3932477949"
"141","0.324403","172.20.0.4","172.20.0.3","TCP","66","37944  >  8080 [ACK] Seq=156 Ack=182449 Win=325376 Len=0 TSval=3911967396 TSecr=3932477949"
"142","0.324409","172.20.0.4","172.20.0.3","TCP","66","37944  >  8080 [ACK] Seq=156 Ack=185345 Win=331136 Len=0 TSval=3911967396 TSecr=3932477949"
"143","0.324416","172.20.0.4","172.20.0.3","TCP","66","37944  >  8080 [ACK] Seq=156 Ack=188241 Win=337024 Len=0 TSval=3911967396 TSecr=3932477949"
"144","0.324422","172.20.0.4","172.20.0.3","TCP","66","37944  >  8080 [ACK] Seq=156 Ack=191137 Win=342784 Len=0 TSval=3911967396 TSecr=3932477949"
"145","0.324427","172.20.0.4","172.20.0.3","TCP","66","37944  >  8080 [ACK] Seq=156 Ack=194033 Win=348544 Len=0 TSval=3911967396 TSecr=3932477949"
"146","0.324430","172.20.0.4","172.20.0.3","TCP","66","37944  >  8080 [ACK] Seq=156 Ack=198377 Win=348544 Len=0 TSval=3911967396 TSecr=3932477950"
"147","0.324435","172.20.0.4","172.20.0.3","TCP","66","37944  >  8080 [ACK] Seq=156 Ack=207065 Win=347392 Len=0 TSval=3911967396 TSecr=3932477950"
"148","0.324440","172.20.0.4","172.20.0.3","TCP","66","37944  >  8080 [ACK] Seq=156 Ack=217201 Win=343296 Len=0 TSval=3911967396 TSecr=3932477950"
"149","0.324448","172.20.0.3","172.20.0.4","TCP","4410","8080  >  37944 [PSH, ACK] Seq=221545 Ack=156 Win=65024 Len=4344 TSval=3932478000 TSecr=3911967395 [TCP PDU reassembled in 207]"
"150","0.325535","172.20.0.3","172.20.0.4","TCP","4410","8080  >  37944 [PSH, ACK] Seq=225889 Ack=156 Win=65024 Len=4344 TSval=3932478001 TSecr=3911967396 [TCP PDU reassembled in 207]"
"151","0.325566","172.20.0.3","172.20.0.4","TCP","5858","8080  >  37944 [PSH, ACK] Seq=230233 Ack=156 Win=65024 Len=5792 TSval=3932478001 TSecr=3911967396 [TCP PDU reassembled in 207]"
"152","0.325684","172.20.0.3","172.20.0.4","TCP","5858","8080  >  37944 [PSH, ACK] Seq=236025 Ack=156 Win=65024 Len=5792 TSval=3932478001 TSecr=3911967396 [TCP PDU reassembled in 207]"
"153","0.325791","172.20.0.3","172.20.0.4","TCP","5858","8080  >  37944 [PSH, ACK] Seq=241817 Ack=156 Win=65024 Len=5792 TSval=3932478002 TSecr=3911967396 [TCP PDU reassembled in 207]"
"154","0.325814","172.20.0.3","172.20.0.4","TCP","8754","8080  >  37944 [PSH, ACK] Seq=247609 Ack=156 Win=65024 Len=8688 TSval=3932478002 TSecr=3911967396 [TCP PDU reassembled in 207]"
"155","0.325938","172.20.0.3","172.20.0.4","TCP","4410","8080  >  37944 [PSH, ACK] Seq=256297 Ack=156 Win=65024 Len=4344 TSval=3932478002 TSecr=3911967396 [TCP PDU reassembled in 207]"
"156","0.325977","172.20.0.3","172.20.0.4","TCP","8754","8080  >  37944 [PSH, ACK] Seq=260641 Ack=156 Win=65024 Len=8688 TSval=3932478002 TSecr=3911967396 [TCP PDU reassembled in 207]"
"157","0.326008","172.20.0.3","172.20.0.4","TCP","8754","8080  >  37944 [PSH, ACK] Seq=269329 Ack=156 Win=65024 Len=8688 TSval=3932478002 TSecr=3911967396 [TCP PDU reassembled in 207]"
"158","0.326095","172.20.0.3","172.20.0.4","TCP","8754","8080  >  37944 [PSH, ACK] Seq=278017 Ack=156 Win=65024 Len=8688 TSval=3932478002 TSecr=3911967396 [TCP PDU reassembled in 207]"
"159","0.326123","172.20.0.3","172.20.0.4","TCP","8754","8080  >  37944 [PSH, ACK] Seq=286705 Ack=156 Win=65024 Len=8688 TSval=3932478002 TSecr=3911967396 [TCP PDU reassembled in 207]"
"160","0.326220","172.20.0.3","172.20.0.4","TCP","8754","8080  >  37944 [PSH, ACK] Seq=295393 Ack=156 Win=65024 Len=8688 TSval=3932478002 TSecr=3911967396 [TCP PDU reassembled in 207]"
"161","0.326241","172.20.0.3","172.20.0.4","TCP","4410","8080  >  37944 [PSH, ACK] Seq=304081 Ack=156 Win=65024 Len=4344 TSval=3932478002 TSecr=3911967396 [TCP PDU reassembled in 207]"
"162","0.326262","172.20.0.3","172.20.0.4","TCP","8754","8080  >  37944 [PSH, ACK] Seq=308425 Ack=156 Win=65024 Len=8688 TSval=3932478002 TSecr=3911967396 [TCP PDU reassembled in 207]"
"163","0.326339","172.20.0.3","172.20.0.4","TCP","8754","8080  >  37944 [PSH, ACK] Seq=317113 Ack=156 Win=65024 Len=8688 TSval=3932478002 TSecr=3911967396 [TCP PDU reassembled in 207]"
"164","0.326365","172.20.0.3","172.20.0.4","TCP","8754","8080  >  37944 [PSH, ACK] Seq=325801 Ack=156 Win=65024 Len=8688 TSval=3932478002 TSecr=3911967396 [TCP PDU reassembled in 207]"
"165","0.326443","172.20.0.3","172.20.0.4","TCP","8754","8080  >  37944 [PSH, ACK] Seq=334489 Ack=156 Win=65024 Len=8688 TSval=3932478003 TSecr=3911967396 [TCP PDU reassembled in 207]"
"166","0.326469","172.20.0.3","172.20.0.4","TCP","8754","8080  >  37944 [PSH, ACK] Seq=343177 Ack=156 Win=65024 Len=8688 TSval=3932478003 TSecr=3911967396 [TCP PDU reassembled in 207]"
"167","0.326576","172.20.0.3","172.20.0.4","TCP","4410","8080  >  37944 [PSH, ACK] Seq=351865 Ack=156 Win=65024 Len=4344 TSval=3932478003 TSecr=3911967396 [TCP PDU reassembled in 207]"
"168","0.326603","172.20.0.3","172.20.0.4","TCP","8754","8080  >  37944 [PSH, ACK] Seq=356209 Ack=156 Win=65024 Len=8688 TSval=3932478003 TSecr=3911967396 [TCP PDU reassembled in 207]"
"169","0.326624","172.20.0.3","172.20.0.4","TCP","8754","8080  >  37944 [PSH, ACK] Seq=364897 Ack=156 Win=65024 Len=8688 TSval=3932478003 TSecr=3911967396 [TCP PDU reassembled in 207]"
"170","0.326700","172.20.0.3","172.20.0.4","TCP","8754","8080  >  37944 [PSH, ACK] Seq=373585 Ack=156 Win=65024 Len=8688 TSval=3932478003 TSecr=3911967396 [TCP PDU reassembled in 207]"
"171","0.326713","172.20.0.3","172.20.0.4","TCP","8754","8080  >  37944 [PSH, ACK] Seq=382273 Ack=156 Win=65024 Len=8688 TSval=3932478003 TSecr=3911967396 [TCP PDU reassembled in 207]"
"172","0.326762","172.20.0.3","172.20.0.4","TCP","8754","8080  >  37944 [PSH, ACK] Seq=390961 Ack=156 Win=65024 Len=8688 TSval=3932478003 TSecr=3911967396 [TCP PDU reassembled in 207]"
"173","0.326771","172.20.0.3","172.20.0.4","TCP","8754","8080  >  37944 [PSH, ACK] Seq=399649 Ack=156 Win=65024 Len=8688 TSval=3932478003 TSecr=3911967396 [TCP PDU reassembled in 207]"
"174","0.326836","172.20.0.3","172.20.0.4","TCP","8754","8080  >  37944 [PSH, ACK] Seq=408337 Ack=156 Win=65024 Len=8688 TSval=3932478003 TSecr=3911967396 [TCP PDU reassembled in 207]"
"175","0.326845","172.20.0.3","172.20.0.4","TCP","4410","8080  >  37944 [PSH, ACK] Seq=417025 Ack=156 Win=65024 Len=4344 TSval=3932478003 TSecr=3911967396 [TCP PDU reassembled in 207]"
"176","0.326855","172.20.0.3","172.20.0.4","TCP","8754","8080  >  37944 [PSH, ACK] Seq=421369 Ack=156 Win=65024 Len=8688 TSval=3932478003 TSecr=3911967396 [TCP PDU reassembled in 207]"
"177","0.326904","172.20.0.3","172.20.0.4","TCP","8754","8080  >  37944 [PSH, ACK] Seq=430057 Ack=156 Win=65024 Len=8688 TSval=3932478003 TSecr=3911967396 [TCP PDU reassembled in 207]"
"178","0.326914","172.20.0.3","172.20.0.4","TCP","8754","8080  >  37944 [PSH, ACK] Seq=438745 Ack=156 Win=65024 Len=8688 TSval=3932478003 TSecr=3911967396 [TCP PDU reassembled in 207]"
"179","0.326942","172.20.0.3","172.20.0.4","TCP","1514","8080  >  37944 [ACK] Seq=447433 Ack=156 Win=65024 Len=1448 TSval=3932478003 TSecr=3911967396 [TCP PDU reassembled in 207]"
"180","0.374493","172.20.0.4","172.20.0.3","TCP","66","37944  >  8080 [ACK] Seq=156 Ack=221545 Win=357248 Len=0 TSval=3911967446 TSecr=3932478000"
"181","0.374509","172.20.0.4","172.20.0.3","TCP","66","37944  >  8080 [ACK] Seq=156 Ack=225889 Win=365952 Len=0 TSval=3911967447 TSecr=3932478000"
"182","0.374716","172.20.0.3","172.20.0.4","TCP","8754","8080  >  37944 [PSH, ACK] Seq=448881 Ack=156 Win=65024 Len=8688 TSval=3932478051 TSecr=3911967446 [TCP PDU reassembled in 207]"
"183","0.374746","172.20.0.3","172.20.0.4","TCP","8754","8080  >  37944 [PSH, ACK] Seq=457569 Ack=156 Win=65024 Len=8688 TSval=3932478051 TSecr=3911967447 [TCP PDU reassembled in 207]"
"184","0.375686","172.20.0.4","172.20.0.3","TCP","66","37944  >  8080 [ACK] Seq=156 Ack=230233 Win=374656 Len=0 TSval=3911967448 TSecr=3932478001"
"185","0.375692","172.20.0.4","172.20.0.3","TCP","66","37944  >  8080 [ACK] Seq=156 Ack=236025 Win=386176 Len=0 TSval=3911967448 TSecr=3932478001"
"186","0.375844","172.20.0.3","172.20.0.4","TCP","8754","8080  >  37944 [PSH, ACK] Seq=466257 Ack=156 Win=65024 Len=8688 TSval=3932478052 TSecr=3911967448 [TCP PDU reassembled in 207]"
"187","0.375872","172.20.0.4","172.20.0.3","TCP","66","37944  >  8080 [ACK] Seq=156 Ack=241817 Win=397824 Len=0 TSval=3911967448 TSecr=3932478001"
"188","0.375875","172.20.0.4","172.20.0.3","TCP","66","37944  >  8080 [ACK] Seq=156 Ack=247609 Win=409344 Len=0 TSval=3911967448 TSecr=3932478002"
"189","0.375878","172.20.0.4","172.20.0.3","TCP","66","37944  >  8080 [ACK] Seq=156 Ack=256297 Win=426752 Len=0 TSval=3911967448 TSecr=3932478002"
"190","0.375886","172.20.0.3","172.20.0.4","TCP","8754","8080  >  37944 [PSH, ACK] Seq=474945 Ack=156 Win=65024 Len=8688 TSval=3932478052 TSecr=3911967448 [TCP PDU reassembled in 207]"
"191","0.376017","172.20.0.3","172.20.0.4","TCP","2962","8080  >  37944 [PSH, ACK] Seq=483633 Ack=156 Win=65024 Len=2896 TSval=3932478052 TSecr=3911967448 [TCP PDU reassembled in 207]"
"192","0.376038","172.20.0.4","172.20.0.3","TCP","66","37944  >  8080 [ACK] Seq=156 Ack=260641 Win=435456 Len=0 TSval=3911967448 TSecr=3932478002"
"193","0.376040","172.20.0.4","172.20.0.3","TCP","66","37944  >  8080 [ACK] Seq=156 Ack=269329 Win=452864 Len=0 TSval=3911967448 TSecr=3932478002"
"194","0.376043","172.20.0.4","172.20.0.3","TCP","66","37944  >  8080 [ACK] Seq=156 Ack=278017 Win=470144 Len=0 TSval=3911967448 TSecr=3932478002"
"195","0.376152","172.20.0.3","172.20.0.4","TCP","8754","8080  >  37944 [PSH, ACK] Seq=486529 Ack=156 Win=65024 Len=8688 TSval=3932478052 TSecr=3911967448 [TCP PDU reassembled in 207]"
"196","0.376197","172.20.0.4","172.20.0.3","TCP","66","37944  >  8080 [ACK] Seq=156 Ack=286705 Win=487552 Len=0 TSval=3911967448 TSecr=3932478002"
"197","0.376203","172.20.0.4","172.20.0.3","TCP","66","37944  >  8080 [ACK] Seq=156 Ack=295393 Win=504960 Len=0 TSval=3911967448 TSecr=3932478002"
"198","0.376519","172.20.0.3","172.20.0.4","TCP","2962","8080  >  37944 [PSH, ACK] Seq=495217 Ack=156 Win=65024 Len=2896 TSval=3932478053 TSecr=3911967448 [TCP PDU reassembled in 207]"
"199","0.376549","172.20.0.4","172.20.0.3","TCP","66","37944  >  8080 [ACK] Seq=156 Ack=304081 Win=522368 Len=0 TSval=3911967448 TSecr=3932478002"
"200","0.376552","172.20.0.4","172.20.0.3","TCP","66","37944  >  8080 [ACK] Seq=156 Ack=308425 Win=530944 Len=0 TSval=3911967448 TSecr=3932478002"
"201","0.376554","172.20.0.4","172.20.0.3","TCP","66","37944  >  8080 [ACK] Seq=156 Ack=317113 Win=548352 Len=0 TSval=3911967448 TSecr=3932478002"
"202","0.376556","172.20.0.4","172.20.0.3","TCP","66","37944  >  8080 [ACK] Seq=156 Ack=325801 Win=565760 Len=0 TSval=3911967449 TSecr=3932478002"
"203","0.376559","172.20.0.4","172.20.0.3","TCP","66","37944  >  8080 [ACK] Seq=156 Ack=334489 Win=583168 Len=0 TSval=3911967449 TSecr=3932478002"
"204","0.376561","172.20.0.4","172.20.0.3","TCP","66","37944  >  8080 [ACK] Seq=156 Ack=343177 Win=600448 Len=0 TSval=3911967449 TSecr=3932478003"
"205","0.376564","172.20.0.4","172.20.0.3","TCP","66","37944  >  8080 [ACK] Seq=156 Ack=351865 Win=617856 Len=0 TSval=3911967449 TSecr=3932478003"
"206","0.376570","172.20.0.3","172.20.0.4","TCP","10202","8080  >  37944 [PSH, ACK] Seq=498113 Ack=156 Win=65024 Len=10136 TSval=3932478053 TSecr=3911967448 [TCP PDU reassembled in 207]"
"207","0.376852","172.20.0.3","172.20.0.4","HTTP","4001","HTTP/1.1 200 OK "
"208","0.376895","172.20.0.4","172.20.0.3","TCP","66","37944  >  8080 [ACK] Seq=156 Ack=356209 Win=626560 Len=0 TSval=3911967449 TSecr=3932478003"
"209","0.376898","172.20.0.4","172.20.0.3","TCP","66","37944  >  8080 [ACK] Seq=156 Ack=364897 Win=643968 Len=0 TSval=3911967449 TSecr=3932478003"
"210","0.376901","172.20.0.4","172.20.0.3","TCP","66","37944  >  8080 [ACK] Seq=156 Ack=373585 Win=648320 Len=0 TSval=3911967449 TSecr=3932478003"
"211","0.377186","172.20.0.4","172.20.0.3","TCP","66","37944  >  8080 [ACK] Seq=156 Ack=448881 Win=588160 Len=0 TSval=3911967449 TSecr=3932478003"
"212","0.424888","172.20.0.4","172.20.0.3","TCP","66","37944  >  8080 [ACK] Seq=156 Ack=457569 Win=665728 Len=0 TSval=3911967497 TSecr=3932478051"
"213","0.424897","172.20.0.4","172.20.0.3","TCP","66","37944  >  8080 [ACK] Seq=156 Ack=466257 Win=683136 Len=0 TSval=3911967497 TSecr=3932478051"
"214","0.425968","172.20.0.4","172.20.0.3","TCP","66","37944  >  8080 [ACK] Seq=156 Ack=474945 Win=700416 Len=0 TSval=3911967498 TSecr=3932478052"
"215","0.425976","172.20.0.4","172.20.0.3","TCP","66","37944  >  8080 [ACK] Seq=156 Ack=483633 Win=717824 Len=0 TSval=3911967498 TSecr=3932478052"
"216","0.426143","172.20.0.4","172.20.0.3","TCP","66","37944  >  8080 [ACK] Seq=156 Ack=486529 Win=723584 Len=0 TSval=3911967498 TSecr=3932478052"
"217","0.426254","172.20.0.4","172.20.0.3","TCP","66","37944  >  8080 [ACK] Seq=156 Ack=495217 Win=740992 Len=0 TSval=3911967498 TSecr=3932478052"
"218","0.426685","172.20.0.4","172.20.0.3","TCP","66","37944  >  8080 [ACK] Seq=156 Ack=498113 Win=746752 Len=0 TSval=3911967499 TSecr=3932478053"
"219","0.426690","172.20.0.4","172.20.0.3","TCP","66","37944  >  8080 [ACK] Seq=156 Ack=508249 Win=767104 Len=0 TSval=3911967499 TSecr=3932478053"
"220","0.426990","172.20.0.4","172.20.0.3","TCP","66","37944  >  8080 [ACK] Seq=156 Ack=512185 Win=774912 Len=0 TSval=3911967499 TSecr=3932478053"
"221","0.450588","172.20.0.4","172.20.0.3","TCP","66","37944  >  8080 [FIN, ACK] Seq=156 Ack=512185 Win=774912 Len=0 TSval=3911967523 TSecr=3932478053"
"222","0.450751","172.20.0.3","172.20.0.4","TCP","66","8080  >  37944 [ACK] Seq=512185 Ack=157 Win=65024 Len=0 TSval=3932478127 TSecr=3911967523"
"223","2.101302","172.20.0.4","172.20.0.2","DNS","59","DNS Stateful operations (DSO) 0x3931[Malformed Packet]"
"224","2.101898","172.20.0.2","172.20.0.4","DNS","70","DNS Stateful operations (DSO) 0x3931[Malformed Packet]"
"225","2.152656","172.20.0.4","172.20.0.3","TCP","74","37946  >  8080 [SYN] Seq=0 Win=64240 Len=0 MSS=1460 SACK_PERM TSval=3911969225 TSecr=0 WS=128"
"226","2.152885","172.20.0.3","172.20.0.4","TCP","74","8080  >  37946 [SYN, ACK] Seq=0 Ack=1 Win=65160 Len=0 MSS=1460 SACK_PERM TSval=3932479829 TSecr=3911969225 WS=128"
"227","2.203283","172.20.0.4","172.20.0.3","TCP","66","37946  >  8080 [ACK] Seq=1 Ack=1 Win=64256 Len=0 TSval=3911969275 TSecr=3932479829"
"228","2.203296","172.20.0.4","172.20.0.3","HTTP","221","GET /arquivo_500kb.bin HTTP/1.1 "
"229","2.203610","172.20.0.3","172.20.0.4","TCP","66","8080  >  37946 [ACK] Seq=1 Ack=156 Win=65024 Len=0 TSval=3932479880 TSecr=3911969275"
"230","2.219952","172.20.0.3","172.20.0.4","TCP","2962","8080  >  37946 [PSH, ACK] Seq=1 Ack=156 Win=65024 Len=2896 TSval=3932479896 TSecr=3911969275 [TCP PDU reassembled in 425]"
"231","2.220108","172.20.0.3","172.20.0.4","TCP","2962","8080  >  37946 [PSH, ACK] Seq=2897 Ack=156 Win=65024 Len=2896 TSval=3932479896 TSecr=3911969275 [TCP PDU reassembled in 425]"
"232","2.220133","172.20.0.3","172.20.0.4","TCP","2962","8080  >  37946 [PSH, ACK] Seq=5793 Ack=156 Win=65024 Len=2896 TSval=3932479896 TSecr=3911969275 [TCP PDU reassembled in 425]"
"233","2.220154","172.20.0.3","172.20.0.4","TCP","2962","8080  >  37946 [PSH, ACK] Seq=8689 Ack=156 Win=65024 Len=2896 TSval=3932479896 TSecr=3911969275 [TCP PDU reassembled in 425]"
"234","2.220176","172.20.0.3","172.20.0.4","TCP","2962","8080  >  37946 [PSH, ACK] Seq=11585 Ack=156 Win=65024 Len=2896 TSval=3932479896 TSecr=3911969275 [TCP PDU reassembled in 425]"
"235","2.270878","172.20.0.4","172.20.0.3","TCP","66","37946  >  8080 [ACK] Seq=156 Ack=2897 Win=70144 Len=0 TSval=3911969342 TSecr=3932479896"
"236","2.270891","172.20.0.4","172.20.0.3","TCP","66","37946  >  8080 [ACK] Seq=156 Ack=5793 Win=75904 Len=0 TSval=3911969342 TSecr=3932479896"
"237","2.270893","172.20.0.4","172.20.0.3","TCP","66","37946  >  8080 [ACK] Seq=156 Ack=8689 Win=81664 Len=0 TSval=3911969342 TSecr=3932479896"
"238","2.270896","172.20.0.4","172.20.0.3","TCP","66","37946  >  8080 [ACK] Seq=156 Ack=11585 Win=87424 Len=0 TSval=3911969342 TSecr=3932479896"
"239","2.270899","172.20.0.4","172.20.0.3","TCP","66","37946  >  8080 [ACK] Seq=156 Ack=14481 Win=88320 Len=0 TSval=3911969342 TSecr=3932479896"
"240","2.271174","172.20.0.3","172.20.0.4","TCP","2962","8080  >  37946 [PSH, ACK] Seq=14481 Ack=156 Win=65024 Len=2896 TSval=3932479947 TSecr=3911969342 [TCP PDU reassembled in 425]"
"241","2.271297","172.20.0.3","172.20.0.4","TCP","2962","8080  >  37946 [PSH, ACK] Seq=17377 Ack=156 Win=65024 Len=2896 TSval=3932479947 TSecr=3911969342 [TCP PDU reassembled in 425]"
"242","2.271437","172.20.0.3","172.20.0.4","TCP","2962","8080  >  37946 [PSH, ACK] Seq=20273 Ack=156 Win=65024 Len=2896 TSval=3932479948 TSecr=3911969342 [TCP PDU reassembled in 425]"
"243","2.271467","172.20.0.3","172.20.0.4","TCP","2962","8080  >  37946 [PSH, ACK] Seq=23169 Ack=156 Win=65024 Len=2896 TSval=3932479948 TSecr=3911969342 [TCP PDU reassembled in 425]"
