"No.","Time","Source","Destination","Protocol","Length","Info"
"1","0.000000","172.20.0.4","172.20.0.2","DNS","59","Unknown operation (7) 0x3930[Malformed Packet]"
"2","0.000557","172.20.0.2","172.20.0.4","DNS","70","Unknown operation (7) 0x3930[Malformed Packet]"
"3","0.102588","172.20.0.4","172.20.0.3","TCP","74","56682  >  8080 [SYN] Seq=0 Win=64240 Len=0 MSS=1460 SACK_PERM TSval=3912516560 TSecr=0 WS=128"
"4","0.102784","172.20.0.3","172.20.0.4","TCP","74","8080  >  56682 [SYN, ACK] Seq=0 Ack=1 Win=65160 Len=0 MSS=1460 SACK_PERM TSval=3933027215 TSecr=3912516560 WS=128"
"5","0.203741","172.20.0.4","172.20.0.3","TCP","66","56682  >  8080 [ACK] Seq=1 Ack=1 Win=64256 Len=0 TSval=3912516661 TSecr=3933027215"
"6","0.203757","172.20.0.4","172.20.0.3","HTTP","219","GET /arquivo_1mb.bin HTTP/1.1 "
"7","0.204051","172.20.0.3","172.20.0.4","TCP","66","8080  >  56682 [ACK] Seq=1 Ack=154 Win=65024 Len=0 TSval=3933027317 TSecr=3912516662"
"8","0.240864","172.20.0.3","172.20.0.4","TCP","2962","8080  >  56682 [PSH, ACK] Seq=1 Ack=154 Win=65024 Len=2896 TSval=3933027353 TSecr=3912516662 [TCP PDU reassembled in 406]"
"9","0.241137","172.20.0.3","172.20.0.4","TCP","2962","8080  >  56682 [PSH, ACK] Seq=2897 Ack=154 Win=65024 Len=2896 TSval=3933027354 TSecr=3912516662 [TCP PDU reassembled in 406]"
"10","0.241195","172.20.0.3","172.20.0.4","TCP","2962","8080  >  56682 [PSH, ACK] Seq=5793 Ack=154 Win=65024 Len=2896 TSval=3933027354 TSecr=3912516662 [TCP PDU reassembled in 406]"
"11","0.241244","172.20.0.3","172.20.0.4","TCP","2962","8080  >  56682 [PSH, ACK] Seq=8689 Ack=154 Win=65024 Len=2896 TSval=3933027354 TSecr=3912516662 [TCP PDU reassembled in 406]"
"12","0.241294","172.20.0.3","172.20.0.4","TCP","2962","8080  >  56682 [PSH, ACK] Seq=11585 Ack=154 Win=65024 Len=2896 TSval=3933027354 TSecr=3912516662 [TCP PDU reassembled in 406]"
"13","0.341347","172.20.0.4","172.20.0.3","TCP","66","56682  >  8080 [ACK] Seq=154 Ack=2897 Win=70144 Len=0 TSval=3912516799 TSecr=3933027353"
"14","0.341360","172.20.0.4","172.20.0.3","TCP","66","56682  >  8080 [ACK] Seq=154 Ack=5793 Win=75904 Len=0 TSval=3912516800 TSecr=3933027354"
"15","0.341363","172.20.0.4","172.20.0.3","TCP","66","56682  >  8080 [ACK] Seq=154 Ack=8689 Win=81664 Len=0 TSval=3912516800 TSecr=3933027354"
"16","0.341367","172.20.0.4","172.20.0.3","TCP","66","56682  >  8080 [ACK] Seq=154 Ack=14481 Win=93312 Len=0 TSval=3912516800 TSecr=3933027354"
"17","0.341623","172.20.0.3","172.20.0.4","TCP","2962","8080  >  56682 [PSH, ACK] Seq=14481 Ack=154 Win=65024 Len=2896 TSval=3933027454 TSecr=3912516799 [TCP PDU reassembled in 406]"
"18","0.341769","172.20.0.3","172.20.0.4","TCP","2962","8080  >  56682 [PSH, ACK] Seq=17377 Ack=154 Win=65024 Len=2896 TSval=3933027454 TSecr=3912516799 [TCP PDU reassembled in 406]"
"19","0.341904","172.20.0.3","172.20.0.4","TCP","2962","8080  >  56682 [PSH, ACK] Seq=20273 Ack=154 Win=65024 Len=2896 TSval=3933027454 TSecr=3912516800 [TCP PDU reassembled in 406]"
"20","0.341957","172.20.0.3","172.20.0.4","TCP","2962","8080  >  56682 [PSH, ACK] Seq=23169 Ack=154 Win=65024 Len=2896 TSval=3933027454 TSecr=3912516800 [TCP PDU reassembled in 406]"
"21","0.342020","172.20.0.3","172.20.0.4","TCP","2962","8080  >  56682 [PSH, ACK] Seq=26065 Ack=154 Win=65024 Len=2896 TSval=3933027454 TSecr=3912516800 [TCP PDU reassembled in 406]"
"22","0.342068","172.20.0.3","172.20.0.4","TCP","2962","8080  >  56682 [PSH, ACK] Seq=28961 Ack=154 Win=65024 Len=2896 TSval=3933027454 TSecr=3912516800 [TCP PDU reassembled in 406]"
"23","0.342131","172.20.0.3","172.20.0.4","TCP","2962","8080  >  56682 [PSH, ACK] Seq=31857 Ack=154 Win=65024 Len=2896 TSval=3933027454 TSecr=3912516800 [TCP PDU reassembled in 406]"
"24","0.342190","172.20.0.3","172.20.0.4","TCP","2962","8080  >  56682 [PSH, ACK] Seq=34753 Ack=154 Win=65024 Len=2896 TSval=3933027454 TSecr=3912516800 [TCP PDU reassembled in 406]"
"25","0.342252","172.20.0.3","172.20.0.4","TCP","2962","8080  >  56682 [PSH, ACK] Seq=37649 Ack=154 Win=65024 Len=2896 TSval=3933027454 TSecr=3912516800 [TCP PDU reassembled in 406]"
"26","0.342304","172.20.0.3","172.20.0.4","TCP","2962","8080  >  56682 [PSH, ACK] Seq=40545 Ack=154 Win=65024 Len=2896 TSval=3933027454 TSecr=3912516800 [TCP PDU reassembled in 406]"
"27","0.442570","172.20.0.4","172.20.0.3","TCP","66","56682  >  8080 [ACK] Seq=154 Ack=17377 Win=97024 Len=0 TSval=3912516900 TSecr=3933027454"
"28","0.442582","172.20.0.4","172.20.0.3","TCP","66","56682  >  8080 [ACK] Seq=154 Ack=20273 Win=94208 Len=0 TSval=3912516900 TSecr=3933027454"
"29","0.442585","172.20.0.4","172.20.0.3","TCP","66","56682  >  8080 [ACK] Seq=154 Ack=23169 Win=97024 Len=0 TSval=3912516901 TSecr=3933027454"
"30","0.442587","172.20.0.4","172.20.0.3","TCP","66","56682  >  8080 [ACK] Seq=154 Ack=26065 Win=97024 Len=0 TSval=3912516901 TSecr=3933027454"
"31","0.442590","172.20.0.4","172.20.0.3","TCP","66","56682  >  8080 [ACK] Seq=154 Ack=28961 Win=97024 Len=0 TSval=3912516901 TSecr=3933027454"
"32","0.442593","172.20.0.4","172.20.0.3","TCP","66","56682  >  8080 [ACK] Seq=154 Ack=31857 Win=97024 Len=0 TSval=3912516901 TSecr=3933027454"
"33","0.442596","172.20.0.4","172.20.0.3","TCP","66","56682  >  8080 [ACK] Seq=154 Ack=34753 Win=97024 Len=0 TSval=3912516901 TSecr=3933027454"
"34","0.442599","172.20.0.4","172.20.0.3","TCP","66","56682  >  8080 [ACK] Seq=154 Ack=37649 Win=97024 Len=0 TSval=3912516901 TSecr=3933027454"
"35","0.442602","172.20.0.4","172.20.0.3","TCP","66","56682  >  8080 [ACK] Seq=154 Ack=40545 Win=97024 Len=0 TSval=3912516901 TSecr=3933027454"
"36","0.442606","172.20.0.4","172.20.0.3","TCP","66","56682  >  8080 [ACK] Seq=154 Ack=43441 Win=97024 Len=0 TSval=3912516901 TSecr=3933027454"
"37","0.442974","172.20.0.3","172.20.0.4","TCP","2962","8080  >  56682 [PSH, ACK] Seq=43441 Ack=154 Win=65024 Len=2896 TSval=3933027555 TSecr=3912516900 [TCP PDU reassembled in 406]"
"38","0.443118","172.20.0.3","172.20.0.4","TCP","2962","8080  >  56682 [PSH, ACK] Seq=46337 Ack=154 Win=65024 Len=2896 TSval=3933027555 TSecr=3912516900 [TCP PDU reassembled in 406]"
"39","0.443252","172.20.0.3","172.20.0.4","TCP","2962","8080  >  56682 [PSH, ACK] Seq=49233 Ack=154 Win=65024 Len=2896 TSval=3933027556 TSecr=3912516901 [TCP PDU reassembled in 406]"
"40","0.443291","172.20.0.3","172.20.0.4","TCP","2962","8080  >  56682 [PSH, ACK] Seq=52129 Ack=154 Win=65024 Len=2896 TSval=3933027556 TSecr=3912516901 [TCP PDU reassembled in 406]"
"41","0.443327","172.20.0.3","172.20.0.4","TCP","2962","8080  >  56682 [PSH, ACK] Seq=55025 Ack=154 Win=65024 Len=2896 TSval=3933027556 TSecr=3912516901 [TCP PDU reassembled in 406]"
"42","0.443374","172.20.0.3","172.20.0.4","TCP","2962","8080  >  56682 [PSH, ACK] Seq=57921 Ack=154 Win=65024 Len=2896 TSval=3933027556 TSecr=3912516901 [TCP PDU reassembled in 406]"
"43","0.443421","172.20.0.3","172.20.0.4","TCP","2962","8080  >  56682 [PSH, ACK] Seq=60817 Ack=154 Win=65024 Len=2896 TSval=3933027556 TSecr=3912516901 [TCP PDU reassembled in 406]"
"44","0.443470","172.20.0.3","172.20.0.4","TCP","2962","8080  >  56682 [PSH, ACK] Seq=63713 Ack=154 Win=65024 Len=2896 TSval=3933027556 TSecr=3912516901 [TCP PDU reassembled in 406]"
"45","0.443518","172.20.0.3","172.20.0.4","TCP","2962","8080  >  56682 [PSH, ACK] Seq=66609 Ack=154 Win=65024 Len=2896 TSval=3933027556 TSecr=3912516901 [TCP PDU reassembled in 406]"
"46","0.443563","172.20.0.3","172.20.0.4","TCP","2962","8080  >  56682 [PSH, ACK] Seq=69505 Ack=154 Win=65024 Len=2896 TSval=3933027556 TSecr=3912516901 [TCP PDU reassembled in 406]"
"47","0.443607","172.20.0.3","172.20.0.4","TCP","2962","8080  >  56682 [PSH, ACK] Seq=72401 Ack=154 Win=65024 Len=2896 TSval=3933027556 TSecr=3912516901 [TCP PDU reassembled in 406]"
"48","0.443654","172.20.0.3","172.20.0.4","TCP","2962","8080  >  56682 [PSH, ACK] Seq=75297 Ack=154 Win=65024 Len=2896 TSval=3933027556 TSecr=3912516901 [TCP PDU reassembled in 406]"
"49","0.443703","172.20.0.3","172.20.0.4","TCP","2962","8080  >  56682 [PSH, ACK] Seq=78193 Ack=154 Win=65024 Len=2896 TSval=3933027556 TSecr=3912516901 [TCP PDU reassembled in 406]"
"50","0.443765","172.20.0.3","172.20.0.4","TCP","2962","8080  >  56682 [PSH, ACK] Seq=81089 Ack=154 Win=65024 Len=2896 TSval=3933027556 TSecr=3912516901 [TCP PDU reassembled in 406]"
"51","0.443813","172.20.0.3","172.20.0.4","TCP","2962","8080  >  56682 [PSH, ACK] Seq=83985 Ack=154 Win=65024 Len=2896 TSval=3933027556 TSecr=3912516901 [TCP PDU reassembled in 406]"
"52","0.443857","172.20.0.3","172.20.0.4","TCP","2962","8080  >  56682 [PSH, ACK] Seq=86881 Ack=154 Win=65024 Len=2896 TSval=3933027556 TSecr=3912516901 [TCP PDU reassembled in 406]"
"53","0.443910","172.20.0.3","172.20.0.4","TCP","2962","8080  >  56682 [PSH, ACK] Seq=89777 Ack=154 Win=65024 Len=2896 TSval=3933027556 TSecr=3912516901 [TCP PDU reassembled in 406]"
"54","0.443962","172.20.0.3","172.20.0.4","TCP","2962","8080  >  56682 [PSH, ACK] Seq=92673 Ack=154 Win=65024 Len=2896 TSval=3933027556 TSecr=3912516901 [TCP PDU reassembled in 406]"
"55","0.444022","172.20.0.3","172.20.0.4","TCP","2962","8080  >  56682 [PSH, ACK] Seq=95569 Ack=154 Win=65024 Len=2896 TSval=3933027556 TSecr=3912516901 [TCP PDU reassembled in 406]"
"56","0.444070","172.20.0.3","172.20.0.4","TCP","2962","8080  >  56682 [PSH, ACK] Seq=98465 Ack=154 Win=65024 Len=2896 TSval=3933027556 TSecr=3912516901 [TCP PDU reassembled in 406]"
"57","0.543933","172.20.0.4","172.20.0.3","TCP","66","56682  >  8080 [ACK] Seq=154 Ack=46337 Win=97024 Len=0 TSval=3912517002 TSecr=3933027555"
"58","0.543945","172.20.0.4","172.20.0.3","TCP","66","56682  >  8080 [ACK] Seq=154 Ack=49233 Win=94208 Len=0 TSval=3912517002 TSecr=3933027555"
"59","0.543948","172.20.0.4","172.20.0.3","TCP","66","56682  >  8080 [ACK] Seq=154 Ack=52129 Win=102784 Len=0 TSval=3912517002 TSecr=3933027556"
"60","0.543951","172.20.0.4","172.20.0.3","TCP","66","56682  >  8080 [ACK] Seq=154 Ack=55025 Win=108544 Len=0 TSval=3912517002 TSecr=3933027556"
"61","0.543953","172.20.0.4","172.20.0.3","TCP","66","56682  >  8080 [ACK] Seq=154 Ack=57921 Win=114432 Len=0 TSval=3912517002 TSecr=3933027556"
"62","0.543956","172.20.0.4","172.20.0.3","TCP","66","56682  >  8080 [ACK] Seq=154 Ack=60817 Win=120192 Len=0 TSval=3912517002 TSecr=3933027556"
"63","0.543959","172.20.0.4","172.20.0.3","TCP","66","56682  >  8080 [ACK] Seq=154 Ack=63713 Win=125952 Len=0 TSval=3912517002 TSecr=3933027556"
"64","0.543962","172.20.0.4","172.20.0.3","TCP","66","56682  >  8080 [ACK] Seq=154 Ack=69505 Win=137600 Len=0 TSval=3912517002 TSecr=3933027556"
"65","0.543965","172.20.0.4","172.20.0.3","TCP","66","56682  >  8080 [ACK] Seq=154 Ack=72401 Win=143360 Len=0 TSval=3912517002 TSecr=3933027556"
"66","0.543979","172.20.0.4","172.20.0.3","TCP","66","56682  >  8080 [ACK] Seq=154 Ack=75297 Win=149120 Len=0 TSval=3912517002 TSecr=3933027556"
"67","0.543982","172.20.0.4","172.20.0.3","TCP","66","56682  >  8080 [ACK] Seq=154 Ack=78193 Win=154880 Len=0 TSval=3912517002 TSecr=3933027556"
"68","0.543985","172.20.0.4","172.20.0.3","TCP","66","56682  >  8080 [ACK] Seq=154 Ack=81089 Win=160768 Len=0 TSval=3912517002 TSecr=3933027556"
"69","0.543987","172.20.0.4","172.20.0.3","TCP","66","56682  >  8080 [ACK] Seq=154 Ack=83985 Win=166528 Len=0 TSval=3912517002 TSecr=3933027556"
"70","0.544004","172.20.0.4","172.20.0.3","TCP","66","56682  >  8080 [ACK] Seq=154 Ack=86881 Win=172288 Len=0 TSval=3912517002 TSecr=3933027556"
"71","0.544007","172.20.0.4","172.20.0.3","TCP","66","56682  >  8080 [ACK] Seq=154 Ack=89777 Win=178048 Len=0 TSval=3912517002 TSecr=3933027556"
"72","0.544016","172.20.0.4","172.20.0.3","TCP","66","56682  >  8080 [ACK] Seq=154 Ack=95569 Win=186368 Len=0 TSval=3912517003 TSecr=3933027556"
"73","0.544507","172.20.0.3","172.20.0.4","TCP","2962","8080  >  56682 [PSH, ACK] Seq=101361 Ack=154 Win=65024 Len=2896 TSval=3933027657 TSecr=3912517002 [TCP PDU reassembled in 406]"
"74","0.544641","172.20.0.4","172.20.0.3","TCP","66","56682  >  8080 [ACK] Seq=154 Ack=98465 Win=186368 Len=0 TSval=3912517003 TSecr=3933027556"
"75","0.544648","172.20.0.4","172.20.0.3","TCP","66","56682  >  8080 [ACK] Seq=154 Ack=101361 Win=183552 Len=0 TSval=3912517003 TSecr=3933027556"
"76","0.544659","172.20.0.3","172.20.0.4","TCP","2962","8080  >  56682 [PSH, ACK] Seq=104257 Ack=154 Win=65024 Len=2896 TSval=3933027657 TSecr=3912517002 [TCP PDU reassembled in 406]"
"77","0.544804","172.20.0.3","172.20.0.4","TCP","2962","8080  >  56682 [PSH, ACK] Seq=107153 Ack=154 Win=65024 Len=2896 TSval=3933027657 TSecr=3912517003 [TCP PDU reassembled in 406]"
"78","0.544829","172.20.0.3","172.20.0.4","TCP","2962","8080  >  56682 [PSH, ACK] Seq=110049 Ack=154 Win=65024 Len=2896 TSval=3933027657 TSecr=3912517003 [TCP PDU reassembled in 406]"
"79","0.545054","172.20.0.3","172.20.0.4","TCP","2962","8080  >  56682 [PSH, ACK] Seq=112945 Ack=154 Win=65024 Len=2896 TSval=3933027657 TSecr=3912517003 [TCP PDU reassembled in 406]"
"80","0.545081","172.20.0.3","172.20.0.4","TCP","2962","8080  >  56682 [PSH, ACK] Seq=115841 Ack=154 Win=65024 Len=2896 TSval=3933027657 TSecr=3912517003 [TCP PDU reassembled in 406]"
"81","0.545167","172.20.0.3","172.20.0.4","TCP","2962","8080  >  56682 [PSH, ACK] Seq=118737 Ack=154 Win=65024 Len=2896 TSval=3933027658 TSecr=3912517003 [TCP PDU reassembled in 406]"
"82","0.545192","172.20.0.3","172.20.0.4","TCP","2962","8080  >  56682 [PSH, ACK] Seq=121633 Ack=154 Win=65024 Len=2896 TSval=3933027658 TSecr=3912517003 [TCP PDU reassembled in 406]"
"83","0.545268","172.20.0.3","172.20.0.4","TCP","2962","8080  >  56682 [PSH, ACK] Seq=124529 Ack=154 Win=65024 Len=2896 TSval=3933027658 TSecr=3912517003 [TCP PDU reassembled in 406]"
"84","0.545289","172.20.0.3","172.20.0.4","TCP","2962","8080  >  56682 [PSH, ACK] Seq=127425 Ack=154 Win=65024 Len=2896 TSval=3933027658 TSecr=3912517003 [TCP PDU reassembled in 406]"
"85","0.545360","172.20.0.3","172.20.0.4","TCP","2962","8080  >  56682 [PSH, ACK] Seq=130321 Ack=154 Win=65024 Len=2896 TSval=3933027658 TSecr=3912517003 [TCP PDU reassembled in 406]"
"86","0.545380","172.20.0.3","172.20.0.4","TCP","2962","8080  >  56682 [PSH, ACK] Seq=133217 Ack=154 Win=65024 Len=2896 TSval=3933027658 TSecr=3912517003 [TCP PDU reassembled in 406]"
"87","0.545456","172.20.0.3","172.20.0.4","TCP","2962","8080  >  56682 [PSH, ACK] Seq=136113 Ack=154 Win=65024 Len=2896 TSval=3933027658 TSecr=3912517003 [TCP PDU reassembled in 406]"
"88","0.545478","172.20.0.3","172.20.0.4","TCP","2962","8080  >  56682 [PSH, ACK] Seq=139009 Ack=154 Win=65024 Len=2896 TSval=3933027658 TSecr=3912517003 [TCP PDU reassembled in 406]"
"89","0.545679","172.20.0.3","172.20.0.4","TCP","2962","8080  >  56682 [PSH, ACK] Seq=141905 Ack=154 Win=65024 Len=2896 TSval=3933027658 TSecr=3912517003 [TCP PDU reassembled in 406]"
"90","0.545717","172.20.0.3","172.20.0.4","TCP","2962","8080  >  56682 [PSH, ACK] Seq=144801 Ack=154 Win=65024 Len=2896 TSval=3933027658 TSecr=3912517003 [TCP PDU reassembled in 406]"
"91","0.545796","172.20.0.3","172.20.0.4","TCP","2962","8080  >  56682 [PSH, ACK] Seq=147697 Ack=154 Win=65024 Len=2896 TSval=3933027658 TSecr=3912517003 [TCP PDU reassembled in 406]"
"92","0.545817","172.20.0.3","172.20.0.4","TCP","2962","8080  >  56682 [PSH, ACK] Seq=150593 Ack=154 Win=65024 Len=2896 TSval=3933027658 TSecr=3912517003 [TCP PDU reassembled in 406]"
"93","0.545889","172.20.0.3","172.20.0.4","TCP","2962","8080  >  56682 [PSH, ACK] Seq=153489 Ack=154 Win=65024 Len=2896 TSval=3933027658 TSecr=3912517003 [TCP PDU reassembled in 406]"
"94","0.545911","172.20.0.3","172.20.0.4","TCP","2962","8080  >  56682 [PSH, ACK] Seq=156385 Ack=154 Win=65024 Len=2896 TSval=3933027658 TSecr=3912517003 [TCP PDU reassembled in 406]"
"95","0.545980","172.20.0.3","172.20.0.4","TCP","2962","8080  >  56682 [PSH, ACK] Seq=159281 Ack=154 Win=65024 Len=2896 TSval=3933027659 TSecr=3912517003 [TCP PDU reassembled in 406]"
"96","0.546001","172.20.0.3","172.20.0.4","TCP","2962","8080  >  56682 [PSH, ACK] Seq=162177 Ack=154 Win=65024 Len=2896 TSval=3933027659 TSecr=3912517003 [TCP PDU reassembled in 406]"
"97","0.546064","172.20.0.3","172.20.0.4","TCP","2962","8080  >  56682 [PSH, ACK] Seq=165073 Ack=154 Win=65024 Len=2896 TSval=3933027659 TSecr=3912517003 [TCP PDU reassembled in 406]"
"98","0.546087","172.20.0.3","172.20.0.4","TCP","2962","8080  >  56682 [PSH, ACK] Seq=167969 Ack=154 Win=65024 Len=2896 TSval=3933027659 TSecr=3912517003 [TCP PDU reassembled in 406]"
"99","0.546161","172.20.0.3","172.20.0.4","TCP","2962","8080  >  56682 [PSH, ACK] Seq=170865 Ack=154 Win=65024 Len=2896 TSval=3933027659 TSecr=3912517003 [TCP PDU reassembled in 406]"
"100","0.546184","172.20.0.3","172.20.0.4","TCP","2962","8080  >  56682 [PSH, ACK] Seq=173761 Ack=154 Win=65024 Len=2896 TSval=3933027659 TSecr=3912517003 [TCP PDU reassembled in 406]"
"101","0.546260","172.20.0.3","172.20.0.4","TCP","2962","8080  >  56682 [PSH, ACK] Seq=176657 Ack=154 Win=65024 Len=2896 TSval=3933027659 TSecr=3912517003 [TCP PDU reassembled in 406]"
"102","0.546281","172.20.0.3","172.20.0.4","TCP","2962","8080  >  56682 [PSH, ACK] Seq=179553 Ack=154 Win=65024 Len=2896 TSval=3933027659 TSecr=3912517003 [TCP PDU reassembled in 406]"
"103","0.546353","172.20.0.3","172.20.0.4","TCP","2962","8080  >  56682 [PSH, ACK] Seq=182449 Ack=154 Win=65024 Len=2896 TSval=3933027659 TSecr=3912517003 [TCP PDU reassembled in 406]"
"104","0.546387","172.20.0.3","172.20.0.4","TCP","2962","8080  >  56682 [PSH, ACK] Seq=185345 Ack=154 Win=65024 Len=2896 TSval=3933027659 TSecr=3912517003 [TCP PDU reassembled in 406]"
"105","0.546474","172.20.0.3","172.20.0.4","TCP","2962","8080  >  56682 [PSH, ACK] Seq=188241 Ack=154 Win=65024 Len=2896 TSval=3933027659 TSecr=3912517003 [TCP PDU reassembled in 406]"
"106","0.546494","172.20.0.3","172.20.0.4","TCP","2962","8080  >  56682 [PSH, ACK] Seq=191137 Ack=154 Win=65024 Len=2896 TSval=3933027659 TSecr=3912517003 [TCP PDU reassembled in 406]"
"107","0.546567","172.20.0.3","172.20.0.4","TCP","2962","8080  >  56682 [PSH, ACK] Seq=194033 Ack=154 Win=65024 Len=2896 TSval=3933027659 TSecr=3912517003 [TCP PDU reassembled in 406]"
"108","0.547016","172.20.0.3","172.20.0.4","TCP","2962","[TCP Previous segment not captured] 8080  >  56682 [PSH, ACK] Seq=199825 Ack=154 Win=65024 Len=2896 TSval=3933027660 TSecr=3912517003 [TCP PDU reassembled in 406]"
"109","0.548694","172.20.0.3","172.20.0.4","TCP","2962","[TCP Out-Of-Order] 8080  >  56682 [PSH, ACK] Seq=196929 Ack=154 Win=65024 Len=2896 TSval=3933027659 TSecr=3912517003 [TCP PDU reassembled in 406]"
"110","0.552131","172.20.0.3","172.20.0.4","TCP","2962","8080  >  56682 [PSH, ACK] Seq=202721 Ack=154 Win=65024 Len=2896 TSval=3933027660 TSecr=3912517003 [TCP PDU reassembled in 406]"
"111","0.552190","172.20.0.3","172.20.0.4","TCP","2962","8080  >  56682 [PSH, ACK] Seq=205617 Ack=154 Win=65024 Len=2896 TSval=3933027660 TSecr=3912517003 [TCP PDU reassembled in 406]"
"112","0.552235","172.20.0.3","172.20.0.4","TCP","2962","8080  >  56682 [PSH, ACK] Seq=208513 Ack=154 Win=65024 Len=2896 TSval=3933027660 TSecr=3912517003 [TCP PDU reassembled in 406]"
"113","0.552280","172.20.0.3","172.20.0.4","TCP","2962","8080  >  56682 [PSH, ACK] Seq=211409 Ack=154 Win=65024 Len=2896 TSval=3933027660 TSecr=3912517003 [TCP PDU reassembled in 406]"
"114","0.552317","172.20.0.3","172.20.0.4","TCP","2962","8080  >  56682 [PSH, ACK] Seq=214305 Ack=154 Win=65024 Len=2896 TSval=3933027660 TSecr=3912517003 [TCP PDU reassembled in 406]"
"115","0.644778","172.20.0.4","172.20.0.3","TCP","66","56682  >  8080 [ACK] Seq=154 Ack=107153 Win=183552 Len=0 TSval=3912517103 TSecr=3933027657"
"116","0.644998","172.20.0.3","172.20.0.4","TCP","1514","8080  >  56682 [PSH, ACK] Seq=217201 Ack=154 Win=65024 Len=1448 TSval=3933027758 TSecr=3912517103 [TCP PDU reassembled in 406]"
"117","0.645113","172.20.0.4","172.20.0.3","TCP","66","56682  >  8080 [ACK] Seq=154 Ack=110049 Win=192128 Len=0 TSval=3912517103 TSecr=3933027657"
"118","0.645119","172.20.0.4","172.20.0.3","TCP","66","56682  >  8080 [ACK] Seq=154 Ack=112945 Win=198016 Len=0 TSval=3912517103 TSecr=3933027657"
"119","0.645123","172.20.0.4","172.20.0.3","TCP","66","56682  >  8080 [ACK] Seq=154 Ack=115841 Win=203776 Len=0 TSval=3912517104 TSecr=3933027657"
"120","0.645126","172.20.0.4","172.20.0.3","TCP","66","56682  >  8080 [ACK] Seq=154 Ack=118737 Win=209536 Len=0 TSval=3912517104 TSecr=3933027657"
"121","0.645135","172.20.0.3","172.20.0.4","TCP","2962","8080  >  56682 [PSH, ACK] Seq=218649 Ack=154 Win=65024 Len=2896 TSval=3933027758 TSecr=3912517103 [TCP PDU reassembled in 406]"
"122","0.645163","172.20.0.3","172.20.0.4","TCP","2962","8080  >  56682 [PSH, ACK] Seq=221545 Ack=154 Win=65024 Len=2896 TSval=3933027758 TSecr=3912517103 [TCP PDU reassembled in 406]"
"123","0.645494","172.20.0.3","172.20.0.4","TCP","2962","8080  >  56682 [PSH, ACK] Seq=224441 Ack=154 Win=65024 Len=2896 TSval=3933027758 TSecr=3912517103 [TCP PDU reassembled in 406]"
"124","0.645535","172.20.0.4","172.20.0.3","TCP","66","56682  >  8080 [ACK] Seq=154 Ack=124529 Win=221184 Len=0 TSval=3912517104 TSecr=3933027658"
"125","0.645539","172.20.0.4","172.20.0.3","TCP","66","56682  >  8080 [ACK] Seq=154 Ack=127425 Win=226944 Len=0 TSval=3912517104 TSecr=3933027658"
"126","0.645542","172.20.0.4","172.20.0.3","TCP","66","56682  >  8080 [ACK] Seq=154 Ack=130321 Win=232704 Len=0 TSval=3912517104 TSecr=3933027658"
"127","0.645546","172.20.0.4","172.20.0.3","TCP","66","56682  >  8080 [ACK] Seq=154 Ack=133217 Win=238464 Len=0 TSval=3912517104 TSecr=3933027658"
"128","0.645549","172.20.0.4","172.20.0.3","TCP","66","56682  >  8080 [ACK] Seq=154 Ack=136113 Win=244352 Len=0 TSval=3912517104 TSecr=3933027658"
"129","0.645552","172.20.0.4","172.20.0.3","TCP","66","56682  >  8080 [ACK] Seq=154 Ack=139009 Win=250112 Len=0 TSval=3912517104 TSecr=3933027658"
"130","0.645555","172.20.0.4","172.20.0.3","TCP","66","56682  >  8080 [ACK] Seq=154 Ack=141905 Win=255872 Len=0 TSval=3912517104 TSecr=3933027658"
"131","0.645563","172.20.0.3","172.20.0.4","TCP","2962","8080  >  56682 [PSH, ACK] Seq=227337 Ack=154 Win=65024 Len=2896 TSval=3933027758 TSecr=3912517103 [TCP PDU reassembled in 406]"
"132","0.645569","172.20.0.3","172.20.0.4","TCP","2962","8080  >  56682 [PSH, ACK] Seq=230233 Ack=154 Win=65024 Len=2896 TSval=3933027758 TSecr=3912517104 [TCP PDU reassembled in 406]"
"133","0.645614","172.20.0.3","172.20.0.4","TCP","2962","8080  >  56682 [PSH, ACK] Seq=233129 Ack=154 Win=65024 Len=2896 TSval=3933027758 TSecr=3912517104 [TCP PDU reassembled in 406]"
"134","0.645648","172.20.0.3","172.20.0.4","TCP","2962","8080  >  56682 [PSH, ACK] Seq=236025 Ack=154 Win=65024 Len=2896 TSval=3933027758 TSecr=3912517104 [TCP PDU reassembled in 406]"
"135","0.645695","172.20.0.3","172.20.0.4","TCP","2962","8080  >  56682 [PSH, ACK] Seq=238921 Ack=154 Win=65024 Len=2896 TSval=3933027758 TSecr=3912517104 [TCP PDU reassembled in 406]"
"136","0.645827","172.20.0.3","172.20.0.4","TCP","2962","8080  >  56682 [PSH, ACK] Seq=241817 Ack=154 Win=65024 Len=2896 TSval=3933027758 TSecr=3912517104 [TCP PDU reassembled in 406]"
"137","0.645829","172.20.0.4","172.20.0.3","TCP","66","56682  >  8080 [ACK] Seq=154 Ack=147697 Win=267520 Len=0 TSval=3912517104 TSecr=3933027658"
"138","0.645844","172.20.0.4","172.20.0.3","TCP","66","56682  >  8080 [ACK] Seq=154 Ack=150593 Win=273280 Len=0 TSval=3912517104 TSecr=3933027658"
"139","0.645847","172.20.0.4","172.20.0.3","TCP","66","56682  >  8080 [ACK] Seq=154 Ack=153489 Win=279040 Len=0 TSval=3912517104 TSecr=3933027658"
"140","0.645893","172.20.0.3","172.20.0.4","TCP","2962","8080  >  56682 [PSH, ACK] Seq=244713 Ack=154 Win=65024 Len=2896 TSval=3933027758 TSecr=3912517104 [TCP PDU reassembled in 406]"
"141","0.645917","172.20.0.4","172.20.0.3","TCP","66","56682  >  8080 [ACK] Seq=154 Ack=156385 Win=284800 Len=0 TSval=3912517105 TSecr=3933027658"
"142","0.645969","172.20.0.4","172.20.0.3","TCP","66","56682  >  8080 [ACK] Seq=154 Ack=159281 Win=290688 Len=0 TSval=3912517105 TSecr=3933027658"
"143","0.645975","172.20.0.3","172.20.0.4","TCP","2962","8080  >  56682 [PSH, ACK] Seq=247609 Ack=154 Win=65024 Len=2896 TSval=3933027758 TSecr=3912517104 [TCP PDU reassembled in 406]"
"144","0.646052","172.20.0.4","172.20.0.3","TCP","66","56682  >  8080 [ACK] Seq=154 Ack=162177 Win=296448 Len=0 TSval=3912517105 TSecr=3933027659"
"145","0.646057","172.20.0.4","172.20.0.3","TCP","66","56682  >  8080 [ACK] Seq=154 Ack=165073 Win=302208 Len=0 TSval=3912517105 TSecr=3933027659"
"146","0.646137","172.20.0.4","172.20.0.3","TCP","66","56682  >  8080 [ACK] Seq=154 Ack=170865 Win=313856 Len=0 TSval=3912517105 TSecr=3933027659"
"147","0.646226","172.20.0.3","172.20.0.4","TCP","2962","8080  >  56682 [PSH, ACK] Seq=250505 Ack=154 Win=65024 Len=2896 TSval=3933027759 TSecr=3912517104 [TCP PDU reassembled in 406]"
"148","0.646262","172.20.0.4","172.20.0.3","TCP","66","56682  >  8080 [ACK] Seq=154 Ack=173761 Win=319616 Len=0 TSval=3912517105 TSecr=3933027659"
"149","0.646267","172.20.0.4","172.20.0.3","TCP","66","56682  >  8080 [ACK] Seq=154 Ack=176657 Win=325376 Len=0 TSval=3912517105 TSecr=3933027659"
"150","0.646342","172.20.0.4","172.20.0.3","TCP","66","56682  >  8080 [ACK] Seq=154 Ack=179553 Win=331136 Len=0 TSval=3912517105 TSecr=3933027659"
"151","0.646348","172.20.0.4","172.20.0.3","TCP","66","56682  >  8080 [ACK] Seq=154 Ack=182449 Win=337024 Len=0 TSval=3912517105 TSecr=3933027659"
"152","0.646369","172.20.0.3","172.20.0.4","TCP","2962","8080  >  56682 [PSH, ACK] Seq=253401 Ack=154 Win=65024 Len=2896 TSval=3933027759 TSecr=3912517104 [TCP PDU reassembled in 406]"
"153","0.646400","172.20.0.4","172.20.0.3","TCP","66","56682  >  8080 [ACK] Seq=154 Ack=185345 Win=342784 Len=0 TSval=3912517105 TSecr=3933027659"
"154","0.646422","172.20.0.4","172.20.0.3","TCP","66","56682  >  8080 [ACK] Seq=154 Ack=188241 Win=348544 Len=0 TSval=3912517105 TSecr=3933027659"
"155","0.646478","172.20.0.3","172.20.0.4","TCP","2962","8080  >  56682 [PSH, ACK] Seq=256297 Ack=154 Win=65024 Len=2896 TSval=3933027759 TSecr=3912517104 [TCP PDU reassembled in 406]"
"156","0.646529","172.20.0.4","172.20.0.3","TCP","66","56682  >  8080 [ACK] Seq=154 Ack=191137 Win=354304 Len=0 TSval=3912517105 TSecr=3933027659"
"157","0.646539","172.20.0.4","172.20.0.3","TCP","66","56682  >  8080 [ACK] Seq=154 Ack=194033 Win=359296 Len=0 TSval=3912517105 TSecr=3933027659"
"158","0.646628","172.20.0.3","172.20.0.4","TCP","2962","8080  >  56682 [PSH, ACK] Seq=259193 Ack=154 Win=65024 Len=2896 TSval=3933027759 TSecr=3912517104 [TCP PDU reassembled in 406]"
"159","0.646678","172.20.0.3","172.20.0.4","TCP","2962","8080  >  56682 [PSH, ACK] Seq=262089 Ack=154 Win=65024 Len=2896 TSval=3933027759 TSecr=3912517104 [TCP PDU reassembled in 406]"
"160","0.646721","172.20.0.3","172.20.0.4","TCP","1514","8080  >  56682 [PSH, ACK] Seq=264985 Ack=154 Win=65024 Len=1448 TSval=3933027759 TSecr=3912517104 [TCP PDU reassembled in 406]"
"161","0.646767","172.20.0.3","172.20.0.4","TCP","2962","8080  >  56682 [PSH, ACK] Seq=266433 Ack=154 Win=65024 Len=2896 TSval=3933027759 TSecr=3912517104 [TCP PDU reassembled in 406]"
"162","0.646812","172.20.0.3","172.20.0.4","TCP","2962","8080  >  56682 [PSH, ACK] Seq=269329 Ack=154 Win=65024 Len=2896 TSval=3933027759 TSecr=3912517104 [TCP PDU reassembled in 406]"
"163","0.646859","172.20.0.3","172.20.0.4","TCP","2962","8080  >  56682 [PSH, ACK] Seq=272225 Ack=154 Win=65024 Len=2896 TSval=3933027759 TSecr=3912517104 [TCP PDU reassembled in 406]"
"164","0.646906","172.20.0.3","172.20.0.4","TCP","2962","8080  >  56682 [PSH, ACK] Seq=275121 Ack=154 Win=65024 Len=2896 TSval=3933027759 TSecr=3912517104 [TCP PDU reassembled in 406]"
"165","0.646955","172.20.0.3","172.20.0.4","TCP","2962","8080  >  56682 [PSH, ACK] Seq=278017 Ack=154 Win=65024 Len=2896 TSval=3933027759 TSecr=3912517104 [TCP PDU reassembled in 406]"
"166","0.647003","172.20.0.3","172.20.0.4","TCP","2962","8080  >  56682 [PSH, ACK] Seq=280913 Ack=154 Win=65024 Len=2896 TSval=3933027759 TSecr=3912517104 [TCP PDU reassembled in 406]"
"167","0.647055","172.20.0.3","172.20.0.4","TCP","2962","8080  >  56682 [PSH, ACK] Seq=283809 Ack=154 Win=65024 Len=2896 TSval=3933027759 TSecr=3912517104 [TCP PDU reassembled in 406]"
"168","0.647197","172.20.0.3","172.20.0.4","TCP","2962","8080  >  56682 [PSH, ACK] Seq=286705 Ack=154 Win=65024 Len=2896 TSval=3933027759 TSecr=3912517104 [TCP PDU reassembled in 406]"
"169","0.647287","172.20.0.3","172.20.0.4","TCP","2962","8080  >  56682 [PSH, ACK] Seq=289601 Ack=154 Win=65024 Len=2896 TSval=3933027759 TSecr=3912517104 [TCP PDU reassembled in 406]"
"170","0.647352","172.20.0.3","172.20.0.4","TCP","2962","8080  >  56682 [PSH, ACK] Seq=292497 Ack=154 Win=65024 Len=2896 TSval=3933027759 TSecr=3912517104 [TCP PDU reassembled in 406]"
"171","0.647407","172.20.0.3","172.20.0.4","TCP","2962","8080  >  56682 [PSH, ACK] Seq=295393 Ack=154 Win=65024 Len=2896 TSval=3933027759 TSecr=3912517104 [TCP PDU reassembled in 406]"
"172","0.647505","172.20.0.3","172.20.0.4","TCP","2962","8080  >  56682 [PSH, ACK] Seq=298289 Ack=154 Win=65024 Len=2896 TSval=3933027760 TSecr=3912517105 [TCP PDU reassembled in 406]"
"173","0.647570","172.20.0.3","172.20.0.4","TCP","2962","8080  >  56682 [PSH, ACK] Seq=301185 Ack=154 Win=65024 Len=2896 TSval=3933027760 TSecr=3912517105 [TCP PDU reassembled in 406]"
"174","0.647631","172.20.0.3","172.20.0.4","TCP","2962","8080  >  56682 [PSH, ACK] Seq=304081 Ack=154 Win=65024 Len=2896 TSval=3933027760 TSecr=3912517105 [TCP PDU reassembled in 406]"
"175","0.647680","172.20.0.3","172.20.0.4","TCP","2962","8080  >  56682 [PSH, ACK] Seq=306977 Ack=154 Win=65024 Len=2896 TSval=3933027760 TSecr=3912517105 [TCP PDU reassembled in 406]"
"176","0.647747","172.20.0.3","172.20.0.4","TCP","2962","8080  >  56682 [PSH, ACK] Seq=309873 Ack=154 Win=65024 Len=2896 TSval=3933027760 TSecr=3912517105 [TCP PDU reassembled in 406]"
"177","0.647810","172.20.0.3","172.20.0.4","TCP","1514","8080  >  56682 [ACK] Seq=312769 Ack=154 Win=65024 Len=1448 TSval=3933027760 TSecr=3912517105 [TCP PDU reassembled in 406]"
"178","0.647885","172.20.0.3","172.20.0.4","TCP","2962","8080  >  56682 [PSH, ACK] Seq=314217 Ack=154 Win=65024 Len=2896 TSval=3933027760 TSecr=3912517105 [TCP PDU reassembled in 406]"
"179","0.648049","172.20.0.3","172.20.0.4","TCP","2962","8080  >  56682 [PSH, ACK] Seq=317113 Ack=154 Win=65024 Len=2896 TSval=3933027760 TSecr=3912517105 [TCP PDU reassembled in 406]"
"180","0.648121","172.20.0.3","172.20.0.4","TCP","2962","8080  >  56682 [PSH, ACK] Seq=320009 Ack=154 Win=65024 Len=2896 TSval=3933027760 TSecr=3912517105 [TCP PDU reassembled in 406]"
"181","0.648158","172.20.0.3","172.20.0.4","TCP","2962","8080  >  56682 [PSH, ACK] Seq=322905 Ack=154 Win=65024 Len=2896 TSval=3933027760 TSecr=3912517105 [TCP PDU reassembled in 406]"
"182","0.648233","172.20.0.3","172.20.0.4","TCP","2962","8080  >  56682 [PSH, ACK] Seq=325801 Ack=154 Win=65024 Len=2896 TSval=3933027761 TSecr=3912517105 [TCP PDU reassembled in 406]"
"183","0.648292","172.20.0.3","172.20.0.4","TCP","2962","8080  >  56682 [PSH, ACK] Seq=328697 Ack=154 Win=65024 Len=2896 TSval=3933027761 TSecr=3912517105 [TCP PDU reassembled in 406]"
"184","0.648361","172.20.0.3","172.20.0.4","TCP","2962","8080  >  56682 [PSH, ACK] Seq=331593 Ack=154 Win=65024 Len=2896 TSval=3933027761 TSecr=3912517105 [TCP PDU reassembled in 406]"
"185","0.648416","172.20.0.3","172.20.0.4","TCP","2962","8080  >  56682 [PSH, ACK] Seq=334489 Ack=154 Win=65024 Len=2896 TSval=3933027761 TSecr=3912517105 [TCP PDU reassembled in 406]"
"186","0.648468","172.20.0.3","172.20.0.4","TCP","2962","8080  >  56682 [PSH, ACK] Seq=337385 Ack=154 Win=65024 Len=2896 TSval=3933027761 TSecr=3912517105 [TCP PDU reassembled in 406]"
"187","0.648551","172.20.0.3","172.20.0.4","TCP","2962","8080  >  56682 [PSH, ACK] Seq=340281 Ack=154 Win=65024 Len=2896 TSval=3933027761 TSecr=3912517105 [TCP PDU reassembled in 406]"
"188","0.648658","172.20.0.3","172.20.0.4","TCP","2962","8080  >  56682 [PSH, ACK] Seq=343177 Ack=154 Win=65024 Len=2896 TSval=3933027761 TSecr=3912517105 [TCP PDU reassembled in 406]"
"189","0.648730","172.20.0.4","172.20.0.3","TCP","66","56682  >  8080 [ACK] Seq=154 Ack=196929 Win=362240 Len=0 TSval=3912517105 TSecr=3933027659"
"190","0.649033","172.20.0.3","172.20.0.4","TCP","2962","8080  >  56682 [PSH, ACK] Seq=346073 Ack=154 Win=65024 Len=2896 TSval=3933027761 TSecr=3912517105 [TCP PDU reassembled in 406]"
"191","0.649213","172.20.0.3","172.20.0.4","TCP","2962","8080  >  56682 [PSH, ACK] Seq=348969 Ack=154 Win=65024 Len=2896 TSval=3933027761 TSecr=3912517105 [TCP PDU reassembled in 406]"
"192","0.649281","172.20.0.3","172.20.0.4","TCP","2962","8080  >  56682 [PSH, ACK] Seq=351865 Ack=154 Win=65024 Len=2896 TSval=3933027761 TSecr=3912517105 [TCP PDU reassembled in 406]"
"193","0.649319","172.20.0.3","172.20.0.4","TCP","2962","8080  >  56682 [PSH, ACK] Seq=354761 Ack=154 Win=65024 Len=2896 TSval=3933027761 TSecr=3912517105 [TCP PDU reassembled in 406]"
"194","0.649370","172.20.0.3","172.20.0.4","TCP","2962","8080  >  56682 [PSH, ACK] Seq=357657 Ack=154 Win=65024 Len=2896 TSval=3933027761 TSecr=3912517105 [TCP PDU reassembled in 406]"
"195","0.649413","172.20.0.3","172.20.0.4","TCP","2962","8080  >  56682 [PSH, ACK] Seq=360553 Ack=154 Win=65024 Len=2896 TSval=3933027761 TSecr=3912517105 [TCP PDU reassembled in 406]"
"196","0.649456","172.20.0.3","172.20.0.4","TCP","2962","8080  >  56682 [PSH, ACK] Seq=363449 Ack=154 Win=65024 Len=2896 TSval=3933027761 TSecr=3912517105 [TCP PDU reassembled in 406]"
"197","0.649492","172.20.0.3","172.20.0.4","TCP","2962","8080  >  56682 [PSH, ACK] Seq=366345 Ack=154 Win=65024 Len=2896 TSval=3933027761 TSecr=3912517105 [TCP PDU reassembled in 406]"
"198","0.649532","172.20.0.3","172.20.0.4","TCP","2962","8080  >  56682 [PSH, ACK] Seq=369241 Ack=154 Win=65024 Len=2896 TSval=3933027761 TSecr=3912517105 [TCP PDU reassembled in 406]"
"199","0.649573","172.20.0.3","172.20.0.4","TCP","2962","8080  >  56682 [PSH, ACK] Seq=372137 Ack=154 Win=65024 Len=2896 TSval=3933027761 TSecr=3912517105 [TCP PDU reassembled in 406]"
"200","0.649611","172.20.0.3","172.20.0.4","TCP","2962","8080  >  56682 [PSH, ACK] Seq=375033 Ack=154 Win=65024 Len=2896 TSval=3933027761 TSecr=3912517105 [TCP PDU reassembled in 406]"
"201","0.649646","172.20.0.3","172.20.0.4","TCP","1514","8080  >  56682 [PSH, ACK] Seq=377929 Ack=154 Win=65024 Len=1448 TSval=3933027761 TSecr=3912517105 [TCP PDU reassembled in 406]"
"202","0.649682","172.20.0.3","172.20.0.4","TCP","2962","8080  >  56682 [PSH, ACK] Seq=379377 Ack=154 Win=65024 Len=2896 TSval=3933027761 TSecr=3912517105 [TCP PDU reassembled in 406]"
"203","0.649721","172.20.0.3","172.20.0.4","TCP","2962","8080  >  56682 [PSH, ACK] Seq=382273 Ack=154 Win=65024 Len=2896 TSval=3933027761 TSecr=3912517105 [TCP PDU reassembled in 406]"
"204","0.649757","172.20.0.3","172.20.0.4","TCP","2962","8080  >  56682 [PSH, ACK] Seq=385169 Ack=154 Win=65024 Len=2896 TSval=3933027761 TSecr=3912517105 [TCP PDU reassembled in 406]"
"205","0.649796","172.20.0.3","172.20.0.4","TCP","2962","8080  >  56682 [PSH, ACK] Seq=388065 Ack=154 Win=65024 Len=2896 TSval=3933027761 TSecr=3912517105 [TCP PDU reassembled in 406]"
"206","0.649900","172.20.0.3","172.20.0.4","TCP","2962","8080  >  56682 [PSH, ACK] Seq=390961 Ack=154 Win=65024 Len=2896 TSval=3933027761 TSecr=3912517105 [TCP PDU reassembled in 406]"
"207","0.649942","172.20.0.3","172.20.0.4","TCP","2962","8080  >  56682 [PSH, ACK] Seq=393857 Ack=154 Win=65024 Len=2896 TSval=3933027761 TSecr=3912517105 [TCP PDU reassembled in 406]"
"208","0.649980","172.20.0.3","172.20.0.4","TCP","2962","8080  >  56682 [PSH, ACK] Seq=396753 Ack=154 Win=65024 Len=2896 TSval=3933027761 TSecr=3912517105 [TCP PDU reassembled in 406]"
"209","0.650016","172.20.0.3","172.20.0.4","TCP","2962","8080  >  56682 [PSH, ACK] Seq=399649 Ack=154 Win=65024 Len=2896 TSval=3933027761 TSecr=3912517105 [TCP PDU reassembled in 406]"
"210","0.650075","172.20.0.3","172.20.0.4","TCP","2962","8080  >  56682 [PSH, ACK] Seq=402545 Ack=154 Win=65024 Len=2896 TSval=3933027763 TSecr=3912517105 [TCP PDU reassembled in 406]"
"211","0.650134","172.20.0.3","172.20.0.4","TCP","2962","8080  >  56682 [PSH, ACK] Seq=405441 Ack=154 Win=65024 Len=2896 TSval=3933027763 TSecr=3912517105 [TCP PDU reassembled in 406]"
"212","0.652184","172.20.0.4","172.20.0.3","TCP","78","[TCP Dup ACK 189#1] 56682  >  8080 [ACK] Seq=154 Ack=196929 Win=362240 Len=0 TSval=3912517111 TSecr=3933027659 SLE=199825 SRE=202721"
"213","0.652200","172.20.0.4","172.20.0.3","TCP","78","[TCP Dup ACK 189#2] 56682  >  8080 [ACK] Seq=154 Ack=196929 Win=362240 Len=0 TSval=3912517111 TSecr=3933027659 SLE=199825 SRE=205617"
"214","0.652509","172.20.0.3","172.20.0.4","TCP","2962","8080  >  56682 [PSH, ACK] Seq=408337 Ack=154 Win=65024 Len=2896 TSval=3933027765 TSecr=3912517111 [TCP PDU reassembled in 406]"
"215","0.652583","172.20.0.4","172.20.0.3","TCP","78","[TCP Dup ACK 189#3] 56682  >  8080 [ACK] Seq=154 Ack=196929 Win=362240 Len=0 TSval=3912517111 TSecr=3933027659 SLE=199825 SRE=208513"
"216","0.652589","172.20.0.4","172.20.0.3","TCP","78","[TCP Dup ACK 189#4] 56682  >  8080 [ACK] Seq=154 Ack=196929 Win=362240 Len=0 TSval=3912517111 TSecr=3933027659 SLE=199825 SRE=211409"
"217","0.652595","172.20.0.4","172.20.0.3","TCP","66","56682  >  8080 [ACK] Seq=154 Ack=217201 Win=347776 Len=0 TSval=3912517111 TSecr=3933027659"
"218","0.652605","172.20.0.3","172.20.0.4","TCP","2962","[TCP Spurious Retransmission] 8080  >  56682 [PSH, ACK] Seq=196929 Ack=154 Win=65024 Len=2896 TSval=3933027765 TSecr=3912517111 [TCP PDU reassembled in 406]"
"219","0.653111","172.20.0.3","172.20.0.4","TCP","1514","8080  >  56682 [ACK] Seq=411233 Ack=154 Win=65024 Len=1448 TSval=3933027765 TSecr=3912517111 [TCP PDU reassembled in 406]"
"220","0.653154","172.20.0.3","172.20.0.4","TCP","2962","8080  >  56682 [PSH, ACK] Seq=412681 Ack=154 Win=65024 Len=2896 TSval=3933027765 TSecr=3912517111 [TCP PDU reassembled in 406]"
"221","0.653176","172.20.0.3","172.20.0.4","TCP","2962","8080  >  56682 [PSH, ACK] Seq=415577 Ack=154 Win=65024 Len=2896 TSval=3933027766 TSecr=3912517111 [TCP PDU reassembled in 406]"
"222","0.653320","172.20.0.3","172.20.0.4","TCP","2962","8080  >  56682 [PSH, ACK] Seq=418473 Ack=154 Win=65024 Len=2896 TSval=3933027766 TSecr=3912517111 [TCP PDU reassembled in 406]"
"223","0.653349","172.20.0.3","172.20.0.4","TCP","2962","8080  >  56682 [PSH, ACK] Seq=421369 Ack=154 Win=65024 Len=2896 TSval=3933027766 TSecr=3912517111 [TCP PDU reassembled in 406]"
"224","0.653450","172.20.0.3","172.20.0.4","TCP","2962","8080  >  56682 [PSH, ACK] Seq=424265 Ack=154 Win=65024 Len=2896 TSval=3933027766 TSecr=3912517111 [TCP PDU reassembled in 406]"
"225","0.653474","172.20.0.3","172.20.0.4","TCP","2962","8080  >  56682 [PSH, ACK] Seq=427161 Ack=154 Win=65024 Len=2896 TSval=3933027766 TSecr=3912517111 [TCP PDU reassembled in 406]"
"226","0.653567","172.20.0.3","172.20.0.4","TCP","2962","8080  >  56682 [PSH, ACK] Seq=430057 Ack=154 Win=65024 Len=2896 TSval=3933027766 TSecr=3912517111 [TCP PDU reassembled in 406]"
"227","0.653595","172.20.0.3","172.20.0.4","TCP","2962","8080  >  56682 [PSH, ACK] Seq=432953 Ack=154 Win=65024 Len=2896 TSval=3933027766 TSecr=3912517111 [TCP PDU reassembled in 406]"
"228","0.653746","172.20.0.3","172.20.0.4","TCP","1514","8080  >  56682 [ACK] Seq=435849 Ack=154 Win=65024 Len=1448 TSval=3933027766 TSecr=3912517111 [TCP PDU reassembled in 406]"
"229","0.745832","172.20.0.4","172.20.0.3","TCP","66","56682  >  8080 [ACK] Seq=154 Ack=218649 Win=368000 Len=0 TSval=3912517204 TSecr=3933027758"
"230","0.745844","172.20.0.4","172.20.0.3","TCP","66","56682  >  8080 [ACK] Seq=154 Ack=221545 Win=373760 Len=0 TSval=3912517204 TSecr=3933027758"
"231","0.745847","172.20.0.4","172.20.0.3","TCP","66","56682  >  8080 [ACK] Seq=154 Ack=224441 Win=379520 Len=0 TSval=3912517204 TSecr=3933027758"
"232","0.745850","172.20.0.4","172.20.0.3","TCP","66","56682  >  8080 [ACK] Seq=154 Ack=227337 Win=385408 Len=0 TSval=3912517204 TSecr=3933027758"
