"No.","Time","Source","Destination","Protocol","Length","Info"
"1","0.000000","172.20.0.4","172.20.0.2","DNS","59","Unknown operation (7) 0x3235[Malformed Packet]"
"2","0.000826","172.20.0.2","172.20.0.4","DNS","70","Unknown operation (7) 0x3235[Malformed Packet]"
"3","0.011979","172.20.0.4","172.20.0.3","TCP","74","36634  >  8080 [SYN] Seq=0 Win=64240 Len=0 MSS=1460 SACK_PERM TSval=3911889937 TSecr=0 WS=128"
"4","0.012218","172.20.0.3","172.20.0.4","TCP","74","8080  >  36634 [SYN, ACK] Seq=0 Ack=1 Win=65160 Len=0 MSS=1460 SACK_PERM TSval=3932400501 TSecr=3911889937 WS=128"
"5","0.022471","172.20.0.4","172.20.0.3","TCP","66","36634  >  8080 [ACK] Seq=1 Ack=1 Win=64256 Len=0 TSval=3911889947 TSecr=3932400501"
"6","0.022774","172.20.0.4","172.20.0.3","HTTP","221","GET /arquivo_500kb.bin HTTP/1.1 "
"7","0.022874","172.20.0.3","172.20.0.4","TCP","66","8080  >  36634 [ACK] Seq=1 Ack=156 Win=65024 Len=0 TSval=3932400512 TSecr=3911889948"
"8","0.054065","172.20.0.3","172.20.0.4","TCP","2962","8080  >  36634 [PSH, ACK] Seq=1 Ack=156 Win=65024 Len=2896 TSval=3932400543 TSecr=3911889948 [TCP PDU reassembled in 93]"
"9","0.054260","172.20.0.3","172.20.0.4","TCP","2962","8080  >  36634 [PSH, ACK] Seq=2897 Ack=156 Win=65024 Len=2896 TSval=3932400543 TSecr=3911889948 [TCP PDU reassembled in 93]"
"10","0.054303","172.20.0.3","172.20.0.4","TCP","2962","8080  >  36634 [PSH, ACK] Seq=5793 Ack=156 Win=65024 Len=2896 TSval=3932400543 TSecr=3911889948 [TCP PDU reassembled in 93]"
"11","0.054338","172.20.0.3","172.20.0.4","TCP","2962","8080  >  36634 [PSH, ACK] Seq=8689 Ack=156 Win=65024 Len=2896 TSval=3932400543 TSecr=3911889948 [TCP PDU reassembled in 93]"
"12","0.054507","172.20.0.3","172.20.0.4","TCP","2962","8080  >  36634 [PSH, ACK] Seq=11585 Ack=156 Win=65024 Len=2896 TSval=3932400543 TSecr=3911889948 [TCP PDU reassembled in 93]"
"13","0.064431","172.20.0.4","172.20.0.3","TCP","66","36634  >  8080 [ACK] Seq=156 Ack=2897 Win=70144 Len=0 TSval=3911889989 TSecr=3932400543"
"14","0.064445","172.20.0.4","172.20.0.3","TCP","66","36634  >  8080 [ACK] Seq=156 Ack=5793 Win=75904 Len=0 TSval=3911889989 TSecr=3932400543"
"15","0.064448","172.20.0.4","172.20.0.3","TCP","66","36634  >  8080 [ACK] Seq=156 Ack=8689 Win=81664 Len=0 TSval=3911889989 TSecr=3932400543"
"16","0.064450","172.20.0.4","172.20.0.3","TCP","66","36634  >  8080 [ACK] Seq=156 Ack=11585 Win=87424 Len=0 TSval=3911889989 TSecr=3932400543"
"17","0.064714","172.20.0.3","172.20.0.4","TCP","2962","8080  >  36634 [PSH, ACK] Seq=14481 Ack=156 Win=65024 Len=2896 TSval=3932400554 TSecr=3911889989 [TCP PDU reassembled in 93]"
"18","0.064843","172.20.0.4","172.20.0.3","TCP","66","36634  >  8080 [ACK] Seq=156 Ack=14481 Win=93312 Len=0 TSval=3911889990 TSecr=3932400543"
"19","0.064855","172.20.0.3","172.20.0.4","TCP","2962","8080  >  36634 [PSH, ACK] Seq=17377 Ack=156 Win=65024 Len=2896 TSval=3932400554 TSecr=3911889989 [TCP PDU reassembled in 93]"
"20","0.065125","172.20.0.3","172.20.0.4","TCP","2962","8080  >  36634 [PSH, ACK] Seq=20273 Ack=156 Win=65024 Len=2896 TSval=3932400554 TSecr=3911889990 [TCP PDU reassembled in 93]"
"21","0.065216","172.20.0.3","172.20.0.4","TCP","4410","[TCP Previous segment not captured] 8080  >  36634 [PSH, ACK] Seq=31857 Ack=156 Win=65024 Len=4344 TSval=3932400554 TSecr=3911889990 [TCP PDU reassembled in 93]"
"22","0.065239","172.20.0.3","172.20.0.4","TCP","4410","[TCP Out-Of-Order] 8080  >  36634 [PSH, ACK] Seq=23169 Ack=156 Win=65024 Len=4344 TSval=3932400554 TSecr=3911889990 [TCP PDU reassembled in 93]"
"23","0.065270","172.20.0.3","172.20.0.4","TCP","4410","[TCP Out-Of-Order] 8080  >  36634 [PSH, ACK] Seq=27513 Ack=156 Win=65024 Len=4344 TSval=3932400554 TSecr=3911889990 [TCP PDU reassembled in 93]"
"24","0.065278","172.20.0.3","172.20.0.4","TCP","4410","8080  >  36634 [PSH, ACK] Seq=36201 Ack=156 Win=65024 Len=4344 TSval=3932400554 TSecr=3911889990 [TCP PDU reassembled in 93]"
"25","0.065325","172.20.0.3","172.20.0.4","TCP","2962","8080  >  36634 [PSH, ACK] Seq=40545 Ack=156 Win=65024 Len=2896 TSval=3932400554 TSecr=3911889990 [TCP PDU reassembled in 93]"
"26","0.074998","172.20.0.4","172.20.0.3","TCP","66","36634  >  8080 [ACK] Seq=156 Ack=17377 Win=97024 Len=0 TSval=3911890000 TSecr=3932400554"
"27","0.075019","172.20.0.4","172.20.0.3","TCP","66","36634  >  8080 [ACK] Seq=156 Ack=20273 Win=94208 Len=0 TSval=3911890000 TSecr=3932400554"
"28","0.075270","172.20.0.3","172.20.0.4","TCP","2962","8080  >  36634 [PSH, ACK] Seq=43441 Ack=156 Win=65024 Len=2896 TSval=3932400564 TSecr=3911890000 [TCP PDU reassembled in 93]"
"29","0.075418","172.20.0.4","172.20.0.3","TCP","66","36634  >  8080 [ACK] Seq=156 Ack=23169 Win=97024 Len=0 TSval=3911890000 TSecr=3932400554"
"30","0.075423","172.20.0.4","172.20.0.3","TCP","78","[TCP Dup ACK 29#1] 36634  >  8080 [ACK] Seq=156 Ack=23169 Win=97024 Len=0 TSval=3911890000 TSecr=3932400554 SLE=31857 SRE=36201"
"31","0.075426","172.20.0.4","172.20.0.3","TCP","78","36634  >  8080 [ACK] Seq=156 Ack=27513 Win=92800 Len=0 TSval=3911890000 TSecr=3932400554 SLE=31857 SRE=36201"
"32","0.075430","172.20.0.4","172.20.0.3","TCP","66","36634  >  8080 [ACK] Seq=156 Ack=36201 Win=87936 Len=0 TSval=3911890000 TSecr=3932400554"
"33","0.075433","172.20.0.4","172.20.0.3","TCP","66","36634  >  8080 [ACK] Seq=156 Ack=40545 Win=83968 Len=0 TSval=3911890000 TSecr=3932400554"
"34","0.075436","172.20.0.4","172.20.0.3","TCP","66","36634  >  8080 [ACK] Seq=156 Ack=43441 Win=89088 Len=0 TSval=3911890000 TSecr=3932400554"
"35","0.075446","172.20.0.3","172.20.0.4","TCP","5858","8080  >  36634 [PSH, ACK] Seq=46337 Ack=156 Win=65024 Len=5792 TSval=3932400564 TSecr=3911890000 [TCP PDU reassembled in 93]"
"36","0.075853","172.20.0.3","172.20.0.4","TCP","5858","8080  >  36634 [PSH, ACK] Seq=52129 Ack=156 Win=65024 Len=5792 TSval=3932400565 TSecr=3911890000 [TCP PDU reassembled in 93]"
"37","0.075935","172.20.0.3","172.20.0.4","TCP","1514","8080  >  36634 [ACK] Seq=57921 Ack=156 Win=65024 Len=1448 TSval=3932400565 TSecr=3911890000 [TCP PDU reassembled in 93]"
"38","0.075950","172.20.0.3","172.20.0.4","TCP","2962","[TCP Spurious Retransmission] 8080  >  36634 [PSH, ACK] Seq=23169 Ack=156 Win=65024 Len=2896 TSval=3932400565 TSecr=3911890000 [TCP PDU reassembled in 93]"
"39","0.075999","172.20.0.3","172.20.0.4","TCP","8754","8080  >  36634 [PSH, ACK] Seq=59369 Ack=156 Win=65024 Len=8688 TSval=3932400565 TSecr=3911890000 [TCP PDU reassembled in 93]"
"40","0.076068","172.20.0.3","172.20.0.4","TCP","8754","8080  >  36634 [PSH, ACK] Seq=68057 Ack=156 Win=65024 Len=8688 TSval=3932400565 TSecr=3911890000 [TCP PDU reassembled in 93]"
"41","0.076095","172.20.0.3","172.20.0.4","TCP","1514","8080  >  36634 [PSH, ACK] Seq=76745 Ack=156 Win=65024 Len=1448 TSval=3932400565 TSecr=3911890000 [TCP PDU reassembled in 93]"
"42","0.076124","172.20.0.3","172.20.0.4","TCP","8754","8080  >  36634 [PSH, ACK] Seq=78193 Ack=156 Win=65024 Len=8688 TSval=3932400565 TSecr=3911890000 [TCP PDU reassembled in 93]"
"43","0.076161","172.20.0.3","172.20.0.4","TCP","8754","8080  >  36634 [PSH, ACK] Seq=86881 Ack=156 Win=65024 Len=8688 TSval=3932400565 TSecr=3911890000 [TCP PDU reassembled in 93]"
"44","0.076194","172.20.0.3","172.20.0.4","TCP","1514","8080  >  36634 [ACK] Seq=95569 Ack=156 Win=65024 Len=1448 TSval=3932400565 TSecr=3911890000 [TCP PDU reassembled in 93]"
"45","0.085591","172.20.0.4","172.20.0.3","TCP","66","36634  >  8080 [ACK] Seq=156 Ack=46337 Win=97024 Len=0 TSval=3911890010 TSecr=3932400564"
"46","0.085602","172.20.0.4","172.20.0.3","TCP","66","36634  >  8080 [ACK] Seq=156 Ack=52129 Win=91904 Len=0 TSval=3911890011 TSecr=3932400564"
"47","0.085806","172.20.0.3","172.20.0.4","TCP","5858","8080  >  36634 [PSH, ACK] Seq=97017 Ack=156 Win=65024 Len=5792 TSval=3932400575 TSecr=3911890010 [TCP PDU reassembled in 93]"
"48","0.085917","172.20.0.3","172.20.0.4","TCP","10202","8080  >  36634 [PSH, ACK] Seq=102809 Ack=156 Win=65024 Len=10136 TSval=3932400575 TSecr=3911890011 [TCP PDU reassembled in 93]"
"49","0.085974","172.20.0.4","172.20.0.3","TCP","66","36634  >  8080 [ACK] Seq=156 Ack=57921 Win=108544 Len=0 TSval=3911890011 TSecr=3932400565"
"50","0.085984","172.20.0.4","172.20.0.3","TCP","66","36634  >  8080 [ACK] Seq=156 Ack=59369 Win=111488 Len=0 TSval=3911890011 TSecr=3932400565"
"51","0.085986","172.20.0.4","172.20.0.3","TCP","78","[TCP Dup ACK 50#1] 36634  >  8080 [ACK] Seq=156 Ack=59369 Win=111488 Len=0 TSval=3911890011 TSecr=3932400565 SLE=23169 SRE=26065"
"52","0.086098","172.20.0.3","172.20.0.4","TCP","11650","8080  >  36634 [PSH, ACK] Seq=112945 Ack=156 Win=65024 Len=11584 TSval=3932400575 TSecr=3911890011 [TCP PDU reassembled in 93]"
"53","0.086121","172.20.0.4","172.20.0.3","TCP","66","36634  >  8080 [ACK] Seq=156 Ack=68057 Win=128896 Len=0 TSval=3911890011 TSecr=3932400565"
"54","0.086133","172.20.0.4","172.20.0.3","TCP","66","36634  >  8080 [ACK] Seq=156 Ack=76745 Win=146304 Len=0 TSval=3911890011 TSecr=3932400565"
"55","0.086148","172.20.0.4","172.20.0.3","TCP","66","36634  >  8080 [ACK] Seq=156 Ack=78193 Win=149120 Len=0 TSval=3911890011 TSecr=3932400565"
"56","0.086155","172.20.0.4","172.20.0.3","TCP","66","36634  >  8080 [ACK] Seq=156 Ack=86881 Win=158720 Len=0 TSval=3911890011 TSecr=3932400565"
"57","0.086408","172.20.0.3","172.20.0.4","TCP","14546","8080  >  36634 [PSH, ACK] Seq=124529 Ack=156 Win=65024 Len=14480 TSval=3932400575 TSecr=3911890011 [TCP PDU reassembled in 93]"
"58","0.086469","172.20.0.4","172.20.0.3","TCP","66","36634  >  8080 [ACK] Seq=156 Ack=95569 Win=151424 Len=0 TSval=3911890011 TSecr=3932400565"
"59","0.086473","172.20.0.4","172.20.0.3","TCP","66","36634  >  8080 [ACK] Seq=156 Ack=97017 Win=156544 Len=0 TSval=3911890011 TSecr=3932400565"
"60","0.086484","172.20.0.3","172.20.0.4","TCP","15994","8080  >  36634 [PSH, ACK] Seq=139009 Ack=156 Win=65024 Len=15928 TSval=3932400575 TSecr=3911890011 [TCP PDU reassembled in 93]"
"61","0.086514","172.20.0.3","172.20.0.4","TCP","15994","8080  >  36634 [PSH, ACK] Seq=154937 Ack=156 Win=65024 Len=15928 TSval=3932400575 TSecr=3911890011 [TCP PDU reassembled in 93]"
"62","0.086621","172.20.0.3","172.20.0.4","TCP","18890","8080  >  36634 [PSH, ACK] Seq=170865 Ack=156 Win=65024 Len=18824 TSval=3932400576 TSecr=3911890011 [TCP PDU reassembled in 93]"
"63","0.086641","172.20.0.3","172.20.0.4","TCP","14546","8080  >  36634 [PSH, ACK] Seq=189689 Ack=156 Win=65024 Len=14480 TSval=3932400576 TSecr=3911890011 [TCP PDU reassembled in 93]"
"64","0.096090","172.20.0.4","172.20.0.3","TCP","66","36634  >  8080 [ACK] Seq=156 Ack=102809 Win=170240 Len=0 TSval=3911890021 TSecr=3932400575"
"65","0.096105","172.20.0.4","172.20.0.3","TCP","66","36634  >  8080 [ACK] Seq=156 Ack=112945 Win=175744 Len=0 TSval=3911890021 TSecr=3932400575"
"66","0.096356","172.20.0.3","172.20.0.4","TCP","11650","8080  >  36634 [PSH, ACK] Seq=204169 Ack=156 Win=65024 Len=11584 TSval=3932400585 TSecr=3911890021 [TCP PDU reassembled in 93]"
"67","0.096486","172.20.0.4","172.20.0.3","TCP","66","36634  >  8080 [ACK] Seq=156 Ack=124529 Win=198912 Len=0 TSval=3911890021 TSecr=3932400575"
"68","0.096490","172.20.0.4","172.20.0.3","TCP","66","36634  >  8080 [ACK] Seq=156 Ack=139009 Win=227840 Len=0 TSval=3911890022 TSecr=3932400575"
"69","0.096498","172.20.0.3","172.20.0.4","TCP","2962","8080  >  36634 [PSH, ACK] Seq=215753 Ack=156 Win=65024 Len=2896 TSval=3932400585 TSecr=3911890021 [TCP PDU reassembled in 93]"
"70","0.096538","172.20.0.4","172.20.0.3","TCP","66","36634  >  8080 [ACK] Seq=156 Ack=154937 Win=259712 Len=0 TSval=3911890022 TSecr=3932400575"
"71","0.096541","172.20.0.4","172.20.0.3","TCP","66","36634  >  8080 [ACK] Seq=156 Ack=170865 Win=291584 Len=0 TSval=3911890022 TSecr=3932400575"
"72","0.096712","172.20.0.3","172.20.0.4","TCP","24682","8080  >  36634 [PSH, ACK] Seq=218649 Ack=156 Win=65024 Len=24616 TSval=3932400586 TSecr=3911890021 [TCP PDU reassembled in 93]"
"73","0.096744","172.20.0.4","172.20.0.3","TCP","66","36634  >  8080 [ACK] Seq=156 Ack=189689 Win=307584 Len=0 TSval=3911890022 TSecr=3932400576"
"74","0.096747","172.20.0.4","172.20.0.3","TCP","66","36634  >  8080 [ACK] Seq=156 Ack=204169 Win=295808 Len=0 TSval=3911890022 TSecr=3932400576"
"75","0.096822","172.20.0.3","172.20.0.4","TCP","23234","8080  >  36634 [PSH, ACK] Seq=243265 Ack=156 Win=65024 Len=23168 TSval=3932400586 TSecr=3911890022 [TCP PDU reassembled in 93]"
"76","0.096857","172.20.0.3","172.20.0.4","TCP","30474","8080  >  36634 [PSH, ACK] Seq=266433 Ack=156 Win=65024 Len=30408 TSval=3932400586 TSecr=3911890022 [TCP PDU reassembled in 93]"
"77","0.096966","172.20.0.3","172.20.0.4","TCP","17442","8080  >  36634 [PSH, ACK] Seq=296841 Ack=156 Win=65024 Len=17376 TSval=3932400586 TSecr=3911890022 [TCP PDU reassembled in 93]"
"78","0.096996","172.20.0.3","172.20.0.4","TCP","36266","8080  >  36634 [PSH, ACK] Seq=314217 Ack=156 Win=65024 Len=36200 TSval=3932400586 TSecr=3911890022 [TCP PDU reassembled in 93]"
"79","0.097018","172.20.0.3","172.20.0.4","TCP","29026","8080  >  36634 [PSH, ACK] Seq=350417 Ack=156 Win=65024 Len=28960 TSval=3932400586 TSecr=3911890022 [TCP PDU reassembled in 93]"
"80","0.097092","172.20.0.3","172.20.0.4","TCP","39162","8080  >  36634 [PSH, ACK] Seq=379377 Ack=156 Win=65024 Len=39096 TSval=3932400586 TSecr=3911890022 [TCP PDU reassembled in 93]"
"81","0.106608","172.20.0.4","172.20.0.3","TCP","66","36634  >  8080 [ACK] Seq=156 Ack=215753 Win=330752 Len=0 TSval=3911890031 TSecr=3932400585"
"82","0.106620","172.20.0.4","172.20.0.3","TCP","66","36634  >  8080 [ACK] Seq=156 Ack=218649 Win=336512 Len=0 TSval=3911890032 TSecr=3932400585"
"83","0.106848","172.20.0.3","172.20.0.4","TCP","23234","8080  >  36634 [PSH, ACK] Seq=418473 Ack=156 Win=65024 Len=23168 TSval=3932400596 TSecr=3911890031 [TCP PDU reassembled in 93]"
"84","0.106889","172.20.0.4","172.20.0.3","TCP","66","36634  >  8080 [ACK] Seq=156 Ack=243265 Win=385664 Len=0 TSval=3911890032 TSecr=3932400586"
"85","0.106891","172.20.0.4","172.20.0.3","TCP","66","36634  >  8080 [ACK] Seq=156 Ack=266433 Win=432000 Len=0 TSval=3911890032 TSecr=3932400586"
"86","0.106893","172.20.0.4","172.20.0.3","TCP","66","36634  >  8080 [ACK] Seq=156 Ack=296841 Win=492928 Len=0 TSval=3911890032 TSecr=3932400586"
"87","0.106899","172.20.0.3","172.20.0.4","TCP","2962","8080  >  36634 [PSH, ACK] Seq=441641 Ack=156 Win=65024 Len=2896 TSval=3932400596 TSecr=3911890032 [TCP PDU reassembled in 93]"
"88","0.107024","172.20.0.3","172.20.0.4","TCP","46402","8080  >  36634 [PSH, ACK] Seq=444537 Ack=156 Win=65024 Len=46336 TSval=3932400596 TSecr=3911890032 [TCP PDU reassembled in 93]"
"89","0.107047","172.20.0.4","172.20.0.3","TCP","66","36634  >  8080 [ACK] Seq=156 Ack=314217 Win=527616 Len=0 TSval=3911890032 TSecr=3932400586"
"90","0.107050","172.20.0.4","172.20.0.3","TCP","66","36634  >  8080 [ACK] Seq=156 Ack=350417 Win=575488 Len=0 TSval=3911890032 TSecr=3932400586"
"91","0.107052","172.20.0.4","172.20.0.3","TCP","66","36634  >  8080 [ACK] Seq=156 Ack=379377 Win=552704 Len=0 TSval=3911890032 TSecr=3932400586"
"92","0.107070","172.20.0.3","172.20.0.4","TCP","18890","8080  >  36634 [PSH, ACK] Seq=490873 Ack=156 Win=65024 Len=18824 TSval=3932400596 TSecr=3911890032 [TCP PDU reassembled in 93]"
"93","0.107153","172.20.0.3","172.20.0.4","HTTP","2553","HTTP/1.1 200 OK "
"94","0.107169","172.20.0.4","172.20.0.3","TCP","66","36634  >  8080 [ACK] Seq=156 Ack=418473 Win=522240 Len=0 TSval=3911890032 TSecr=3932400586"
"95","0.117030","172.20.0.4","172.20.0.3","TCP","66","36634  >  8080 [ACK] Seq=156 Ack=441641 Win=577920 Len=0 TSval=3911890042 TSecr=3932400596"
"96","0.117057","172.20.0.4","172.20.0.3","TCP","66","36634  >  8080 [ACK] Seq=156 Ack=444537 Win=575104 Len=0 TSval=3911890042 TSecr=3932400596"
"97","0.117067","172.20.0.4","172.20.0.3","TCP","66","36634  >  8080 [ACK] Seq=156 Ack=490873 Win=552960 Len=0 TSval=3911890042 TSecr=3932400596"
"98","0.117318","172.20.0.4","172.20.0.3","TCP","66","36634  >  8080 [ACK] Seq=156 Ack=509697 Win=537984 Len=0 TSval=3911890042 TSecr=3932400596"
"99","0.117681","172.20.0.4","172.20.0.3","TCP","66","36634  >  8080 [ACK] Seq=156 Ack=512185 Win=535552 Len=0 TSval=3911890043 TSecr=3932400596"
"100","0.163619","172.20.0.4","172.20.0.3","TCP","66","36634  >  8080 [FIN, ACK] Seq=156 Ack=512185 Win=577920 Len=0 TSval=3911890089 TSecr=3932400596"
"101","0.163791","172.20.0.3","172.20.0.4","TCP","66","8080  >  36634 [ACK] Seq=512185 Ack=157 Win=65024 Len=0 TSval=3932400653 TSecr=3911890089"
"102","1.623558","172.20.0.4","172.20.0.2","DNS","59","Unknown operation (7) 0x3833[Malformed Packet]"
"103","1.625021","172.20.0.2","172.20.0.4","DNS","70","Unknown operation (7) 0x3833[Malformed Packet]"
"104","1.635946","172.20.0.4","172.20.0.3","TCP","74","36636  >  8080 [SYN] Seq=0 Win=64240 Len=0 MSS=1460 SACK_PERM TSval=3911891561 TSecr=0 WS=128"
"105","1.636190","172.20.0.3","172.20.0.4","TCP","74","8080  >  36636 [SYN, ACK] Seq=0 Ack=1 Win=65160 Len=0 MSS=1460 SACK_PERM TSval=3932402125 TSecr=3911891561 WS=128"
"106","1.646429","172.20.0.4","172.20.0.3","TCP","66","36636  >  8080 [ACK] Seq=1 Ack=1 Win=64256 Len=0 TSval=3911891571 TSecr=3932402125"
"107","1.646812","172.20.0.4","172.20.0.3","HTTP","221","GET /arquivo_500kb.bin HTTP/1.1 "
"108","1.646926","172.20.0.3","172.20.0.4","TCP","66","8080  >  36636 [ACK] Seq=1 Ack=156 Win=65024 Len=0 TSval=3932402136 TSecr=3911891572"
"109","1.669718","172.20.0.3","172.20.0.4","TCP","2962","8080  >  36636 [PSH, ACK] Seq=1 Ack=156 Win=65024 Len=2896 TSval=3932402159 TSecr=3911891572 [TCP PDU reassembled in 196]"
"110","1.671167","172.20.0.3","172.20.0.4","TCP","2962","8080  >  36636 [PSH, ACK] Seq=2897 Ack=156 Win=65024 Len=2896 TSval=3932402160 TSecr=3911891572 [TCP PDU reassembled in 196]"
"111","1.671317","172.20.0.3","172.20.0.4","TCP","2962","8080  >  36636 [PSH, ACK] Seq=5793 Ack=156 Win=65024 Len=2896 TSval=3932402160 TSecr=3911891572 [TCP PDU reassembled in 196]"
"112","1.671359","172.20.0.3","172.20.0.4","TCP","2962","8080  >  36636 [PSH, ACK] Seq=8689 Ack=156 Win=65024 Len=2896 TSval=3932402160 TSecr=3911891572 [TCP PDU reassembled in 196]"
"113","1.671394","172.20.0.3","172.20.0.4","TCP","2962","8080  >  36636 [PSH, ACK] Seq=11585 Ack=156 Win=65024 Len=2896 TSval=3932402160 TSecr=3911891572 [TCP PDU reassembled in 196]"
"114","1.681100","172.20.0.4","172.20.0.3","TCP","66","36636  >  8080 [ACK] Seq=156 Ack=2897 Win=70144 Len=0 TSval=3911891605 TSecr=3932402159"
"115","1.681337","172.20.0.3","172.20.0.4","TCP","2962","8080  >  36636 [PSH, ACK] Seq=14481 Ack=156 Win=65024 Len=2896 TSval=3932402170 TSecr=3911891605 [TCP PDU reassembled in 196]"
"116","1.681489","172.20.0.4","172.20.0.3","TCP","66","36636  >  8080 [ACK] Seq=156 Ack=5793 Win=75904 Len=0 TSval=3911891606 TSecr=3932402160"
"117","1.681493","172.20.0.4","172.20.0.3","TCP","66","36636  >  8080 [ACK] Seq=156 Ack=8689 Win=81664 Len=0 TSval=3911891606 TSecr=3932402160"
"118","1.681495","172.20.0.4","172.20.0.3","TCP","66","36636  >  8080 [ACK] Seq=156 Ack=11585 Win=87424 Len=0 TSval=3911891606 TSecr=3932402160"
"119","1.681497","172.20.0.4","172.20.0.3","TCP","66","36636  >  8080 [ACK] Seq=156 Ack=14481 Win=91264 Len=0 TSval=3911891607 TSecr=3932402160"
"120","1.681504","172.20.0.3","172.20.0.4","TCP","2962","8080  >  36636 [PSH, ACK] Seq=17377 Ack=156 Win=65024 Len=2896 TSval=3932402170 TSecr=3911891605 [TCP PDU reassembled in 196]"
"121","1.681680","172.20.0.3","172.20.0.4","TCP","2962","8080  >  36636 [PSH, ACK] Seq=20273 Ack=156 Win=65024 Len=2896 TSval=3932402171 TSecr=3911891606 [TCP PDU reassembled in 196]"
"122","1.681697","172.20.0.3","172.20.0.4","TCP","2962","8080  >  36636 [PSH, ACK] Seq=23169 Ack=156 Win=65024 Len=2896 TSval=3932402171 TSecr=3911891606 [TCP PDU reassembled in 196]"
"123","1.681789","172.20.0.3","172.20.0.4","TCP","2962","8080  >  36636 [PSH, ACK] Seq=26065 Ack=156 Win=65024 Len=2896 TSval=3932402171 TSecr=3911891607 [TCP PDU reassembled in 196]"
"124","1.681884","172.20.0.3","172.20.0.4","TCP","4410","[TCP Previous segment not captured] 8080  >  36636 [PSH, ACK] Seq=37649 Ack=156 Win=65024 Len=4344 TSval=3932402171 TSecr=3911891607 [TCP PDU reassembled in 196]"
"125","1.681923","172.20.0.3","172.20.0.4","TCP","4410","[TCP Out-Of-Order] 8080  >  36636 [PSH, ACK] Seq=28961 Ack=156 Win=65024 Len=4344 TSval=3932402171 TSecr=3911891607 [TCP PDU reassembled in 196]"
"126","1.681947","172.20.0.3","172.20.0.4","TCP","4410","[TCP Out-Of-Order] 8080  >  36636 [PSH, ACK] Seq=33305 Ack=156 Win=65024 Len=4344 TSval=3932402171 TSecr=3911891607 [TCP PDU reassembled in 196]"
"127","1.681957","172.20.0.3","172.20.0.4","TCP","1514","8080  >  36636 [ACK] Seq=41993 Ack=156 Win=65024 Len=1448 TSval=3932402171 TSecr=3911891607 [TCP PDU reassembled in 196]"
"128","1.691661","172.20.0.4","172.20.0.3","TCP","66","36636  >  8080 [ACK] Seq=156 Ack=17377 Win=97024 Len=0 TSval=3911891616 TSecr=3932402170"
"129","1.691677","172.20.0.4","172.20.0.3","TCP","66","36636  >  8080 [ACK] Seq=156 Ack=20273 Win=94208 Len=0 TSval=3911891617 TSecr=3932402170"
"130","1.691939","172.20.0.3","172.20.0.4","TCP","2962","8080  >  36636 [PSH, ACK] Seq=43441 Ack=156 Win=65024 Len=2896 TSval=3932402181 TSecr=3911891616 [TCP PDU reassembled in 196]"
"131","1.692118","172.20.0.4","172.20.0.3","TCP","66","36636  >  8080 [ACK] Seq=156 Ack=23169 Win=97024 Len=0 TSval=3911891617 TSecr=3932402171"
"132","1.692123","172.20.0.4","172.20.0.3","TCP","66","36636  >  8080 [ACK] Seq=156 Ack=26065 Win=97024 Len=0 TSval=3911891617 TSecr=3932402171"
"133","1.692125","172.20.0.4","172.20.0.3","TCP","66","36636  >  8080 [ACK] Seq=156 Ack=28961 Win=97024 Len=0 TSval=3911891617 TSecr=3932402171"
"134","1.692128","172.20.0.4","172.20.0.3","TCP","78","[TCP Dup ACK 133#1] 36636  >  8080 [ACK] Seq=156 Ack=28961 Win=97024 Len=0 TSval=3911891617 TSecr=3932402171 SLE=37649 SRE=41993"
"135","1.692129","172.20.0.4","172.20.0.3","TCP","78","36636  >  8080 [ACK] Seq=156 Ack=33305 Win=92800 Len=0 TSval=3911891617 TSecr=3932402171 SLE=37649 SRE=41993"
"136","1.692132","172.20.0.4","172.20.0.3","TCP","66","36636  >  8080 [ACK] Seq=156 Ack=41993 Win=84992 Len=0 TSval=3911891617 TSecr=3932402171"
"137","1.692135","172.20.0.4","172.20.0.3","TCP","66","36636  >  8080 [ACK] Seq=156 Ack=43441 Win=83584 Len=0 TSval=3911891617 TSecr=3932402171"
"138","1.692143","172.20.0.3","172.20.0.4","TCP","5858","8080  >  36636 [PSH, ACK] Seq=46337 Ack=156 Win=65024 Len=5792 TSval=3932402181 TSecr=3911891617 [TCP PDU reassembled in 196]"
"139","1.692529","172.20.0.3","172.20.0.4","TCP","5858","8080  >  36636 [PSH, ACK] Seq=52129 Ack=156 Win=65024 Len=5792 TSval=3932402181 TSecr=3911891617 [TCP PDU reassembled in 196]"
"140","1.692562","172.20.0.3","172.20.0.4","TCP","7306","8080  >  36636 [PSH, ACK] Seq=57921 Ack=156 Win=65024 Len=7240 TSval=3932402181 TSecr=3911891617 [TCP PDU reassembled in 196]"
"141","1.692580","172.20.0.3","172.20.0.4","TCP","7306","8080  >  36636 [PSH, ACK] Seq=65161 Ack=156 Win=65024 Len=7240 TSval=3932402181 TSecr=3911891617 [TCP PDU reassembled in 196]"
"142","1.692651","172.20.0.3","172.20.0.4","TCP","1514","8080  >  36636 [ACK] Seq=72401 Ack=156 Win=65024 Len=1448 TSval=3932402182 TSecr=3911891617 [TCP PDU reassembled in 196]"
"143","1.692702","172.20.0.3","172.20.0.4","TCP","4410","8080  >  36636 [PSH, ACK] Seq=73849 Ack=156 Win=65024 Len=4344 TSval=3932402182 TSecr=3911891617 [TCP PDU reassembled in 196]"
"144","1.692752","172.20.0.3","172.20.0.4","TCP","8754","8080  >  36636 [PSH, ACK] Seq=78193 Ack=156 Win=65024 Len=8688 TSval=3932402182 TSecr=3911891617 [TCP PDU reassembled in 196]"
"145","1.692799","172.20.0.3","172.20.0.4","TCP","8754","8080  >  36636 [PSH, ACK] Seq=86881 Ack=156 Win=65024 Len=8688 TSval=3932402182 TSecr=3911891617 [TCP PDU reassembled in 196]"
"146","1.692840","172.20.0.3","172.20.0.4","TCP","1514","8080  >  36636 [ACK] Seq=95569 Ack=156 Win=65024 Len=1448 TSval=3932402182 TSecr=3911891617 [TCP PDU reassembled in 196]"
"147","1.702493","172.20.0.4","172.20.0.3","TCP","66","36636  >  8080 [ACK] Seq=156 Ack=46337 Win=97024 Len=0 TSval=3911891627 TSecr=3932402181"
"148","1.702505","172.20.0.4","172.20.0.3","TCP","66","36636  >  8080 [ACK] Seq=156 Ack=52129 Win=91904 Len=0 TSval=3911891627 TSecr=3932402181"
"149","1.702699","172.20.0.3","172.20.0.4","TCP","5858","8080  >  36636 [PSH, ACK] Seq=97017 Ack=156 Win=65024 Len=5792 TSval=3932402192 TSecr=3911891627 [TCP PDU reassembled in 196]"
"150","1.702800","172.20.0.4","172.20.0.3","TCP","66","36636  >  8080 [ACK] Seq=156 Ack=57921 Win=108544 Len=0 TSval=3911891628 TSecr=3932402181"
"151","1.702802","172.20.0.4","172.20.0.3","TCP","66","36636  >  8080 [ACK] Seq=156 Ack=65161 Win=123136 Len=0 TSval=3911891628 TSecr=3932402181"
"152","1.702804","172.20.0.4","172.20.0.3","TCP","66","36636  >  8080 [ACK] Seq=156 Ack=72401 Win=137600 Len=0 TSval=3911891628 TSecr=3932402181"
"153","1.702805","172.20.0.4","172.20.0.3","TCP","66","36636  >  8080 [ACK] Seq=156 Ack=73849 Win=140416 Len=0 TSval=3911891628 TSecr=3932402182"
"154","1.702807","172.20.0.4","172.20.0.3","TCP","66","36636  >  8080 [ACK] Seq=156 Ack=78193 Win=149120 Len=0 TSval=3911891628 TSecr=3932402182"
"155","1.702809","172.20.0.4","172.20.0.3","TCP","66","36636  >  8080 [ACK] Seq=156 Ack=86881 Win=153600 Len=0 TSval=3911891628 TSecr=3932402182"
"156","1.702824","172.20.0.3","172.20.0.4","TCP","10202","8080  >  36636 [PSH, ACK] Seq=102809 Ack=156 Win=65024 Len=10136 TSval=3932402192 TSecr=3911891627 [TCP PDU reassembled in 196]"
"157","1.702840","172.20.0.4","172.20.0.3","TCP","66","36636  >  8080 [ACK] Seq=156 Ack=95569 Win=146304 Len=0 TSval=3911891628 TSecr=3932402182"
"158","1.703054","172.20.0.3","172.20.0.4","TCP","10202","8080  >  36636 [PSH, ACK] Seq=112945 Ack=156 Win=65024 Len=10136 TSval=3932402192 TSecr=3911891628 [TCP PDU reassembled in 196]"
"159","1.703069","172.20.0.4","172.20.0.3","TCP","66","36636  >  8080 [ACK] Seq=156 Ack=97017 Win=144896 Len=0 TSval=3911891628 TSecr=3932402182"
"160","1.703078","172.20.0.3","172.20.0.4","TCP","13098","8080  >  36636 [PSH, ACK] Seq=123081 Ack=156 Win=65024 Len=13032 TSval=3932402192 TSecr=3911891628 [TCP PDU reassembled in 196]"
"161","1.703093","172.20.0.3","172.20.0.4","TCP","14546","8080  >  36636 [PSH, ACK] Seq=136113 Ack=156 Win=65024 Len=14480 TSval=3932402192 TSecr=3911891628 [TCP PDU reassembled in 196]"
"162","1.703211","172.20.0.3","172.20.0.4","TCP","15994","8080  >  36636 [PSH, ACK] Seq=150593 Ack=156 Win=65024 Len=15928 TSval=3932402192 TSecr=3911891628 [TCP PDU reassembled in 196]"
"163","1.703253","172.20.0.3","172.20.0.4","TCP","1514","8080  >  36636 [PSH, ACK] Seq=166521 Ack=156 Win=65024 Len=1448 TSval=3932402192 TSecr=3911891628 [TCP PDU reassembled in 196]"
"164","1.703289","172.20.0.3","172.20.0.4","TCP","18890","8080  >  36636 [PSH, ACK] Seq=167969 Ack=156 Win=65024 Len=18824 TSval=3932402192 TSecr=3911891628 [TCP PDU reassembled in 196]"
"165","1.703385","172.20.0.3","172.20.0.4","TCP","17442","8080  >  36636 [PSH, ACK] Seq=186793 Ack=156 Win=65024 Len=17376 TSval=3932402192 TSecr=3911891628 [TCP PDU reassembled in 196]"
"166","1.712931","172.20.0.4","172.20.0.3","TCP","66","36636  >  8080 [ACK] Seq=156 Ack=102809 Win=165248 Len=0 TSval=3911891638 TSecr=3932402192"
"167","1.712945","172.20.0.4","172.20.0.3","TCP","66","36636  >  8080 [ACK] Seq=156 Ack=112945 Win=175744 Len=0 TSval=3911891638 TSecr=3932402192"
"168","1.713191","172.20.0.3","172.20.0.4","TCP","11650","8080  >  36636 [PSH, ACK] Seq=204169 Ack=156 Win=65024 Len=11584 TSval=3932402202 TSecr=3911891638 [TCP PDU reassembled in 196]"
"169","1.713340","172.20.0.4","172.20.0.3","TCP","66","36636  >  8080 [ACK] Seq=156 Ack=123081 Win=196096 Len=0 TSval=3911891638 TSecr=3932402192"
"170","1.713344","172.20.0.4","172.20.0.3","TCP","66","36636  >  8080 [ACK] Seq=156 Ack=136113 Win=222080 Len=0 TSval=3911891638 TSecr=3932402192"
"171","1.713346","172.20.0.4","172.20.0.3","TCP","66","36636  >  8080 [ACK] Seq=156 Ack=150593 Win=251008 Len=0 TSval=3911891638 TSecr=3932402192"
"172","1.713348","172.20.0.4","172.20.0.3","TCP","66","36636  >  8080 [ACK] Seq=156 Ack=166521 Win=282880 Len=0 TSval=3911891638 TSecr=3932402192"
"173","1.713351","172.20.0.4","172.20.0.3","TCP","66","36636  >  8080 [ACK] Seq=156 Ack=167969 Win=285824 Len=0 TSval=3911891638 TSecr=3932402192"
"174","1.713353","172.20.0.4","172.20.0.3","TCP","66","36636  >  8080 [ACK] Seq=156 Ack=186793 Win=300672 Len=0 TSval=3911891638 TSecr=3932402192"
"175","1.713567","172.20.0.3","172.20.0.4","TCP","24682","8080  >  36636 [PSH, ACK] Seq=215753 Ack=156 Win=65024 Len=24616 TSval=3932402203 TSecr=3911891638 [TCP PDU reassembled in 196]"
"176","1.713597","172.20.0.4","172.20.0.3","TCP","66","36636  >  8080 [ACK] Seq=156 Ack=204169 Win=295168 Len=0 TSval=3911891638 TSecr=3932402192"
"177","1.713713","172.20.0.3","172.20.0.4","TCP","23234","8080  >  36636 [PSH, ACK] Seq=240369 Ack=156 Win=65024 Len=23168 TSval=3932402203 TSecr=3911891638 [TCP PDU reassembled in 196]"
"178","1.713755","172.20.0.3","172.20.0.4","TCP","29026","8080  >  36636 [PSH, ACK] Seq=263537 Ack=156 Win=65024 Len=28960 TSval=3932402203 TSecr=3911891638 [TCP PDU reassembled in 196]"
"179","1.713868","172.20.0.3","172.20.0.4","TCP","18890","8080  >  36636 [PSH, ACK] Seq=292497 Ack=156 Win=65024 Len=18824 TSval=3932402203 TSecr=3911891638 [TCP PDU reassembled in 196]"
"180","1.713904","172.20.0.3","172.20.0.4","TCP","39162","8080  >  36636 [PSH, ACK] Seq=311321 Ack=156 Win=65024 Len=39096 TSval=3932402203 TSecr=3911891638 [TCP PDU reassembled in 196]"
"181","1.713978","172.20.0.3","172.20.0.4","TCP","26130","8080  >  36636 [PSH, ACK] Seq=350417 Ack=156 Win=65024 Len=26064 TSval=3932402203 TSecr=3911891638 [TCP PDU reassembled in 196]"
"182","1.714019","172.20.0.3","172.20.0.4","TCP","39162","8080  >  36636 [PSH, ACK] Seq=376481 Ack=156 Win=65024 Len=39096 TSval=3932402203 TSecr=3911891638 [TCP PDU reassembled in 196]"
"183","1.714056","172.20.0.3","172.20.0.4","TCP","2962","8080  >  36636 [PSH, ACK] Seq=415577 Ack=156 Win=65024 Len=2896 TSval=3932402203 TSecr=3911891638 [TCP PDU reassembled in 196]"
"184","1.723464","172.20.0.4","172.20.0.3","TCP","66","36636  >  8080 [ACK] Seq=156 Ack=215753 Win=323840 Len=0 TSval=3911891648 TSecr=3932402202"
"185","1.723851","172.20.0.3","172.20.0.4","TCP","23234","8080  >  36636 [PSH, ACK] Seq=418473 Ack=156 Win=65024 Len=23168 TSval=3932402213 TSecr=3911891648 [TCP PDU reassembled in 196]"
"186","1.724281","172.20.0.4","172.20.0.3","TCP","66","36636  >  8080 [ACK] Seq=156 Ack=240369 Win=372992 Len=0 TSval=3911891649 TSecr=3932402203"
"187","1.724289","172.20.0.4","172.20.0.3","TCP","66","36636  >  8080 [ACK] Seq=156 Ack=263537 Win=419328 Len=0 TSval=3911891649 TSecr=3932402203"
"188","1.724291","172.20.0.4","172.20.0.3","TCP","66","36636  >  8080 [ACK] Seq=156 Ack=292497 Win=477312 Len=0 TSval=3911891649 TSecr=3932402203"
"189","1.724293","172.20.0.4","172.20.0.3","TCP","66","36636  >  8080 [ACK] Seq=156 Ack=311321 Win=514944 Len=0 TSval=3911891649 TSecr=3932402203"
"190","1.724294","172.20.0.4","172.20.0.3","TCP","66","36636  >  8080 [ACK] Seq=156 Ack=350417 Win=576128 Len=0 TSval=3911891649 TSecr=3932402203"
"191","1.724296","172.20.0.4","172.20.0.3","TCP","66","36636  >  8080 [ACK] Seq=156 Ack=376481 Win=555648 Len=0 TSval=3911891649 TSecr=3932402203"
"192","1.724298","172.20.0.4","172.20.0.3","TCP","66","36636  >  8080 [ACK] Seq=156 Ack=415577 Win=525184 Len=0 TSval=3911891649 TSecr=3932402203"
"193","1.724300","172.20.0.4","172.20.0.3","TCP","66","36636  >  8080 [ACK] Seq=156 Ack=418473 Win=531840 Len=0 TSval=3911891649 TSecr=3932402203"
"194","1.724661","172.20.0.3","172.20.0.4","TCP","44954","8080  >  36636 [PSH, ACK] Seq=441641 Ack=156 Win=65024 Len=44888 TSval=3932402214 TSecr=3911891649 [TCP PDU reassembled in 196]"
"195","1.724703","172.20.0.3","172.20.0.4","TCP","20338","8080  >  36636 [PSH, ACK] Seq=486529 Ack=156 Win=65024 Len=20272 TSval=3932402214 TSecr=3911891649 [TCP PDU reassembled in 196]"
"196","1.724714","172.20.0.3","172.20.0.4","HTTP","5449","HTTP/1.1 200 OK "
"197","1.734430","172.20.0.4","172.20.0.3","TCP","66","36636  >  8080 [ACK] Seq=156 Ack=441641 Win=551168 Len=0 TSval=3911891659 TSecr=3932402213"
"198","1.736125","172.20.0.4","172.20.0.3","TCP","66","36636  >  8080 [ACK] Seq=156 Ack=512185 Win=518144 Len=0 TSval=3911891661 TSecr=3932402214"
"199","1.815916","172.20.0.4","172.20.0.3","TCP","66","36636  >  8080 [FIN, ACK] Seq=156 Ack=512185 Win=576128 Len=0 TSval=3911891741 TSecr=3932402214"
"200","1.816093","172.20.0.3","172.20.0.4","TCP","66","8080  >  36636 [ACK] Seq=512185 Ack=157 Win=65024 Len=0 TSval=3932402305 TSecr=3911891741"
"201","3.370021","172.20.0.4","172.20.0.2","DNS","59","Unknown operation (7) 0x3630[Malformed Packet]"
"202","3.370469","172.20.0.2","172.20.0.4","DNS","70","Unknown operation (7) 0x3630[Malformed Packet]"
"203","3.381058","172.20.0.4","172.20.0.3","TCP","74","36652  >  8080 [SYN] Seq=0 Win=64240 Len=0 MSS=1460 SACK_PERM TSval=3911893306 TSecr=0 WS=128"
"204","3.381274","172.20.0.3","172.20.0.4","TCP","74","8080  >  36652 [SYN, ACK] Seq=0 Ack=1 Win=65160 Len=0 MSS=1460 SACK_PERM TSval=3932403870 TSecr=3911893306 WS=128"
"205","3.391719","172.20.0.4","172.20.0.3","TCP","66","36652  >  8080 [ACK] Seq=1 Ack=1 Win=64256 Len=0 TSval=3911893316 TSecr=3932403870"
"206","3.391733","172.20.0.4","172.20.0.3","HTTP","221","GET /arquivo_500kb.bin HTTP/1.1 "
"207","3.392068","172.20.0.3","172.20.0.4","TCP","66","8080  >  36652 [ACK] Seq=1 Ack=156 Win=65024 Len=0 TSval=3932403881 TSecr=3911893317"
"208","3.409656","172.20.0.3","172.20.0.4","TCP","2962","8080  >  36652 [PSH, ACK] Seq=1 Ack=156 Win=65024 Len=2896 TSval=3932403899 TSecr=3911893317 [TCP PDU reassembled in 287]"
"209","3.409805","172.20.0.3","172.20.0.4","TCP","2962","8080  >  36652 [PSH, ACK] Seq=2897 Ack=156 Win=65024 Len=2896 TSval=3932403899 TSecr=3911893317 [TCP PDU reassembled in 287]"
"210","3.409830","172.20.0.3","172.20.0.4","TCP","2962","8080  >  36652 [PSH, ACK] Seq=5793 Ack=156 Win=65024 Len=2896 TSval=3932403899 TSecr=3911893317 [TCP PDU reassembled in 287]"
"211","3.409852","172.20.0.3","172.20.0.4","TCP","2962","8080  >  36652 [PSH, ACK] Seq=8689 Ack=156 Win=65024 Len=2896 TSval=3932403899 TSecr=3911893317 [TCP PDU reassembled in 287]"
"212","3.409873","172.20.0.3","172.20.0.4","TCP","2962","8080  >  36652 [PSH, ACK] Seq=11585 Ack=156 Win=65024 Len=2896 TSval=3932403899 TSecr=3911893317 [TCP PDU reassembled in 287]"
"213","3.419934","172.20.0.4","172.20.0.3","TCP","66","36652  >  8080 [ACK] Seq=156 Ack=2897 Win=70144 Len=0 TSval=3911893345 TSecr=3932403899"
"214","3.419948","172.20.0.4","172.20.0.3","TCP","66","36652  >  8080 [ACK] Seq=156 Ack=5793 Win=75904 Len=0 TSval=3911893345 TSecr=3932403899"
"215","3.419951","172.20.0.4","172.20.0.3","TCP","66","36652  >  8080 [ACK] Seq=156 Ack=8689 Win=81664 Len=0 TSval=3911893345 TSecr=3932403899"
"216","3.419954","172.20.0.4","172.20.0.3","TCP","66","36652  >  8080 [ACK] Seq=156 Ack=11585 Win=87424 Len=0 TSval=3911893345 TSecr=3932403899"
"217","3.419957","172.20.0.4","172.20.0.3","TCP","66","36652  >  8080 [ACK] Seq=156 Ack=14481 Win=88320 Len=0 TSval=3911893345 TSecr=3932403899"
"218","3.420280","172.20.0.3","172.20.0.4","TCP","2962","8080  >  36652 [PSH, ACK] Seq=14481 Ack=156 Win=65024 Len=2896 TSval=3932403909 TSecr=3911893345 [TCP PDU reassembled in 287]"
"219","3.420446","172.20.0.3","172.20.0.4","TCP","2962","8080  >  36652 [PSH, ACK] Seq=17377 Ack=156 Win=65024 Len=2896 TSval=3932403909 TSecr=3911893345 [TCP PDU reassembled in 287]"
"220","3.420583","172.20.0.3","172.20.0.4","TCP","2962","8080  >  36652 [PSH, ACK] Seq=20273 Ack=156 Win=65024 Len=2896 TSval=3932403910 TSecr=3911893345 [TCP PDU reassembled in 287]"
"221","3.420598","172.20.0.3","172.20.0.4","TCP","4410","8080  >  36652 [PSH, ACK] Seq=23169 Ack=156 Win=65024 Len=4344 TSval=3932403910 TSecr=3911893345 [TCP PDU reassembled in 287]"
"222","3.420610","172.20.0.3","172.20.0.4","TCP","4410","8080  >  36652 [PSH, ACK] Seq=27513 Ack=156 Win=65024 Len=4344 TSval=3932403910 TSecr=3911893345 [TCP PDU reassembled in 287]"
"223","3.420650","172.20.0.3","172.20.0.4","TCP","4410","8080  >  36652 [PSH, ACK] Seq=31857 Ack=156 Win=65024 Len=4344 TSval=3932403910 TSecr=3911893345 [TCP PDU reassembled in 287]"
"224","3.420662","172.20.0.3","172.20.0.4","TCP","4410","8080  >  36652 [PSH, ACK] Seq=36201 Ack=156 Win=65024 Len=4344 TSval=3932403910 TSecr=3911893345 [TCP PDU reassembled in 287]"
"225","3.420687","172.20.0.3","172.20.0.4","TCP","2962","8080  >  36652 [PSH, ACK] Seq=40545 Ack=156 Win=65024 Len=2896 TSval=3932403910 TSecr=3911893345 [TCP PDU reassembled in 287]"
"226","3.430530","172.20.0.4","172.20.0.3","TCP","66","36652  >  8080 [ACK] Seq=156 Ack=17377 Win=94080 Len=0 TSval=3911893355 TSecr=3932403909"
"227","3.430540","172.20.0.4","172.20.0.3","TCP","66","36652  >  8080 [ACK] Seq=156 Ack=20273 Win=94080 Len=0 TSval=3911893356 TSecr=3932403909"
"228","3.430706","172.20.0.3","172.20.0.4","TCP","2962","8080  >  36652 [PSH, ACK] Seq=43441 Ack=156 Win=65024 Len=2896 TSval=3932403920 TSecr=3911893355 [TCP PDU reassembled in 287]"
"229","3.430797","172.20.0.4","172.20.0.3","TCP","66","36652  >  8080 [ACK] Seq=156 Ack=23169 Win=91264 Len=0 TSval=3911893356 TSecr=3932403910"
"230","3.430799","172.20.0.4","172.20.0.3","TCP","66","36652  >  8080 [ACK] Seq=156 Ack=27513 Win=87296 Len=0 TSval=3911893356 TSecr=3932403910"
"231","3.430801","172.20.0.4","172.20.0.3","TCP","66","36652  >  8080 [ACK] Seq=156 Ack=31857 Win=83200 Len=0 TSval=3911893356 TSecr=3932403910"
"232","3.430803","172.20.0.4","172.20.0.3","TCP","66","36652  >  8080 [ACK] Seq=156 Ack=36201 Win=79232 Len=0 TSval=3911893356 TSecr=3932403910"
"233","3.430804","172.20.0.4","172.20.0.3","TCP","66","36652  >  8080 [ACK] Seq=156 Ack=40545 Win=75264 Len=0 TSval=3911893356 TSecr=3932403910"
"234","3.430806","172.20.0.4","172.20.0.3","TCP","66","36652  >  8080 [ACK] Seq=156 Ack=43441 Win=72448 Len=0 TSval=3911893356 TSecr=3932403910"
"235","3.430811","172.20.0.3","172.20.0.4","TCP","5858","8080  >  36652 [PSH, ACK] Seq=46337 Ack=156 Win=65024 Len=5792 TSval=3932403920 TSecr=3911893356 [TCP PDU reassembled in 287]"
"236","3.431019","172.20.0.3","172.20.0.4","TCP","5858","8080  >  36652 [PSH, ACK] Seq=52129 Ack=156 Win=65024 Len=5792 TSval=3932403920 TSecr=3911893356 [TCP PDU reassembled in 287]"
"237","3.431041","172.20.0.3","172.20.0.4","TCP","7306","8080  >  36652 [PSH, ACK] Seq=57921 Ack=156 Win=65024 Len=7240 TSval=3932403920 TSecr=3911893356 [TCP PDU reassembled in 287]"
"238","3.431057","172.20.0.3","172.20.0.4","TCP","7306","8080  >  36652 [PSH, ACK] Seq=65161 Ack=156 Win=65024 Len=7240 TSval=3932403920 TSecr=3911893356 [TCP PDU reassembled in 287]"
"239","3.431164","172.20.0.3","172.20.0.4","TCP","5858","8080  >  36652 [PSH, ACK] Seq=72401 Ack=156 Win=65024 Len=5792 TSval=3932403920 TSecr=3911893356 [TCP PDU reassembled in 287]"
"240","3.431198","172.20.0.3","172.20.0.4","TCP","10202","8080  >  36652 [PSH, ACK] Seq=78193 Ack=156 Win=65024 Len=10136 TSval=3932403920 TSecr=3911893356 [TCP PDU reassembled in 287]"
"241","3.431229","172.20.0.3","172.20.0.4","TCP","10202","8080  >  36652 [PSH, ACK] Seq=88329 Ack=156 Win=65024 Len=10136 TSval=3932403920 TSecr=3911893356 [TCP PDU reassembled in 287]"
"242","3.431259","172.20.0.3","172.20.0.4","TCP","2962","8080  >  36652 [PSH, ACK] Seq=98465 Ack=156 Win=65024 Len=2896 TSval=3932403920 TSecr=3911893356 [TCP PDU reassembled in 287]"
"243","3.440967","172.20.0.4","172.20.0.3","TCP","66","36652  >  8080 [ACK] Seq=156 Ack=46337 Win=97024 Len=0 TSval=3911893366 TSecr=3932403920"
"244","3.440980","172.20.0.4","172.20.0.3","TCP","66","36652  >  8080 [ACK] Seq=156 Ack=52129 Win=91904 Len=0 TSval=3911893366 TSecr=3932403920"
"245","3.441227","172.20.0.3","172.20.0.4","TCP","5858","8080  >  36652 [PSH, ACK] Seq=101361 Ack=156 Win=65024 Len=5792 TSval=3932403930 TSecr=3911893366 [TCP PDU reassembled in 287]"
