"No.","Time","Source","Destination","Protocol","Length","Info"
"1","0.000000","172.20.0.4","172.20.0.2","DNS","59","DNS Stateful operations (DSO) 0x3637[Malformed Packet]"
"2","0.000669","172.20.0.2","172.20.0.4","DNS","70","DNS Stateful operations (DSO) 0x3637[Malformed Packet]"
"3","0.102057","172.20.0.4","172.20.0.3","TCP","74","59108  >  8080 [SYN] Seq=0 Win=64240 Len=0 MSS=1460 SACK_PERM TSval=3912074323 TSecr=0 WS=128"
"4","0.102520","172.20.0.3","172.20.0.4","TCP","74","8080  >  59108 [SYN, ACK] Seq=0 Ack=1 Win=65160 Len=0 MSS=1460 SACK_PERM TSval=3932584977 TSecr=3912074323 WS=128"
"5","0.202736","172.20.0.4","172.20.0.3","TCP","66","59108  >  8080 [ACK] Seq=1 Ack=1 Win=64256 Len=0 TSval=3912074423 TSecr=3932584977"
"6","0.202999","172.20.0.4","172.20.0.3","HTTP","221","GET /arquivo_500kb.bin HTTP/1.1 "
"7","0.203087","172.20.0.3","172.20.0.4","TCP","66","8080  >  59108 [ACK] Seq=1 Ack=156 Win=65024 Len=0 TSval=3932585078 TSecr=3912074424"
"8","0.227205","172.20.0.3","172.20.0.4","TCP","2962","8080  >  59108 [PSH, ACK] Seq=1 Ack=156 Win=65024 Len=2896 TSval=3932585102 TSecr=3912074424 [TCP PDU reassembled in 271]"
"9","0.227380","172.20.0.3","172.20.0.4","TCP","2962","8080  >  59108 [PSH, ACK] Seq=2897 Ack=156 Win=65024 Len=2896 TSval=3932585102 TSecr=3912074424 [TCP PDU reassembled in 271]"
"10","0.227423","172.20.0.3","172.20.0.4","TCP","2962","8080  >  59108 [PSH, ACK] Seq=5793 Ack=156 Win=65024 Len=2896 TSval=3932585102 TSecr=3912074424 [TCP PDU reassembled in 271]"
"11","0.227458","172.20.0.3","172.20.0.4","TCP","2962","8080  >  59108 [PSH, ACK] Seq=8689 Ack=156 Win=65024 Len=2896 TSval=3932585102 TSecr=3912074424 [TCP PDU reassembled in 271]"
"12","0.227492","172.20.0.3","172.20.0.4","TCP","2962","8080  >  59108 [PSH, ACK] Seq=11585 Ack=156 Win=65024 Len=2896 TSval=3932585102 TSecr=3912074424 [TCP PDU reassembled in 271]"
"13","0.328151","172.20.0.4","172.20.0.3","TCP","66","59108  >  8080 [ACK] Seq=156 Ack=2897 Win=70144 Len=0 TSval=3912074548 TSecr=3932585102"
"14","0.328163","172.20.0.4","172.20.0.3","TCP","66","59108  >  8080 [ACK] Seq=156 Ack=5793 Win=75904 Len=0 TSval=3912074548 TSecr=3932585102"
"15","0.328166","172.20.0.4","172.20.0.3","TCP","66","59108  >  8080 [ACK] Seq=156 Ack=8689 Win=81664 Len=0 TSval=3912074548 TSecr=3932585102"
"16","0.328169","172.20.0.4","172.20.0.3","TCP","66","59108  >  8080 [ACK] Seq=156 Ack=11585 Win=87424 Len=0 TSval=3912074548 TSecr=3932585102"
"17","0.328172","172.20.0.4","172.20.0.3","TCP","66","59108  >  8080 [ACK] Seq=156 Ack=14481 Win=88320 Len=0 TSval=3912074548 TSecr=3932585102"
"18","0.328445","172.20.0.3","172.20.0.4","TCP","2962","8080  >  59108 [PSH, ACK] Seq=14481 Ack=156 Win=65024 Len=2896 TSval=3932585203 TSecr=3912074548 [TCP PDU reassembled in 271]"
"19","0.328577","172.20.0.3","172.20.0.4","TCP","2962","8080  >  59108 [PSH, ACK] Seq=17377 Ack=156 Win=65024 Len=2896 TSval=3932585203 TSecr=3912074548 [TCP PDU reassembled in 271]"
"20","0.328683","172.20.0.3","172.20.0.4","TCP","2962","8080  >  59108 [PSH, ACK] Seq=20273 Ack=156 Win=65024 Len=2896 TSval=3932585203 TSecr=3912074548 [TCP PDU reassembled in 271]"
"21","0.328700","172.20.0.3","172.20.0.4","TCP","2962","8080  >  59108 [PSH, ACK] Seq=23169 Ack=156 Win=65024 Len=2896 TSval=3932585203 TSecr=3912074548 [TCP PDU reassembled in 271]"
"22","0.328754","172.20.0.3","172.20.0.4","TCP","2962","8080  >  59108 [PSH, ACK] Seq=26065 Ack=156 Win=65024 Len=2896 TSval=3932585204 TSecr=3912074548 [TCP PDU reassembled in 271]"
"23","0.328770","172.20.0.3","172.20.0.4","TCP","2962","8080  >  59108 [PSH, ACK] Seq=28961 Ack=156 Win=65024 Len=2896 TSval=3932585204 TSecr=3912074548 [TCP PDU reassembled in 271]"
"24","0.328824","172.20.0.3","172.20.0.4","TCP","2962","8080  >  59108 [PSH, ACK] Seq=31857 Ack=156 Win=65024 Len=2896 TSval=3932585204 TSecr=3912074548 [TCP PDU reassembled in 271]"
"25","0.328839","172.20.0.3","172.20.0.4","TCP","2962","8080  >  59108 [PSH, ACK] Seq=34753 Ack=156 Win=65024 Len=2896 TSval=3932585204 TSecr=3912074548 [TCP PDU reassembled in 271]"
"26","0.328893","172.20.0.3","172.20.0.4","TCP","2962","8080  >  59108 [PSH, ACK] Seq=37649 Ack=156 Win=65024 Len=2896 TSval=3932585204 TSecr=3912074548 [TCP PDU reassembled in 271]"
"27","0.328997","172.20.0.3","172.20.0.4","TCP","2962","8080  >  59108 [PSH, ACK] Seq=40545 Ack=156 Win=65024 Len=2896 TSval=3932585204 TSecr=3912074548 [TCP PDU reassembled in 271]"
"28","0.429588","172.20.0.4","172.20.0.3","TCP","66","59108  >  8080 [ACK] Seq=156 Ack=17377 Win=94080 Len=0 TSval=3912074649 TSecr=3932585203"
"29","0.429601","172.20.0.4","172.20.0.3","TCP","66","59108  >  8080 [ACK] Seq=156 Ack=20273 Win=94080 Len=0 TSval=3912074649 TSecr=3932585203"
"30","0.429605","172.20.0.4","172.20.0.3","TCP","66","59108  >  8080 [ACK] Seq=156 Ack=23169 Win=94080 Len=0 TSval=3912074650 TSecr=3932585203"
"31","0.429608","172.20.0.4","172.20.0.3","TCP","66","59108  >  8080 [ACK] Seq=156 Ack=26065 Win=91264 Len=0 TSval=3912074650 TSecr=3932585203"
"32","0.429698","172.20.0.4","172.20.0.3","TCP","66","59108  >  8080 [ACK] Seq=156 Ack=31857 Win=94080 Len=0 TSval=3912074650 TSecr=3932585204"
"33","0.429703","172.20.0.4","172.20.0.3","TCP","66","59108  >  8080 [ACK] Seq=156 Ack=34753 Win=97024 Len=0 TSval=3912074650 TSecr=3932585204"
"34","0.429706","172.20.0.4","172.20.0.3","TCP","66","59108  >  8080 [ACK] Seq=156 Ack=37649 Win=97024 Len=0 TSval=3912074650 TSecr=3932585204"
"35","0.429708","172.20.0.4","172.20.0.3","TCP","66","59108  >  8080 [ACK] Seq=156 Ack=40545 Win=97024 Len=0 TSval=3912074650 TSecr=3932585204"
"36","0.430272","172.20.0.3","172.20.0.4","TCP","2962","8080  >  59108 [PSH, ACK] Seq=43441 Ack=156 Win=65024 Len=2896 TSval=3932585305 TSecr=3912074649 [TCP PDU reassembled in 271]"
"37","0.430307","172.20.0.3","172.20.0.4","TCP","2962","[TCP Previous segment not captured] 8080  >  59108 [PSH, ACK] Seq=49233 Ack=156 Win=65024 Len=2896 TSval=3932585305 TSecr=3912074650 [TCP PDU reassembled in 271]"
"38","0.430478","172.20.0.3","172.20.0.4","TCP","2962","[TCP Out-Of-Order] 8080  >  59108 [PSH, ACK] Seq=46337 Ack=156 Win=65024 Len=2896 TSval=3932585305 TSecr=3912074649 [TCP PDU reassembled in 271]"
"39","0.430541","172.20.0.3","172.20.0.4","TCP","2962","8080  >  59108 [PSH, ACK] Seq=52129 Ack=156 Win=65024 Len=2896 TSval=3932585305 TSecr=3912074650 [TCP PDU reassembled in 271]"
"40","0.430595","172.20.0.3","172.20.0.4","TCP","2962","8080  >  59108 [PSH, ACK] Seq=55025 Ack=156 Win=65024 Len=2896 TSval=3932585305 TSecr=3912074650 [TCP PDU reassembled in 271]"
"41","0.430681","172.20.0.3","172.20.0.4","TCP","2962","8080  >  59108 [PSH, ACK] Seq=57921 Ack=156 Win=65024 Len=2896 TSval=3932585305 TSecr=3912074650 [TCP PDU reassembled in 271]"
"42","0.430758","172.20.0.3","172.20.0.4","TCP","2962","8080  >  59108 [PSH, ACK] Seq=60817 Ack=156 Win=65024 Len=2896 TSval=3932585305 TSecr=3912074650 [TCP PDU reassembled in 271]"
"43","0.430822","172.20.0.3","172.20.0.4","TCP","2962","8080  >  59108 [PSH, ACK] Seq=63713 Ack=156 Win=65024 Len=2896 TSval=3932585305 TSecr=3912074650 [TCP PDU reassembled in 271]"
"44","0.430873","172.20.0.3","172.20.0.4","TCP","2962","8080  >  59108 [PSH, ACK] Seq=66609 Ack=156 Win=65024 Len=2896 TSval=3932585305 TSecr=3912074650 [TCP PDU reassembled in 271]"
"45","0.430921","172.20.0.3","172.20.0.4","TCP","2962","8080  >  59108 [PSH, ACK] Seq=69505 Ack=156 Win=65024 Len=2896 TSval=3932585305 TSecr=3912074650 [TCP PDU reassembled in 271]"
"46","0.430957","172.20.0.3","172.20.0.4","TCP","2962","8080  >  59108 [PSH, ACK] Seq=72401 Ack=156 Win=65024 Len=2896 TSval=3932585305 TSecr=3912074650 [TCP PDU reassembled in 271]"
"47","0.430989","172.20.0.3","172.20.0.4","TCP","2962","8080  >  59108 [PSH, ACK] Seq=75297 Ack=156 Win=65024 Len=2896 TSval=3932585305 TSecr=3912074650 [TCP PDU reassembled in 271]"
"48","0.431023","172.20.0.3","172.20.0.4","TCP","2962","8080  >  59108 [PSH, ACK] Seq=78193 Ack=156 Win=65024 Len=2896 TSval=3932585305 TSecr=3912074650 [TCP PDU reassembled in 271]"
"49","0.431057","172.20.0.3","172.20.0.4","TCP","2962","8080  >  59108 [PSH, ACK] Seq=81089 Ack=156 Win=65024 Len=2896 TSval=3932585305 TSecr=3912074650 [TCP PDU reassembled in 271]"
"50","0.431091","172.20.0.3","172.20.0.4","TCP","2962","8080  >  59108 [PSH, ACK] Seq=83985 Ack=156 Win=65024 Len=2896 TSval=3932585305 TSecr=3912074650 [TCP PDU reassembled in 271]"
"51","0.431125","172.20.0.3","172.20.0.4","TCP","2962","8080  >  59108 [PSH, ACK] Seq=86881 Ack=156 Win=65024 Len=2896 TSval=3932585305 TSecr=3912074650 [TCP PDU reassembled in 271]"
"52","0.431165","172.20.0.3","172.20.0.4","TCP","2962","8080  >  59108 [PSH, ACK] Seq=89777 Ack=156 Win=65024 Len=2896 TSval=3932585306 TSecr=3912074650 [TCP PDU reassembled in 271]"
"53","0.431201","172.20.0.3","172.20.0.4","TCP","2962","8080  >  59108 [PSH, ACK] Seq=92673 Ack=156 Win=65024 Len=2896 TSval=3932585306 TSecr=3912074650 [TCP PDU reassembled in 271]"
"54","0.530752","172.20.0.4","172.20.0.3","TCP","66","59108  >  8080 [ACK] Seq=156 Ack=46337 Win=97024 Len=0 TSval=3912074751 TSecr=3932585305"
"55","0.530765","172.20.0.4","172.20.0.3","TCP","78","[TCP Dup ACK 54#1] 59108  >  8080 [ACK] Seq=156 Ack=46337 Win=97024 Len=0 TSval=3912074751 TSecr=3932585305 SLE=49233 SRE=52129"
"56","0.530768","172.20.0.4","172.20.0.3","TCP","66","59108  >  8080 [ACK] Seq=156 Ack=52129 Win=91264 Len=0 TSval=3912074751 TSecr=3932585305"
"57","0.530771","172.20.0.4","172.20.0.3","TCP","66","59108  >  8080 [ACK] Seq=156 Ack=55025 Win=102784 Len=0 TSval=3912074751 TSecr=3932585305"
"58","0.530774","172.20.0.4","172.20.0.3","TCP","66","59108  >  8080 [ACK] Seq=156 Ack=57921 Win=108544 Len=0 TSval=3912074751 TSecr=3932585305"
"59","0.530776","172.20.0.4","172.20.0.3","TCP","66","59108  >  8080 [ACK] Seq=156 Ack=60817 Win=114432 Len=0 TSval=3912074752 TSecr=3932585305"
"60","0.531150","172.20.0.3","172.20.0.4","TCP","2962","8080  >  59108 [PSH, ACK] Seq=95569 Ack=156 Win=65024 Len=2896 TSval=3932585406 TSecr=3912074751 [TCP PDU reassembled in 271]"
"61","0.531270","172.20.0.4","172.20.0.3","TCP","66","59108  >  8080 [ACK] Seq=156 Ack=63713 Win=120192 Len=0 TSval=3912074752 TSecr=3932585305"
"62","0.531274","172.20.0.4","172.20.0.3","TCP","66","59108  >  8080 [ACK] Seq=156 Ack=66609 Win=125952 Len=0 TSval=3912074752 TSecr=3932585305"
"63","0.531276","172.20.0.4","172.20.0.3","TCP","66","59108  >  8080 [ACK] Seq=156 Ack=69505 Win=131712 Len=0 TSval=3912074752 TSecr=3932585305"
"64","0.531279","172.20.0.4","172.20.0.3","TCP","66","59108  >  8080 [ACK] Seq=156 Ack=72401 Win=137600 Len=0 TSval=3912074752 TSecr=3932585305"
"65","0.531281","172.20.0.4","172.20.0.3","TCP","66","59108  >  8080 [ACK] Seq=156 Ack=75297 Win=143360 Len=0 TSval=3912074752 TSecr=3932585305"
"66","0.531284","172.20.0.4","172.20.0.3","TCP","66","59108  >  8080 [ACK] Seq=156 Ack=78193 Win=149120 Len=0 TSval=3912074752 TSecr=3932585305"
"67","0.531286","172.20.0.4","172.20.0.3","TCP","66","59108  >  8080 [ACK] Seq=156 Ack=81089 Win=154880 Len=0 TSval=3912074752 TSecr=3932585305"
"68","0.531289","172.20.0.4","172.20.0.3","TCP","66","59108  >  8080 [ACK] Seq=156 Ack=83985 Win=160768 Len=0 TSval=3912074752 TSecr=3932585305"
"69","0.531291","172.20.0.4","172.20.0.3","TCP","66","59108  >  8080 [ACK] Seq=156 Ack=86881 Win=166528 Len=0 TSval=3912074752 TSecr=3932585305"
"70","0.531302","172.20.0.4","172.20.0.3","TCP","66","59108  >  8080 [ACK] Seq=156 Ack=89777 Win=172288 Len=0 TSval=3912074752 TSecr=3932585305"
"71","0.531304","172.20.0.4","172.20.0.3","TCP","66","59108  >  8080 [ACK] Seq=156 Ack=92673 Win=178048 Len=0 TSval=3912074752 TSecr=3932585306"
"72","0.531307","172.20.0.4","172.20.0.3","TCP","66","59108  >  8080 [ACK] Seq=156 Ack=95569 Win=180608 Len=0 TSval=3912074752 TSecr=3932585306"
"73","0.531314","172.20.0.3","172.20.0.4","TCP","2962","8080  >  59108 [PSH, ACK] Seq=98465 Ack=156 Win=65024 Len=2896 TSval=3932585406 TSecr=3912074751 [TCP PDU reassembled in 271]"
"74","0.531739","172.20.0.3","172.20.0.4","TCP","2962","8080  >  59108 [PSH, ACK] Seq=101361 Ack=156 Win=65024 Len=2896 TSval=3932585406 TSecr=3912074752 [TCP PDU reassembled in 271]"
"75","0.531763","172.20.0.3","172.20.0.4","TCP","2962","[TCP Previous segment not captured] 8080  >  59108 [PSH, ACK] Seq=107153 Ack=156 Win=65024 Len=2896 TSval=3932585407 TSecr=3912074752 [TCP PDU reassembled in 271]"
"76","0.531846","172.20.0.3","172.20.0.4","TCP","2962","[TCP Out-Of-Order] 8080  >  59108 [PSH, ACK] Seq=104257 Ack=156 Win=65024 Len=2896 TSval=3932585406 TSecr=3912074752 [TCP PDU reassembled in 271]"
"77","0.531905","172.20.0.3","172.20.0.4","TCP","2962","8080  >  59108 [PSH, ACK] Seq=110049 Ack=156 Win=65024 Len=2896 TSval=3932585407 TSecr=3912074752 [TCP PDU reassembled in 271]"
"78","0.531964","172.20.0.3","172.20.0.4","TCP","2962","8080  >  59108 [PSH, ACK] Seq=112945 Ack=156 Win=65024 Len=2896 TSval=3932585407 TSecr=3912074752 [TCP PDU reassembled in 271]"
"79","0.532008","172.20.0.3","172.20.0.4","TCP","2962","8080  >  59108 [PSH, ACK] Seq=115841 Ack=156 Win=65024 Len=2896 TSval=3932585407 TSecr=3912074752 [TCP PDU reassembled in 271]"
"80","0.532043","172.20.0.3","172.20.0.4","TCP","2962","8080  >  59108 [PSH, ACK] Seq=118737 Ack=156 Win=65024 Len=2896 TSval=3932585407 TSecr=3912074752 [TCP PDU reassembled in 271]"
"81","0.532135","172.20.0.3","172.20.0.4","TCP","2962","8080  >  59108 [PSH, ACK] Seq=121633 Ack=156 Win=65024 Len=2896 TSval=3932585407 TSecr=3912074752 [TCP PDU reassembled in 271]"
"82","0.532200","172.20.0.3","172.20.0.4","TCP","2962","8080  >  59108 [PSH, ACK] Seq=124529 Ack=156 Win=65024 Len=2896 TSval=3932585407 TSecr=3912074752 [TCP PDU reassembled in 271]"
"83","0.532234","172.20.0.3","172.20.0.4","TCP","2962","8080  >  59108 [PSH, ACK] Seq=127425 Ack=156 Win=65024 Len=2896 TSval=3932585407 TSecr=3912074752 [TCP PDU reassembled in 271]"
"84","0.532268","172.20.0.3","172.20.0.4","TCP","2962","8080  >  59108 [PSH, ACK] Seq=130321 Ack=156 Win=65024 Len=2896 TSval=3932585407 TSecr=3912074752 [TCP PDU reassembled in 271]"
"85","0.532300","172.20.0.3","172.20.0.4","TCP","2962","8080  >  59108 [PSH, ACK] Seq=133217 Ack=156 Win=65024 Len=2896 TSval=3932585407 TSecr=3912074752 [TCP PDU reassembled in 271]"
"86","0.532335","172.20.0.3","172.20.0.4","TCP","2962","8080  >  59108 [PSH, ACK] Seq=136113 Ack=156 Win=65024 Len=2896 TSval=3932585407 TSecr=3912074752 [TCP PDU reassembled in 271]"
"87","0.532373","172.20.0.3","172.20.0.4","TCP","2962","8080  >  59108 [PSH, ACK] Seq=139009 Ack=156 Win=65024 Len=2896 TSval=3932585407 TSecr=3912074752 [TCP PDU reassembled in 271]"
"88","0.532407","172.20.0.3","172.20.0.4","TCP","2962","8080  >  59108 [PSH, ACK] Seq=141905 Ack=156 Win=65024 Len=2896 TSval=3932585407 TSecr=3912074752 [TCP PDU reassembled in 271]"
"89","0.532432","172.20.0.3","172.20.0.4","TCP","2962","8080  >  59108 [PSH, ACK] Seq=144801 Ack=156 Win=65024 Len=2896 TSval=3932585407 TSecr=3912074752 [TCP PDU reassembled in 271]"
"90","0.532467","172.20.0.3","172.20.0.4","TCP","2962","8080  >  59108 [PSH, ACK] Seq=147697 Ack=156 Win=65024 Len=2896 TSval=3932585407 TSecr=3912074752 [TCP PDU reassembled in 271]"
"91","0.532503","172.20.0.3","172.20.0.4","TCP","2962","8080  >  59108 [PSH, ACK] Seq=150593 Ack=156 Win=65024 Len=2896 TSval=3932585407 TSecr=3912074752 [TCP PDU reassembled in 271]"
"92","0.532537","172.20.0.3","172.20.0.4","TCP","2962","8080  >  59108 [PSH, ACK] Seq=153489 Ack=156 Win=65024 Len=2896 TSval=3932585407 TSecr=3912074752 [TCP PDU reassembled in 271]"
"93","0.532569","172.20.0.3","172.20.0.4","TCP","2962","8080  >  59108 [PSH, ACK] Seq=156385 Ack=156 Win=65024 Len=2896 TSval=3932585407 TSecr=3912074752 [TCP PDU reassembled in 271]"
"94","0.532602","172.20.0.3","172.20.0.4","TCP","2962","8080  >  59108 [PSH, ACK] Seq=159281 Ack=156 Win=65024 Len=2896 TSval=3932585407 TSecr=3912074752 [TCP PDU reassembled in 271]"
"95","0.532634","172.20.0.3","172.20.0.4","TCP","2962","8080  >  59108 [PSH, ACK] Seq=162177 Ack=156 Win=65024 Len=2896 TSval=3932585407 TSecr=3912074752 [TCP PDU reassembled in 271]"
"96","0.532667","172.20.0.3","172.20.0.4","TCP","2962","8080  >  59108 [PSH, ACK] Seq=165073 Ack=156 Win=65024 Len=2896 TSval=3932585407 TSecr=3912074752 [TCP PDU reassembled in 271]"
"97","0.532701","172.20.0.3","172.20.0.4","TCP","2962","8080  >  59108 [PSH, ACK] Seq=167969 Ack=156 Win=65024 Len=2896 TSval=3932585407 TSecr=3912074752 [TCP PDU reassembled in 271]"
"98","0.532735","172.20.0.3","172.20.0.4","TCP","2962","8080  >  59108 [PSH, ACK] Seq=170865 Ack=156 Win=65024 Len=2896 TSval=3932585407 TSecr=3912074752 [TCP PDU reassembled in 271]"
"99","0.532820","172.20.0.3","172.20.0.4","TCP","2962","8080  >  59108 [PSH, ACK] Seq=173761 Ack=156 Win=65024 Len=2896 TSval=3932585408 TSecr=3912074752 [TCP PDU reassembled in 271]"
"100","0.532856","172.20.0.3","172.20.0.4","TCP","2962","8080  >  59108 [PSH, ACK] Seq=176657 Ack=156 Win=65024 Len=2896 TSval=3932585408 TSecr=3912074752 [TCP PDU reassembled in 271]"
"101","0.532902","172.20.0.3","172.20.0.4","TCP","2962","8080  >  59108 [PSH, ACK] Seq=179553 Ack=156 Win=65024 Len=2896 TSval=3932585408 TSecr=3912074752 [TCP PDU reassembled in 271]"
"102","0.532934","172.20.0.3","172.20.0.4","TCP","2962","8080  >  59108 [PSH, ACK] Seq=182449 Ack=156 Win=65024 Len=2896 TSval=3932585408 TSecr=3912074752 [TCP PDU reassembled in 271]"
"103","0.532964","172.20.0.3","172.20.0.4","TCP","2962","8080  >  59108 [PSH, ACK] Seq=185345 Ack=156 Win=65024 Len=2896 TSval=3932585408 TSecr=3912074752 [TCP PDU reassembled in 271]"
"104","0.533045","172.20.0.3","172.20.0.4","TCP","2962","8080  >  59108 [PSH, ACK] Seq=188241 Ack=156 Win=65024 Len=2896 TSval=3932585408 TSecr=3912074752 [TCP PDU reassembled in 271]"
"105","0.533103","172.20.0.3","172.20.0.4","TCP","2962","8080  >  59108 [PSH, ACK] Seq=191137 Ack=156 Win=65024 Len=2896 TSval=3932585408 TSecr=3912074752 [TCP PDU reassembled in 271]"
"106","0.533133","172.20.0.3","172.20.0.4","TCP","2962","8080  >  59108 [PSH, ACK] Seq=194033 Ack=156 Win=65024 Len=2896 TSval=3932585408 TSecr=3912074752 [TCP PDU reassembled in 271]"
"107","0.533160","172.20.0.3","172.20.0.4","TCP","2962","8080  >  59108 [PSH, ACK] Seq=196929 Ack=156 Win=65024 Len=2896 TSval=3932585408 TSecr=3912074752 [TCP PDU reassembled in 271]"
"108","0.533193","172.20.0.3","172.20.0.4","TCP","2962","8080  >  59108 [PSH, ACK] Seq=199825 Ack=156 Win=65024 Len=2896 TSval=3932585408 TSecr=3912074752 [TCP PDU reassembled in 271]"
"109","0.631446","172.20.0.4","172.20.0.3","TCP","66","59108  >  8080 [ACK] Seq=156 Ack=98465 Win=186368 Len=0 TSval=3912074852 TSecr=3932585406"
"110","0.631458","172.20.0.4","172.20.0.3","TCP","66","59108  >  8080 [ACK] Seq=156 Ack=101361 Win=183552 Len=0 TSval=3912074852 TSecr=3932585406"
"111","0.631813","172.20.0.3","172.20.0.4","TCP","2962","8080  >  59108 [PSH, ACK] Seq=202721 Ack=156 Win=65024 Len=2896 TSval=3932585506 TSecr=3912074852 [TCP PDU reassembled in 271]"
"112","0.631963","172.20.0.4","172.20.0.3","TCP","66","59108  >  8080 [ACK] Seq=156 Ack=104257 Win=192128 Len=0 TSval=3912074853 TSecr=3932585406"
"113","0.631967","172.20.0.4","172.20.0.3","TCP","78","[TCP Dup ACK 112#1] 59108  >  8080 [ACK] Seq=156 Ack=104257 Win=198016 Len=0 TSval=3912074853 TSecr=3932585406 SLE=107153 SRE=110049"
"114","0.631969","172.20.0.4","172.20.0.3","TCP","66","59108  >  8080 [ACK] Seq=156 Ack=110049 Win=203776 Len=0 TSval=3912074853 TSecr=3932585406"
"115","0.631972","172.20.0.4","172.20.0.3","TCP","66","59108  >  8080 [ACK] Seq=156 Ack=112945 Win=209536 Len=0 TSval=3912074853 TSecr=3932585407"
"116","0.631978","172.20.0.3","172.20.0.4","TCP","2962","8080  >  59108 [PSH, ACK] Seq=205617 Ack=156 Win=65024 Len=2896 TSval=3932585506 TSecr=3912074852 [TCP PDU reassembled in 271]"
"117","0.632015","172.20.0.4","172.20.0.3","TCP","66","59108  >  8080 [ACK] Seq=156 Ack=115841 Win=215296 Len=0 TSval=3912074853 TSecr=3932585407"
"118","0.632200","172.20.0.3","172.20.0.4","TCP","2962","8080  >  59108 [PSH, ACK] Seq=208513 Ack=156 Win=65024 Len=2896 TSval=3932585507 TSecr=3912074853 [TCP PDU reassembled in 271]"
"119","0.632223","172.20.0.4","172.20.0.3","TCP","66","59108  >  8080 [ACK] Seq=156 Ack=118737 Win=221184 Len=0 TSval=3912074853 TSecr=3932585407"
"120","0.632226","172.20.0.4","172.20.0.3","TCP","66","59108  >  8080 [ACK] Seq=156 Ack=121633 Win=226944 Len=0 TSval=3912074853 TSecr=3932585407"
"121","0.632228","172.20.0.4","172.20.0.3","TCP","66","59108  >  8080 [ACK] Seq=156 Ack=127425 Win=238464 Len=0 TSval=3912074853 TSecr=3932585407"
"122","0.632233","172.20.0.3","172.20.0.4","TCP","1514","8080  >  59108 [PSH, ACK] Seq=211409 Ack=156 Win=65024 Len=1448 TSval=3932585507 TSecr=3912074853 [TCP PDU reassembled in 271]"
"123","0.632259","172.20.0.3","172.20.0.4","TCP","2962","8080  >  59108 [PSH, ACK] Seq=212857 Ack=156 Win=65024 Len=2896 TSval=3932585507 TSecr=3912074853 [TCP PDU reassembled in 271]"
"124","0.632277","172.20.0.4","172.20.0.3","TCP","66","59108  >  8080 [ACK] Seq=156 Ack=130321 Win=244352 Len=0 TSval=3912074853 TSecr=3932585407"
"125","0.632473","172.20.0.3","172.20.0.4","TCP","2962","8080  >  59108 [PSH, ACK] Seq=215753 Ack=156 Win=65024 Len=2896 TSval=3932585507 TSecr=3912074853 [TCP PDU reassembled in 271]"
"126","0.632487","172.20.0.3","172.20.0.4","TCP","2962","8080  >  59108 [PSH, ACK] Seq=218649 Ack=156 Win=65024 Len=2896 TSval=3932585507 TSecr=3912074853 [TCP PDU reassembled in 271]"
"127","0.632509","172.20.0.4","172.20.0.3","TCP","66","59108  >  8080 [ACK] Seq=156 Ack=133217 Win=250112 Len=0 TSval=3912074853 TSecr=3932585407"
"128","0.632513","172.20.0.4","172.20.0.3","TCP","66","59108  >  8080 [ACK] Seq=156 Ack=136113 Win=255872 Len=0 TSval=3912074853 TSecr=3932585407"
"129","0.632529","172.20.0.4","172.20.0.3","TCP","66","59108  >  8080 [ACK] Seq=156 Ack=139009 Win=261632 Len=0 TSval=3912074853 TSecr=3932585407"
"130","0.632531","172.20.0.4","172.20.0.3","TCP","66","59108  >  8080 [ACK] Seq=156 Ack=141905 Win=267520 Len=0 TSval=3912074853 TSecr=3932585407"
"131","0.632534","172.20.0.4","172.20.0.3","TCP","66","59108  >  8080 [ACK] Seq=156 Ack=144801 Win=273280 Len=0 TSval=3912074853 TSecr=3932585407"
"132","0.632536","172.20.0.4","172.20.0.3","TCP","66","59108  >  8080 [ACK] Seq=156 Ack=150593 Win=284800 Len=0 TSval=3912074853 TSecr=3932585407"
"133","0.632544","172.20.0.4","172.20.0.3","TCP","66","59108  >  8080 [ACK] Seq=156 Ack=153489 Win=290688 Len=0 TSval=3912074853 TSecr=3932585407"
"134","0.632590","172.20.0.4","172.20.0.3","TCP","66","59108  >  8080 [ACK] Seq=156 Ack=156385 Win=296448 Len=0 TSval=3912074853 TSecr=3932585407"
"135","0.632597","172.20.0.4","172.20.0.3","TCP","66","59108  >  8080 [ACK] Seq=156 Ack=159281 Win=302208 Len=0 TSval=3912074853 TSecr=3932585407"
"136","0.632801","172.20.0.4","172.20.0.3","TCP","66","59108  >  8080 [ACK] Seq=156 Ack=162177 Win=307968 Len=0 TSval=3912074853 TSecr=3932585407"
"137","0.632807","172.20.0.4","172.20.0.3","TCP","66","59108  >  8080 [ACK] Seq=156 Ack=165073 Win=313856 Len=0 TSval=3912074853 TSecr=3932585407"
"138","0.632808","172.20.0.3","172.20.0.4","TCP","2962","8080  >  59108 [PSH, ACK] Seq=221545 Ack=156 Win=65024 Len=2896 TSval=3932585507 TSecr=3912074853 [TCP PDU reassembled in 271]"
"139","0.632809","172.20.0.4","172.20.0.3","TCP","66","59108  >  8080 [ACK] Seq=156 Ack=170865 Win=325376 Len=0 TSval=3912074854 TSecr=3932585407"
"140","0.632812","172.20.0.4","172.20.0.3","TCP","66","59108  >  8080 [ACK] Seq=156 Ack=173761 Win=331136 Len=0 TSval=3912074854 TSecr=3932585407"
"141","0.632816","172.20.0.3","172.20.0.4","TCP","2962","8080  >  59108 [PSH, ACK] Seq=224441 Ack=156 Win=65024 Len=2896 TSval=3932585507 TSecr=3912074853 [TCP PDU reassembled in 271]"
"142","0.632861","172.20.0.3","172.20.0.4","TCP","2962","8080  >  59108 [PSH, ACK] Seq=227337 Ack=156 Win=65024 Len=2896 TSval=3932585508 TSecr=3912074853 [TCP PDU reassembled in 271]"
"143","0.632868","172.20.0.3","172.20.0.4","TCP","2962","8080  >  59108 [PSH, ACK] Seq=230233 Ack=156 Win=65024 Len=2896 TSval=3932585508 TSecr=3912074853 [TCP PDU reassembled in 271]"
"144","0.632883","172.20.0.4","172.20.0.3","TCP","66","59108  >  8080 [ACK] Seq=156 Ack=176657 Win=337024 Len=0 TSval=3912074854 TSecr=3932585408"
"145","0.632886","172.20.0.4","172.20.0.3","TCP","66","59108  >  8080 [ACK] Seq=156 Ack=179553 Win=335488 Len=0 TSval=3912074854 TSecr=3932585408"
"146","0.632989","172.20.0.3","172.20.0.4","TCP","2962","[TCP Previous segment not captured] 8080  >  59108 [PSH, ACK] Seq=238921 Ack=156 Win=65024 Len=2896 TSval=3932585508 TSecr=3912074854 [TCP PDU reassembled in 271]"
"147","0.632997","172.20.0.3","172.20.0.4","TCP","2962","8080  >  59108 [PSH, ACK] Seq=241817 Ack=156 Win=65024 Len=2896 TSval=3932585508 TSecr=3912074854 [TCP PDU reassembled in 271]"
"148","0.633077","172.20.0.3","172.20.0.4","TCP","2962","[TCP Out-Of-Order] 8080  >  59108 [PSH, ACK] Seq=233129 Ack=156 Win=65024 Len=2896 TSval=3932585508 TSecr=3912074853 [TCP PDU reassembled in 271]"
"149","0.633075","172.20.0.4","172.20.0.3","TCP","66","59108  >  8080 [ACK] Seq=156 Ack=182449 Win=332672 Len=0 TSval=3912074854 TSecr=3932585408"
"150","0.633099","172.20.0.3","172.20.0.4","TCP","2962","[TCP Out-Of-Order] 8080  >  59108 [PSH, ACK] Seq=236025 Ack=156 Win=65024 Len=2896 TSval=3932585508 TSecr=3912074853 [TCP PDU reassembled in 271]"
"151","0.633166","172.20.0.4","172.20.0.3","TCP","66","59108  >  8080 [ACK] Seq=156 Ack=194033 Win=321152 Len=0 TSval=3912074854 TSecr=3932585408"
"152","0.633194","172.20.0.3","172.20.0.4","TCP","2962","8080  >  59108 [PSH, ACK] Seq=244713 Ack=156 Win=65024 Len=2896 TSval=3932585508 TSecr=3912074854 [TCP PDU reassembled in 271]"
"153","0.633207","172.20.0.3","172.20.0.4","TCP","2962","8080  >  59108 [PSH, ACK] Seq=247609 Ack=156 Win=65024 Len=2896 TSval=3932585508 TSecr=3912074854 [TCP PDU reassembled in 271]"
"154","0.633232","172.20.0.3","172.20.0.4","TCP","2962","8080  >  59108 [PSH, ACK] Seq=250505 Ack=156 Win=65024 Len=2896 TSval=3932585508 TSecr=3912074854 [TCP PDU reassembled in 271]"
"155","0.633240","172.20.0.3","172.20.0.4","TCP","2962","8080  >  59108 [PSH, ACK] Seq=253401 Ack=156 Win=65024 Len=2896 TSval=3932585508 TSecr=3912074854 [TCP PDU reassembled in 271]"
"156","0.633409","172.20.0.3","172.20.0.4","TCP","2962","8080  >  59108 [PSH, ACK] Seq=256297 Ack=156 Win=65024 Len=2896 TSval=3932585508 TSecr=3912074854 [TCP PDU reassembled in 271]"
"157","0.633452","172.20.0.3","172.20.0.4","TCP","1514","8080  >  59108 [PSH, ACK] Seq=259193 Ack=156 Win=65024 Len=1448 TSval=3932585508 TSecr=3912074854 [TCP PDU reassembled in 271]"
"158","0.633477","172.20.0.3","172.20.0.4","TCP","2962","8080  >  59108 [PSH, ACK] Seq=260641 Ack=156 Win=65024 Len=2896 TSval=3932585508 TSecr=3912074854 [TCP PDU reassembled in 271]"
"159","0.633492","172.20.0.4","172.20.0.3","TCP","66","59108  >  8080 [ACK] Seq=156 Ack=202721 Win=318208 Len=0 TSval=3912074854 TSecr=3932585408"
"160","0.633561","172.20.0.3","172.20.0.4","TCP","2962","[TCP Previous segment not captured] 8080  >  59108 [PSH, ACK] Seq=269329 Ack=156 Win=65024 Len=2896 TSval=3932585508 TSecr=3912074854 [TCP PDU reassembled in 271]"
"161","0.633565","172.20.0.3","172.20.0.4","TCP","2962","[TCP Out-Of-Order] 8080  >  59108 [PSH, ACK] Seq=263537 Ack=156 Win=65024 Len=2896 TSval=3932585508 TSecr=3912074854 [TCP PDU reassembled in 271]"
"162","0.633594","172.20.0.3","172.20.0.4","TCP","2962","[TCP Out-Of-Order] 8080  >  59108 [PSH, ACK] Seq=266433 Ack=156 Win=65024 Len=2896 TSval=3932585508 TSecr=3912074854 [TCP PDU reassembled in 271]"
"163","0.633705","172.20.0.3","172.20.0.4","TCP","2962","8080  >  59108 [PSH, ACK] Seq=272225 Ack=156 Win=65024 Len=2896 TSval=3932585509 TSecr=3912074854 [TCP PDU reassembled in 271]"
"164","0.633727","172.20.0.3","172.20.0.4","TCP","2962","8080  >  59108 [PSH, ACK] Seq=275121 Ack=156 Win=65024 Len=2896 TSval=3932585509 TSecr=3912074854 [TCP PDU reassembled in 271]"
"165","0.633808","172.20.0.3","172.20.0.4","TCP","2962","8080  >  59108 [PSH, ACK] Seq=278017 Ack=156 Win=65024 Len=2896 TSval=3932585509 TSecr=3912074854 [TCP PDU reassembled in 271]"
"166","0.633830","172.20.0.3","172.20.0.4","TCP","2962","8080  >  59108 [PSH, ACK] Seq=280913 Ack=156 Win=65024 Len=2896 TSval=3932585509 TSecr=3912074854 [TCP PDU reassembled in 271]"
"167","0.633905","172.20.0.3","172.20.0.4","TCP","2962","8080  >  59108 [PSH, ACK] Seq=283809 Ack=156 Win=65024 Len=2896 TSval=3932585509 TSecr=3912074854 [TCP PDU reassembled in 271]"
"168","0.633935","172.20.0.3","172.20.0.4","TCP","2962","8080  >  59108 [PSH, ACK] Seq=286705 Ack=156 Win=65024 Len=2896 TSval=3932585509 TSecr=3912074854 [TCP PDU reassembled in 271]"
"169","0.634023","172.20.0.3","172.20.0.4","TCP","2962","8080  >  59108 [PSH, ACK] Seq=289601 Ack=156 Win=65024 Len=2896 TSval=3932585509 TSecr=3912074854 [TCP PDU reassembled in 271]"
"170","0.634048","172.20.0.3","172.20.0.4","TCP","2962","8080  >  59108 [PSH, ACK] Seq=292497 Ack=156 Win=65024 Len=2896 TSval=3932585509 TSecr=3912074854 [TCP PDU reassembled in 271]"
"171","0.634114","172.20.0.3","172.20.0.4","TCP","2962","8080  >  59108 [PSH, ACK] Seq=295393 Ack=156 Win=65024 Len=2896 TSval=3932585509 TSecr=3912074854 [TCP PDU reassembled in 271]"
"172","0.634131","172.20.0.3","172.20.0.4","TCP","2962","8080  >  59108 [PSH, ACK] Seq=298289 Ack=156 Win=65024 Len=2896 TSval=3932585509 TSecr=3912074854 [TCP PDU reassembled in 271]"
"173","0.634191","172.20.0.3","172.20.0.4","TCP","2962","8080  >  59108 [PSH, ACK] Seq=301185 Ack=156 Win=65024 Len=2896 TSval=3932585509 TSecr=3912074854 [TCP PDU reassembled in 271]"
"174","0.634230","172.20.0.3","172.20.0.4","TCP","2962","8080  >  59108 [PSH, ACK] Seq=304081 Ack=156 Win=65024 Len=2896 TSval=3932585509 TSecr=3912074854 [TCP PDU reassembled in 271]"
"175","0.634407","172.20.0.3","172.20.0.4","TCP","1514","8080  >  59108 [ACK] Seq=306977 Ack=156 Win=65024 Len=1448 TSval=3932585509 TSecr=3912074854 [TCP PDU reassembled in 271]"
"176","0.634449","172.20.0.3","172.20.0.4","TCP","2962","8080  >  59108 [PSH, ACK] Seq=308425 Ack=156 Win=65024 Len=2896 TSval=3932585509 TSecr=3912074854 [TCP PDU reassembled in 271]"
"177","0.634476","172.20.0.3","172.20.0.4","TCP","2962","8080  >  59108 [PSH, ACK] Seq=311321 Ack=156 Win=65024 Len=2896 TSval=3932585509 TSecr=3912074854 [TCP PDU reassembled in 271]"
"178","0.634542","172.20.0.3","172.20.0.4","TCP","2962","8080  >  59108 [PSH, ACK] Seq=314217 Ack=156 Win=65024 Len=2896 TSval=3932585509 TSecr=3912074854 [TCP PDU reassembled in 271]"
"179","0.634634","172.20.0.3","172.20.0.4","TCP","2962","8080  >  59108 [PSH, ACK] Seq=317113 Ack=156 Win=65024 Len=2896 TSval=3932585509 TSecr=3912074854 [TCP PDU reassembled in 271]"
"180","0.634878","172.20.0.3","172.20.0.4","TCP","2962","8080  >  59108 [PSH, ACK] Seq=320009 Ack=156 Win=65024 Len=2896 TSval=3932585510 TSecr=3912074854 [TCP PDU reassembled in 271]"
"181","0.634920","172.20.0.3","172.20.0.4","TCP","2962","8080  >  59108 [PSH, ACK] Seq=322905 Ack=156 Win=65024 Len=2896 TSval=3932585510 TSecr=3912074854 [TCP PDU reassembled in 271]"
"182","0.634987","172.20.0.3","172.20.0.4","TCP","2962","8080  >  59108 [PSH, ACK] Seq=325801 Ack=156 Win=65024 Len=2896 TSval=3932585510 TSecr=3912074854 [TCP PDU reassembled in 271]"
"183","0.635002","172.20.0.3","172.20.0.4","TCP","2962","8080  >  59108 [PSH, ACK] Seq=328697 Ack=156 Win=65024 Len=2896 TSval=3932585510 TSecr=3912074854 [TCP PDU reassembled in 271]"
"184","0.635051","172.20.0.3","172.20.0.4","TCP","2962","8080  >  59108 [PSH, ACK] Seq=331593 Ack=156 Win=65024 Len=2896 TSval=3932585510 TSecr=3912074854 [TCP PDU reassembled in 271]"
"185","0.635060","172.20.0.3","172.20.0.4","TCP","2962","8080  >  59108 [PSH, ACK] Seq=334489 Ack=156 Win=65024 Len=2896 TSval=3932585510 TSecr=3912074854 [TCP PDU reassembled in 271]"
"186","0.635108","172.20.0.3","172.20.0.4","TCP","2962","8080  >  59108 [PSH, ACK] Seq=337385 Ack=156 Win=65024 Len=2896 TSval=3932585510 TSecr=3912074854 [TCP PDU reassembled in 271]"
"187","0.635117","172.20.0.3","172.20.0.4","TCP","2962","8080  >  59108 [PSH, ACK] Seq=340281 Ack=156 Win=65024 Len=2896 TSval=3932585510 TSecr=3912074854 [TCP PDU reassembled in 271]"
"188","0.635177","172.20.0.3","172.20.0.4","TCP","2962","8080  >  59108 [PSH, ACK] Seq=343177 Ack=156 Win=65024 Len=2896 TSval=3932585510 TSecr=3912074854 [TCP PDU reassembled in 271]"
"189","0.635186","172.20.0.3","172.20.0.4","TCP","2962","8080  >  59108 [PSH, ACK] Seq=346073 Ack=156 Win=65024 Len=2896 TSval=3932585510 TSecr=3912074854 [TCP PDU reassembled in 271]"
"190","0.635239","172.20.0.3","172.20.0.4","TCP","2962","8080  >  59108 [PSH, ACK] Seq=348969 Ack=156 Win=65024 Len=2896 TSval=3932585510 TSecr=3912074854 [TCP PDU reassembled in 271]"
"191","0.635259","172.20.0.3","172.20.0.4","TCP","2962","8080  >  59108 [PSH, ACK] Seq=351865 Ack=156 Win=65024 Len=2896 TSval=3932585510 TSecr=3912074854 [TCP PDU reassembled in 271]"
"192","0.635404","172.20.0.3","172.20.0.4","TCP","2962","8080  >  59108 [PSH, ACK] Seq=354761 Ack=156 Win=65024 Len=2896 TSval=3932585510 TSecr=3912074854 [TCP PDU reassembled in 271]"
"193","0.635428","172.20.0.3","172.20.0.4","TCP","2962","8080  >  59108 [PSH, ACK] Seq=357657 Ack=156 Win=65024 Len=2896 TSval=3932585510 TSecr=3912074854 [TCP PDU reassembled in 271]"
"194","0.635518","172.20.0.3","172.20.0.4","TCP","2962","8080  >  59108 [PSH, ACK] Seq=360553 Ack=156 Win=65024 Len=2896 TSval=3932585510 TSecr=3912074854 [TCP PDU reassembled in 271]"
"195","0.635532","172.20.0.3","172.20.0.4","TCP","2962","8080  >  59108 [PSH, ACK] Seq=363449 Ack=156 Win=65024 Len=2896 TSval=3932585510 TSecr=3912074854 [TCP PDU reassembled in 271]"
"196","0.635664","172.20.0.3","172.20.0.4","TCP","2962","8080  >  59108 [PSH, ACK] Seq=366345 Ack=156 Win=65024 Len=2896 TSval=3932585510 TSecr=3912074854 [TCP PDU reassembled in 271]"
"197","0.635683","172.20.0.3","172.20.0.4","TCP","2962","8080  >  59108 [PSH, ACK] Seq=369241 Ack=156 Win=65024 Len=2896 TSval=3932585510 TSecr=3912074854 [TCP PDU reassembled in 271]"
"198","0.635786","172.20.0.3","172.20.0.4","TCP","1514","8080  >  59108 [PSH, ACK] Seq=372137 Ack=156 Win=65024 Len=1448 TSval=3932585511 TSecr=3912074854 [TCP PDU reassembled in 271]"
"199","0.635798","172.20.0.3","172.20.0.4","TCP","2962","8080  >  59108 [PSH, ACK] Seq=373585 Ack=156 Win=65024 Len=2896 TSval=3932585511 TSecr=3912074854 [TCP PDU reassembled in 271]"
"200","0.635812","172.20.0.3","172.20.0.4","TCP","2962","8080  >  59108 [PSH, ACK] Seq=376481 Ack=156 Win=65024 Len=2896 TSval=3932585511 TSecr=3912074854 [TCP PDU reassembled in 271]"
"201","0.635889","172.20.0.3","172.20.0.4","TCP","2962","8080  >  59108 [PSH, ACK] Seq=379377 Ack=156 Win=65024 Len=2896 TSval=3932585511 TSecr=3912074854 [TCP PDU reassembled in 271]"
"202","0.635905","172.20.0.3","172.20.0.4","TCP","2962","8080  >  59108 [PSH, ACK] Seq=382273 Ack=156 Win=65024 Len=2896 TSval=3932585511 TSecr=3912074854 [TCP PDU reassembled in 271]"
"203","0.635979","172.20.0.3","172.20.0.4","TCP","2962","8080  >  59108 [PSH, ACK] Seq=385169 Ack=156 Win=65024 Len=2896 TSval=3932585511 TSecr=3912074854 [TCP PDU reassembled in 271]"
"204","0.635992","172.20.0.3","172.20.0.4","TCP","2962","8080  >  59108 [PSH, ACK] Seq=388065 Ack=156 Win=65024 Len=2896 TSval=3932585511 TSecr=3912074854 [TCP PDU reassembled in 271]"
"205","0.636041","172.20.0.3","172.20.0.4","TCP","2962","8080  >  59108 [PSH, ACK] Seq=390961 Ack=156 Win=65024 Len=2896 TSval=3932585511 TSecr=3912074854 [TCP PDU reassembled in 271]"
"206","0.636050","172.20.0.3","172.20.0.4","TCP","2962","8080  >  59108 [PSH, ACK] Seq=393857 Ack=156 Win=65024 Len=2896 TSval=3932585511 TSecr=3912074854 [TCP PDU reassembled in 271]"
"207","0.636102","172.20.0.3","172.20.0.4","TCP","2962","8080  >  59108 [PSH, ACK] Seq=396753 Ack=156 Win=65024 Len=2896 TSval=3932585511 TSecr=3912074854 [TCP PDU reassembled in 271]"
"208","0.636120","172.20.0.3","172.20.0.4","TCP","2962","8080  >  59108 [PSH, ACK] Seq=399649 Ack=156 Win=65024 Len=2896 TSval=3932585511 TSecr=3912074854 [TCP PDU reassembled in 271]"
"209","0.636220","172.20.0.3","172.20.0.4","TCP","2962","8080  >  59108 [PSH, ACK] Seq=402545 Ack=156 Win=65024 Len=2896 TSval=3932585511 TSecr=3912074854 [TCP PDU reassembled in 271]"
"210","0.636236","172.20.0.3","172.20.0.4","TCP","2962","8080  >  59108 [PSH, ACK] Seq=405441 Ack=156 Win=65024 Len=2896 TSval=3932585511 TSecr=3912074854 [TCP PDU reassembled in 271]"
"211","0.636446","172.20.0.3","172.20.0.4","TCP","2962","8080  >  59108 [PSH, ACK] Seq=408337 Ack=156 Win=65024 Len=2896 TSval=3932585511 TSecr=3912074854 [TCP PDU reassembled in 271]"
"212","0.636460","172.20.0.3","172.20.0.4","TCP","2962","8080  >  59108 [PSH, ACK] Seq=411233 Ack=156 Win=65024 Len=2896 TSval=3932585511 TSecr=3912074854 [TCP PDU reassembled in 271]"
"213","0.636488","172.20.0.3","172.20.0.4","TCP","2962","8080  >  59108 [PSH, ACK] Seq=414129 Ack=156 Win=65024 Len=2896 TSval=3932585511 TSecr=3912074854 [TCP PDU reassembled in 271]"
"214","0.732552","172.20.0.4","172.20.0.3","TCP","66","59108  >  8080 [ACK] Seq=156 Ack=205617 Win=342784 Len=0 TSval=3912074953 TSecr=3932585506"
"215","0.732563","172.20.0.4","172.20.0.3","TCP","66","59108  >  8080 [ACK] Seq=156 Ack=208513 Win=348544 Len=0 TSval=3912074953 TSecr=3932585506"
"216","0.732565","172.20.0.4","172.20.0.3","TCP","66","59108  >  8080 [ACK] Seq=156 Ack=211409 Win=354304 Len=0 TSval=3912074953 TSecr=3932585507"
"217","0.732568","172.20.0.4","172.20.0.3","TCP","66","59108  >  8080 [ACK] Seq=156 Ack=215753 Win=362624 Len=0 TSval=3912074953 TSecr=3932585507"
"218","0.732824","172.20.0.3","172.20.0.4","TCP","2962","8080  >  59108 [PSH, ACK] Seq=417025 Ack=156 Win=65024 Len=2896 TSval=3932585608 TSecr=3912074953 [TCP PDU reassembled in 271]"
"219","0.732873","172.20.0.4","172.20.0.3","TCP","66","59108  >  8080 [ACK] Seq=156 Ack=221545 Win=362624 Len=0 TSval=3912074954 TSecr=3932585507"
"220","0.732881","172.20.0.3","172.20.0.4","TCP","2962","8080  >  59108 [PSH, ACK] Seq=419921 Ack=156 Win=65024 Len=2896 TSval=3932585608 TSecr=3912074953 [TCP PDU reassembled in 271]"
"221","0.732973","172.20.0.3","172.20.0.4","TCP","2962","8080  >  59108 [PSH, ACK] Seq=422817 Ack=156 Win=65024 Len=2896 TSval=3932585608 TSecr=3912074954 [TCP PDU reassembled in 271]"
"222","0.732991","172.20.0.3","172.20.0.4","TCP","4410","8080  >  59108 [PSH, ACK] Seq=425713 Ack=156 Win=65024 Len=4344 TSval=3932585608 TSecr=3912074954 [TCP PDU reassembled in 271]"
"223","0.733008","172.20.0.3","172.20.0.4","TCP","4410","8080  >  59108 [PSH, ACK] Seq=430057 Ack=156 Win=65024 Len=4344 TSval=3932585608 TSecr=3912074954 [TCP PDU reassembled in 271]"
"224","0.733093","172.20.0.3","172.20.0.4","TCP","4410","8080  >  59108 [PSH, ACK] Seq=434401 Ack=156 Win=65024 Len=4344 TSval=3932585608 TSecr=3912074954 [TCP PDU reassembled in 271]"
"225","0.733122","172.20.0.3","172.20.0.4","TCP","4410","8080  >  59108 [PSH, ACK] Seq=438745 Ack=156 Win=65024 Len=4344 TSval=3932585608 TSecr=3912074954 [TCP PDU reassembled in 271]"
"226","0.733150","172.20.0.4","172.20.0.3","TCP","66","59108  >  8080 [ACK] Seq=156 Ack=227337 Win=374144 Len=0 TSval=3912074954 TSecr=3932585507"
"227","0.733153","172.20.0.4","172.20.0.3","TCP","66","59108  >  8080 [ACK] Seq=156 Ack=230233 Win=380032 Len=0 TSval=3912074954 TSecr=3932585508"
"228","0.733156","172.20.0.4","172.20.0.3","TCP","66","59108  >  8080 [ACK] Seq=156 Ack=233129 Win=385792 Len=0 TSval=3912074954 TSecr=3932585508"
"229","0.733158","172.20.0.4","172.20.0.3","TCP","78","[TCP Dup ACK 228#1] 59108  >  8080 [ACK] Seq=156 Ack=233129 Win=391552 Len=0 TSval=3912074954 TSecr=3932585508 SLE=238921 SRE=241817"
"230","0.733166","172.20.0.4","172.20.0.3","TCP","78","[TCP Dup ACK 228#2] 59108  >  8080 [ACK] Seq=156 Ack=233129 Win=397312 Len=0 TSval=3912074954 TSecr=3932585508 SLE=238921 SRE=244713"
"231","0.733169","172.20.0.4","172.20.0.3","TCP","78","59108  >  8080 [ACK] Seq=156 Ack=236025 Win=403200 Len=0 TSval=3912074954 TSecr=3932585508 SLE=238921 SRE=244713"
